"RAGM","RAGMT2","Ranunculus gmelinii DC. var. terrestris (Ledeb.) L.D. Benson","","Ranunculaceae"
"RAGM","RAGMT","Ranunculus gmelinii DC. var. typicus L.D. Benson","","Ranunculaceae"
"RAGM","RALI2","Ranunculus limosus Nutt.","","Ranunculaceae"
"RAGM","RAPU3","Ranunculus purshii Richardson","","Ranunculaceae"
"RAHY2","","Ranunculus hyperboreus Rottb.","high northern buttercup","Ranunculaceae"
"RAHY2","RAHYA","Ranunculus hyperboreus Rottb. ssp. arnellii Scheutz","","Ranunculaceae"
"RAHY2","RAHYI","Ranunculus hyperboreus Rottb. ssp. intertextus (Greene) Kapoor & Á. Löve & D. Löve","","Ranunculaceae"
"RAHY2","RAHYI2","Ranunculus hyperboreus Rottb. var. intertextus (Greene) B. Boivin","","Ranunculaceae"
"RAHY2","RAHYT","Ranunculus hyperboreus Rottb. var. tuquetilianus Polunin p.p.","","Ranunculaceae"
"RAHY2","RAIN2","Ranunculus intertextus Greene","","Ranunculaceae"
"RAHY2","RANAI","Ranunculus natans C.A. Mey. var. intertextus (Greene) L.D. Benson","","Ranunculaceae"
"RAKA","","Ranunculus kamchaticus DC.","Kamchatka buttercup","Ranunculaceae"
"RAKA","OXGL4","Oxygraphis glacialis (Fisch.) Bunge","","Ranunculaceae"
"RAKA3","","Ranunculus karelinii Czern.","ice cold buttercup","Ranunculaceae"
"RAKA3","RAGE","Ranunculus gelidus Kar. & Kir.","","Ranunculaceae"
"RAKA3","RAGEG","Ranunculus gelidus Kar. & Kir. ssp. grayi (Britton) Hultén","","Ranunculaceae"
"RAKA3","RAGES","Ranunculus gelidus Kar. & Kir. var. shumaginensis Hultén","","Ranunculaceae"
"RAKA3","RAGR3","Ranunculus grayi Britton","","Ranunculaceae"
"RALA","","Ranunculus lapponicus L.","Lapland buttercup","Ranunculaceae"
"RALA","COLA9","Coptidium lapponicum (L.) Gandog.","","Ranunculaceae"
"RAMA2","","Ranunculus macounii Britton","Macoun's buttercup","Ranunculaceae"
"RAMA2","RAMAO","Ranunculus macounii Britton var. oreganus (A. Gray) Davis","","Ranunculaceae"
"RANI","","Ranunculus nivalis L.","snow buttercup","Ranunculaceae"
"RANUN","","Ranunculus L.","buttercup","Ranunculaceae"
"RAOC","","Ranunculus occidentalis Nutt.","western buttercup","Ranunculaceae"
"RAOCB","","Ranunculus occidentalis Nutt. var. brevistylis Greene","western buttercup","Ranunculaceae"
"RAOCN","","Ranunculus occidentalis Nutt. var. nelsonii (DC.) L.D. Benson","Nelson's buttercup","Ranunculaceae"
"RAOCN","RANE2","Ranunculus nelsonii (DC.) A. Gray","","Ranunculaceae"
"RAOCN","RAOCI","Ranunculus occidentalis Nutt. ssp. insularis Hultén","","Ranunculaceae"
"RAOCN","RAOCN2","Ranunculus occidentalis Nutt. ssp. nelsonii (DC.) Hultén","","Ranunculaceae"
"RAOCN","RAREN","Ranunculus recurvatus Poir. var. nelsonii DC.","","Ranunculaceae"
"RAOCO","","Ranunculus occidentalis Nutt. var. occidentalis","western buttercup","Ranunculaceae"
"RAOCO","RAEI","Ranunculus eisenii Kellogg","","Ranunculaceae"
"RAOCO","RAHO","Ranunculus howellii Greene","","Ranunculaceae"
"RAOCO","RAOCD","Ranunculus occidentalis Nutt. var. dissectus L.F. Hend.","","Ranunculaceae"
"RAOCO","RAOCE","Ranunculus occidentalis Nutt. var. eisenii (Kellogg) A. Gray","","Ranunculaceae"
"RAOCO","RAOCH","Ranunculus occidentalis Nutt. var. howellii (Greene) Greene","","Ranunculaceae"
"RAOCO","RAOCR","Ranunculus occidentalis Nutt. var. rattanii A. Gray","","Ranunculaceae"
"RAOCO","RAOCT","Ranunculus occidentalis Nutt. var. typicus L.D. Benson","","Ranunculaceae"
"RAOCO","RAOCU","Ranunculus occidentalis Nutt. var. ultramontanus Greene","","Ranunculaceae"
"RAOR3","","Ranunculus orthorhynchus Hook.","straightbeak buttercup","Ranunculaceae"
"RAORO","","Ranunculus orthorhynchus Hook. var. orthorhynchus","straightbeak buttercup","Ranunculaceae"
"RAORO","RAORA3","Ranunculus orthorhynchus Hook. ssp. alaschensis (L.D. Benson) Hultén","","Ranunculaceae"
"RAORO","RAORP2","Ranunculus orthorhynchus Hook. ssp. platyphyllus (A. Gray) Roy L. Taylor & MacBryde","","Ranunculaceae"
"RAORO","RAORA","Ranunculus orthorhynchus Hook. var. alaschensis L.D. Benson","","Ranunculaceae"
"RAORO","RAORH","Ranunculus orthorhynchus Hook. var. hallii Jeps.","","Ranunculaceae"
"RAORO","RAORP","Ranunculus orthorhynchus Hook. var. platyphyllus A. Gray","","Ranunculaceae"
"RAORO","RAORT","Ranunculus orthorhynchus Hook. var. typicus L.D. Benson","","Ranunculaceae"
"RAPA","","Ranunculus pacificus (Hultén) L.D. Benson","Pacific buttercup","Ranunculaceae"
"RAPA","RASEP2","Ranunculus septentrionalis Poir. ssp. pacificus Hultén","","Ranunculaceae"
"RAPA2","","Ranunculus pallasii Schltdl.","Pallas' buttercup","Ranunculaceae"
"RAPA2","COPA6","Coptidium pallasii (Schltdl.) Tzvelev","","Ranunculaceae"
"RAPE","","Ranunculus pedatifidus Sm.","surefoot buttercup","Ranunculaceae"
"RAPE2","","Ranunculus pensylvanicus L. f.","Pennsylvania buttercup","Ranunculaceae"
"RAPEA","","Ranunculus pedatifidus Sm. var. affinis (R. Br.) L.D. Benson","northern buttercup","Ranunculaceae"
"RAPEA","RAAF","Ranunculus affinis R. Br.","","Ranunculaceae"
"RAPEA","RAAR9","Ranunculus arcticus Richardson","","Ranunculaceae"
"RAPEA","RAPEA3","Ranunculus pedatifidus Sm. ssp. affinis (R. Br.) Hultén","","Ranunculaceae"
"RAPEA","RAPEL","Ranunculus pedatifidus Sm. var. leiocarpus (Trautv.) Fernald","","Ranunculaceae"
"RAPHA","","Raphanus L.","radish","Brassicaceae"
"RAPY","","Ranunculus pygmaeus Wahlenb.","pygmy buttercup","Ranunculaceae"
"RAPYP2","","Ranunculus pygmaeus Wahlenb. var. pygmaeus","pygmy buttercup","Ranunculaceae"
"RARE3","","Ranunculus repens L.","creeping buttercup","Ranunculaceae"
"RARE3","RARED","Ranunculus repens L. var. degeneratus Schur","","Ranunculaceae"
"RARE3","RAREE","Ranunculus repens L. var. erectus DC.","","Ranunculaceae"
"RARE3","RAREG","Ranunculus repens L. var. glabratus DC.","","Ranunculaceae"
"RARE3","RAREL","Ranunculus repens L. var. linearilobus DC.","","Ranunculaceae"
"RARE3","RAREP","Ranunculus repens L. var. pleniflorus Fernald","","Ranunculaceae"
"RARE3","RARET3","Ranunculus repens L. var. typicus G. Beck","","Ranunculaceae"
"RARE3","RAREV","Ranunculus repens L. var. villosus Lamotte","","Ranunculaceae"
"RASA2","","Raphanus sativus L.","cultivated radish","Brassicaceae"
"RASA2","RARAS","Raphanus raphanistrum L. var. sativus (L.) G. Beck","","Brassicaceae"
"RASA2","RASAL","Raphanus sativus L. var. longipinnatus L.H. Bailey","","Brassicaceae"
"RASA2","RASAS2","Raphanus sativus L. var. sativus","","Brassicaceae"
"RASA4","","Ranunculus sabinei R. Br.","Sabine buttercup","Ranunculaceae"
"RASA4","RAPYS","Ranunculus pygmaeus Wahlenb. ssp. sabinei (R. Br.) Hultén","","Ranunculaceae"
"RASC3","","Ranunculus sceleratus L.","cursed buttercup","Ranunculaceae"
"RASCM","","Ranunculus sceleratus L. var. multifidus Nutt.","cursed buttercup","Ranunculaceae"
"RASCM","RASCM3","Ranunculus sceleratus L. ssp. multifidus (Nutt.) Hultén","","Ranunculaceae"
"RASU2","","Ranunculus sulphureus Sol. ex C.J. Phipps","sulphur buttercup","Ranunculaceae"
"RASU2","RANIS","Ranunculus nivalis L. var. sulphureus (Sol. ex C.J. Phipps) Wahlenb.","","Ranunculaceae"
"RASU2","RASUI","Ranunculus sulphureus Sol. ex C.J. Phipps var. intercedens Hultén","","Ranunculaceae"
"RATR","","Ranunculus trichophyllus Chaix","threadleaf crowfoot","Ranunculaceae"
"RATRE","","Ranunculus trichophyllus Chaix var. eradicatus (Laest.) W. Drew","threadleaf crowfoot","Ranunculaceae"
"RATRE","BACO5","Batrachium confervoides Fr.","","Ranunculaceae"
"RATRE","RAAQC5","Ranunculus aquatilis L. var. codyanus (B. Boivin) B. Boivin","","Ranunculaceae"
"RATRE","RAAQC4","Ranunculus aquatilis L. var. confervoides (Fr.) G. Lawson","","Ranunculaceae"
"RATRE","RAAQE2","Ranunculus aquatilis L. var. eradicatus Laest.","","Ranunculaceae"
"RATRE","RACO8","Ranunculus codyanus B. Boivin","","Ranunculaceae"
"RATRE","RACO9","Ranunculus confervoides (Fr.) Fr.","","Ranunculaceae"
"RATRE","RAFLC","Ranunculus flaccidus Pers. var. confervoides (Fr.) Hegi","","Ranunculaceae"
"RATRE","RATRE2","Ranunculus trichophyllus Chaix ssp. eradicatus (Laest.) C.D.K. Cook","","Ranunculaceae"
"RATRE","RATRL","Ranunculus trichophyllus Chaix ssp. lutulentus (Perrier & Songeon) Vierh.","","Ranunculaceae"
"RATRE","RATRC","Ranunculus trichophyllus Chaix var. confervoides (Fr.) Rikli","","Ranunculaceae"
"RATRT","","Ranunculus trichophyllus Chaix var. trichophyllus","threadleaf crowfoot","Ranunculaceae"
"RATRT","BAFL2","Batrachium flaccidum (Pers.) Rupr.","","Ranunculaceae"
"RATRT","BAPO3","Batrachium porteri (Britton) Britton","","Ranunculaceae"
"RATRT","BATR2","Batrachium trichophyllum (Chaix) F.W. Schultz","","Ranunculaceae"
"RATRT","RAAQC3","Ranunculus aquatilis L. var. calvescens (W. Drew) L.D. Benson","","Ranunculaceae"
"RATRT","RAAQC2","Ranunculus aquatilis L. var. capillaceus (Thuill.) DC.","","Ranunculaceae"
"RATRT","RAAQH2","Ranunculus aquatilis L. var. harrisii L.D. Benson","","Ranunculaceae"
"RATRT","RAAQL3","Ranunculus aquatilis L. var. lalondei L.D. Benson","","Ranunculaceae"
"RATRT","RAAQP2","Ranunculus aquatilis L. var. porteri (Britton) L.D. Benson","","Ranunculaceae"
"RATRT","RAAQT2","Ranunculus aquatilis L. var. trichophyllus (Chaix) A. Gray","","Ranunculaceae"
"RATRT","RAFL3","Ranunculus flaccidus Pers.","","Ranunculaceae"
"RATRT","RATRC2","Ranunculus trichophyllus Chaix var. calvescens W. Drew","","Ranunculaceae"
"RATRT","RATRT2","Ranunculus trichophyllus Chaix var. typicus W. Drew","","Ranunculaceae"
"RATU","","Ranunculus turneri Greene","Turner's buttercup","Ranunculaceae"
"RATU","RAOCT2","Ranunculus occidentalis Nutt. var. turneri (Greene) L.D. Benson","","Ranunculaceae"
"RAUN","","Ranunculus uncinatus D. Don ex G. Don","woodland buttercup","Ranunculaceae"
"RAUNP","","Ranunculus uncinatus D. Don ex G. Don var. parviflorus (Torr.) L.D. Benson","Idaho buttercup","Ranunculaceae"
"RAUNP","RABO2","Ranunculus bongardii Greene","","Ranunculaceae"
"RAUNP","RAOCP","Ranunculus occidentalis Nutt. var. parviflorus Torr.","","Ranunculaceae"
"RAUNU","","Ranunculus uncinatus D. Don ex G. Don var. uncinatus","woodland buttercup","Ranunculaceae"
"RAUNU","RABOT2","Ranunculus bongardii Greene var. tenellus (Nutt.) Greene","","Ranunculaceae"
"RAUNU","RAUNT","Ranunculus uncinatus D. Don ex G. Don var. typicus L.D. Benson","","Ranunculaceae"
"RAVE","","Ranunculus verecundus B.L. Rob. ex Piper","wetslope buttercup","Ranunculaceae"
"RHAL3","","Rhynchospora alba (L.) Vahl","white beaksedge","Cyperaceae"
"RHAL3","RHLU2","Rhynchospora luquillensis Britton","","Cyperaceae"
"RHCA5","","Rhododendron camtschaticum Pall.","Kamchatka rhododendron","Ericaceae"
"RHCAC4","","Rhododendron camtschaticum Pall. ssp. camtschaticum","Kamchatka rhododendron","Ericaceae"
"RHCAG","","Rhododendron camtschaticum Pall. ssp. glandulosum (Standl.) Hultén","Kamchatka rhododendron","Ericaceae"
"RHEUM","","Rheum L.","rhubarb","Polygonaceae"
"RHIN11","","Rhodiola integrifolia Raf.","ledge stonecrop","Crassulaceae"
"RHINA","","Rhinanthus L.","yellow rattle","Scrophulariaceae"
"RHINI","","Rhodiola integrifolia Raf. ssp. integrifolia","ledge stonecrop","Crassulaceae"
"RHINI","SEAL9","Sedum alaskanum (Rose) Rose ex Hutch.","","Crassulaceae"
"RHINI","SEIN4","Sedum integrifolium (Raf.) A. Nelson","","Crassulaceae"
"RHINI","SEROI3","Sedum rosea (L.) Scop. ssp. integrifolium (Raf.) Hultén","","Crassulaceae"
"RHINI","SEROA","Sedum rosea (L.) Scop. var. alaskanum (Rose) A. Berger","","Crassulaceae"
"RHINI","SEROF","Sedum rosea (L.) Scop. var. frigidum (Rydb.) Hultén","","Crassulaceae"
"RHINI","SEROI2","Sedum rosea (L.) Scop. var. integrifolium (Raf.) A. Berger","","Crassulaceae"
"RHINI","SEROI4","Sedum roseum (L.) Scop. ssp. integrifolium (Raf.) Hultén, orth. var.","","Crassulaceae"
"RHINI","SEROA2","Sedum roseum (L.) Scop. var. alaskanum (Rose) A. Berger, orth. var.","","Crassulaceae"
"RHINI","SEROF2","Sedum roseum (L.) Scop. var. frigidum (Rydb.) Hultén, orth. var.","","Crassulaceae"
"RHINI","SEROI5","Sedum roseum (L.) Scop. var. integrifolium (Raf.) A. Berger, orth. var.","","Crassulaceae"
"RHINI","TOIN3","Tolmachevia integrifolia (Raf.) Á. Löve & D. Löve","","Crassulaceae"
"RHLA2","","Rhododendron lapponicum (L.) Wahlenb.","Lapland rosebay","Ericaceae"
"RHLAL","","Rhododendron lapponicum (L.) Wahlenb. var. lapponicum","Lapland rosebay","Ericaceae"
"RHLAP","","Rhododendron lapponicum (L.) Wahlenb. var. parvifolium (M.F. Adams) Herder","Lapland rosebay","Ericaceae"
"RHMI13","","Rhinanthus minor L.","little yellow rattle","Scrophulariaceae"
"RHMIG","","Rhinanthus minor L. ssp. groenlandicus (Ostenf.) L. Neum.","arctic rattlebox","Scrophulariaceae"
"RHMIG","RHAR2","Rhinanthus arcticus (Sterneck) Pennell","","Scrophulariaceae"
"RHMIG","RHBO3","Rhinanthus borealis (Sterneck) Druce","","Scrophulariaceae"
"RHMIG","RHGR4","Rhinanthus groenlandicus (Ostenf.) Chabert","","Scrophulariaceae"
"RHMIG","RHMIB","Rhinanthus minor L. ssp. borealis (Sterneck) Á. Löve","","Scrophulariaceae"
"RHODI","","Rhodiola L.","stonecrop","Crassulaceae"
"RHODO","","Rhododendron L.","rhododendron","Ericaceae"
"RHRH2","","Rheum rhabarbarum L.","garden rhubarb","Polygonaceae"
"RHRH2","RHRH5","Rheum rhaponticum auct. non L.","","Polygonaceae"
"RHYNC3","","Rhynchospora Vahl","beaksedge","Cyperaceae"
"RHYNC3","RAYMO","Raymondiella B. Boivin, nom. inval.","","Cyperaceae"
"RIBES","","Ribes L.","currant","Grossulariaceae"
"RIBR","","Ribes bracteosum Douglas ex Hook.","stink currant","Grossulariaceae"
"RIGL","","Ribes glandulosum Grauer","skunk currant","Grossulariaceae"
"RIGL","RIPR","Ribes prostratum L'Hér.","","Grossulariaceae"
"RIGL","RIRE2","Ribes resinosum Pursh","","Grossulariaceae"
"RIHU","","Ribes hudsonianum Richardson","northern black currant","Grossulariaceae"
"RIHUH","","Ribes hudsonianum Richardson var. hudsonianum","Hudson Bay currant","Grossulariaceae"
"RILA","","Ribes lacustre (Pers.) Poir.","prickly currant","Grossulariaceae"
"RILA","LILA9","Limnobotrya lacustris (Pers.) Rydb.","","Grossulariaceae"
"RILA","RILAP","Ribes lacustre (Pers.) Poir. var. parvulum A. Gray","","Grossulariaceae"
"RILA","RIOXL","Ribes oxycanthoides L. var. lacustre Pers.","","Grossulariaceae"
"RILA3","","Ribes laxiflorum Pursh","trailing black currant","Grossulariaceae"
"RILA3","RICO2","Ribes coloradense Coville","","Grossulariaceae"
"RIOX","","Ribes oxyacanthoides L.","Canadian gooseberry","Grossulariaceae"
"RIOXO","","Ribes oxyacanthoides L. ssp. oxyacanthoides","Canadian gooseberry","Grossulariaceae"
"RIOXO","GROX2","Grossularia oxyacanthoides (L.) Mill.","","Grossulariaceae"
"RITR","","Ribes triste Pall.","red currant","Grossulariaceae"
"RITR","RIRUA","Ribes rubrum L. var. alaskanum (A. Berger) B. Boivin","","Grossulariaceae"
"RITR","RIRUP","Ribes rubrum L. var. propinquum (Turcz.) Trautv. & C.A. Mey.","","Grossulariaceae"
"RITR","RITRA","Ribes triste Pall. var. albinervium (Michx.) Fernald","","Grossulariaceae"
"ROAC","","Rosa acicularis Lindl.","prickly rose","Rosaceae"
"ROACA","","Rosa acicularis Lindl. ssp. acicularis","prickly rose","Rosaceae"
"ROACS","","Rosa acicularis Lindl. ssp. sayi (Schwein.) W.H. Lewis","prickly rose","Rosaceae"
"ROACS","ROACB","Rosa acicularis Lindl. var. bourgeauiana (Crép.) Crép.","","Rosaceae"
"ROACS","ROACS2","Rosa acicularis Lindl. var. sayana Erlanson","","Rosaceae"
"ROACS","ROBO5","Rosa bourgeauiana Crép.","","Rosaceae"
"ROACS","ROCO8","Rosa collaris Rydb.","","Rosaceae"
"ROACS","ROEN","Rosa engelmannii S. Watson","","Rosaceae"
"ROACS","ROSA3","Rosa sayi Schwein.","","Rosaceae"
"ROBA","","Rorippa barbareifolia (DC.) Kitagawa","hoary yellowcress","Brassicaceae"
"ROBA","CABA18","Cardamine barbareifolia DC.","","Brassicaceae"
"ROBA","ROHIB","Rorippa hispida (Desv.) Britton var. barbareifolia (DC.) Hultén","","Brassicaceae"
"ROBA","ROISB","Rorippa islandica (Oeder) Borbás var. barbareifolia (DC.) S.L. Welsh","","Brassicaceae"
"ROCU","","Rorippa curvisiliqua (Hook.) Besser ex Britton","curvepod yellowcress","Brassicaceae"
"ROCU2","","Rorippa curvipes Greene","bluntleaf yellowcress","Brassicaceae"
"ROCUC2","","Rorippa curvisiliqua (Hook.) Besser ex Britton var. curvisiliqua","curvepod yellowcress","Brassicaceae"
"ROCUC2","NACU","Nasturtium curvisiliqua (Hook.) Nutt. ex Torr. & A. Gray","","Brassicaceae"
"ROCUC2","RACU","Radicula curvisiliqua (Hook.) Greene","","Brassicaceae"
"ROCUC2","SICU5","Sisymbrium curvisiliqua Hook.","","Brassicaceae"
"ROCUP","","Rorippa curvisiliqua (Hook.) Besser ex Britton var. procumbens R. Stuckey","curvepod yellowcress","Brassicaceae"
"ROCUT","","Rorippa curvipes Greene var. truncata (Jeps.) Rollins","bluntleaf yellowcress","Brassicaceae"
"ROCUT","RASIT","Radicula sinuata (Nutt.) Greene var. truncata Jeps.","","Brassicaceae"
"ROCUT","ROCUI","Rorippa curvipes Greene var. integra (Rydb.) R. Stuckey","","Brassicaceae"
"ROCUT","ROOBI","Rorippa obtusa (Nutt.) Britton var. integra (Rydb.) Vict.","","Brassicaceae"
"ROCUT","ROTE5","Rorippa teres auct. non (Michx.) R. Stuckey","","Brassicaceae"
"ROCUT","ROTR3","Rorippa truncata (Jeps.) R. Stuckey","","Brassicaceae"
"ROMAN","","Romanzoffia Cham.","mistmaiden","Hydrophyllaceae"
"RONU","","Rosa nutkana C. Presl","Nootka rose","Rosaceae"
"RONUN","","Rosa nutkana C. Presl var. nutkana","Nootka rose","Rosaceae"
"RONUN","RODU3","Rosa durandii Crép.","","Rosaceae"
"ROPA2","","Rorippa palustris (L.) Besser","bog yellowcress","Brassicaceae"
"ROPAF2","","Rorippa palustris (L.) Besser ssp. fernaldiana (Butters & Abbe) Jonsell","Fernald's yellowcress","Brassicaceae"
"ROPAF2","ROHIG","Rorippa hispida (Desv.) Britton var. glabrata Lunell","","Brassicaceae"
"ROPAF2","ROISF3","Rorippa islandica (Oeder) Borbás ssp. fernaldiana (Butters & Abbe) Hultén","","Brassicaceae"
"ROPAF2","ROISF2","Rorippa islandica (Oeder) Borbás var. fernaldiana Butters & Abbe","","Brassicaceae"
"ROPAF2","ROISG","Rorippa islandica (Oeder) Borbás var. glabra (O.E. Schulz) S.L. Welsh & Reveal","","Brassicaceae"
"ROPAF2","ROISG2","Rorippa islandica (Oeder) Borbás var. glabrata (Lunell) Butters & Abbe","","Brassicaceae"
"ROPAF2","ROPAG","Rorippa palustris (L.) Besser ssp. glabra (O.E. Schulz) R. Stuckey","","Brassicaceae"
"ROPAF2","ROPAC3","Rorippa palustris (L.) Besser var. cernua (Nutt.) R. Stuckey","","Brassicaceae"
"ROPAF2","ROPAD2","Rorippa palustris (L.) Besser var. dictyota (Greene) R. Stuckey","","Brassicaceae"
"ROPAF2","ROPAG3","Rorippa palustris (L.) Besser var. glabra (O.E. Schulz) R. Stuckey","","Brassicaceae"
"ROPAF2","ROPAG4","Rorippa palustris (L.) Besser var. glabrata (Lunell) R. Stuckey","","Brassicaceae"
"ROPAH","","Rorippa palustris (L.) Besser ssp. hispida (Desv.) Jonsell","hispid yellowcress","Brassicaceae"
"ROPAH","RAHI3","Radicula hispida (Desv.) Britton","","Brassicaceae"
"ROPAH","ROHI2","Rorippa hispida (Desv.) Britton","","Brassicaceae"
"ROPAH","ROISH2","Rorippa islandica (Oeder) Borbás var. hispida (Desv.) Butters & Abbe","","Brassicaceae"
"ROPAH","ROPAE2","Rorippa palustris (L.) Besser var. elongata R. Stuckey","","Brassicaceae"
"ROPAH","ROPAH2","Rorippa palustris (L.) Besser var. hispida (Desv.) Rydb.","","Brassicaceae"
"ROPAO","","Rorippa palustris (L.) Besser ssp. occidentalis (S. Watson) Abrams","western bog yellowcress","Brassicaceae"
"ROPAO","ROISO2","Rorippa islandica (Oeder) Borbás var. occidentalis (S. Watson) Butters & Abbe","","Brassicaceae"
"ROPAO","ROPAC4","Rorippa palustris (L.) Besser var. clavata (Rydb.) R. Stuckey","","Brassicaceae"
"ROPAO","ROPAO2","Rorippa palustris (L.) Besser var. occidentalis (S. Watson) Rollins","","Brassicaceae"
"ROPAP","","Rorippa palustris (L.) Besser ssp. palustris","bog yellowcress","Brassicaceae"
"ROPAP","RAPA7","Radicula palustris (L.) Moench","","Brassicaceae"
"ROPAP","ROISM","Rorippa islandica (Oeder) Borbás var. microcarpa (Regel) Fernald","","Brassicaceae"
"ROPAP","ROPAR","Rorippa palustris (L.) Besser var. reptabunda (Fernald) R. Stuckey","","Brassicaceae"
"ROPAP","ROPAW","Rorippa palustris (L.) Besser var. williamsii (Britton) Hultén","","Brassicaceae"
"RORIP","","Rorippa Scop.","yellowcress","Brassicaceae"
"RORU","","Rosa rugosa Thunb.","rugosa rose","Rosaceae"
"RORU","RORUA3","Rosa rugosa Thunb. var. albiflora Koidz.","","Rosaceae"
"RORU","RORUA2","Rosa rugosa Thunb. f. alba Rehder","","Rosaceae"
"ROSA5","","Rosa L.","rose","Rosaceae"
"ROSI","","Romanzoffia sitchensis Bong.","Sitka mistmaiden","Hydrophyllaceae"
"ROSY","","Rorippa sylvestris (L.) Besser","creeping yellowcress","Brassicaceae"
"ROSY","RASY","Radicula sylvestris (L.) Druce","","Brassicaceae"
"ROUN","","Romanzoffia unalaschcensis Cham.","Alaska mistmaiden","Hydrophyllaceae"
"ROUNG","","Romanzoffia unalaschcensis Cham. var. glabriuscula Hultén","Alaska mistmaiden","Hydrophyllaceae"
"ROUNU","","Romanzoffia unalaschcensis Cham. var. unalaschcensis","Alaska mistmaiden","Hydrophyllaceae"
"ROWO","","Rosa woodsii Lindl.","Woods' rose","Rosaceae"
"ROWOW","","Rosa woodsii Lindl. var. woodsii","Woods' rose","Rosaceae"
"ROWOW","ROAD","Rosa adenosepala Wooton & Standl.","","Rosaceae"
"ROWOW","ROFE2","Rosa fendleri Crép.","","Rosaceae"
"ROWOW","ROHY2","Rosa hypoleuca Wooton & Standl.","","Rosaceae"
"ROWOW","ROMA5","Rosa macounii Greene","","Rosaceae"
"ROWOW","RONE2","Rosa neomexicana Cockerell","","Rosaceae"
"ROWOW","ROST4","Rosa standleyi Rydb.","","Rosaceae"
"ROWOW","ROTE4","Rosa terrens Lunell","","Rosaceae"
"ROWOW","ROWOA2","Rosa woodsii Lindl. var. adenosepala (Wooton & Standl.) W.C. Martin & C.R. Hutchins","","Rosaceae"
"ROWOW","ROWOF","Rosa woodsii Lindl. var. fendleri (Crép.) Rydb.","","Rosaceae"
"ROWOW","ROWOH","Rosa woodsii Lindl. var. hypoleuca (Wooton & Standl.) W.C. Martin & C.R. Hutchins","","Rosaceae"
"ROWOW","ROWOM","Rosa woodsii Lindl. var. macounii (Greene) W.C. Martin & C.R. Hutchins","","Rosaceae"
"RUAC2","","Rumex acetosa L.","garden sorrel","Polygonaceae"
"RUAC3","","Rumex acetosella L.","common sheep sorrel","Polygonaceae"
"RUAC3","ACAC5","Acetosella acetosella (L.) Small, nom. inval.","","Polygonaceae"
"RUAC3","ACTE3","Acetosella tenuifolia (Wallr.) Á. Löve","","Polygonaceae"
"RUAC3","ACVU","Acetosella vulgaris Fourr.","","Polygonaceae"
"RUAC3","RUACA5","Rumex acetosella L. ssp. angiocarpus (Murb.) Murb.","","Polygonaceae"
"RUAC3","RUACP2","Rumex acetosella L. var. pyrenaeus (Pourr.) Timbal-Lagrave","","Polygonaceae"
"RUAC3","RUACT2","Rumex acetosella L. var. tenuifolius Wallr.","","Polygonaceae"
"RUAC3","RUAN","Rumex angiocarpus Murb.","","Polygonaceae"
"RUAC3","RUTE5","Rumex tenuifolius (Wallr.) Á. Löve","","Polygonaceae"
"RUACA","","Rumex acetosa L. ssp. acetosa","garden sorrel","Polygonaceae"
"RUACA2","","Rumex acetosa L. ssp. alpestris (Jacq.) Á. Löve","garden sorrel","Polygonaceae"
"RUACA2","ACAL8","Acetosa alpestris (Jacq.) Á. Löve","","Polygonaceae"
"RUACA2","ACPRA","Acetosa pratensis Mill. ssp. alpestris (Jacq.) Á. Löve","","Polygonaceae"
"RUACA2","RUAL11","Rumex alpestris Jacq.","","Polygonaceae"
"RUACP","","Rumex acetosa L. ssp. pseudoxyria Tolm.","garden sorrel","Polygonaceae"
"RUACP","RUPS2","Rumex pseudoxyria (Tolm.) A.P. Khokhr.","","Polygonaceae"
"RUAL6","","Rubus alaskensis L.H. Bailey","Alaska blackberry","Rosaceae"
"RUAL6","RUPUA","Rubus pubescens Raf. var. alaskensis (L.H. Bailey) B. Boivin","","Rosaceae"
"RUAQ","","Rumex aquaticus L.","western dock","Polygonaceae"
"RUAQF","","Rumex aquaticus L. var. fenestratus (Greene) Dorn","western dock","Polygonaceae"
"RUAQF","RUAQF2","Rumex aquaticus L. ssp. fenestratus (Greene) Hultén","","Polygonaceae"
"RUAQF","RUAQO","Rumex aquaticus L. ssp. occidentalis (S. Watson) Hultén","","Polygonaceae"
"RUAQF","RUFE3","Rumex fenestratus Greene","","Polygonaceae"
"RUAQF","RUOC3","Rumex occidentalis S. Watson","","Polygonaceae"
"RUAQF","RUOCF","Rumex occidentalis S. Watson var. fenestratus (Greene) Lepage","","Polygonaceae"
"RUAQF","RUOCL","Rumex occidentalis S. Watson var. labradoricus (Rech. f.) Lepage","","Polygonaceae"
"RUAQF","RUOCP","Rumex occidentalis S. Watson var. procerus (Greene) J.T. Howell","","Polygonaceae"
"RUAQF","RUSU2","Rumex subalpinus M.E. Jones","","Polygonaceae"
"RUAR","","Rubus arcticus L.","arctic raspberry","Rosaceae"
"RUAR6","","Rumex arcticus Trautv.","arctic dock","Polygonaceae"
"RUARA","","Rumex arcticus Trautv. var. arcticus","arctic dock","Polygonaceae"
"RUARA2","","Rubus arcticus L. ssp. acaulis (Michx.) Focke","dwarf raspberry","Rosaceae"
"RUARA2","CYARA","Cylactis arctica (L.) Raf. ex B.D. Jacks. ssp. acaulis (Michx.) W.A. Weber","","Rosaceae"
"RUARA2","RUAC","Rubus acaulis Michx.","","Rosaceae"
"RUARA2","RUARA4","Rubus arcticus L. var. acaulis (Michx.) B. Boivin","","Rosaceae"
"RUARA3","","Rubus arcticus L. ssp. arcticus","arctic raspberry","Rosaceae"
"RUARA3","RUARP2","Rubus arcticus L. var. pentaphylloides Hultén","","Rosaceae"
"RUARP","","Rumex arcticus Trautv. var. perlatus Hultén","arctic dock","Polygonaceae"
"RUARS","","Rubus arcticus L. ssp. stellatus (Sm.) B. Boivin","arctic raspberry","Rosaceae"
"RUARS","RUARS2","Rubus arcticus L. var. stellatus (Sm.) B. Boivin","","Rosaceae"
"RUARS","RUST6","Rubus stellatus Sm.","","Rosaceae"
"RUBE4","","Rumex beringensis Jurtzev & V.V. Petrovsky","Bering Sea dock","Polygonaceae"
"RUBUS","","Rubus L.","blackberry","Rosaceae"
"RUCH","","Rubus chamaemorus L.","cloudberry","Rosaceae"
"RUCI2","","Ruppia cirrhosa (Petagna) Grande","spiral ditchgrass","Ruppiaceae"
"RUCI2","RUCIO","Ruppia cirrhosa (Petagna) Grande ssp. occidentalis (S. Watson) Á. Löve & D. Löve","","Ruppiaceae"
"RUCI2","RUMAO","Ruppia maritima L. var. occidentalis (S. Watson) Graebn.","","Ruppiaceae"
"RUCI2","RUMAS","Ruppia maritima L. var. spiralis (Dumort.) Moris","","Ruppiaceae"
"RUCI2","RUOC6","Ruppia occidentalis S. Watson","","Ruppiaceae"
"RUCI2","RUSP5","Ruppia spiralis Dumort.","","Ruppiaceae"
"RUCR","","Rumex crispus L.","curly dock","Polygonaceae"
"RUCRC","","Rumex crispus L. ssp. crispus","curly dock","Polygonaceae"
"RUDBE","","Rudbeckia L.","coneflower","Asteraceae"
"RUGR2","","Rumex graminifolius Georgi ex Lamb.","grassleaf sorrel","Polygonaceae"
"RUGR2","ACGR6","Acetosella graminifolia (Georgi ex Lamb.) Á. Löve","","Polygonaceae"
"RUHI2","","Rudbeckia hirta L.","blackeyed Susan","Asteraceae"
"RUID","","Rubus idaeus L.","American red raspberry","Rosaceae"
