"COGR6","COOFA","Cochlearia officinalis L. ssp. arctica (Schltdl.) Hultén","","Brassicaceae"
"COGR6","COOFG","Cochlearia officinalis L. ssp. groenlandica (L.) A.E. Porsild","","Brassicaceae"
"COGR6","COOFO","Cochlearia officinalis L. ssp. oblongifolia (DC.) Hultén","","Brassicaceae"
"COGR6","COOFA2","Cochlearia officinalis L. var. arctica (Schltdl.) Gelert","","Brassicaceae"
"COGR6","COGR11","Cochleariopsis groenlandica (L.) Á. Löve & D. Löve","","Brassicaceae"
"COGR6","COGRA","Cochleariopsis groenlandica (L.) Á. Löve & D. Löve ssp. arctica (Schltdl.) Á. Löve & D. Löve","","Brassicaceae"
"COGR6","COGRO","Cochleariopsis groenlandica (L.) Á. Löve & D. Löve ssp. oblongifolia (DC.) Á. Löve & D. Löve","","Brassicaceae"
"COIN19","","Cornus ×intermedia (Farr) Calder & Roy L. Taylor [canadensis × suecica]","dogwood","Cornaceae"
"COIN19","COCAI","Cornus canadensis L. var. intermedia Farr p.p.","","Cornaceae"
"COIN19","COIN20","Cornus intermedia (Farr) Calder & Roy L. Taylor, database artifact","","Cornaceae"
"COLI2","","Collomia linearis Nutt.","tiny trumpet","Polemoniaceae"
"COLLI","","Collinsia Nutt.","blue eyed Mary","Scrophulariaceae"
"COLLO","","Collomia Nutt.","trumpet","Polemoniaceae"
"COMA25","","Corallorhiza maculata (Raf.) Raf.","summer coralroot","Orchidaceae"
"COMA25","COMA4","Corallorrhiza maculata (Raf.) Raf., orth. var.","","Orchidaceae"
"COMAN","","Comandra Nutt.","bastard toadflax","Santalaceae"
"COMAR3","","Comarum L.","comarum","Rosaceae"
"COME17","","Corallorhiza mertensiana Bong.","Pacific coralroot","Orchidaceae"
"COME17","COMAM6","Corallorhiza maculata (Raf.) Raf. ssp. mertensiana (Bong.) Calder & Roy L. Taylor","","Orchidaceae"
"COME17","COMAM4","Corallorrhiza maculata (Raf.) Raf. ssp. mertensiana (Bong.) Calder & Roy L. Taylor, orth. var.","","Orchidaceae"
"COME17","COME4","Corallorrhiza mertensiana Bong., orth. var.","","Orchidaceae"
"CONIO","","Conioselinum Hoffm.","hemlockparsley","Apiaceae"
"CONRI","","Conringia Heist. ex Fabr.","hare's ear mustard","Brassicaceae"
"CONYZ","","Conyza Less.","horseweed","Asteraceae"
"COOC9","","Corispermum ochotense Ignatov","Russian bugseed","Chenopodiaceae"
"COOCA","","Corispermum ochotense Ignatov var. alaskanum Mosyakin","Alaskan bugseed","Chenopodiaceae"
"COOCA","COHYR","Corispermum hyssopifolium L. var. rubricaule Hook.","","Chenopodiaceae"
"COOCO","","Corispermum ochotense Ignatov var. ochotense","Russian bugseed","Chenopodiaceae"
"COOR","","Conringia orientalis (L.) Dumort.","hare's ear mustard","Brassicaceae"
"COOR","BROR4","Brassica orientalis L.","","Brassicaceae"
"COPA11","","Corydalis pauciflora (Stephan) Pers.","fewflower fumewort","Fumariaceae"
"COPA11","COAR18","Corydalis arctica Popov","","Fumariaceae"
"COPA11","COPAA","Corydalis pauciflora (Stephan) Pers. var. albiflora A.E. Porsild","","Fumariaceae"
"COPA11","COPAC","Corydalis pauciflora (Stephan) Pers. var. chamissonis Fedde","","Fumariaceae"
"COPA28","","Comarum palustre L.","purple marshlocks","Rosaceae"
"COPA28","POPA14","Potentilla palustris (L.) Scop.","","Rosaceae"
"COPA28","POPAP2","Potentilla palustris (L.) Scop. var. parvifolia (Raf.) Fernald & Long","","Rosaceae"
"COPA28","POPAV","Potentilla palustris (L.) Scop. var. villosa (Pers.) Lehm.","","Rosaceae"
"COPA3","","Collinsia parviflora Lindl.","maiden blue eyed Mary","Scrophulariaceae"
"COPA3","ANTE7","Antirrhinum tenellum Pursh","","Scrophulariaceae"
"COPA3","COGRP","Collinsia grandiflora Lindl. var. pusilla A. Gray","","Scrophulariaceae"
"COPA3","COTE11","Collinsia tenella (Pursh) Piper","","Scrophulariaceae"
"COPTI","","Coptis Salisb.","goldthread","Ranunculaceae"
"CORAL5","","Corallorhiza Gagnebin, orth. cons.","coralroot","Orchidaceae"
"CORAL5","CORAL2","Corallorrhiza Gagnebin, orth. rej.","","Orchidaceae"
"CORIS","","Corispermum L.","bugseed","Chenopodiaceae"
"CORNU","","Cornus L.","dogwood","Cornaceae"
"CORYD","","Corydalis DC.","fumewort","Fumariaceae"
"COSE16","","Cornus sericea L.","redosier dogwood","Cornaceae"
"COSE5","","Corydalis sempervirens (L.) Pers.","rock harlequin","Fumariaceae"
"COSE5","CASE16","Capnoides sempervirens (L.) Borkh.","","Fumariaceae"
"COSE8","","Cochlearia sessilifolia Rollins","sessileleaf scurvygrass","Brassicaceae"
"COSE8","COOFS","Cochlearia officinalis L. var. sessilifolia (Rollins) S.L. Welsh","","Brassicaceae"
"COSEO","","Cornus sericea L. ssp. occidentalis (Torr. & A. Gray) Fosberg","western dogwood","Cornaceae"
"COSEO","COALC","Cornus alba L. var. californica (C.A. Mey.) B. Boivin","","Cornaceae"
"COSEO","COALO","Cornus alba L. var. occidentalis (Torr. & A. Gray) B. Boivin","","Cornaceae"
"COSEO","COCA26","Cornus ×californica C.A. Mey.","","Cornaceae"
"COSEO","COOC6","Cornus occidentalis (Torr. & A. Gray) Coville","","Cornaceae"
"COSEO","COSTC4","Cornus stolonifera Michx. var. californica (C.A. Mey.) McMinn","","Cornaceae"
"COSEO","COSTO2","Cornus stolonifera Michx. var. occidentalis (Torr. & A. Gray) C.L. Hitchc.","","Cornaceae"
"COSES","","Cornus sericea L. ssp. sericea","redosier dogwood","Cornaceae"
"COSES","COAL80","Cornus alba L. p.p.","","Cornaceae"
"COSES","COALS","Cornus alba L. ssp. stolonifera (Michx.) Wangerin","","Cornaceae"
"COSES","COALB","Cornus alba L. var. baileyi (J.M. Coult. & Evans) B. Boivin","","Cornaceae"
"COSES","COALI","Cornus alba L. var. interior (Rydb.) B. Boivin","","Cornaceae"
"COSES","COALS2","Cornus alba L. var. sibirica Lodd. ex Loudon","","Cornaceae"
"COSES","COBA6","Cornus baileyi J.M. Coult. & Evans","","Cornaceae"
"COSES","COIN5","Cornus instolonea A. Nelson","","Cornaceae"
"COSES","COIN6","Cornus interior (Rydb.) N. Petersen","","Cornaceae"
"COSES","COSES2","Cornus sericea L. ssp. stolonifera (Michx.) Fosberg","","Cornaceae"
"COSES","COSEI","Cornus sericea L. var. interior (Rydb.) H. St. John","","Cornaceae"
"COSES","COST4","Cornus stolonifera Michx.","","Cornaceae"
"COSES","COSTB","Cornus stolonifera Michx. var. baileyi (J.M. Coult. & Evans) Drescher","","Cornaceae"
"COSES","COSTC2","Cornus stolonifera Michx. var. coloradensis (Koehne) C.K. Schneid.","","Cornaceae"
"COSES","COSTI","Cornus stolonifera Michx. var. interior (Rydb.) H. St. John","","Cornaceae"
"COSES","COSTS2","Cornus stolonifera Michx. var. stolonifera","","Cornaceae"
"COSES","SWIN","Swida instolonea (A. Nelson) Rydb.","","Cornaceae"
"COSES","SWSE","Swida sericea (L.) Holub","","Cornaceae"
"COSES","SWST2","Swida stolonifera (Michx.) Rydb.","","Cornaceae"
"COSU4","","Cornus suecica L.","Lapland cornel","Cornaceae"
"COSU4","CHSU9","Chamaepericlymenum suecicum (L.) Asch. & Graebn.","","Cornaceae"
"COSU4","COSU10","Cornella suecica (L.) Rydb.","","Cornaceae"
"COSU4","SWSU","Swida suecica (L.) Holub","","Cornaceae"
"COTR18","","Corallorhiza trifida Chatelain","yellow coralroot","Orchidaceae"
"COTR18","COCO40","Corallorhiza corallorhiza (L.) Karst., nom. inval.","","Orchidaceae"
"COTR18","COTRV2","Corallorhiza trifida Chatelain var. verna (Nutt.) Fernald","","Orchidaceae"
"COTR18","COCO23","Corallorrhiza corallorrhiza (L.) Karst., orth. var., nom. inval.","","Orchidaceae"
"COTR18","COTR3","Corallorrhiza trifida Chatelain, orth. var.","","Orchidaceae"
"COTR18","COTRV","Corallorrhiza trifida Chatelain var. verna (Nutt.) Fernald, orth. var.","","Orchidaceae"
"COTR2","","Coptis trifolia (L.) Salisb.","threeleaf goldthread","Ranunculaceae"
"COTR2","COGR13","Coptis groenlandica (Oeder) Fernald","","Ranunculaceae"
"COTR2","COTRG","Coptis trifolia (L.) Salisb. ssp. groenlandica (Oeder) Hultén","","Ranunculaceae"
"COTR2","COTRG2","Coptis trifolia (L.) Salisb. var. groenlandica (Oeder) Fassett","","Ranunculaceae"
"COTUL","","Cotula L.","waterbuttons","Asteraceae"
"COUM","","Comandra umbellata (L.) Nutt.","bastard toadflax","Santalaceae"
"COUN","","Cornus unalaschkensis Ledeb.","western cordilleran bunchberry","Cornaceae"
"COUN","CHUN3","Chamaepericlymenum unalaschkense (Ledeb.) Rydb.","","Cornaceae"
"CRAC3","","Cryptogramma acrostichoides R. Br.","American rockbrake","Pteridaceae"
"CRAC3","CRCRA2","Cryptogramma crispa (L.) R. Br. ex Hook. ssp. acrostichoides (R. Br.) Hultén","","Pteridaceae"
"CRAQ","","Crassula aquatica (L.) Schoenl.","water pygmyweed","Crassulaceae"
"CRAQ","BUAQ","Bulliarda aquatica (L.) DC.","","Crassulaceae"
"CRAQ","HYAQ","Hydrophila aquatica (L.) House","","Crassulaceae"
"CRAQ","TIAN2","Tillaea angustifolia Nutt.","","Crassulaceae"
"CRAQ","TIAQ3","Tillaea aquatica L.","","Crassulaceae"
"CRAQ","TIAS","Tillaea ascendens Eaton","","Crassulaceae"
"CRAQ","TIAQ2","Tillaeastrum aquaticum (L.) Britton","","Crassulaceae"
"CRASS","","Crassula L.","pygmyweed","Crassulaceae"
"CRATA","","Crataegus L.","hawthorn","Rosaceae"
"CRCA3","","Crepis capillaris (L.) Wallr.","smooth hawksbeard","Asteraceae"
"CRDO2","","Crataegus douglasii Lindl.","black hawthorn","Rosaceae"
"CRDO2","CRCO6","Crataegus columbiana Howell","","Rosaceae"
"CRDO2","CRDOD","Crataegus douglasii Lindl. var. douglasii","","Rosaceae"
"CREL","","Crepis elegans Hook.","elegant hawksbeard","Asteraceae"
"CREL","ASEL7","Askellia elegans (Hook.) W.A. Weber","","Asteraceae"
"CREPI","","Crepis L.","hawksbeard","Asteraceae"
"CRFE3","","Cryptantha fendleri (A. Gray) Greene","sanddune cryptantha","Boraginaceae"
"CRFE3","CRPA7","Cryptantha pattersonii (A. Gray) Greene","","Boraginaceae"
"CRMO3","","Crataegus monogyna Jacq.","oneseed hawthorn","Rosaceae"
"CRMO3","CRCU2","Crataegus curvisepala auct. non Lindm.","","Rosaceae"
"CRMO3","CROX2","Crataegus oxyacantha L., nom. utique rej.","","Rosaceae"
"CRMO3","CROXP","Crataegus oxyacantha L. var. paulii (Rehder) Rehder","","Rosaceae"
"CRNA","","Crepis nana Richardson","dwarf alpine hawksbeard","Asteraceae"
"CRNA","ASNA5","Askellia nana (Richardson) W.A. Weber","","Asteraceae"
"CRNA","ASPY4","Askellia pygmaea (Ledeb.) K.L. Chambers & S.C. Meyers, nom. illeg.","","Asteraceae"
"CRNA","ASPY7","Askellia pygmaea (Ledeb.) Sennikov","","Asteraceae"
"CRNAN","","Crepis nana Richardson ssp. nana","dwarf alpine hawksbeard","Asteraceae"
"CRNAN","CRNAT2","Crepis nana Richardson ssp. typica Babc.","","Asteraceae"
"CRNAN","CRNAL","Crepis nana Richardson var. lyratifolia (Turcz.) Hultén","","Asteraceae"
"CRSA7","","Crassula saginoides (Maxim.) Bywater & Wickens","wrinkleseed pygmyweed","Crassulaceae"
"CRSA7","HYVA2","Hydrophila vaillantii sensu House, non (Willd.) Roth","","Crassulaceae"
"CRSA7","TIANB","Tillaea angustifolia Nutt. var. bolanderi S. Watson","","Crassulaceae"
"CRSA7","TIBO","Tillaea bolanderi (S. Watson) Greene","","Crassulaceae"
"CRSA7","TIDRB","Tillaea drummondii Torr. & A. Gray var. bolanderi (S. Watson) Jeps.","","Crassulaceae"
"CRSA7","TIVA3","Tillaea vaillantii sensu A. Gray, non Willd.","","Crassulaceae"
"CRSA7","TIPR2","Tillaeastrum pringlei Rose","","Crassulaceae"
"CRSA7","TIVA4","Tillaeastrum vaillantii auct. non (Willd.) Britton","","Crassulaceae"
"CRSH6","","Cryptantha shackletteana Higgins","Shacklette's cryptantha","Boraginaceae"
"CRSH6","CRSH","Cryptantha shacklettiana Higgins, orth. var.","","Boraginaceae"
"CRSI7","","Cryptogramma sitchensis (Rupr.) T. Moore","Sitka rockbrake","Pteridaceae"
"CRSI7","CRCRS","Cryptogramma crispa (L.) R. Br. ex Hook. var. sitchensis (Rupr.) C. Chr.","","Pteridaceae"
"CRSP4","","Cryptantha spiculifera (Piper) Payson","Snake River cryptantha","Boraginaceae"
"CRSP4","ORSP3","Oreocarya spiculifera Piper","","Boraginaceae"
"CRST2","","Cryptogramma stelleri (S.G. Gmel.) Prantl","fragile rockbrake","Pteridaceae"
"CRSU16","","Crataegus suksdorfii (Sarg.) Kruschke","Suksdorf's hawthorn","Rosaceae"
"CRSU16","CRDOS","Crataegus douglasii Lindl. var. suksdorfii Sarg.","","Rosaceae"
"CRSU16","CRGA","Crataegus gaylussacia A. Heller","","Rosaceae"
"CRTE3","","Crepis tectorum L.","narrowleaf hawksbeard","Asteraceae"
"CRTO4","","Cryptantha torreyana (A. Gray) Greene","Torrey's cryptantha","Boraginaceae"
"CRTO4","CRCA14","Cryptantha calycosa (A. Gray) Rydb.","","Boraginaceae"
"CRTO4","CREA","Cryptantha eastwoodiae H. St. John","","Boraginaceae"
"CRTO4","CRFL12","Cryptantha flexulosa (A. Nelson) A. Nelson","","Boraginaceae"
"CRTO4","CRTOC","Cryptantha torreyana (A. Gray) Greene var. calycosa (A. Gray) Greene","","Boraginaceae"
"CRTO4","CRTOP","Cryptantha torreyana (A. Gray) Greene var. pumila (A. Heller) I.M. Johnst.","","Boraginaceae"
"CRYPT","","Cryptantha Lehm. ex G. Don","cryptantha","Boraginaceae"
"CRYPT3","","Cryptogramma R. Br.","rockbrake","Pteridaceae"
"CYAL10","","Cypripedium ×alaskanum P.M. Brown [guttatum × yatabeanum]","hybrid ladyslipper","Orchidaceae"
"CYFR2","","Cystopteris fragilis (L.) Bernh.","brittle bladderfern","Dryopteridaceae"
"CYFR2","CYDI10","Cystopteris dickieana Sim","","Dryopteridaceae"
"CYFR2","CYFRD","Cystopteris fragilis (L.) Bernh. ssp. dickieana (Sim) Hyl.","","Dryopteridaceae"
"CYFR2","CYFRA","Cystopteris fragilis (L.) Bernh. var. angustata G. Lawson","","Dryopteridaceae"
"CYFR2","CYFRW","Cystopteris fragilis (L.) Bernh. var. woodsioides Christ","","Dryopteridaceae"
"CYFR2","FIFR","Filix fragilis (L.) Underw.","","Dryopteridaceae"
"CYGU","","Cypripedium guttatum Sw.","spotted lady's slipper","Orchidaceae"
"CYGU","CYGUG","Cypripedium guttatum Sw. var. guttatum","","Orchidaceae"
"CYMO2","","Cypripedium montanum Douglas ex Lindl.","mountain lady's slipper","Orchidaceae"
"CYMO3","","Cystopteris montana (Lam.) Bernh. ex Desv.","mountain bladderfern","Dryopteridaceae"
"CYMO3","FIMO","Filix montana (Lam.) Underw.","","Dryopteridaceae"
"CYPA19","","Cypripedium parviflorum Salisb.","lesser yellow lady's slipper","Orchidaceae"
"CYPA5","","Cypripedium passerinum Richardson","sparrowegg lady's slipper","Orchidaceae"
"CYPA5","CYPAM2","Cypripedium passerinum Richardson var. minganense Vict.","","Orchidaceae"
"CYPAP3","","Cypripedium parviflorum Salisb. var. pubescens (Willd.) Knight","greater yellow lady's slipper","Orchidaceae"
"CYPAP3","CYCAP4","Cypripedium calceolus L. var. planipetalum (Fernald) Vict. & J. Rousseau","","Orchidaceae"
"CYPAP3","CYCAP2","Cypripedium calceolus L. var. pubescens (Willd.) Correll","","Orchidaceae"
"CYPAP3","CYFU7","Cypripedium furcatum Raf.","","Orchidaceae"
"CYPAP3","CYPL8","Cypripedium planipetalum (Fernald) Morris & Eames","","Orchidaceae"
"CYPAP3","CYPU10","Cypripedium pubescens Willd.","","Orchidaceae"
"CYPAP3","CYPUP","Cypripedium pubescens Willd. var. pubescens","","Orchidaceae"
"CYPRI","","Cypripedium L.","lady's slipper","Orchidaceae"
"CYSC4","","Cytisus scoparius (L.) Link","Scotch broom","Fabaceae"
"CYSTO","","Cystopteris Bernh.","bladderfern","Dryopteridaceae"
"CYTIS","","Cytisus Desf.","broom","Fabaceae"
"CYYA","","Cypripedium yatabeanum Makino","spotted lady's slipper","Orchidaceae"
"CYYA","CYGUY2","Cypripedium guttatum Sw. ssp. yatabeanum (Makino) Hultén","","Orchidaceae"
"CYYA","CYGUY","Cypripedium guttatum Sw. var. yatabeanum (Makino) Pfitzer","","Orchidaceae"
"DAAR","","Dactylorhiza aristata (Fisch. ex Lindl.) Soó","keyflower","Orchidaceae"
"DAARA","","Dactylorhiza aristata (Fisch. ex Lindl.) Soó var. aristata","keyflower","Orchidaceae"
"DAARA","ORAR","Orchis aristata Fisch. ex Lindl.","","Orchidaceae"
"DAARK","","Dactylorhiza aristata (Fisch. ex Lindl.) Soó var. kodiakensis Luer & Luer f.","Kodiak keyflower","Orchidaceae"
"DACO","","Danthonia compressa Austin","flattened oatgrass","Poaceae"
"DACO","DAAL3","Danthonia allenii Austin","","Poaceae"
"DACTY","","Dactylis L.","orchardgrass","Poaceae"
"DACTY3","","Dactylorhiza Neck. ex Nevski","keyflower","Orchidaceae"
"DAFR6","","Dasiphora fruticosa (L.) Rydb.","shrubby cinquefoil","Rosaceae"
"DAFR6","POFR4","Potentilla fruticosa L.","","Rosaceae"
"DAFRF","","Dasiphora fruticosa (L.) Rydb. ssp. floribunda (Pursh) Kartesz","shrubby cinquefoil","Rosaceae"
"DAFRF","DAFL3","Dasiphora floribunda (Pursh) Raf.","","Rosaceae"
"DAFRF","DAFR3","Dasiphora fruticosa auct. non (L.) Rydb.","","Rosaceae"
"DAFRF","PEFL15","Pentaphylloides floribunda (Pursh) Á. Löve, nom. illeg.","","Rosaceae"
"DAFRF","PEFR10","Pentaphylloides fruticosa auct. non (L.) O. Schwarz","","Rosaceae"
"DAFRF","POFL13","Potentilla floribunda Pursh","","Rosaceae"
"DAFRF","POFRF","Potentilla fruticosa L. ssp. floribunda (Pursh) Elkington","","Rosaceae"
"DAFRF","POFRF4","Potentilla fruticosa L. var. farreri Besant","","Rosaceae"
"DAFRF","POFRT","Potentilla fruticosa L. var. tenuifolia Lehm.","","Rosaceae"
"DAGL","","Dactylis glomerata L.","orchardgrass","Poaceae"
"DAGLG","","Dactylis glomerata L. ssp. glomerata","orchardgrass","Poaceae"
"DAGLG","DAGLC","Dactylis glomerata L. var. ciliata Peterm.","","Poaceae"
"DAGLG","DAGLD","Dactylis glomerata L. var. detonsa Fr.","","Poaceae"
"DAGLG","DAGLV","Dactylis glomerata L. var. vivipara Parl.","","Poaceae"
"DAIN","","Danthonia intermedia Vasey","timber oatgrass","Poaceae"
"DAIN","DACA11","Danthonia canadensis Baum & Findlay","","Poaceae"
"DAIN","DAINC","Danthonia intermedia Vasey var. cusickii T.A. Williams","","Poaceae"
"DAME3","","Daphne mezereum L.","paradise plant","Thymelaeaceae"
"DANTH","","Danthonia DC.","oatgrass","Poaceae"
"DAPHN2","","Daphne L.","daphne","Thymelaeaceae"
"DASIP","","Dasiphora Raf.","shrubby cinquefoil","Rosaceae"
"DASP2","","Danthonia spicata (L.) P. Beauv. ex Roem. & Schult.","poverty oatgrass","Poaceae"
"DASP2","DASPL","Danthonia spicata (L.) P. Beauv. ex Roem. & Schult. var. longipila Scribn. & Merr.","","Poaceae"
"DASP2","DASPP","Danthonia spicata (L.) P. Beauv. ex Roem. & Schult. var. pinetorum Piper","","Poaceae"
"DASP2","DATH3","Danthonia thermalis Scribn.","","Poaceae"
"DAVI6","","Dactylorhiza viridis (L.) R.M. Bateman, A.M. Pridgeon & M.W. Chase","longbract frog orchid","Orchidaceae"
"DAVI6","COBR3","Coeloglossum bracteatum (Muhl. ex Willd.) Parl.","","Orchidaceae"
"DAVI6","COVI6","Coeloglossum viride (L.) Hartm.","","Orchidaceae"
"DAVI6","COVIB3","Coeloglossum viride (L.) Hartm. ssp. bracteatum (Muhl. ex Willd.) Hultén","","Orchidaceae"
"DAVI6","COVII","Coeloglossum viride (L.) Hartm. var. islandicum (Lindl.) M. Schulze","","Orchidaceae"
"DAVI6","COVIV","Coeloglossum viride (L.) Hartm. var. virescens (Muhl. ex Willd.) Luer","","Orchidaceae"
"DAVI6","COVIV2","Coeloglossum viride (L.) Hartm. var. viride","","Orchidaceae"
"DAVI6","HABR7","Habenaria bracteata (Muhl. ex Willd.) R. Br.","","Orchidaceae"
"DAVI6","HAVI7","Habenaria viridis (L.) R. Br.","","Orchidaceae"
"DAVI6","HAVIB2","Habenaria viridis (L.) R. Br. var. bracteata (Muhl. ex Willd.) Rchb. ex A. Gray","","Orchidaceae"
"DAVI6","HAVII","Habenaria viridis (L.) R. Br. var. interjecta Fernald","","Orchidaceae"
"DEBE2","","Deschampsia beringensis Hultén","Bering's tufted hairgrass","Poaceae"
"DEBE2","DECAB","Deschampsia caespitosa (L.) P. Beauv. ssp. beringensis (Hultén) W.E. Lawrence, orth. var.","","Poaceae"
"DEBE2","DECEB","Deschampsia cespitosa (L.) P. Beauv. ssp. beringensis (Hultén) W.E. Lawrence","","Poaceae"
"DEBR","","Delphinium brachycentrum Ledeb.","northern larkspur","Ranunculaceae"
"DEBR","DERU2","Delphinium ruthiae A. Nelson","","Ranunculaceae"
"DEBR2","","Deschampsia brevifolia R. Br.","Bering hairgrass","Poaceae"
"DEBR2","DECAB2","Deschampsia caespitosa (L.) P. Beauv. ssp. brevifolia (R. Br.) Tzvelev, orth. var.","","Poaceae"
"DEBR2","DECEB3","Deschampsia cespitosa (L.) P. Beauv. ssp. brevifolia (R. Br.) Tzvelev","","Poaceae"
"DECE","","Deschampsia cespitosa (L.) P. Beauv.","tufted hairgrass","Poaceae"
"DECE","AICA6","Aira caespitosa L.","","Poaceae"
"DECE","AICE","Aira cespitosa L., orth. var.","","Poaceae"
"DECE","DEBO2","Deschampsia bottnica (Wahlenb.) Trin.","","Poaceae"
"DECE","DECA18","Deschampsia caespitosa (L.) P. Beauv., orth. var.","","Poaceae"
"DECE","DECAG3","Deschampsia caespitosa (L.) P. Beauv. ssp. genuina (Rchb.) O.H. Volk, orth. var.","","Poaceae"
"DECE","DECAG","Deschampsia caespitosa (L.) P. Beauv. ssp. glauca (C. Hartm.) C. Hartm., orth. var.","","Poaceae"
"DECE","DECAO","Deschampsia caespitosa (L.) P. Beauv. ssp. orientalis Hultén, orth. var.","","Poaceae"
"DECE","DECAP5","Deschampsia caespitosa (L.) P. Beauv. ssp. paramushirensis (Honda) Tzvelev, orth. var.","","Poaceae"
"DECE","DECAP3","Deschampsia caespitosa (L.) P. Beauv. ssp. parviflora (Thuill.) K. Richt., orth. var.","","Poaceae"
"DECE","DECAA4","Deschampsia caespitosa (L.) P. Beauv. var. abbei B. Boivin, orth. var.","","Poaceae"
"DECE","DECAA3","Deschampsia caespitosa (L.) P. Beauv. var. alpicola (Rydb.) Á. Löve & D. Löve & Kapoor, orth. var.","","Poaceae"
"DECE","DECAA2","Deschampsia caespitosa (L.) P. Beauv. var. arctica Vasey, orth. var.","","Poaceae"
"DECE","DECAG2","Deschampsia caespitosa (L.) P. Beauv. var. glauca (C. Hartm.) C. Hartm., non Regel, orth. var.","","Poaceae"
"DECE","DECAI4","Deschampsia caespitosa (L.) P. Beauv. var. intercotidalis B. Boivin, orth. var.","","Poaceae"
"DECE","DECAL2","Deschampsia caespitosa (L.) P. Beauv. var. littoralis (Gaudin) K. Richt., orth. var.","","Poaceae"
"DECE","DECAL","Deschampsia caespitosa (L.) P. Beauv. var. longiflora Beal, orth. var.","","Poaceae"
"DECE","DECAM3","Deschampsia caespitosa (L.) P. Beauv. var. mackenzieana (Raup) B. Boivin, orth. var.","","Poaceae"
"DECE","DECAM2","Deschampsia caespitosa (L.) P. Beauv. var. maritima Vasey, orth. var.","","Poaceae"
"DECE","DECAP4","Deschampsia caespitosa (L.) P. Beauv. var. parviflora (Thuill.) Coss. & Germ., orth. var.","","Poaceae"
"DECE","DECEB5","Deschampsia cespitosa (L.) P. Beauv. ssp. bottnica (Wahlenb.) Tzvelev","","Poaceae"
"DECE","DECEC2","Deschampsia cespitosa (L.) P. Beauv. ssp. cespitosa","","Poaceae"
"DECE","DECEG3","Deschampsia cespitosa (L.) P. Beauv. ssp. genuina (Rchb.) O.H. Volk","","Poaceae"
"DECE","DECEG2","Deschampsia cespitosa (L.) P. Beauv. ssp. glauca (C. Hartm.) C. Hartm.","","Poaceae"
"DECE","DECEO2","Deschampsia cespitosa (L.) P. Beauv. ssp. obensis (Rosh.) Tzvelev","","Poaceae"
"DECE","DECEO","Deschampsia cespitosa (L.) P. Beauv. ssp. orientalis Hultén","","Poaceae"
"DECE","DECEP2","Deschampsia cespitosa (L.) P. Beauv. ssp. paramushirensis (Honda) Tzvelev","","Poaceae"
"DECE","DECEP3","Deschampsia cespitosa (L.) P. Beauv. ssp. parviflora (Thuill.) K. Richt.","","Poaceae"
"DECE","DECEA4","Deschampsia cespitosa (L.) P. Beauv. var. abbei B. Boivin","","Poaceae"
"DECE","DECEA","Deschampsia cespitosa (L.) P. Beauv. var. alpicola (Rydb.) Á. Löve & D. Löve & Kapoor","","Poaceae"
"DECE","DECEA3","Deschampsia cespitosa (L.) P. Beauv. var. arctica Vasey","","Poaceae"
"DECE","DECEB6","Deschampsia cespitosa (L.) P. Beauv. var. bottnica (Wahlenb.) Vasey","","Poaceae"
"DECE","DECEG","Deschampsia cespitosa (L.) P. Beauv. var. glauca (C. Hartm.) C. Hartm., non Regel","","Poaceae"
"DECE","DECEI","Deschampsia cespitosa (L.) P. Beauv. var. intercotidalis B. Boivin","","Poaceae"
"DECE","DECEL","Deschampsia cespitosa (L.) P. Beauv. var. littoralis (Gaudin) K. Richt.","","Poaceae"
"DECE","DECEL2","Deschampsia cespitosa (L.) P. Beauv. var. longiflora Beal","","Poaceae"
"DECE","DECEM2","Deschampsia cespitosa (L.) P. Beauv. var. mackenzieana (Raup) B. Boivin","","Poaceae"
"DECE","DECEM","Deschampsia cespitosa (L.) P. Beauv. var. maritima Vasey","","Poaceae"
"DECE","DECEP4","Deschampsia cespitosa (L.) P. Beauv. var. pallida Gren. & Godr.","","Poaceae"
"DECE","DECEP","Deschampsia cespitosa (L.) P. Beauv. var. parviflora (Thuill.) Coss. & Germ.","","Poaceae"
"DECE","DEGL9","Deschampsia glauca C. Hartm.","","Poaceae"
"DECE","DEMA3","Deschampsia mackenzieana Raup","","Poaceae"
"DECE","DEOB6","Deschampsia obensis Rosh.","","Poaceae"
"DECE","DEPA11","Deschampsia paramushirensis Honda","","Poaceae"
"DECE","DEPU3","Deschampsia pumila (Ledeb.) Ostenf.","","Poaceae"
"DECE","DESU2","Deschampsia sukatschewii (Popl.) Rosh.","","Poaceae"
"DECH","","Delphinium chamissonis Pritz. ex Walp.","Chamisso's larkspur","Ranunculaceae"
"DEDA","","Deschampsia danthonioides (Trin.) Munro","annual hairgrass","Poaceae"
"DEDA","AIDA","Aira danthonioides Trin.","","Poaceae"
"DEDA","DECA10","Deschampsia calycina J. Presl","","Poaceae"
"DEDA","DEDAG","Deschampsia danthonioides (Trin.) Munro var. gracilis (Vasey) Munz","","Poaceae"
"DEEL","","Deschampsia elongata (Hook.) Munro","slender hairgrass","Poaceae"
"DEEL","AIEL3","Aira elongata Hook.","","Poaceae"
"DEEL2","","Delphinium elatum L.","candle larkspur","Ranunculaceae"
"DEFL","","Deschampsia flexuosa (L.) Trin.","wavy hairgrass","Poaceae"
"DEFLF","","Deschampsia flexuosa (L.) Trin. var. flexuosa","wavy hairgrass","Poaceae"
"DEFLF","AIFL","Aira flexuosa L.","","Poaceae"
"DEFLF","AVFL2","Avenella flexuosa (L.) Drejer","","Poaceae"
"DEFLF","LEFL5","Lerchenfeldia flexuosa (L.) Schur","","Poaceae"
"DEGL3","","Delphinium glaucum S. Watson","Sierra larkspur","Ranunculaceae"
"DEGL3","DEBR4","Delphinium brownii Rydb.","","Ranunculaceae"
"DEGL3","DESC7","Delphinium scopulorum auct. non A. Gray","","Ranunculaceae"
"DEGL3","DESCG","Delphinium scopulorum A. Gray var. glaucum (S. Watson) A. Gray","","Ranunculaceae"
"DEIN5","","Descurainia incana (Bernh. ex Fisch. & C.A. Mey.) Dorn","mountain tansymustard","Brassicaceae"
"DEINI","","Descurainia incana (Bernh. ex Fisch. & C.A. Mey.) Dorn ssp. incana","mountain tansymustard","Brassicaceae"
"DEINI","DEINM","Descurainia incana (Bernh. ex Fisch. & C.A. Mey.) Dorn var. major (Hook.) Dorn","","Brassicaceae"
"DEINI","DERI2","Descurainia richardsonii O.E. Schulz","","Brassicaceae"
"DEINI","DETO2","Descurainia torulosa Rollins, nom. inq.","","Brassicaceae"
"DEINI","SIIN11","Sisymbrium incanum Bernh. ex Fisch. & C.A. Mey.","","Brassicaceae"
"DEINI","SORI5","Sophia richardsonii (O.E. Schulz) Rydb.","","Brassicaceae"
"DELPH","","Delphinium L.","larkspur","Ranunculaceae"
"DENU7","","Delphinium ×nutans A. Nelson (pro sp.) [brachycentrum × glaucum]","larkspur","Ranunculaceae"
"DESCH","","Deschampsia P. Beauv.","hairgrass","Poaceae"
"DESCU","","Descurainia Webb & Bethel.","tansymustard","Brassicaceae"
"DESO2","","Descurainia sophia (L.) Webb ex Prantl","herb sophia","Brassicaceae"
"DESO2","SISO4","Sisymbrium sophia L.","","Brassicaceae"
"DESO2","SOSO7","Sophia sophia (L.) Britton, nom. inval.","","Brassicaceae"
