"Symbol","Synonym Symbol","Scientific Name with Author","State Common Name","Family"
"ABAM","","Abies amabilis (Douglas ex Loudon) Douglas ex Forbes","Pacific silver fir","Pinaceae"
"ABIES","","Abies Mill.","fir","Pinaceae"
"ABLA","","Abies lasiocarpa (Hook.) Nutt.","subalpine fir","Pinaceae"
"ABLAL","","Abies lasiocarpa (Hook.) Nutt. var. lasiocarpa","subalpine fir","Pinaceae"
"ABLAL","ABBAL","Abies balsamea (L.) Mill. ssp. lasiocarpa (Hook.) B. Boivin","","Pinaceae"
"ABLAL","ABBAF","Abies balsamea (L.) Mill. var. fallax (Engelm.) B. Boivin","","Pinaceae"
"ABLAL","ABBI3","Abies bifolia A. Murray bis","","Pinaceae"
"ABLAL","ABLAB","Abies lasiocarpa (Hook.) Nutt. ssp. bifolia (A. Murray bis) Silba","","Pinaceae"
"ABLAL","ABLAB2","Abies lasiocarpa (Hook.) Nutt. var. bifolia (A. Murray bis) Eckenw.","","Pinaceae"
"ABLAL","ABSU","Abies subalpina Engelmann","","Pinaceae"
"ACAM","","Acorus americanus (Raf.) Raf.","sweetflag","Acoraceae"
"ACAM","ACCA10","Acorus calamus auct. non L.","","Acoraceae"
"ACAM","ACCAA2","Acorus calamus L. var. americanus (Raf.) H.D. Wulff.","","Acoraceae"
"ACARO2","","Acarospora A. Massal.","cracked lichen","Acarosporaceae"
"ACCI","","Acer circinatum Pursh","vine maple","Aceraceae"
"ACDE2","","Aconitum delphiniifolium DC.","larkspurleaf monkshood","Ranunculaceae"
"ACDEC","","Aconitum delphiniifolium DC. ssp. chamissonianum (Rchb.) Hultén","larkspurleaf monkshood","Ranunculaceae"
"ACDED3","","Aconitum delphiniifolium DC. ssp. delphiniifolium","larkspurleaf monkshood","Ranunculaceae"
"ACDED3","ACDEA","Aconitum delphiniifolium DC. var. albiflorum A.E. Porsild","","Ranunculaceae"
"ACDEP","","Aconitum delphiniifolium DC. ssp. paradoxum (Rchb.) Hultén","larkspurleaf monkshood","Ranunculaceae"
"ACDEP","ACNI3","Aconitum nivatum A. Nelson","","Ranunculaceae"
"ACER","","Acer L.","maple","Aceraceae"
"ACGL","","Acer glabrum Torr.","Rocky Mountain maple","Aceraceae"
"ACGLD4","","Acer glabrum Torr. var. douglasii (Hook.) Dippel","Douglas maple","Aceraceae"
"ACGLD4","ACDO","Acer douglasii Hook.","","Aceraceae"
"ACGLD4","ACGLD2","Acer glabrum Torr. ssp. douglasii (Hook.) Wesmael","","Aceraceae"
"ACHIL","","Achillea L.","yarrow","Asteraceae"
"ACHNA","","Achnatherum P. Beauv.","needlegrass","Poaceae"
"ACMA4","","Aconitum maximum Pall. ex DC.","Kamchatka aconite","Ranunculaceae"
"ACMI2","","Achillea millefolium L.","common yarrow","Asteraceae"
"ACMIA","","Achillea millefolium L. var. alpicola (Rydb.) Garrett","common yarrow","Asteraceae"
"ACMIA","ACAL11","Achillea alpicola (Rydb.) Rydb.","","Asteraceae"
"ACMIA","ACFU","Achillea fusca Rydb.","","Asteraceae"
"ACMIA","ACLAA","Achillea lanulosa Nutt. ssp. alpicola (Rydb.) D.D. Keck","","Asteraceae"
"ACMIA","ACLAA2","Achillea lanulosa Nutt. var. alpicola Rydb.","","Asteraceae"
"ACMIA","ACMIF","Achillea millefolium L. var. fusca (Rydb.) G.N. Jones","","Asteraceae"
"ACMIA","ACSU3","Achillea subalpina Greene","","Asteraceae"
"ACMIB","","Achillea millefolium L. var. borealis (Bong.) Farw.","boreal yarrow","Asteraceae"
"ACMIB","ACBO","Achillea borealis Bong.","","Asteraceae"
"ACMIB","ACBOT","Achillea borealis Bong. ssp. typica D.D. Keck","","Asteraceae"
"ACMIB","ACMIA3","Achillea millefolium L. ssp. atrotegula B. Boivin","","Asteraceae"
"ACMIB","ACMIB2","Achillea millefolium L. ssp. borealis (Bong.) Breitung","","Asteraceae"
"ACMIB","ACMIF2","Achillea millefolium L. var. fulva B. Boivin","","Asteraceae"
"ACMIB","ACMIP3","Achillea millefolium L. var. parviligula B. Boivin","","Asteraceae"
"ACMIB","ACMIP4","Achillea millefolium L. var. parvula B. Boivin","","Asteraceae"
"ACMIN","","Achillea millefolium L. var. nigrescens E. Mey.","common yarrow","Asteraceae"
"ACMIN","ACNI4","Achillea nigrescens (E. Mey.) Rydb.","","Asteraceae"
"ACMIO","","Achillea millefolium L. var. occidentalis DC.","western yarrow","Asteraceae"
"ACMIO","ACAN7","Achillea angustissima Rydb.","","Asteraceae"
"ACMIO","ACAS2","Achillea aspleniifolia auct. non Vent.","","Asteraceae"
"ACMIO","ACER2","Achillea eradiata Piper","","Asteraceae"
"ACMIO","ACGR5","Achillea gracilis Raf.","","Asteraceae"
"ACMIO","ACLA5","Achillea lanulosa Nutt.","","Asteraceae"
"ACMIO","ACLAT","Achillea lanulosa Nutt. ssp. typica D.D. Keck","","Asteraceae"
"ACMIO","ACLAA3","Achillea lanulosa Nutt. var. arachnoidea Lunell","","Asteraceae"
"ACMIO","ACLAE","Achillea lanulosa Nutt. var. eradiata (Piper) M. Peck","","Asteraceae"
"ACMIO","ACLA3","Achillea laxiflora Pollard & Cockerell","","Asteraceae"
"ACMIO","ACMIL","Achillea millefolium L. ssp. lanulosa (Nutt.) Piper","","Asteraceae"
"ACMIO","ACMIO2","Achillea millefolium L. ssp. occidentalis (DC.) Hyl.","","Asteraceae"
"ACMIO","ACMIP5","Achillea millefolium L. ssp. pallidotegula B. Boivin","","Asteraceae"
"ACMIO","ACMIA4","Achillea millefolium L. var. aspleniifolia (Vent.) Farw.","","Asteraceae"
"ACMIO","ACMIG2","Achillea millefolium L. var. gracilis (Raf.) Raf. ex DC.","","Asteraceae"
"ACMIO","ACMIL3","Achillea millefolium L. var. lanulosa (Nutt.) Piper","","Asteraceae"
"ACMIO","ACMIR","Achillea millefolium L. var. rosea (Desf.) Torr. & A. Gray","","Asteraceae"
"ACMIO","ACMIR2","Achillea millefolium L. var. russeolata B. Boivin","","Asteraceae"
"ACMIO","ACOC","Achillea occidentalis (DC.) Raf. ex Rydb.","","Asteraceae"
"ACMIO","ACRO4","Achillea rosea Desf.","","Asteraceae"
"ACMIO","ACTO3","Achillea tomentosa Pursh, non L.","","Asteraceae"
"ACMIP","","Achillea millefolium L. var. pacifica (Rydb.) G.N. Jones","Pacific yarrow","Asteraceae"
"ACMIP","ACPA5","Achillea pacifica Rydb.","","Asteraceae"
"ACONI","","Aconitum L.","monkshood","Ranunculaceae"
"ACORU","","Acorus L.","sweetflag","Acoraceae"
"ACPT","","Achillea ptarmica L.","sneezeweed","Asteraceae"
"ACRI8","","Achnatherum richardsonii (Link) Barkworth","Richardson's needlegrass","Poaceae"
"ACRI8","STRI2","Stipa richardsonii Link","","Poaceae"
"ACRU2","","Actaea rubra (Aiton) Willd.","red baneberry","Ranunculaceae"
"ACRUA8","","Actaea rubra (Aiton) Willd. ssp. arguta (Nutt.) Hultén","red baneberry","Ranunculaceae"
"ACRUA8","ACAR7","Actaea arguta Nutt.","","Ranunculaceae"
"ACRUA8","ACARV","Actaea arguta Nutt. var. viridiflora (Greene) Tidestr.","","Ranunculaceae"
"ACRUA8","ACRUA","Actaea rubra (Aiton) Willd. var. arguta (Nutt.) G. Lawson","","Ranunculaceae"
"ACRUA8","ACSPA","Actaea spicata L. var. arguta (Nutt.) Torr.","","Ranunculaceae"
"ACRUR2","","Actaea rubra (Aiton) Willd. ssp. rubra","red baneberry","Ranunculaceae"
"ACRUR2","ACRUR3","Actaea rubra (Aiton) Willd. var. rubra","","Ranunculaceae"
"ACRUR2","ACSPR3","Actaea spicata L. ssp. rubra (Aiton) Hultén","","Ranunculaceae"
"ACSI","","Achillea sibirica Ledeb.","Siberian yarrow","Asteraceae"
"ACSI","ACMU3","Achillea multiflora Hook.","","Asteraceae"
"ACTAE","","Actaea L.","baneberry","Ranunculaceae"
"ADAL","","Adiantum aleuticum (Rupr.) Paris","Aleutian maidenhair","Pteridaceae"
"ADAL","ADPEA2","Adiantum pedatum L. ssp. aleuticum (Rupr.) Calder & Roy L. Taylor","","Pteridaceae"
"ADAL","ADPEC","Adiantum pedatum L. ssp. calderi Cody","","Pteridaceae"
"ADAL","ADPES","Adiantum pedatum L. ssp. subpumilum (W.H. Wagner) Lellinger","","Pteridaceae"
"ADAL","ADPEA","Adiantum pedatum L. var. aleuticum Rupr.","","Pteridaceae"
"ADAL","ADPES2","Adiantum pedatum L. var. subpumilum W.H. Wagner","","Pteridaceae"
"ADIAN","","Adiantum L.","maidenhair fern","Pteridaceae"
"ADMO","","Adoxa moschatellina L.","muskroot","Adoxaceae"
"ADOXA","","Adoxa L.","adoxa","Adoxaceae"
"AGAE","","Agrostis aequivalvis (Trin.) Trin.","arctic bentgrass","Poaceae"
"AGAE","POAE","Podagrostis aequivalvis (Trin.) Scribn. & Merr.","","Poaceae"
"AGAU2","","Agoseris aurantiaca (Hook.) Greene","orange agoseris","Asteraceae"
"AGAUA","","Agoseris aurantiaca (Hook.) Greene var. aurantiaca","orange agoseris","Asteraceae"
"AGAUA","AGGR7","Agoseris graminifolia Greene","","Asteraceae"
"AGAUA","AGRO2","Agoseris rostrata Rydb.","","Asteraceae"
"AGAUA","TRAU8","Troximon aurantiacum Hook.","","Asteraceae"
"AGCA5","","Agrostis capillaris L.","colonial bentgrass","Poaceae"
"AGCA5","AGSY2","Agrostis sylvatica Huds.","","Poaceae"
"AGCA5","AGTE","Agrostis tenuis Sibth.","","Poaceae"
"AGCA5","AGTEA","Agrostis tenuis Sibth. var. aristata (Parnell) Druce","","Poaceae"
"AGCA5","AGTEH","Agrostis tenuis Sibth. var. hispida (Willd.) Philipson","","Poaceae"
"AGCA5","AGTEP","Agrostis tenuis Sibth. var. pumila (L.) Druce","","Poaceae"
"AGCA5","AGVU2","Agrostis vulgaris With.","","Poaceae"
"AGCL","","Agrostis clavata Trin.","clavate bentgrass","Poaceae"
"AGCR","","Agropyron cristatum (L.) Gaertn.","crested wheatgrass","Poaceae"
"AGCRP8","","Agropyron cristatum (L.) Gaertn. ssp. pectinatum (M. Bieb.) Tzvelev","crested wheatgrass","Poaceae"
"AGCRP8","AGCR3","Agropyron cristatiforme Sarkar","","Poaceae"
"AGCRP8","AGPE6","Agropyron pectinatum (M. Bieb.) P. Beauv.","","Poaceae"
"AGCRP8","AGPE5","Agropyron pectiniforme Roem. & Schult.","","Poaceae"
"AGEX","","Agrostis exarata Trin.","spike bentgrass","Poaceae"
"AGEX","AGAE2","Agrostis aenea Trin.","","Poaceae"
"AGEX","AGAL2","Agrostis alaskana Hultén","","Poaceae"
"AGEX","AGAM2","Agrostis ampla Hitchc.","","Poaceae"
"AGEX","AGAS4","Agrostis asperifolia Trin.","","Poaceae"
"AGEX","AGEXM3","Agrostis exarata Trin. ssp. minor (Hook.) C.L. Hitchc.","","Poaceae"
"AGEX","AGEXM","Agrostis exarata Trin. var. minor Hook.","","Poaceae"
"AGEX","AGEXM2","Agrostis exarata Trin. var. monolepis (Torr.) Hitchc.","","Poaceae"
"AGEX","AGEXP2","Agrostis exarata Trin. var. pacifica Vasey","","Poaceae"
"AGEX","AGEXP","Agrostis exarata Trin. var. purpurascens Hultén","","Poaceae"
"AGEX","AGLO2","Agrostis longiligula Hitchc.","","Poaceae"
"AGEX","AGLOA","Agrostis longiligula Hitchc. var. australis J.T. Howell","","Poaceae"
"AGEX","AGME","Agrostis melaleuca (Trin.) Hitchc.","","Poaceae"
"AGEX","AGMIM","Agrostis microphylla Steud. var. major Vasey","","Poaceae"
"AGGI","","Agrostemma githago L.","common corncockle","Caryophyllaceae"
"AGGI2","","Agrostis gigantea Roth","redtop","Poaceae"
"AGGI2","AGAL3","Agrostis alba auct. non L.","","Poaceae"
"AGGI2","AGGID","Agrostis gigantea Roth var. dispar (Michx.) Philipson","","Poaceae"
"AGGI2","AGNI","Agrostis nigra With.","","Poaceae"
"AGGI2","AGSTG","Agrostis stolonifera L. ssp. gigantea (Roth) Schübl. & G. Martens","","Poaceae"
"AGGI2","AGSTM","Agrostis stolonifera L. var. major (Gaudin) Farw.","","Poaceae"
"AGGL","","Agoseris glauca (Pursh) Raf.","pale agoseris","Asteraceae"
"AGGLD","","Agoseris glauca (Pursh) Raf. var. dasycephala (Torr. & A. Gray) Jeps.","pale agoseris","Asteraceae"
"AGGLD","AGGLS","Agoseris glauca (Pursh) Raf. ssp. scorzonerifolia (Schrad.) Piper","","Asteraceae"
"AGGLD","AGGLA2","Agoseris glauca (Pursh) Raf. var. asper (Rydb.) Cronquist","","Asteraceae"
"AGGLD","AGGLP2","Agoseris glauca (Pursh) Raf. var. pumila (Nutt.) Garrett","","Asteraceae"
"AGGLD","AGSC7","Agoseris scorzonerifolia (Schrad.) Greene","","Asteraceae"
"AGGLD","TRGLD","Troximon glaucum Pursh var. dasycephalum Torr. & A. Gray","","Asteraceae"
"AGHU","","Agrostis humilis Vasey","alpine bentgrass","Poaceae"
"AGHU","AGTH2","Agrostis thurberiana Hitchc.","","Poaceae"
"AGHU","POHU","Podagrostis humilis (Vasey) Björkman","","Poaceae"
"AGHU","POTH3","Podagrostis thurberiana (Hitchc.) Hultén","","Poaceae"
"AGID","","Agrostis idahoensis Nash","Idaho bentgrass","Poaceae"
"AGID","AGBOR","Agrostis borealis Hartm. var. recta (Hartm.) B. Boivin","","Poaceae"
"AGID","AGCL4","Agrostis clavata auct. non Trin.","","Poaceae"
"AGID","AGFI3","Agrostis filicumis M.E. Jones","","Poaceae"
"AGME3","","Agrostis mertensii Trin.","northern bentgrass","Poaceae"
"AGME3","AGBA5","Agrostis bakeri Rydb.","","Poaceae"
"AGME3","AGBO2","Agrostis borealis Hartm.","","Poaceae"
"AGME3","AGBOA3","Agrostis borealis Hartm. var. americana (Scribn.) Fernald","","Poaceae"
"AGME3","AGBOP","Agrostis borealis Hartm. var. paludosa (Scribn.) Fernald","","Poaceae"
"AGME3","AGIDB","Agrostis idahoensis Nash var. bakeri (Rydb.) W.A. Weber","","Poaceae"
"AGME3","AGMEB","Agrostis mertensii Trin. ssp. borealis (Hartm.) Tzvelev","","Poaceae"
"AGME3","AGRU2","Agrostis rupestris auct. non All.","","Poaceae"
"AGOSE","","Agoseris Raf.","agoseris","Asteraceae"
"AGROP2","","Agropyron Gaertn.","wheatgrass","Poaceae"
"AGROS","","Agrostemma L.","corncockle","Caryophyllaceae"
"AGROS2","","Agrostis L.","bentgrass","Poaceae"
"AGSC5","","Agrostis scabra Willd.","rough bentgrass","Poaceae"
"AGSC5","AGGE2","Agrostis geminata Trin.","","Poaceae"
"AGSC5","AGHYG","Agrostis hyemalis (Walter) Britton, Sterns & Poggenb. var. geminata (Trin.) Hitchc.","","Poaceae"
"AGSC5","AGHYS","Agrostis hyemalis (Walter) Britton, Sterns & Poggenb. var. scabra (Willd.) Blomquist","","Poaceae"
"AGSC5","AGHYT","Agrostis hyemalis (Walter) Britton, Sterns & Poggenb. var. tenuis (Tuck.) Gleason","","Poaceae"
"AGSC5","AGSCS4","Agrostis scabra Willd. ssp. septentrionalis (Fernald) Á. Löve & D. Löve","","Poaceae"
"AGSC5","AGSCG","Agrostis scabra Willd. var. geminata (Trin.) Swallen","","Poaceae"
"AGSC5","AGSCS","Agrostis scabra Willd. var. septentrionalis Fernald","","Poaceae"
"AGST2","","Agrostis stolonifera L.","creeping bentgrass","Poaceae"
"AGST2","AGALP","Agrostis alba L. var. palustris (Huds.) Pers.","","Poaceae"
"AGST2","AGALS","Agrostis alba L. var. stolonifera (L.) Sm.","","Poaceae"
"AGST2","AGMA10","Agrostis maritima Lam.","","Poaceae"
"AGST2","AGPA17","Agrostis palustris Huds.","","Poaceae"
"AGST2","AGSTC","Agrostis stolonifera L. var. compacta Hartm.","","Poaceae"
"AGST2","AGSTP","Agrostis stolonifera L. var. palustris (Huds.) Farw.","","Poaceae"
"AGVI9","","Agrostis vinealis Schreb.","brown bentgrass","Poaceae"
"AGVIV3","","Agrostis vinealis Schreb. ssp. vinealis","brown bentgrass","Poaceae"
"AGVIV3","AGCAM3","Agrostis canina L. ssp. montana (Hartm.) Hartm.","","Poaceae"
"AGVIV3","AGCAA2","Agrostis canina L. var. arida Schltdl.","","Poaceae"
"AGVIV3","AGCAM4","Agrostis canina L. var. montana Hartm.","","Poaceae"
"AGVIV3","AGST5","Agrostis stricta J.F. Gmel.","","Poaceae"
"AGVIV3","AGTR4","Agrostis trinii Turcz.","","Poaceae"
"AGVIV3","AGVIT","Agrostis vinealis Schreb. ssp. trinii (Turcz.) Tzvelev","","Poaceae"
"AICA","","Aira caryophyllea L.","silver hairgrass","Poaceae"
"AICAC2","","Aira caryophyllea L. var. caryophyllea","silver hairgrass","Poaceae"
"AICAC2","ASCA22","Aspris caryophyllea (L.) Nash","","Poaceae"
"AIRA","","Aira L.","hairgrass","Poaceae"
"ALAE","","Alopecurus aequalis Sobol.","shortawn foxtail","Poaceae"
"ALAEA","","Alopecurus aequalis Sobol. var. aequalis","shortawn foxtail","Poaceae"
"ALAEA","ALAEN","Alopecurus aequalis Sobol. var. natans (Wahlenb.) Fernald","","Poaceae"
"ALAEA","ALAR5","Alopecurus aristulatus Michx.","","Poaceae"
"ALAEA","ALGEA","Alopecurus geniculatus L. var. aristulatus (Michx.) Torr.","","Poaceae"
"ALCHE","","Alchemilla L.","lady's mantle","Rosaceae"
"ALFI4","","Allium fistulosum L.","welsh onion","Liliaceae"
"ALGE2","","Alopecurus geniculatus L.","water foxtail","Poaceae"
"ALGEG4","","Alopecurus geniculatus L. var. geniculatus","water foxtail","Poaceae"
"ALGEG4","ALPA9","Alopecurus pallescens Piper","","Poaceae"
"ALIN2","","Alnus incana (L.) Moench","gray alder","Betulaceae"
"ALINT","","Alnus incana (L.) Moench ssp. tenuifolia (Nutt.) Breitung","thinleaf alder","Betulaceae"
"ALINT","ALINO","Alnus incana (L.) Moench var. occidentalis (Dippel) C.L. Hitchc.","","Betulaceae"
"ALINT","ALINV","Alnus incana (L.) Moench var. virescens S. Watson","","Betulaceae"
"ALINT","ALPU5","Alnus ×purpusii Callier","","Betulaceae"
"ALINT","ALTE2","Alnus tenuifolia Nutt.","","Betulaceae"
"ALISM","","Alisma L.","water plantain","Alismataceae"
"ALLIA","","Alliaria Heist. ex Fabr.","alliaria","Brassicaceae"
"ALLIU","","Allium L.","onion","Liliaceae"
"ALMA8","","Alopecurus magellanicus Lam.","Alpine Meadow-Foxtail","Poaceae"
"ALMA8","ALAL2","Alopecurus alpinus Sm.","","Poaceae"
"ALMA8","ALALG","Alopecurus alpinus Sm. ssp. glaucus (Less.) Hultén","","Poaceae"
"ALMA8","ALALS","Alopecurus alpinus Sm. ssp. stejnegeri (Vasey) Hultén","","Poaceae"
"ALMA8","ALALB","Alopecurus alpinus Sm. var. borealis (Trin.) Griseb.","","Poaceae"
"ALMA8","ALALG2","Alopecurus alpinus Sm. var. glaucus (Less.) Krylov","","Poaceae"
"ALMA8","ALALO","Alopecurus alpinus Sm. var. occidentalis (Scribn. & Tweedy) B. Boivin","","Poaceae"
"ALMA8","ALALS2","Alopecurus alpinus Sm. var. stejnegeri (Vasey) Hultén","","Poaceae"
"ALMA8","ALBO6","Alopecurus borealis Trin.","","Poaceae"
"ALMA8","ALGL8","Alopecurus glaucus Less.","","Poaceae"
"ALMA8","ALOC7","Alopecurus occidentalis Scribn. & Tweedy","","Poaceae"
"ALMO4","","Alchemilla monticola Opiz","hairy lady's mantle","Rosaceae"
"ALMO4","ALPR5","Alchemilla pratensis auct. non F.W. Schmidt","","Rosaceae"
"ALMO4","ALVU2","Alchemilla vulgaris auct. non L.","","Rosaceae"
"ALMO4","ALVUP","Alchemilla vulgaris L. var. pastoralis (Buser) B. Boivin","","Rosaceae"
"ALMO4","ALXA","Alchemilla xanthochlora auct. non Rothm.","","Rosaceae"
"ALNUS","","Alnus Mill.","alder","Betulaceae"
"ALOB5","","Alyssum obovatum (C.A. Mey.) Turcz.","American madwort","Brassicaceae"
"ALOB5","ALAM4","Alyssum americanum Greene","","Brassicaceae"
"ALOPE","","Alopecurus L.","foxtail","Poaceae"
"ALPE4","","Alliaria petiolata (M. Bieb.) Cavara & Grande","garlic mustard","Brassicaceae"
"ALPE4","ALAL8","Alliaria alliaria (L.) Britton, nom. inval.","","Brassicaceae"
"ALPE4","ALOF3","Alliaria officinalis Andrz. ex M. Bieb.","","Brassicaceae"
"ALPE4","ERAL14","Erysimum alliaria L.","","Brassicaceae"
"ALPE4","SIAL11","Sisymbrium alliaria (L.) Scop.","","Brassicaceae"
"ALPL","","Alisma plantago-aquatica L.","European water plantain","Alismataceae"
"ALPR3","","Alopecurus pratensis L.","meadow foxtail","Poaceae"
"ALRU2","","Alnus rubra Bong.","red alder","Betulaceae"
"ALRU2","ALOR","Alnus oregona Nutt.","","Betulaceae"
"ALRU2","ALORP","Alnus oregona Nutt. var. pinnatisecta Starker","","Betulaceae"
"ALSC","","Allium schoenoprasum L.","wild chives","Liliaceae"
"ALSCS","","Allium schoenoprasum L. var. sibiricum (L.) Hartm.","wild chives","Liliaceae"
"ALSCS","ALSCS3","Allium schoenoprasum L. ssp. sibiricum (L.) Celak.","","Liliaceae"
"ALSCS","ALSCL","Allium schoenoprasum L. var. laurentianum Fernald","","Liliaceae"
"ALSCS","ALSI4","Allium sibiricum L.","","Liliaceae"
"ALSCS2","","Allium schoenoprasum L. var. schoenoprasum","wild chives","Liliaceae"
"ALSU2","","Alchemilla subcrenata Buser","broadtooth lady's mantle","Rosaceae"
"ALTR7","","Alisma triviale Pursh","northern water plantain","Alismataceae"
"ALTR7","ALBR10","Alisma brevipes Greene","","Alismataceae"
"ALTR7","ALPLB","Alisma plantago-aquatica L. ssp. brevipes (Greene) Sam.","","Alismataceae"
"ALTR7","ALPLA","Alisma plantago-aquatica L. var. americanum Schult.","","Alismataceae"
"ALTR7","ALPLB2","Alisma plantago-aquatica L. var. brevipes (Greene) Vict.","","Alismataceae"
"ALVI","","Allium vineale L.","wild garlic","Liliaceae"
"ALVI3","","Allium victorialis L.","victory onion","Liliaceae"
"ALVI3","ALVIP2","Allium victorialis L. ssp. platyphyllum Hultén","","Liliaceae"
"ALVI5","","Alnus viridis (Chaix) DC.","green alder","Betulaceae"
"ALVIC","","Alnus viridis (Chaix) DC. ssp. crispa (Aiton) Turrill","mountain alder","Betulaceae"
"ALVIC","ALCR6","Alnus crispa (Aiton) Pursh","","Betulaceae"
"ALVIC","ALCRE","Alnus crispa (Aiton) Pursh var. elongata Raup","","Betulaceae"
"ALVIC","ALCRM","Alnus crispa (Aiton) Pursh var. mollis (Fernald) Fernald","","Betulaceae"
"ALVIC","ALHU3","Alnus ×hultenii Murai p.p.","","Betulaceae"
"ALVIC","ALVIC2","Alnus viridis (Chaix) DC. var. crispa (Aiton) House","","Betulaceae"
"ALVIC","DUVI3","Duschekia viridis (Chaix) Opiz p.p.","","Betulaceae"
"ALVIF","","Alnus viridis (Chaix) DC. ssp. fruticosa (Rupr.) Nyman","Siberian alder","Betulaceae"
"ALVIS","","Alnus viridis (Chaix) DC. ssp. sinuata (Regel) Á. Löve & D. Löve","Sitka alder","Betulaceae"
"ALVIS","ALAL9","Alnus alnobetula (Ehrh.) K. Koch p.p.","","Betulaceae"
"ALVIS","ALCRL","Alnus crispa (Aiton) Pursh ssp. laciniata Hultén","","Betulaceae"
"ALVIS","ALCRS","Alnus crispa (Aiton) Pursh ssp. sinuata (Regel) Hultén","","Betulaceae"
"ALVIS","ALSI3","Alnus sinuata (Regel) Rydb.","","Betulaceae"
"ALVIS","ALVIS2","Alnus viridis (Chaix) DC. var. sinuata Regel","","Betulaceae"
"ALVIS","DUSI","Duschekia sinuata (Regel) Pouzar","","Betulaceae"
"ALVIV","","Allium vineale L. ssp. vineale","wild garlic","Liliaceae"
"ALYSS","","Alyssum L.","madwort","Brassicaceae"
"AMAL","","Amaranthus albus L.","prostrate pigweed","Amaranthaceae"
"AMAL","AMALP3","Amaranthus albus L. var. pubescens (Uline & Bray) Fernald","","Amaranthaceae"
"AMAL","AMGRP","Amaranthus graecizans L. var. pubescens Uline & Bray","","Amaranthaceae"
"AMAL","AMPU","Amaranthus pubescens (Uline & Bray) Rydb.","","Amaranthaceae"
"AMAL2","","Amelanchier alnifolia (Nutt.) Nutt. ex M. Roem.","Saskatoon serviceberry","Rosaceae"
"AMALA","","Amelanchier alnifolia (Nutt.) Nutt. ex M. Roem. var. alnifolia","Saskatoon serviceberry","Rosaceae"
"AMALS","","Amelanchier alnifolia (Nutt.) Nutt. ex M. Roem. var. semiintegrifolia (Hook.) C.L. Hitchc.","Saskatoon serviceberry","Rosaceae"
"AMALS","AMALF","Amelanchier alnifolia (Nutt.) Nutt. ex M. Roem. ssp. florida (Lindl.) Hultén","","Rosaceae"
"AMALS","AMFL","Amelanchier florida Lindl.","","Rosaceae"
"AMARA","","Amaranthus L.","pigweed","Amaranthaceae"
"AMBL","","Amaranthus blitoides S. Watson","mat amaranth","Amaranthaceae"
"AMBL","AMGR","Amaranthus graecizans auct. non L.","","Amaranthaceae"
"AMBRO","","Ambrosia L.","ragweed","Asteraceae"
"AMCH4","","Ambrosia chamissonis (Less.) Greene","silver bur ragweed","Asteraceae"
"AMCH4","AMCHB","Ambrosia chamissonis (Less.) Greene var. bipinnatisecta (Less.) J.T. Howell","","Asteraceae"
"AMCH4","FRCH4","Franseria chamissonis Less.","","Asteraceae"
"AMCH4","FRCHB","Franseria chamissonis Less. ssp. bipinnatisecta (Less.) Wiggins & Stockw.","","Asteraceae"
"AMCH4","FRCHB2","Franseria chamissonis Less. var. bipinnatisecta Less.","","Asteraceae"
"AMELA","","Amelanchier Medik.","serviceberry","Rosaceae"
"AMERO","","Amerorchis Hultén","amerorchis","Orchidaceae"
"AMLY","","Amsinckia lycopsoides Lehm.","tarweed fiddleneck","Boraginaceae"
"AMLY","AMBA6","Amsinckia barbata Greene","","Boraginaceae"
"AMLY","BELY2","Benthamia lycopsoides (Lehm.) Lindl. ex Druce","","Boraginaceae"
"AMME","","Amsinckia menziesii (Lehm.) A. Nelson & J.F. Macbr.","Menzies' fiddleneck","Boraginaceae"
"AMMEI2","","Amsinckia menziesii (Lehm.) A. Nelson & J.F. Macbr. var. intermedia (Fisch. & C.A. Mey.) Ganders","common fiddleneck","Boraginaceae"
"AMMEI2","AMAR7","Amsinckia arizonica Suksd.","","Boraginaceae"
"AMMEI2","AMDE5","Amsinckia demissa Suksd.","","Boraginaceae"
"AMMEI2","AMEC","Amsinckia echinata A. Gray","","Boraginaceae"
"AMMEI2","AMIN5","Amsinckia intactilis J.F. Macbr.","","Boraginaceae"
"AMMEI2","AMIN3","Amsinckia intermedia Fisch. & C.A. Mey.","","Boraginaceae"
"AMMEI2","AMINE2","Amsinckia intermedia Fisch. & C.A. Mey. var. echinata (A. Gray) Wiggins","","Boraginaceae"
"AMMEI2","AMMI2","Amsinckia microphylla Suksd.","","Boraginaceae"
"AMMEI2","AMNA3","Amsinckia nana Suksd.","","Boraginaceae"
"AMMEI2","AMRI2","Amsinckia rigida Suksd.","","Boraginaceae"
"AMRE","","Amaranthus retroflexus L.","redroot amaranth","Amaranthaceae"
"AMRE","AMRES","Amaranthus retroflexus L. var. salicifolius I.M. Johnst.","","Amaranthaceae"
"AMRO","","Amerorchis rotundifolia (Banks ex Pursh) Hultén","roundleaf orchid","Orchidaceae"
"AMRO","ORRO3","Orchis rotundifolia Banks ex Pursh","","Orchidaceae"
"AMRO","ORROL","Orchis rotundifolia Banks ex Pursh var. lineata Mousley","","Orchidaceae"
"AMRO","PLRO9","Platanthera rotundifolia (Banks ex Pursh) Lindl.","","Orchidaceae"
"AMSIN","","Amsinckia Lehm.","fiddleneck","Boraginaceae"
"ANAL4","","Antennaria alpina (L.) Gaertn.","alpine pussytoes","Asteraceae"
"ANAL4","ANALC","Antennaria alpina (L.) Gaertn. var. canescens (Lange) Trautv.","","Asteraceae"
"ANAL4","ANALC2","Antennaria alpina (L.) Gaertn. var. compacta (Malte) S.L. Welsh","","Asteraceae"
"ANAL4","ANALG","Antennaria alpina (L.) Gaertn. var. glabrata J. Vahl","","Asteraceae"
"ANAL4","ANALI","Antennaria alpina (L.) Gaertn. var. intermedia Rosenv.","","Asteraceae"
"ANAL4","ANALS2","Antennaria alpina (L.) Gaertn. var. stolonifera (A.E. Porsild) S.L. Welsh","","Asteraceae"
"ANAL4","ANALU","Antennaria alpina (L.) Gaertn. var. ungavensis Fernald","","Asteraceae"
"ANAL4","ANAR11","Antennaria arenicola Malte","","Asteraceae"
"ANAL4","ANAT2","Antennaria atriceps Fernald","","Asteraceae"
"ANAL4","ANBA7","Antennaria bayardii Fernald","","Asteraceae"
"ANAL4","ANBO","Antennaria boecheriana A.E. Porsild","","Asteraceae"
"ANAL4","ANBO2","Antennaria borealis Greene","","Asteraceae"
"ANAL4","ANBR11","Antennaria brunnescens Fernald","","Asteraceae"
"ANAL4","ANCA30","Antennaria cana (Fernald & Wiegand) Fernald","","Asteraceae"
"ANAL4","ANCA81","Antennaria canescens (Lange) Malte","","Asteraceae"
"ANAL4","ANCAP2","Antennaria canescens (Lange) Malte ssp. porsildii (Ekman) Á. Löve & D. Löve","","Asteraceae"
"ANAL4","ANCAP","Antennaria canescens (Lange) Malte var. pseudoporsildii Böcher","","Asteraceae"
"ANAL4","ANCO16","Antennaria columnaris Fernald","","Asteraceae"
"ANAL4","ANCO5","Antennaria compacta Malte","","Asteraceae"
"ANAL4","ANCO17","Antennaria confusa Fernald","","Asteraceae"
"ANAL4","ANCR5","Antennaria crymophila A.E. Porsild","","Asteraceae"
"ANAL4","ANFO3","Antennaria foggii Fernald","","Asteraceae"
"ANAL4","ANFRC","Antennaria friesiana (Trautv.) Ekman ssp. compacta (Malte) Hultén","","Asteraceae"
"ANAL4","ANGL7","Antennaria glabrata (J. Vahl) Greene","","Asteraceae"
"ANAL4","ANGR6","Antennaria groenlandica A.E. Porsild","","Asteraceae"
"ANAL4","ANHA3","Antennaria hansii Kern.","","Asteraceae"
"ANAL4","ANIN6","Antennaria intermedia (Rosenv.) A.E. Porsild","","Asteraceae"
"ANAL4","ANLA10","Antennaria labradorica Nutt.","","Asteraceae"
"ANAL4","ANLO3","Antennaria longii Fernald","","Asteraceae"
