"MADI6","MASU9","Matricaria suaveolens (Pursh) Buchenau, non L.","","Asteraceae"
"MADI6","SASU14","Santolina suaveolens Pursh","","Asteraceae"
"MADI6","TASU2","Tanacetum suaveolens (Pursh) Hook.","","Asteraceae"
"MADIA","","Madia Molina","tarweed","Asteraceae"
"MAFU","","Malus fusca (Raf.) C.K. Schneid.","Oregon crab apple","Rosaceae"
"MAFU","MADI10","Malus diversifolia (Bong.) M. Roem.","","Rosaceae"
"MAFU","MAFUL","Malus fusca (Raf.) C.K. Schneid. var. levipes (Nutt.) C.K. Schneid.","","Rosaceae"
"MAFU","PYFU","Pyrus fusca Raf.","","Rosaceae"
"MAFU","PYRI3","Pyrus rivularis Douglas ex Hook.","","Rosaceae"
"MAGL2","","Madia glomerata Hook.","mountain tarweed","Asteraceae"
"MAIAN","","Maianthemum F.H. Wigg.","mayflower","Liliaceae"
"MALAX","","Malaxis Sol. ex Sw.","adder's-mouth orchid","Orchidaceae"
"MALUS","","Malus Mill.","apple","Rosaceae"
"MALVA","","Malva L.","mallow","Malvaceae"
"MAMO9","","Malaxis monophyllos (L.) Sw.","adder's-mouth orchid","Orchidaceae"
"MAMO9","MADI5","Malaxis diphyllos Cham.","","Orchidaceae"
"MAMO9","MAMOD","Malaxis monophyllos (L.) Sw. var. diphyllos (Cham.) Luer","","Orchidaceae"
"MANE","","Malva neglecta Wallr.","common mallow","Malvaceae"
"MANE","MARO","Malva rotundifolia auct. non L.","","Malvaceae"
"MAPA4","","Malaxis paludosa (L.) Sw.","bog adder's-mouth orchid","Orchidaceae"
"MAPA4","HAPA11","Hammarbya paludosa (L.) Kuntze","","Orchidaceae"
"MARA7","","Maianthemum racemosum (L.) Link","feathery false lily of the valley","Liliaceae"
"MARAA","","Maianthemum racemosum (L.) Link ssp. amplexicaule (Nutt.) LaFrankie","feathery false lily of the valley","Liliaceae"
"MARAA","MAAM6","Maianthemum amplexicaule (Nutt.) W.A. Weber","","Liliaceae"
"MARAA","MARAA2","Maianthemum racemosum (L.) Link var. amplexicaule (Nutt.) Dorn","","Liliaceae"
"MARAA","SMAM","Smilacina amplexicaulis Nutt.","","Liliaceae"
"MARAA","SMAMG","Smilacina amplexicaulis Nutt. var. glabra J.F. Macbr.","","Liliaceae"
"MARAA","SMAMJ","Smilacina amplexicaulis Nutt. var. jenkinsii B. Boivin","","Liliaceae"
"MARAA","SMAMO","Smilacina amplexicaulis Nutt. var. ovata B. Boivin","","Liliaceae"
"MARAA","SMRAA","Smilacina racemosa (L.) Desf. var. amplexicaulis (Nutt.) S. Watson","","Liliaceae"
"MARAA","SMRAB","Smilacina racemosa (L.) Desf. var. brachystyla G. Hend.","","Liliaceae"
"MARAA","SMRAG","Smilacina racemosa (L.) Desf. var. glabra (J.F. Macbr.) H. St. John","","Liliaceae"
"MARAA","SMRAJ","Smilacina racemosa (L.) Desf. var. jenkinsii (B. Boivin) B. Boivin","","Liliaceae"
"MARAA","VAAM5","Vagnera amplexicaulis (Nutt.) Greene","","Liliaceae"
"MARAA","VAAMG","Vagnera amplexicaulis (Nutt.) Greene var. glabra (J.F. Macbr.) Abrams","","Liliaceae"
"MARRU","","Marrubium L.","horehound","Lamiaceae"
"MASA","","Madia sativa Molina","coast tarweed","Asteraceae"
"MASA","MACA10","Madia capitata Nutt.","","Asteraceae"
"MASA","MASAC2","Madia sativa Molina ssp. capitata (Nutt.) Piper","","Asteraceae"
"MASA","MASAC3","Madia sativa Molina var. congesta Torr. & A. Gray","","Asteraceae"
"MAST","","Matteuccia struthiopteris (L.) Todaro","ostrich fern","Dryopteridaceae"
"MAST","MAPE4","Matteuccia pensylvanica (Willd.) Raymond","","Dryopteridaceae"
"MAST","MASTP","Matteuccia struthiopteris (L.) Todaro var. pensylvanica (Willd.) Morton","","Dryopteridaceae"
"MAST","MASTP2","Matteuccia struthiopteris (L.) Todaro var. pubescens (Terry) Clute","","Dryopteridaceae"
"MAST","ONST2","Onoclea struthiopteris (L.) Hoffm. p.p.","","Dryopteridaceae"
"MAST","ONSTP","Onoclea struthiopteris (L.) Hoffm. var. pensylvanica (Willd.) B. Boivin","","Dryopteridaceae"
"MAST","PTNO2","Pteretis nodulosa (Michx.) Nieuwl.","","Dryopteridaceae"
"MAST","PTPE2","Pteretis pensylvanica (Willd.) Fernald","","Dryopteridaceae"
"MAST4","","Maianthemum stellatum (L.) Link","starry false lily of the valley","Liliaceae"
"MAST4","COST12","Convallaria stellata L.","","Liliaceae"
"MAST4","SMLI","Smilacina liliacea (Greene) Wynd","","Liliaceae"
"MAST4","SMSE","Smilacina sessilifolia Nutt. ex Baker","","Liliaceae"
"MAST4","SMST","Smilacina stellata (L.) Desf.","","Liliaceae"
"MAST4","SMSTC","Smilacina stellata (L.) Desf. var. crassa Vict.","","Liliaceae"
"MAST4","SMSTM","Smilacina stellata (L.) Desf. var. mollis Farw.","","Liliaceae"
"MAST4","SMSTS","Smilacina stellata (L.) Desf. var. sessilifolia (Nutt. ex Baker) G. Hend.","","Liliaceae"
"MAST4","SMSTS2","Smilacina stellata (L.) Desf. var. sylvatica Vict. & J. Rousseau","","Liliaceae"
"MAST4","VALI2","Vagnera liliacea (Greene) Rydb.","","Liliaceae"
"MAST4","VASE5","Vagnera sessilifolia (Nutt. ex Baker) Greene","","Liliaceae"
"MAST4","VAST4","Vagnera stellata (L.) Morong","","Liliaceae"
"MATRI","","Matricaria L.","mayweed","Asteraceae"
"MATTE","","Matteuccia Todaro","ostrich fern","Dryopteridaceae"
"MAVU","","Marrubium vulgare L.","horehound","Lamiaceae"
"MEAR4","","Mentha arvensis L.","wild mint","Lamiaceae"
"MEAR4","MEARB","Mentha arvensis L. ssp. borealis (Michx.) Roy L. Taylor & MacBryde","","Lamiaceae"
"MEAR4","MEARH","Mentha arvensis L. ssp. haplocalyx Briq.","","Lamiaceae"
"MEAR4","MEARP","Mentha arvensis L. ssp. parietariifolia (Becker) Briq.","","Lamiaceae"
"MEAR4","MEARC","Mentha arvensis L. var. canadensis (L.) Kuntze","","Lamiaceae"
"MEAR4","MEARG","Mentha arvensis L. var. glabrata (Benth.) Fernald","","Lamiaceae"
"MEAR4","MEARL2","Mentha arvensis L. var. lanata Piper","","Lamiaceae"
"MEAR4","MEARS3","Mentha arvensis L. var. sativa auct. non Benth.","","Lamiaceae"
"MEAR4","MEARV","Mentha arvensis L. var. villosa (Benth.) S.R. Stewart","","Lamiaceae"
"MEAR4","MECA7","Mentha canadensis L.","","Lamiaceae"
"MEAR4","MEGE2","Mentha gentilis L.","","Lamiaceae"
"MEAR4","MEGL","Mentha glabrior (Hook.) Rydb.","","Lamiaceae"
"MEAR4","MEPE8","Mentha penardii (Briq.) Rydb.","","Lamiaceae"
"MEDIC","","Medicago L.","alfalfa","Fabaceae"
"MEDR","","Mertensia drummondii (Lehm.) G. Don","Drummond's bluebells","Boraginaceae"
"MEFE","","Menziesia ferruginea Sm.","rusty menziesia","Ericaceae"
"MEFE","MEFEG","Menziesia ferruginea Sm. ssp. glabella (A. Gray) Calder & Roy L. Taylor","","Ericaceae"
"MEFE","MEFEG2","Menziesia ferruginea Sm. var. glabella (A. Gray) M. Peck","","Ericaceae"
"MEFE","MEGL2","Menziesia glabella A. Gray","","Ericaceae"
"MELIC","","Melica L.","melicgrass","Poaceae"
"MELIL","","Melilotus Mill.","sweetclover","Fabaceae"
"MELU","","Medicago lupulina L.","black medick","Fabaceae"
"MELU","MELUC","Medicago lupulina L. var. cupaniana (Guss.) Boiss.","","Fabaceae"
"MELU","MELUG","Medicago lupulina L. var. glandulosa Neilr.","","Fabaceae"
"MEMA3","","Mertensia maritima (L.) Gray","oysterleaf","Boraginaceae"
"MEMAA2","","Mertensia maritima (L.) Gray var. asiatica (Takeda) S.L. Welsh","oysterleaf","Boraginaceae"
"MEMAA2","MEMAA","Mertensia maritima (L.) Gray ssp. asiatica Takeda","","Boraginaceae"
"MEMAM","","Mertensia maritima (L.) Gray var. maritima","oysterleaf","Boraginaceae"
"MEMAM","PNMA","Pneumaria maritima (L.) Hill","","Boraginaceae"
"MENTH","","Mentha L.","mint","Lamiaceae"
"MENYA","","Menyanthes L.","buckbean","Menyanthaceae"
"MENZI","","Menziesia Sm.","menziesia","Ericaceae"
"MEOF","","Melilotus officinalis (L.) Lam.","sweetclover","Fabaceae"
"MEOF","MEAL12","Melilotus alba Medikus, orth. var.","","Fabaceae"
"MEOF","MEAL2","Melilotus albus Medik.","","Fabaceae"
"MEOF","MEALA2","Melilotus albus Medik. var. annuus Coe","","Fabaceae"
"MEOF","MEAR15","Melilotus arvensis Wallr.","","Fabaceae"
"MEOF","MELE6","Melilotus leucanthus W.D.J. Koch ex DC.","","Fabaceae"
"MEOF","MELU6","Melilotus lutea Gueldenst.","","Fabaceae"
"MEOF","MEOFM2","Melilotus officinalis (L.) Lam. var. micranthus O.E. Schulz","","Fabaceae"
"MEPA","","Mertensia paniculata (Aiton) G. Don","tall bluebells","Boraginaceae"
"MEPAA","","Mertensia paniculata (Aiton) G. Don var. alaskana (Britton) L.O. Williams","Alaska tall bluebells","Boraginaceae"
"MEPAA","MEAL9","Mertensia alaskana Britton","","Boraginaceae"
"MEPAE","","Mertensia paniculata (Aiton) G. Don var. eastwoodiae (J.F. Macbr.) Hultén","Eastwood's bluebells","Boraginaceae"
"MEPAE","MEEA","Mertensia eastwoodiae J.F. Macbr.","","Boraginaceae"
"MEPAE","MEPAE2","Mertensia paniculata (Aiton) G. Don ssp. eastwoodiae (J.F. Macbr.) S.L. Welsh","","Boraginaceae"
"MEPAP","","Mertensia paniculata (Aiton) G. Don var. paniculata","tall bluebells","Boraginaceae"
"MEPAP","MEPA8","Mertensia palmeri A. Nelson & J.F. Macbr.","","Boraginaceae"
"MEPAP","MEPI4","Mertensia pilosa (Cham.) DC.","","Boraginaceae"
"MEPI","","Mentha ×piperita L. (pro sp.) [aquatica × spicata]","peppermint","Lamiaceae"
"MEPI","MEAQC","Mentha aquatica L. var. crispa (L.) Benth.","","Lamiaceae"
"MEPI","MECR6","Mentha crispa L.","","Lamiaceae"
"MEPI","MEDU","Mentha dumetorum Schult.","","Lamiaceae"
"MEPO3","","Medicago polymorpha L.","burclover","Fabaceae"
"MEPO3","MEAP3","Medicago apiculata auct. non Willd.","","Fabaceae"
"MEPO3","MEDE13","Medicago denticulata Willd.","","Fabaceae"
"MEPO3","MEHI","Medicago hispida Gaertn.","","Fabaceae"
"MEPO3","MEHIA","Medicago hispida Gaertn. var. apiculata (Willd.) Urb.","","Fabaceae"
"MEPO3","MEHIC","Medicago hispida Gaertn. var. confinis (W.D.J. Koch) Burnat","","Fabaceae"
"MEPO3","MEPO8","Medicago polycarpa Willd.","","Fabaceae"
"MEPO3","MEPOB","Medicago polymorpha L. var. brevispina (Benth.) Heyn","","Fabaceae"
"MEPO3","MEPOC","Medicago polymorpha L. var. ciliaris (Ser.) Shinners","","Fabaceae"
"MEPO3","MEPOP7","Medicago polymorpha L. var. polygyra (Urb.) Shinners","","Fabaceae"
"MEPO3","MEPOT","Medicago polymorpha L. var. tricycla (Gren. & Godr.) Shinners","","Fabaceae"
"MEPO3","MEPOV","Medicago polymorpha L. var. vulgaris (Benth.) Shinners","","Fabaceae"
"MEPO3","MEPOA2","Medicago polymorpha L. f. apiculata (Willd.) Shinners","","Fabaceae"
"MERTE","","Mertensia Roth","bluebells","Boraginaceae"
"MESA","","Medicago sativa L.","alfalfa","Fabaceae"
"MESAF","","Medicago sativa L. ssp. falcata (L.) Arcang.","yellow alfalfa","Fabaceae"
"MESAF","MEFA","Medicago falcata L.","","Fabaceae"
"MESAF","MEFAR2","Medicago falcata L. var. romanica (Prodan) O. Schwarz & Klink.","","Fabaceae"
"MESAS","","Medicago sativa L. ssp. sativa","alfalfa","Fabaceae"
"MESAS","MEME9","Medicago media Pers.","","Fabaceae"
"MESAS","MESAV8","Medicago sativa L. ssp. varia (Martyn) Arcang.","","Fabaceae"
"MESAS","MEVA2","Medicago ×varia Martyn","","Fabaceae"
"MESP3","","Mentha spicata L.","spearmint","Lamiaceae"
"MESP3","MECO7","Mentha cordifolia auct.","","Lamiaceae"
"MESP3","MELO8","Mentha longifolia auct. non (L.) Huds.","","Lamiaceae"
"MESP3","MELOM2","Mentha longifolia (L.) Huds. var. mollissima (Borkh.) Rouy","","Lamiaceae"
"MESP3","MELOU2","Mentha longifolia (L.) Huds. var. undulata (Willd.) Fiori","","Lamiaceae"
"MESP3","MESPL","Mentha spicata L. var. longifolia L.","","Lamiaceae"
"MESP3","MESPS3","Mentha spicata L. var. spicata","","Lamiaceae"
"MESP3","MESY","Mentha sylvestris L.","","Lamiaceae"
"MESP3","MEVI7","Mentha viridis L.","","Lamiaceae"
"MESU","","Melica subulata (Griseb.) Scribn.","Alaska oniongrass","Poaceae"
"MESUS","","Melica subulata (Griseb.) Scribn. var. subulata","Alaska oniongrass","Poaceae"
"MESUS","BRSU16","Bromelica subulata (Griseb.) Farw.","","Poaceae"
"METR3","","Menyanthes trifoliata L.","buckbean","Menyanthaceae"
"METR3","METRM","Menyanthes trifoliata L. var. minor Raf.","","Menyanthaceae"
"MIAR3","","Minuartia arctica (Stev. ex Ser.) Graebn.","arctic stitchwort","Caryophyllaceae"
"MIAR3","ARAR20","Arenaria arctica Stev. ex Ser.","","Caryophyllaceae"
"MIAR3","LIAR7","Lidia arctica (Stev. ex Ser.) Á. Löve & D. Löve","","Caryophyllaceae"
"MIBI9","","Minuartia biflora (L.) Schinz & Thell.","mountain stitchwort","Caryophyllaceae"
"MIBI9","ARSA7","Arenaria sajanensis Willd. ex Schltdl.","","Caryophyllaceae"
"MIBI9","LIBI6","Lidia biflora (L.) Á. Löve & D. Löve","","Caryophyllaceae"
"MIBI9","STBI7","Stellaria biflora L.","","Caryophyllaceae"
"MIBO","","Microseris borealis (Bong.) Sch. Bip.","northern microseris","Asteraceae"
"MIBO","APBO","Apargidium boreale (Bong.) Torr. & A. Gray","","Asteraceae"
"MICRO22","","Microsteris Greene","microsteris","Polemoniaceae"
"MICRO6","","Microseris D. Don","silverpuffs","Asteraceae"
"MIDA","","Minuartia dawsonensis (Britton) House","rock stitchwort","Caryophyllaceae"
"MIDA","ALSTD","Alsinanthe stricta (Sw.) Rchb. ssp. dawsonensis (Britton) Á. Löve & D. Löve","","Caryophyllaceae"
"MIDA","ARDA3","Arenaria dawsonensis Britton","","Caryophyllaceae"
"MIDA","ARLI8","Arenaria litorea Fernald","","Caryophyllaceae"
"MIDA","ARSTD","Arenaria stricta Michx. ssp. dawsonensis (Britton) Maguire","","Caryophyllaceae"
"MIDA","ARSTD2","Arenaria stricta Michx. var. dawsonensis (Britton) Scoggan","","Caryophyllaceae"
"MIDA","ARSTL","Arenaria stricta Michx. var. litorea (Fernald) Britton","","Caryophyllaceae"
"MIEL2","","Minuartia elegans (Cham. & Schltdl.) Schischkin","elegant stitchwort","Caryophyllaceae"
"MIEL2","ALEL2","Alsinanthe elegans (Cham. & Schltdl.) Á. Löve & D. Löve","","Caryophyllaceae"
"MIEL2","ALEL3","Alsine elegans (Cham. & Schltdl.) Fenzl","","Caryophyllaceae"
"MIEL2","AREL6","Arenaria elegans Cham. & Schltdl.","","Caryophyllaceae"
"MIEL2","ARELC","Arenaria elegans Cham. & Schltdl. var. columbiana Raup","","Caryophyllaceae"
"MIEL2","ARROC2","Arenaria rossii R. Br. ex Richardson ssp. columbiana (Raup) Maguire","","Caryophyllaceae"
"MIEL2","ARROE","Arenaria rossii R. Br. ex Richardson ssp. elegans (Cham. & Schltdl.) Maguire","","Caryophyllaceae"
"MIEL2","ARROA","Arenaria rossii R. Br. ex Richardson var. apetala Maguire","","Caryophyllaceae"
"MIEL2","ARROC3","Arenaria rossii R. Br. ex Richardson var. corollina Fenzl","","Caryophyllaceae"
"MIEL2","ARROE2","Arenaria rossii R. Br. ex Richardson var. elegans (Cham. & Schltdl.) S.L. Welsh","","Caryophyllaceae"
"MIEL2","MIOR3","Minuartia orthotrichoides Schischkin","","Caryophyllaceae"
"MIEL2","MIROE","Minuartia rossii (R. Br. ex Richardson) Graebn. var. elegans (Cham. & Schltdl.) Hultén","","Caryophyllaceae"
"MIGR","","Microsteris gracilis (Hook.) Greene","slender phlox","Polemoniaceae"
"MIGRG4","","Microsteris gracilis (Hook.) Greene var. gracilis","slender phlox","Polemoniaceae"
"MIGRG4","GIGR","Gilia gracilis Hook.","","Polemoniaceae"
"MIGRG4","PHGR16","Phlox gracilis (Hook.) Greene","","Polemoniaceae"
"MIGRG4","PHGRG","Phlox gracilis (Hook.) Greene ssp. gracilis","","Polemoniaceae"
"MIGU","","Mimulus guttatus DC.","seep monkeyflower","Scrophulariaceae"
"MIGU","MIAR6","Mimulus arvensis Greene","","Scrophulariaceae"
"MIGU","MIBA4","Mimulus bakeri Gandog.","","Scrophulariaceae"
"MIGU","MIBR8","Mimulus brachystylis Edwin","","Scrophulariaceae"
"MIGU","MICL5","Mimulus clementinus Greene","","Scrophulariaceae"
"MIGU","MICO10","Mimulus cordatus Greene","","Scrophulariaceae"
"MIGU","MICU5","Mimulus cuspidata Greene","","Scrophulariaceae"
"MIGU","MIDE11","Mimulus decorus (A.L. Grant) Suksd.","","Scrophulariaceae"
"MIGU","MIEQ","Mimulus equinnus Greene","","Scrophulariaceae"
"MIGU","MIGLA","Mimulus glabratus Kunth var. ascendens A. Gray","","Scrophulariaceae"
"MIGU","MIGL8","Mimulus glareosus Greene","","Scrophulariaceae"
"MIGU","MIGR9","Mimulus grandiflorus J.T. Howell","","Scrophulariaceae"
"MIGU","MIGR11","Mimulus grandis (Greene) A. Heller","","Scrophulariaceae"
"MIGU","MIGUA","Mimulus guttatus DC. ssp. arenicola Pennell","","Scrophulariaceae"
"MIGU","MIGUA2","Mimulus guttatus DC. ssp. arvensis (Greene) Munz","","Scrophulariaceae"
"MIGU","MIGUH","Mimulus guttatus DC. ssp. haidensis Calder & Roy L. Taylor","","Scrophulariaceae"
"MIGU","MIGUL2","Mimulus guttatus DC. ssp. litoralis Pennell","","Scrophulariaceae"
"MIGU","MIGUM","Mimulus guttatus DC. ssp. micranthus (A. Heller) Munz","","Scrophulariaceae"
"MIGU","MIGUS","Mimulus guttatus DC. ssp. scouleri (Hook.) Pennell","","Scrophulariaceae"
"MIGU","MIGUA3","Mimulus guttatus DC. var. arvensis (Greene) A.L. Grant","","Scrophulariaceae"
"MIGU","MIGUD","Mimulus guttatus DC. var. decorus A.L. Grant","","Scrophulariaceae"
"MIGU","MIGUD2","Mimulus guttatus DC. var. depauperatus (A. Gray) A.L. Grant","","Scrophulariaceae"
"MIGU","MIGUG3","Mimulus guttatus DC. var. gracilis (A. Gray) G.R. Campb.","","Scrophulariaceae"
"MIGU","MIGUG2","Mimulus guttatus DC. var. grandis Greene","","Scrophulariaceae"
"MIGU","MIGUH2","Mimulus guttatus DC. var. hallii (Greene) A.L. Grant","","Scrophulariaceae"
"MIGU","MIGUI","Mimulus guttatus DC. var. insignis Greene","","Scrophulariaceae"
"MIGU","MIGUL4","Mimulus guttatus DC. var. laxus (Pennell ex M. Peck) M. Peck","","Scrophulariaceae"
"MIGU","MIGUL3","Mimulus guttatus DC. var. lyratus (Benth.) Pennell ex M. Peck","","Scrophulariaceae"
"MIGU","MIGUM2","Mimulus guttatus DC. var. microphyllus (Benth.) Pennell ex M. Peck","","Scrophulariaceae"
"MIGU","MIGUN","Mimulus guttatus DC. var. nasutus (Greene) Jeps.","","Scrophulariaceae"
"MIGU","MIGUP","Mimulus guttatus DC. var. puberulus (Greene ex Rydb.) A.L. Grant","","Scrophulariaceae"
"MIGU","MIHA","Mimulus hallii Greene","","Scrophulariaceae"
"MIGU","MIHI3","Mimulus hirsutus J.T. Howell","","Scrophulariaceae"
"MIGU","MILA13","Mimulus langsdorffii Donn ex Greene","","Scrophulariaceae"
"MIGU","MILAA","Mimulus langsdorffii Donn ex Greene var. argutus Greene","","Scrophulariaceae"
"MIGU","MILAA2","Mimulus langsdorffii Donn ex Greene var. arvensis (Greene) Jeps.","","Scrophulariaceae"
"MIGU","MILAC","Mimulus langsdorffii Donn ex Greene var. californicus Jeps.","","Scrophulariaceae"
"MIGU","MILAG","Mimulus langsdorffii Donn ex Greene var. grandis (Greene) Greene","","Scrophulariaceae"
"MIGU","MILAG2","Mimulus langsdorffii Donn ex Greene var. guttatus (DC.) Jeps.","","Scrophulariaceae"
"MIGU","MILAI","Mimulus langsdorffii Donn ex Greene var. insignis (Greene) A.L. Grant","","Scrophulariaceae"
"MIGU","MILAM","Mimulus langsdorffii Donn ex Greene var. microphyllus (Benth.) A. Nelson & J.F. Macbr.","","Scrophulariaceae"
"MIGU","MILAM3","Mimulus langsdorffii Donn ex Greene var. minimus Henry","","Scrophulariaceae"
"MIGU","MILAN","Mimulus langsdorffii Donn ex Greene var. nasutus (Greene) Jeps.","","Scrophulariaceae"
"MIGU","MILAP","Mimulus langsdorffii Donn ex Greene var. platyphyllus Greene","","Scrophulariaceae"
"MIGU","MILA12","Mimulus laxus Pennell ex M. Peck","","Scrophulariaceae"
"MIGU","MILO3","Mimulus longulus Greene","","Scrophulariaceae"
"MIGU","MILUD","Mimulus luteus L. var. depauperatus A. Gray","","Scrophulariaceae"
"MIGU","MILUG","Mimulus luteus L. var. gracilis A. Gray","","Scrophulariaceae"
"MIGU","MILY3","Mimulus lyratus Benth.","","Scrophulariaceae"
"MIGU","MIMA7","Mimulus maguirei Pennell","","Scrophulariaceae"
"MIGU","MIMA9","Mimulus marmoratus Greene","","Scrophulariaceae"
"MIGU","MIMI10","Mimulus micranthus A. Heller","","Scrophulariaceae"
"MIGU","MIMI4","Mimulus microphyllus Benth.","","Scrophulariaceae"
"MIGU","MINA2","Mimulus nasutus Greene","","Scrophulariaceae"
"MIGU","MINAM","Mimulus nasutus Greene var. micranthus (A. Heller) A.L. Grant","","Scrophulariaceae"
"MIGU","MIPA15","Mimulus paniculatus Greene","","Scrophulariaceae"
"MIGU","MIPA8","Mimulus pardalis Pennell","","Scrophulariaceae"
"MIGU","MIPA13","Mimulus parishii Gandog., non Greene","","Scrophulariaceae"
"MIGU","MIPE5","Mimulus petiolaris Greene","","Scrophulariaceae"
"MIGU","MIPR7","Mimulus prionophyllus Greene","","Scrophulariaceae"
"MIGU","MIPR6","Mimulus procerus Greene","","Scrophulariaceae"
"MIGU","MIPU11","Mimulus puberulus Greene ex Rydb.","","Scrophulariaceae"
"MIGU","MIPU12","Mimulus puncticalyx Gandog.","","Scrophulariaceae"
"MIGU","MIRI2","Mimulus rivularis Nutt.","","Scrophulariaceae"
"MIGU","MISC4","Mimulus scouleri Hook.","","Scrophulariaceae"
"MIGU","MISO2","Mimulus sookensis B.G. Benedict, J.L. Modliszewski, A.L. Sweigart, N.H. Martin, F.R. Ganders, & J.H. Willis","","Scrophulariaceae"
"MIGU","MISU7","Mimulus subreniformis Greene","","Scrophulariaceae"
"MIGU","MITE8","Mimulus tenellus Nutt. ex A. Gray","","Scrophulariaceae"
"MIGU","MITH2","Mimulus thermalis A. Nelson","","Scrophulariaceae"
"MIGU","MIUN2","Mimulus unimaculatus Pennell","","Scrophulariaceae"
"MILE2","","Mimulus lewisii Pursh","purple monkeyflower","Scrophulariaceae"
"MIMA4","","Minuartia macrocarpa (Pursh) Ostenf.","longpod stitchwort","Caryophyllaceae"
"MIMA4","ARCR7","Arenaria crilloniana W. Drew","","Caryophyllaceae"
"MIMA4","ARMA15","Arenaria macrocarpa Pursh","","Caryophyllaceae"
"MIMA4","MIMAR","Minuartia macrocarpa (Pursh) Ostenf. var. rosea Hultén","","Caryophyllaceae"
"MIMI2","","Minuartia michauxii (Fenzl) Farw.","Michaux's stitchwort","Caryophyllaceae"
"MIMIM","","Minuartia michauxii (Fenzl) Farw. var. michauxii","Michaux's stitchwort","Caryophyllaceae"
"MIMIM","ARMA13","Arenaria macra A. Nelson & J.F. Macbr.","","Caryophyllaceae"
"MIMIM","ARMI13","Arenaria michauxii (Fenzl) Hook. f.","","Caryophyllaceae"
"MIMIM","ARST8","Arenaria stricta Michx.","","Caryophyllaceae"
"MIMIM","ARSTM","Arenaria stricta Michx. ssp. macra (A. Nelson & J.F. Macbr.) Maguire","","Caryophyllaceae"
"MIMIM","ARSTP","Arenaria stricta Michx. var. puberulenta (M. Peck) C.L. Hitchc.","","Caryophyllaceae"
"MIMIM","ARSTU","Arenaria stricta Michx. var. uliginosa (Schleich. ex Lam. & DC.) B. Boivin","","Caryophyllaceae"
"MIMIM","ARUL2","Arenaria uliginosa Schleich. ex Lam. & DC.","","Caryophyllaceae"
"MIMIM","MIMI15","Minuopsis michauxii (Fenzl) W.A. Weber","","Caryophyllaceae"
"MIMIM","SAST13","Sabulina stricta (Michx.) Small","","Caryophyllaceae"
"MIMUL","","Mimulus L.","monkeyflower","Scrophulariaceae"
"MINU3","","Mitella nuda L.","naked miterwort","Saxifragaceae"
"MINUA","","Minuartia L.","stitchwort","Caryophyllaceae"
"MIOB2","","Minuartia obtusiloba (Rydb.) House","twinflower sandwort","Caryophyllaceae"
"MIOB2","ALOB6","Alsinopsis obtusiloba Rydb.","","Caryophyllaceae"
"MIOB2","AROB3","Arenaria obtusiloba (Rydb.) Fernald","","Caryophyllaceae"
"MIOB2","ARSA8","Arenaria sajanensis auct. non Willd. ex Schltdl.","","Caryophyllaceae"
"MIOB2","LIOB4","Lidia obtusiloba (Rydb.) Á. Löve & D. Löve","","Caryophyllaceae"
"MIOB2","MISA3","Minuartia sajanensis auct. non (Willd. ex Schltdl.) House","","Caryophyllaceae"
"MIOR","","Misopates orontium (L.) Raf.","linearleaf snapdragon","Scrophulariaceae"
"MIOR","ANOR2","Antirrhinum orontium L.","","Scrophulariaceae"
"MIOR","ANORG","Antirrhinum orontium L. var. grandiflorum auct.","","Scrophulariaceae"
"MIPE","","Mitella pentandra Hook.","fivestamen miterwort","Saxifragaceae"
"MIPE","PEPE16","Pectiantia pentandra (Hook.) Rydb.","","Saxifragaceae"
"MIRO4","","Minuartia rossii (R. Br. ex Richardson) Graebn.","Ross' sandwort","Caryophyllaceae"
"MIRO4","ALRO7","Alsinanthe rossii (R. Br. ex Richardson) Á. Löve & D. Löve","","Caryophyllaceae"
"MIRO4","ALRO8","Alsinopsis rossii (R. Br. ex Richardson) Rydb.","","Caryophyllaceae"
"MIRO4","ARRO8","Arenaria rossii R. Br. ex Richardson","","Caryophyllaceae"
"MIRO4","ARROD","Arenaria rossii R. Br. ex Richardson var. daethiana Polunin","","Caryophyllaceae"
"MIRO4","MIRO5","Minuartia rolfii Nannf.","","Caryophyllaceae"
"MIRU3","","Minuartia rubella (Wahlenb.) Hiern.","beautiful sandwort","Caryophyllaceae"
"MIRU3","ARPR5","Arenaria propinqua Richardson","","Caryophyllaceae"
"MIRU3","ARRU5","Arenaria rubella (Wahlenb.) Hiern.","","Caryophyllaceae"
"MIRU3","ARVEP","Arenaria verna L. var. propinqua (Richardson) Fernald","","Caryophyllaceae"
"MIRU3","ARVER","Arenaria verna L. var. rubella (Wahlenb.) S. Watson","","Caryophyllaceae"
"MIRU3","MIROO","Minuartia rossii (R. Br. ex Richardson) Graebn. var. orthotrichoides auct. non (Schischkin) Hultén","","Caryophyllaceae"
"MIRU3","TRRU3","Tryphane rubella (Wahlenb.) Rchb.","","Caryophyllaceae"
"MISOP","","Misopates Raf.","misopates","Scrophulariaceae"
"MIST5","","Minuartia stricta (Sw.) Hiern.","bog stitchwort","Caryophyllaceae"
"MIST5","ALST3","Alsinanthe stricta (Sw.) Rchb.","","Caryophyllaceae"
"MITEL","","Mitella L.","miterwort","Saxifragaceae"
"MITI","","Mimulus tilingii Regel","Tiling's monkeyflower","Scrophulariaceae"
"MITIT","","Mimulus tilingii Regel var. tilingii","Tiling's monkeyflower","Scrophulariaceae"
"MITIT","MICO12","Mimulus corallinus (Greene) A.L. Grant","","Scrophulariaceae"
"MITIT","MIIM2","Mimulus implicatus Greene","","Scrophulariaceae"
"MITIT","MILAM2","Mimulus langsdorffii Donn ex Greene var. minor (A. Nelson) Cockerell","","Scrophulariaceae"
"MITIT","MILAT","Mimulus langsdorffii Donn ex Greene var. tilingii (Regel) Greene","","Scrophulariaceae"
"MITIT","MILU","Mimulus lucens Greene","","Scrophulariaceae"
"MITIT","MIMI12","Mimulus minor A. Nelson","","Scrophulariaceae"
"MITIT","MIMI13","Mimulus minusculus Greene","","Scrophulariaceae"
"MITIT","MITIC2","Mimulus tilingii Regel var. corallinus (Greene) A.L. Grant","","Scrophulariaceae"
"MITIT","MIVE5","Mimulus veronicifolius Greene","","Scrophulariaceae"
"MITR4","","Mitella trifida Graham","threeparted miterwort","Saxifragaceae"
"MITRT","","Mitella trifida Graham var. trifida","threeparted miterwort","Saxifragaceae"
"MITRT","OZAN","Ozomelis anomala (Piper) Rydb.","","Saxifragaceae"
"MITRT","OZMI","Ozomelis micrantha (Piper) Rydb.","","Saxifragaceae"
"MITRT","OZTR","Ozomelis trifida (Graham) Rydb.","","Saxifragaceae"
"MIYU","","Minuartia yukonensis Hultén","Yukon stitchwort","Caryophyllaceae"
"MIYU","ARLA13","Arenaria laricifolia (L.) B.L. Rob. p.p.","","Caryophyllaceae"
"MIYU","ARLAH","Arenaria laricifolia (L.) B.L. Rob. var. hultenii S.L. Welsh p.p.","","Caryophyllaceae"
"MIYU","ARLAO","Arenaria laricifolia (L.) B.L. Rob. var. occulta (Ser.) B. Boivin p.p.","","Caryophyllaceae"
"MIYU","LIYU","Lidia yukonensis (Hultén) Á. Löve & D. Löve","","Caryophyllaceae"
"MOBO","","Montia bostockii (A.E. Porsild) S.L. Welsh","Bostock's minerslettuce","Portulacaceae"
"MOBO","CLBO5","Claytonia bostockii A.E. Porsild","","Portulacaceae"
"MOBO","MOBO3","Montiastrum bostockii (A.E. Porsild) O. Nilss.","","Portulacaceae"
"MOCH","","Montia chamissoi (Ledeb. ex Spreng.) Greene","water minerslettuce","Portulacaceae"
"MOCH","CLCH2","Claytonia chamissoi Ledeb. ex Spreng.","","Portulacaceae"
