"LEAE2","","Lemna aequinoctialis Welw.","lesser duckweed","Lemnaceae"
"LEAE2","LEAN5","Lemna angolensis Welw. ex Hegelm.","","Lemnaceae"
"LEAE2","LEPA16","Lemna paucicostata Hegelm.","","Lemnaceae"
"LEAE2","LETR3","Lemna trinervis (Austin) Small","","Lemnaceae"
"LEAEA","","Leucojum aestivum L. ssp. aestivum","summer snowflake","Liliaceae"
"LEAEP","","Leucojum aestivum L. ssp. pulchellum (Salisb.) Briq.","summer snowflake","Liliaceae"
"LEAVE","","Leavenworthia Torr.","gladecress","Brassicaceae"
"LEBI2","","Lespedeza bicolor Turcz.","shrub lespedeza","Fabaceae"
"LEBR2","","Lespedeza ×brittonii E.P. Bicknell (pro sp.) [procumbens × virginica]","lespedeza","Fabaceae"
"LEBR2","LEPRE","Lespedeza procumbens Michx. var. elliptica S.F. Blake","","Fabaceae"
"LECA2","","Leonurus cardiaca L.","common motherwort","Lamiaceae"
"LECA5","","Lepidium campestre (L.) W.T. Aiton","field pepperweed","Brassicaceae"
"LECA5","NECA5","Neolepia campestris (L.) W.A. Weber","","Brassicaceae"
"LECA5","THCA2","Thlaspi campestre L.","","Brassicaceae"
"LECA8","","Lespedeza capitata Michx.","roundhead lespedeza","Fabaceae"
"LECA8","LEBI5","Lespedeza bicknellii House","","Fabaceae"
"LECA8","LECAS","Lespedeza capitata Michx. var. stenophylla Bissell & Fernald","","Fabaceae"
"LECA8","LECAV2","Lespedeza capitata Michx. var. velutina (E.P. Bicknell) Fernald","","Fabaceae"
"LECA8","LECAV4","Lespedeza capitata Michx. var. vulgaris Torr. & A. Gray","","Fabaceae"
"LECAC7","","Leonurus cardiaca L. ssp. cardiaca","common motherwort","Lamiaceae"
"LECAN4","","Lecanora Ach.","rim lichen","Lecanoraceae"
"LECHE","","Lechea L.","pinweed","Cistaceae"
"LECU","","Lespedeza cuneata (Dum. Cours.) G. Don","sericea lespedeza","Fabaceae"
"LECU","LECUS","Lespedeza cuneata (Dum. Cours.) G. Don var. serpens (Nakai) Ohwi","","Fabaceae"
"LECU","LEJUS","Lespedeza juncea (L. f.) Pers. var. sericea Maxim.","","Fabaceae"
"LECU","LELA31","Lespedeza latissima (Matsum.) Nakai","","Fabaceae"
"LECU","LESE12","Lespedeza sericea Miq., nom. illeg.","","Fabaceae"
"LECU","LESE13","Lespedeza serpens Nakai","","Fabaceae"
"LEDU","","Leptochloa dubia (Kunth) Nees","green sprangletop","Poaceae"
"LEDU","CHDU2","Chloris dubia Kunth","","Poaceae"
"LEDU","DIDU","Diplachne dubia (Kunth) Scribn.","","Poaceae"
"LEERS","","Leersia Sw.","cutgrass","Poaceae"
"LEFI2","","Lesquerella filiformis Rollins","limestoneglade bladderpod","Brassicaceae"
"LEFR5","","Lespedeza frutescens (L.) Hornem.","shrubby lespedeza","Fabaceae"
"LEFR5","LEIN30","Lespedeza intermedia (S. Watson) Britton, nom. inq.","","Fabaceae"
"LEFR5","LEVI23","Lespedeza violacea auct. non (L.) Pers.","","Fabaceae"
"LEFU21","","Leptochloa fusca (L.) Kunth","Malabar sprangletop","Poaceae"
"LEFU21","DIFU7","Diplachne fusca (L.) P. Beauv. ex Roem. & Schult.","","Poaceae"
"LEFUF","","Leptochloa fusca (L.) Kunth ssp. fascicularis (Lam.) N. Snow","bearded sprangletop","Poaceae"
"LEFUF","DIAC3","Diplachne acuminata Nash","","Poaceae"
"LEFUF","DIFA4","Diplachne fascicularis (Lam.) P. Beauv.","","Poaceae"
"LEFUF","DIMA10","Diplachne maritima E.P. Bicknell","","Poaceae"
"LEFUF","LEAC2","Leptochloa acuminata (Nash) Mohlenbr.","","Poaceae"
"LEFUF","LEFA","Leptochloa fascicularis (Lam.) A. Gray","","Poaceae"
"LEFUF","LEFAA","Leptochloa fascicularis (Lam.) A. Gray var. acuminata (Nash) Gleason","","Poaceae"
"LEFUF","LEFAM","Leptochloa fascicularis (Lam.) A. Gray var. maritima (E.P. Bicknell) Gleason","","Poaceae"
"LEFUF","LEFUF2","Leptochloa fusca (L.) Kunth var. fascicularis (Lam.) Dorn","","Poaceae"
"LEFUU","","Leptochloa fusca (L.) Kunth ssp. uninervia (J. Presl) N. Snow","Mexican sprangletop","Poaceae"
"LEFUU","DIUN5","Diplachne uninervia (J. Presl) Parodi","","Poaceae"
"LEFUU","LEUN2","Leptochloa uninervia (J. Presl) Hitchc. & Chase","","Poaceae"
"LEFUU","MEUN4","Megastachya uninervia J. Presl","","Poaceae"
"LEGR2","","Lesquerella gracilis (Hook.) S. Watson","spreading bladderpod","Brassicaceae"
"LEGR2","PHGR6","Physaria gracilis (Hook.) O'Kane & Al-Shehbaz","","Brassicaceae"
"LEGRG","","Lesquerella gracilis (Hook.) S. Watson ssp. gracilis","spreading bladderpod","Brassicaceae"
"LEGRG","VEGR4","Vesicaria gracilis Hook.","","Brassicaceae"
"LEHI2","","Lespedeza hirta (L.) Hornem.","hairy lespedeza","Fabaceae"
"LEHIH2","","Lespedeza hirta (L.) Hornem. ssp. hirta","hairy lespedeza","Fabaceae"
"LEHIH2","LECAC3","Lespedeza capitata Michx. var. calycina (Schindl.) Fernald","","Fabaceae"
"LEHIH2","LEHIS","Lespedeza hirta (L.) Hornem. var. sparsiflora Torr. & A. Gray","","Fabaceae"
"LEHIH2","LEPO3","Lespedeza polystachya Michx.","","Fabaceae"
"LEITN","","Leitneria Chapm.","corkwood","Leitneriaceae"
"LELA2","","Lepidium latifolium L.","broadleaved pepperweed","Brassicaceae"
"LELA2","CALA80","Cardaria latifolia (L.) Spach","","Brassicaceae"
"LELE2","","Leersia lenticularis Michx.","catchfly grass","Poaceae"
"LELE2","HOLE5","Homalocenchrus lenticularis (Michx.) Kuntze","","Poaceae"
"LELO","","Lespedeza ×longifolia DC. (pro sp.) [capitata × hirta]","lespedeza","Fabaceae"
"LELO","LEHID2","Lespedeza hirta (L.) Hornem. var. dissimulans Fernald","","Fabaceae"
"LELO","LEHIL","Lespedeza hirta (L.) Hornem. var. longifolia (DC.) Fernald","","Fabaceae"
"LEMA6","","Lespedeza ×manniana Mack. & Bush (pro sp.) [capitata × violacea]","lespedeza","Fabaceae"
"LEMA6","LENUM2","Lespedeza nuttallii Darl. var. manniana (Mack. & Bush) Gleason","","Fabaceae"
"LEMI3","","Lemna minor L.","common duckweed","Lemnaceae"
"LEMI3","LECY4","Lemna cyclostasa Elliott ex Schleid.","","Lemnaceae"
"LEMI3","LEMI2","Lemna minima Chevall. ex Schleid.","","Lemnaceae"
"LEMI6","","Lemna minuta Kunth","least duckweed","Lemnaceae"
"LEMI6","LEMI10","Lemna minima Phil., non Thuill. ex P. Beauv.","","Lemnaceae"
"LEMI6","LEMI9","Lemna minuscula Herter","","Lemnaceae"
"LEMI6","LEVAA","Lemna valdiviana Phil. var. abbreviata Hegelm.","","Lemnaceae"
"LEMI6","LEVAM","Lemna valdiviana Phil. var. minima (Phil.) Hegelm.","","Lemnaceae"
"LEMNA","","Lemna L.","duckweed","Lemnaceae"
"LEMU","","Leucospora multifida (Michx.) Nutt.","narrowleaf paleseed","Scrophulariaceae"
"LEMU","COMU4","Conobea multifida (Michx.) Benth.","","Scrophulariaceae"
"LEMU3","","Lechea mucronata Raf.","hairy pinweed","Cistaceae"
"LEMU3","LEMIV","Lechea minor L. var. villosa (Elliott) B. Boivin","","Cistaceae"
"LEMU3","LEVI","Lechea villosa Elliott","","Cistaceae"
"LEMU3","LEVIM3","Lechea villosa Elliott var. macrotheca Hodgdon","","Cistaceae"
"LEMU3","LEVIS2","Lechea villosa Elliott var. schaffneri Hodgdon","","Cistaceae"
"LENE8","","Lespedeza ×neglecta Mack. & Bush (pro sp.) [stuevei × virginica]","lespedeza","Fabaceae"
"LENE8","LESTA","Lespedeza stuevei Nutt. var. angustifolia Britton, non Pursh","","Fabaceae"
"LENU","","Lespedeza ×nuttallii Darl. (pro sp.) [hirta × violacea]","lespedeza","Fabaceae"
"LEOB2","","Lemna obscura (Austin) Daubs","little duckweed","Lemnaceae"
"LEOB2","LEMIO","Lemna minor L. var. obscura Austin","","Lemnaceae"
"LEOF","","Levisticum officinale W.D.J. Koch","garden lovage","Apiaceae"
"LEOF","HILE3","Hipposelinum levisticum (L.) Britton & Rose","","Apiaceae"
"LEOF","LEPA13","Levisticum paludapifolium Asch.","","Apiaceae"
"LEONU","","Leonurus L.","motherwort","Lamiaceae"
"LEOR","","Leersia oryzoides (L.) Sw.","rice cutgrass","Poaceae"
"LEOR","HOOR3","Homalocenchrus oryzoides (L.) Pollich","","Poaceae"
"LEOR","PHOR5","Phalaris oryzoides L.","","Poaceae"
"LEPA3","","Leptochloa panicoides (J. Presl) Hitchc.","Amazon sprangletop","Poaceae"
"LEPA3","DIPA27","Dinebra panicoides (J. Presl) P.M. Peterson & N. Snow","","Poaceae"
"LEPA3","DIHA4","Diplachne halei Nash","","Poaceae"
"LEPA3","DIPA13","Diplachne panicoides (J. Presl) McNeill","","Poaceae"
"LEPA3","LEFL6","Leptochloa floribunda Döll","","Poaceae"
"LEPA3","MEPA12","Megastachya panicoides J. Presl","","Poaceae"
"LEPA6","","Leptochloa panicea (Retz.) Ohwi","mucronate sprangletop","Poaceae"
"LEPA6","DIPA26","Dinebra panicea (Retz.) P.M. Peterson & N. Snow","","Poaceae"
"LEPAB","","Leptochloa panicea (Retz.) Ohwi ssp. brachiata (Steud.) N. Snow","mucronate sprangeltop","Poaceae"
"LEPAB","FEFI2","Festuca filiformis Lam.","","Poaceae"
"LEPAB","LEBR17","Leptochloa brachiata Steud.","","Poaceae"
"LEPAB","LEFI","Leptochloa filiformis (Lam.) P. Beauv.","","Poaceae"
"LEPAB","LEFIP","Leptochloa filiformis (Lam.) P. Beauv. var. pulchella (Scribn.) Beetle","","Poaceae"
"LEPAM","","Leptochloa panicea (Retz.) Ohwi ssp. mucronata (Michx.) Nowack","mucronate sprangletop","Poaceae"
"LEPAM","LEAT","Leptochloa attenuata (Nutt.) Steud.","","Poaceae"
"LEPAM","LEFIA","Leptochloa filiformis (Lam.) P. Beauv. var. attenuata (Nutt.) Steyerm. & Kucera","","Poaceae"
"LEPAM","LEMU10","Leptochloa mucronata (Michx.) Kunth","","Poaceae"
"LEPE","","Lemna perpusilla Torr.","minute duckweed","Lemnaceae"
"LEPE","LEPET","Lemna perpusilla Torr. var. trinervis Austin","","Lemnaceae"
"LEPE2","","Lepidium perfoliatum L.","clasping pepperweed","Brassicaceae"
"LEPI16","","Leitneria pilosa J.A. Schrad. & W.R. Graves","hairy corkwood","Leitneriaceae"
"LEPID","","Lepidium L.","pepperweed","Brassicaceae"
"LEPIO","","Leitneria pilosa J.A. Schrad. & W.R. Graves ssp. ozarkana J.A. Schrad. & W.R. Graves","Ozark hairy corkwood","Leitneriaceae"
"LEPR","","Lespedeza procumbens Michx.","trailing lespedeza","Fabaceae"
"LEPTO","","Leptochloa P. Beauv.","sprangletop","Poaceae"
"LERA","","Lechea racemulosa Michx.","Illinois pinweed","Cistaceae"
"LERE2","","Lespedeza repens (L.) W.P.C. Barton","creeping lespedeza","Fabaceae"
"LERE2","HERE7","Hedysarum repens L.","","Fabaceae"
"LESI","","Leonurus sibiricus L.","honeyweed","Lamiaceae"
"LESI","LEAR7","Leonurus artemisia auct. non Lour.","","Lamiaceae"
"LESI2","","Lespedeza ×simulata Mack. & Bush (pro sp.) [capitata × virginica]","lespedeza","Fabaceae"
"LESPE","","Lespedeza Michx.","lespedeza","Fabaceae"
"LESQU","","Lesquerella S. Watson","bladderpod","Brassicaceae"
"LEST5","","Lespedeza stuevei Nutt.","tall lespedeza","Fabaceae"
"LETE","","Lechea tenuifolia Michx.","narrowleaf pinweed","Cistaceae"
"LETE","LETEO","Lechea tenuifolia Michx. var. occidentalis Hodgdon","","Cistaceae"
"LETH4","","Lespedeza thunbergii (DC.) Nakai","Thunberg's lespedeza","Fabaceae"
"LETR","","Lemna trisulca L.","star duckweed","Lemnaceae"
"LETU2","","Lemna turionifera Landolt","turion duckweed","Lemnaceae"
"LEUCA4","","Leucanthemum Mill.","daisy","Asteraceae"
"LEUCO2","","Leucojum L.","snowflake","Liliaceae"
"LEUCO4","","Leucospora Nutt.","leucospora","Scrophulariaceae"
"LEUN","","Leavenworthia uniflora (Michx.) Britton","Michaux's gladecress","Brassicaceae"
"LEUN","CAUN7","Cardamine uniflora Michx.","","Brassicaceae"
"LEUN","LEMI7","Leavenworthia michauxii Torr.","","Brassicaceae"
"LEVA","","Lemna valdiviana Phil.","valdivia duckweed","Lemnaceae"
"LEVA","LECY5","Lemna cyclostasa (Elliott) C.H. Thomp.","","Lemnaceae"
"LEVA","LETO3","Lemna torreyi Austin","","Lemnaceae"
"LEVI2","","Leersia virginica Willd.","whitegrass","Poaceae"
"LEVI2","HOVI4","Homalocenchrus virginicus (Willd.) Britton","","Poaceae"
"LEVI2","LEVIO","Leersia virginica Willd. var. ovata (Poir.) Fernald","","Poaceae"
"LEVI3","","Lepidium virginicum L.","Virginia pepperweed","Brassicaceae"
"LEVI6","","Lespedeza violacea (L.) Pers.","violet lespedeza","Fabaceae"
"LEVI6","HEVI7","Hedysarum violaceum L.","","Fabaceae"
"LEVI6","LEIN2","Lespedeza intermedia sensu Clewell, 1966","","Fabaceae"
"LEVI6","LEPR5","Lespedeza prairea (Mack. & Bush) Britton","","Fabaceae"
"LEVI7","","Lespedeza virginica (L.) Britton","slender lespedeza","Fabaceae"
"LEVIS","","Levisticum Hill","levisticum","Apiaceae"
"LEVIV2","","Lepidium virginicum L. var. virginicum","Virginia pepperweed","Brassicaceae"
"LEVIV2","LEVIT","Lepidium virginicum L. var. typicum C.L. Hitchc.","","Brassicaceae"
"LEVU","","Leucanthemum vulgare Lam.","oxeye daisy","Asteraceae"
"LEVU","CHLE80","Chrysanthemum leucanthemum L.","","Asteraceae"
"LEVU","CHLEB","Chrysanthemum leucanthemum L. var. boecheri B. Boivin","","Asteraceae"
"LEVU","CHLEP","Chrysanthemum leucanthemum L. var. pinnatifidum Lecoq & Lamotte","","Asteraceae"
"LEVU","LELE12","Leucanthemum leucanthemum (L.) Rydb., nom. inval.","","Asteraceae"
"LEVU","LEVUP","Leucanthemum vulgare Lam. var. pinnatifidum (Lecoq & Lamotte) Moldenke","","Asteraceae"
"LIAQ","","Limosella aquatica L.","water mudwort","Scrophulariaceae"
"LIAR6","","Lipocarpha aristulata (Coville) G. Tucker","awned halfchaff sedge","Cyperaceae"
"LIAR6","HEAR7","Hemicarpha aristulata (Coville) Smyth","","Cyperaceae"
"LIAR6","HEMIA2","Hemicarpha micrantha (Vahl) Pax var. aristulata Coville","","Cyperaceae"
"LIAR6","LIMI4","Lipocarpha microcephala auct. non Kunth","","Cyperaceae"
"LIAS","","Liatris aspera Michx.","tall blazing star","Asteraceae"
"LIASA","","Liatris aspera Michx. var. aspera","tall blazing star","Asteraceae"
"LIASA","LAAS2","Lacinaria aspera (Michx.) Greene","","Asteraceae"
"LIASI","","Liatris aspera Michx. var. intermedia (Lunell) Gaiser","tall blazing star","Asteraceae"
"LIASI","LASQI","Lacinaria squarrosa (L.) Hill var. intermedia (Lunell) DC.","","Asteraceae"
"LIATR","","Liatris Gaertn. ex Schreb.","blazing star","Asteraceae"
"LIBE3","","Lindera benzoin (L.) Blume","northern spicebush","Lauraceae"
"LIBEB","","Lindera benzoin (L.) Blume var. benzoin","northern spicebush","Lauraceae"
"LIBEB","BEAE","Benzoin aestivale (L.) Nees","","Lauraceae"
"LIBEP","","Lindera benzoin (L.) Blume var. pubescens (Palmer & Steyerm.) Rehder","northern spicebush","Lauraceae"
"LIBEP","BEAEP","Benzoin aestivale (L.) Nees var. pubescens Palmer & Steyerm.","","Lauraceae"
"LICA12","","Lithospermum canescens (Michx.) Lehm.","hoary puccoon","Boraginaceae"
"LICA12","BACA7","Batschia canescens Michx.","","Boraginaceae"
"LICA13","","Lithospermum caroliniense (Walter ex J.F. Gmel.) MacMill.","Carolina puccoon","Boraginaceae"
"LICA16","","Ligusticum canadense (L.) Britton","Canadian licorice-root","Apiaceae"
"LICAC8","","Lithospermum caroliniense (Walter ex J.F. Gmel.) MacMill. var. caroliniense","Carolina puccoon","Boraginaceae"
"LICAC8","BACA5","Batschia caroliniensis Walter ex J.F. Gmel.","","Boraginaceae"
"LICAC8","LICA27","Lithospermum carolinianum Lam.","","Boraginaceae"
"LICAC8","LIGM","Lithospermum gmelini (Michx.) Hitchc.","","Boraginaceae"
"LICAC9","","Lithospermum caroliniense (Walter ex J.F. Gmel.) MacMill. var. croceum (Fernald) Cronquist","Carolina puccoon","Boraginaceae"
"LICAC9","LICAC7","Lithospermum caroliniense (Walter ex J.F. Gmel.) MacMill. ssp. croceum (Fernald) Cusick","","Boraginaceae"
"LICAC9","LICR4","Lithospermum croceum Fernald","","Boraginaceae"
"LICO3","","Linum compactum A. Nelson","Wyoming flax","Linaceae"
"LICO3","CACO46","Cathartolinum compactum (A. Nelson) Small","","Linaceae"
"LICO3","LIRIC","Linum rigidum Pursh var. compactum (A. Nelson) C.M. Rogers","","Linaceae"
"LICY","","Liatris cylindracea Michx.","Ontario blazing star","Asteraceae"
"LICY","LACY3","Lacinaria cylindracea (Michx.) Kuntze","","Asteraceae"
"LIDE4","","Liatris densispicata (Bush) Gaiser","densespike blazing star","Asteraceae"
"LIDEI","","Liatris densispicata (Bush) Gaiser var. interrupta Gaiser","densespike blazing star","Asteraceae"
"LIDEI","LIAN4","Liatris angustifolia (Bush) Gaiser","","Asteraceae"
"LIDR3","","Lipocarpha drummondii (Nees) G. Tucker","Drummond's halfchaff sedge","Cyperaceae"
"LIDR3","HEDR3","Hemicarpha drummondii Nees","","Cyperaceae"
"LIDR3","HEMID3","Hemicarpha micrantha (Vahl) Pax var. drummondii (Nees) Friedland","","Cyperaceae"
"LIDR3","SCMID","Scirpus micranthus Vahl var. drummondii (Nees) Mohlenbr.","","Cyperaceae"
"LIDU","","Lindernia dubia (L.) Pennell","yellowseed false pimpernel","Scrophulariaceae"
"LIDUA","","Lindernia dubia (L.) Pennell var. anagallidea (Michx.) Cooperr.","yellowseed false pimpernel","Scrophulariaceae"
"LIDUA","ILAN3","Ilysanthes anagallidea (Michx.) B.L. Rob.","","Scrophulariaceae"
"LIDUA","ILIN","Ilysanthes inequalis (Walter) Pennell","","Scrophulariaceae"
"LIDUA","LIAN2","Lindernia anagallidea (Michx.) Pennell","","Scrophulariaceae"
"LIDUD","","Lindernia dubia (L.) Pennell var. dubia","yellowseed false pimpernel","Scrophulariaceae"
"LIDUD","GRDU","Gratiola dubia L.","","Scrophulariaceae"
"LIDUD","ILAT3","Ilysanthes attenuata (Spreng.) Small","","Scrophulariaceae"
"LIDUD","ILDU","Ilysanthes dubia (L.) Barnhart","","Scrophulariaceae"
"LIDUD","LIDUI","Lindernia dubia (L.) Pennell var. inundata (Pennell) Pennell","","Scrophulariaceae"
"LIDUD","LIDUM","Lindernia dubia (L.) Pennell var. major (Pursh) Pennell","","Scrophulariaceae"
"LIDUD","LIDUR","Lindernia dubia (L.) Pennell var. riparia (Raf.) Fernald","","Scrophulariaceae"
"LIDUD","LIDUT","Lindernia dubia (L.) Pennell var. typica Pennell","","Scrophulariaceae"
"LIDUD","LIPR2","Lindernia procumbens auct. non (Knock.) Borb.","","Scrophulariaceae"
"LIDUD","LIPY3","Lindernia pyxidaria sensu Pennell, non L.","","Scrophulariaceae"
"LIGUS","","Ligusticum L.","licorice-root","Apiaceae"
"LIGUS2","","Ligustrum L.","privet","Oleaceae"
"LIIN2","","Lithospermum incisum Lehm.","narrowleaf stoneseed","Boraginaceae"
"LIIN2","BALI","Batschia linearifolia (Goldie) Small","","Boraginaceae"
"LIIN2","LIAN6","Lithospermum angustifolium Michx.","","Boraginaceae"
"LIIN2","LILI8","Lithospermum linearifolium Goldie","","Boraginaceae"
"LIIN2","LIMA14","Lithospermum mandanense Spreng.","","Boraginaceae"
"LILA2","","Lithospermum latifolium Michx.","American stoneseed","Boraginaceae"
"LILA8","","Lilium lancifolium Thunb.","tiger lily","Liliaceae"
"LILA8","LITI","Lilium tigrinum Ker Gawl.","","Liliaceae"
"LILI","","Liatris ligulistylis (A. Nelson) K. Schum.","Rocky Mountain blazing star","Asteraceae"
"LILI","LALI3","Lacinaria ligulistylis A. Nelson","","Asteraceae"
"LILI3","","Liparis liliifolia (L.) Rich. ex Ker Gawl.","brown widelip orchid","Orchidaceae"
"LILIU","","Lilium L.","lily","Liliaceae"
"LILO","","Liparis loeselii (L.) Rich.","yellow widelip orchid","Orchidaceae"
"LIME2","","Linum medium (Planch.) Britton","stiff yellow flax","Linaceae"
"LIME7","","Lindera melissifolia (Walter) Blume","southern spicebush","Lauraceae"
"LIME7","BEME","Benzoin melissifolium (Walter) Nees","","Lauraceae"
"LIME7","LAME4","Laurus melissifolia Walter","","Lauraceae"
"LIMET","","Linum medium (Planch.) Britton var. texanum (Planch.) Fernald","stiff yellow flax","Linaceae"
"LIMET","CACU12","Cathartolinum curtissii (Small) Small","","Linaceae"
"LIMET","LISTT","Linum striatum Walter var. texanum (Planch.) B. Boivin","","Linaceae"
"LIMET","LIVIT","Linum virginianum L. var. texanum Planch.","","Linaceae"
"LIMI12","","Lipocarpha micrantha (Vahl) G. Tucker","smallflower halfchaff sedge","Cyperaceae"
"LIMI12","HEMI5","Hemicarpha micrantha (Vahl) Pax","","Cyperaceae"
"LIMI12","HEMIM3","Hemicarpha micrantha (Vahl) Pax var. minor (Schrad.) Friedland","","Cyperaceae"
"LIMI12","SCMI11","Scirpus micranthus Vahl","","Cyperaceae"
"LIMI12","SCMIM2","Scirpus micranthus Vahl var. minor (Schrad. ex Roem. & Schult.) B. Boivin","","Cyperaceae"
"LIMI9","","Lilium michiganense Farw.","Michigan lily","Liliaceae"
"LIMI9","LICAM","Lilium canadense L. ssp. michiganense (Farw.) B. Boivin & Cody","","Liliaceae"
"LIMI9","LICAU","Lilium canadense L. var. umbelliferum (Farw.) B. Boivin","","Liliaceae"
"LIMI9","LIMIU","Lilium michiganense Farw. var. uniflorum Farw.","","Liliaceae"
"LIMNO","","Limnobium Rich.","spongeplant","Hydrocharitaceae"
"LIMNO3","","Limnosciadium Mathias & Constance","dogshade","Apiaceae"
"LIMOS","","Limosella L.","mudwort","Scrophulariaceae"
"LINAR","","Linaria Mill.","toadflax","Scrophulariaceae"
"LINDE","","Lindernia All.","false pimpernel","Scrophulariaceae"
"LINDE2","","Lindera Thunb.","spicebush","Lauraceae"
"LINUM","","Linum L.","flax","Linaceae"
"LIOB","","Ligustrum obtusifolium Siebold & Zucc.","border privet","Oleaceae"
"LIOV","","Ligustrum ovalifolium Hassk.","California privet","Oleaceae"
"LIPAR","","Liparis Rich.","widelip orchid","Orchidaceae"
"LIPH","","Lilium philadelphicum L.","wood lily","Liliaceae"
"LIPHA","","Lilium philadelphicum L. var. andinum (Nutt.) Ker Gawl.","wood lily","Liliaceae"
"LIPHA","LIAN7","Lilium andinum Nutt.","","Liliaceae"
"LIPHA","LIMO6","Lilium montanum A. Nelson","","Liliaceae"
"LIPHA","LIPHM","Lilium philadelphicum L. var. montanum (A. Nelson) Wherry","","Liliaceae"
"LIPHA","LIUM2","Lilium umbellatum Pursh","","Liliaceae"
"LIPI2","","Limnosciadium pinnatum (DC.) Mathias & Constance","tansy dogshade","Apiaceae"
"LIPI2","CYPI6","Cynosciadium pinnatum DC.","","Apiaceae"
"LIPOC","","Lipocarpha R. Br.","halfchaff sedge","Cyperaceae"
"LIPU","","Liatris punctata Hook.","dotted blazing star","Asteraceae"
"LIPUM2","","Liatris punctata Hook. var. mucronata (DC.) B.L. Turner","cusp blazing star","Asteraceae"
"LIPUM2","LIMU","Liatris mucronata DC.","","Asteraceae"
"LIPUP","","Liatris punctata Hook. var. punctata","dotted blazing star","Asteraceae"
"LIPUP","LAPU8","Lacinaria punctata (Hook.) Kuntze","","Asteraceae"
"LIPUP","LIPUN","Liatris punctata Hook. var. nebraskana Gaiser","","Asteraceae"
"LIPUP","LIPUT","Liatris punctata Hook. var. typica Gaiser","","Asteraceae"
"LIPY","","Liatris pycnostachya Michx.","prairie blazing star","Asteraceae"
"LIPYP","","Liatris pycnostachya Michx. var. pycnostachya","prairie blazing star","Asteraceae"
"LIPYP","LAPY","Lacinaria pycnostachya (Michx.) Kuntze","","Asteraceae"
"LIPYP","LIBE5","Liatris bebbiana Rydb.","","Asteraceae"
"LIQUI","","Liquidambar L.","sweetgum","Hamamelidaceae"
"LIRI","","Linum rigidum Pursh","stiffstem flax","Linaceae"
"LIRIO","","Liriodendron L.","tuliptree","Magnoliaceae"
"LIRIR","","Linum rigidum Pursh var. rigidum","stiffstem flax","Linaceae"
"LIRIR","CAEA3","Cathartolinum earlei Small","","Linaceae"
"LIRIR","CARI10","Cathartolinum rigidum (Pursh) Small","","Linaceae"
"LIRIR","MERI2","Mesynium rigidum (Pursh) Á. Löve & D. Löve","","Linaceae"
"LISC2","","Liatris scariosa (L.) Willd.","devil's bite","Asteraceae"
"LISCN","","Liatris scariosa (L.) Willd. var. nieuwlandii (Lunell) E.G. Voss","Nieuwland's blazing star","Asteraceae"
"LISCN","LASCN","Lacinaria scariosa (L.) Hill var. nieuwlandii Lunell","","Asteraceae"
"LISCN","LINI","Liatris ×nieuwlandii (Lunell) Gaiser","","Asteraceae"
"LISCN","LINON","Liatris novae-angliae (Lunell) Shinners var. nieuwlandii (Lunell) Shinners","","Asteraceae"
"LISI","","Ligustrum sinense Lour.","Chinese privet","Oleaceae"
"LISI","LIMI13","Ligustrum microcarpum Kaneh. & Sasaki","","Oleaceae"
"LISI","LIVI7","Ligustrum villosum May","","Oleaceae"
"LISP","","Liatris spicata (L.) Willd.","dense blazing star","Asteraceae"
"LISP2","","Limnobium spongia (Bosc) Rich. ex Steud.","American spongeplant","Hydrocharitaceae"
"LISP2","HYCO12","Hydrocharis cordifolia Nutt.","","Hydrocharitaceae"
"LISP2","HYSP6","Hydrocharis spongia Bosc","","Hydrocharitaceae"
"LISP4","","Liatris spheroidea Michx.","spherical blazing star","Asteraceae"
"LISP4","LAASS","Lacinaria aspera (Michx.) Greene var. spheroidea (Michx.) Alexander","","Asteraceae"
"LISPS","","Liatris spicata (L.) Willd. var. spicata","dense blazing star","Asteraceae"
"LISPS","LASP5","Lacinaria spicata (L.) Kuntze","","Asteraceae"
"LISQ","","Liatris squarrosa (L.) Michx.","scaly blazing star","Asteraceae"
"LISQ2","","Liatris squarrulosa Michx.","Appalachian blazing star","Asteraceae"
"LISQ2","LARU2","Lacinaria ruthii Alexander","","Asteraceae"
"LISQ2","LASH","Lacinaria shortii Alexander","","Asteraceae"
"LISQ2","LATR7","Lacinaria tracyi Alexander","","Asteraceae"
"LISQ2","LIEA","Liatris earlei (Greene) K. Schum.","","Asteraceae"
"LISQ2","LISC","Liatris scabra (Greene) K. Schum.","","Asteraceae"
"LISQ2","LISCS","Liatris scariosa (L.) Willd. var. squarrulosa (Michx.) A. Gray","","Asteraceae"
"LISQG","","Liatris squarrosa (L.) Michx. var. glabrata (Rydb.) Gaiser","scaly blazing star","Asteraceae"
"LISQG","LIGL4","Liatris glabrata Rydb.","","Asteraceae"
"LISQH","","Liatris squarrosa (L.) Michx. var. hirsuta (Rydb.) Gaiser","scaly blazing star","Asteraceae"
"LISQH","LIHI2","Liatris hirsuta Rydb.","","Asteraceae"
"LISQS","","Liatris squarrosa (L.) Michx. var. squarrosa","scaly blazing star","Asteraceae"
"LISQS","LASQ2","Lacinaria squarrosa (L.) Hill","","Asteraceae"
"LISQS","LISQG2","Liatris squarrosa (L.) Michx. var. gracilenta Gaiser","","Asteraceae"
"LIST","","Linum striatum Walter","ridged yellow flax","Linaceae"
"LIST","CAST31","Cathartolinum striatum (Walter) Small","","Linaceae"
"LIST","LISTM2","Linum striatum Walter var. multijugum Fernald","","Linaceae"
"LIST","NEST3","Nezera striata (Walter) Nieuwl.","","Linaceae"
"LIST2","","Liquidambar styraciflua L.","sweetgum","Hamamelidaceae"
"LISU","","Lilium superbum L.","turk's-cap lily","Liliaceae"
"LISU","LICAS2","Lilium canadense L. ssp. superbum (L.) B. Boivin & Cody","","Liliaceae"
"LISU","LICAS3","Lilium canadense L. ssp. superbum (L.) Baker, nom. illeg.","","Liliaceae"
"LISU","LIGA3","Lilium gazarubrum Roane & Henry","","Liliaceae"
"LISU","LIMA12","Lilium mary-henryae Roane & Henry","","Liliaceae"
"LISU4","","Linum sulcatum Riddell","grooved flax","Linaceae"
"LISUS","","Linum sulcatum Riddell var. sulcatum","grooved flax","Linaceae"
"LISUS","CASU28","Cathartolinum sulcatum (Riddell) Small","","Linaceae"
"LISUS","MESU8","Mesynium sulcatum (Riddell) Á. Löve & D. Löve","","Linaceae"
"LITHO3","","Lithospermum L.","stoneseed","Boraginaceae"
"LITU","","Liriodendron tulipifera L.","tuliptree","Magnoliaceae"
"LIUS","","Linum usitatissimum L.","common flax","Linaceae"
"LIUS","LIHU3","Linum humile Mill.","","Linaceae"
"LIUS","LIUSH","Linum usitatissimum L. var. humile (Mill.) Pers.","","Linaceae"
"LIVI","","Linum virginianum L.","woodland flax","Linaceae"
"LIVI","CAVI15","Cathartolinum virginianum (L.) Rchb.","","Linaceae"
"LIVI","NEVI","Nezera virginiana (L.) Nieuwl.","","Linaceae"
"LIVU","","Ligustrum vulgare L.","European privet","Oleaceae"
"LIVU2","","Linaria vulgaris Mill.","butter and eggs","Scrophulariaceae"
"LIVU2","LILI6","Linaria linaria (L.) Karst., nom. inval.","","Scrophulariaceae"
