"QUST","","Quercus stellata Wangenh.","Post oak","Fagaceae"
"QUST","QUSTA2","Quercus stellata Wangenh. var. attenuata Sarg.","","Fagaceae"
"QUST","QUSTP2","Quercus stellata Wangenh. var. parviloba Sarg.","","Fagaceae"
"QUST2","","Quercus ×stelloides Palmer [prinoides × stellata]","hybrid oak","Fagaceae"
"QUTE","","Quercus texana Buckley","Nuttall oak","Fagaceae"
"QUTE","QUNU","Quercus nuttallii Palmer","","Fagaceae"
"QUTE","QUNUC","Quercus nuttallii Palmer var. cachensis Palmer","","Fagaceae"
"QUTE","QURUT","Quercus rubra L. var. texana (Buckley) Buckley","","Fagaceae"
"QUTE","QUSHM","Quercus shumardii Buckley var. microcarpa (Torr.) Shinners","","Fagaceae"
"QUTE","QUSHT","Quercus shumardii Buckley var. texana (Buckley) Ashe","","Fagaceae"
"QUVE","","Quercus velutina Lam.","Black oak","Fagaceae"
"QUVE","QUVEM","Quercus velutina Lam. var. missouriensis Sarg.","","Fagaceae"
"RAAB","","Ranunculus abortivus L.","LITTLELEAF BUTTERCUP","Ranunculaceae"
"RAAB","RAABA","Ranunculus abortivus L. ssp. acrolasius (Fernald) Kapoor & Á. Löve & D. Löve","","Ranunculaceae"
"RAAB","RAABA3","Ranunculus abortivus L. var. acrolasius Fernald","","Ranunculaceae"
"RAAB","RAABE","Ranunculus abortivus L. var. eucyclus Fernald","","Ranunculaceae"
"RAAB","RAABI","Ranunculus abortivus L. var. indivisus Fernald","","Ranunculaceae"
"RAAB","RAABT","Ranunculus abortivus L. var. typicus Fernald","","Ranunculaceae"
"RAAN2","","Rayjacksonia annua (Rydb.) R.L. Hartm. & M.A. Lane","viscid tansyaster","Asteraceae"
"RAAN2","HAAN","Haplopappus annuus (Rydb.) Cory","","Asteraceae"
"RAAN2","HAPHA","Haplopappus phyllocephalus DC. ssp. annuus (Rydb.) H.M. Hall","","Asteraceae"
"RAAN2","HAPHA2","Haplopappus phyllocephalus DC. var. annuus (Rydb.) Waterf.","","Asteraceae"
"RAAN2","MAAN8","Machaeranthera annua (Rydb.) Shinners","","Asteraceae"
"RAAN2","MAPHA","Machaeranthera phyllocephala (DC.) Shinners var. annua (Rydb.) Shinners","","Asteraceae"
"RAAN2","SIAN6","Sideranthus annuus Rydb.","","Asteraceae"
"RACO3","","Ratibida columnifera (Nutt.) Wooton & Standl.","Prairie coneflower","Asteraceae"
"RACO3","LECO48","Lepachys columnaris (Pursh) Torr. & A. Gray","","Asteraceae"
"RACO3","LECO13","Lepachys columnifera (Nutt.) J.F. Macbr.","","Asteraceae"
"RACO3","RACO7","Ratibida columnaris (Pursh) D. Don","","Asteraceae"
"RACO3","RACOP","Ratibida columnaris (Pursh) D. Don var. pulcherrima (DC.) D. Don","","Asteraceae"
"RACO3","RUCO23","Rudbeckia columnaris Pursh, non Sims","","Asteraceae"
"RACO3","RUCO24","Rudbeckia columnifera Nutt.","","Asteraceae"
"RACY","","Ranunculus cymbalaria Pursh","SHORE BUTTERCUP","Ranunculaceae"
"RACY","CYCY9","Cyrtorhyncha cymbalaria (Pursh) Britton","","Ranunculaceae"
"RACY","CYCYA","Cyrtorhyncha cymbalaria (Pursh) Britton ssp. alpina (Hook.) Á. Löve & D. Löve","","Ranunculaceae"
"RACY","HACY2","Halerpestes cymbalaria (Pursh) Greene","","Ranunculaceae"
"RACY","HACYS","Halerpestes cymbalaria (Pursh) Greene ssp. saximontana (Fernald) Moldenke","","Ranunculaceae"
"RACY","RACYS2","Ranunculus cymbalaria Pursh ssp. saximontanus (Fernald) Thorne","","Ranunculaceae"
"RACY","RACYA","Ranunculus cymbalaria Pursh var. alpinus Hook.","","Ranunculaceae"
"RACY","RACYS","Ranunculus cymbalaria Pursh var. saximontanus Fernald","","Ranunculaceae"
"RACY","RACYT","Ranunculus cymbalaria Pursh var. typicus L.D. Benson","","Ranunculaceae"
"RAFA","","Ranunculus fascicularis Muhl. ex Bigelow","TUFTED BUTTERCUP","Ranunculaceae"
"RAFA","RAFAA","Ranunculus fascicularis Muhl. ex Bigelow var. apricus (Greene) Fernald","","Ranunculaceae"
"RAFA","RAFAT","Ranunculus fascicularis Muhl. ex Bigelow var. typicus L.D. Benson","","Ranunculaceae"
"RAFL","","Ranunculus flabellaris Raf.","YELLOW WATER BUTTERCUP","Ranunculaceae"
"RAFL","RADE2","Ranunculus delphiniifolius Torr. ex Eaton","","Ranunculaceae"
"RAHA","","Ranunculus harveyi (A. Gray) Britton","HARVEY BUTTERCUP","Ranunculaceae"
"RAHA","RAABH","Ranunculus abortivus L. var. harveyi A. Gray","","Ranunculaceae"
"RAHA","RAHAP","Ranunculus harveyi (A. Gray) Britton var. pilosus Benke","","Ranunculaceae"
"RAHA","RAHAT","Ranunculus harveyi (A. Gray) Britton var. typicus L.D. Benson","","Ranunculaceae"
"RAHI","","Ranunculus hispidus Michx.","BRISTLY BUTTERCUP","Ranunculaceae"
"RAHIH","","Ranunculus hispidus Michx. var. hispidus","bristly buttercup","Ranunculaceae"
"RAHIH","RAHIE","Ranunculus hispidus Michx. var. eurylobus L.D. Benson","","Ranunculaceae"
"RAHIH","RAHIF","Ranunculus hispidus Michx. var. falsus Fernald","","Ranunculaceae"
"RAHIH","RAHIG","Ranunculus hispidus Michx. var. greenmanii L.D. Benson","","Ranunculaceae"
"RAHIH","RAHIM","Ranunculus hispidus Michx. var. marilandicus (Poir.) L.D. Benson","","Ranunculaceae"
"RAHIH","RAHIT","Ranunculus hispidus Michx. var. typicus L.D. Benson","","Ranunculaceae"
"RAHIN","","Ranunculus hispidus Michx. var. nitidus (Chapm.) T. Duncan","SWAMP BUTTERCUP","Ranunculaceae"
"RAHIN","RACA5","Ranunculus carolinianus DC.","","Ranunculaceae"
"RAHIN","RACAV","Ranunculus carolinianus DC. var. villicaulis Shinners","","Ranunculaceae"
"RAHIN","RANI3","Ranunculus nitidus Muhl. ex Elliott, non Walter","","Ranunculaceae"
"RAHIN","RAPA5","Ranunculus palmatus Elliott","","Ranunculaceae"
"RAHIN","RASE","Ranunculus septentrionalis Poir.","","Ranunculaceae"
"RAHIN","RASEN","Ranunculus septentrionalis Poir. var. nitidus (Chapm.) Chapm.","","Ranunculaceae"
"RAHIN","RASEP","Ranunculus septentrionalis Poir. var. pterocarpus L.D. Benson","","Ranunculaceae"
"RALA2","","Ranunculus laxicaulis (Torr. & A. Gray) Darby","Mississippi buttercup","Ranunculaceae"
"RALA2","RAFLL","Ranunculus flammula L. var. laxicaulis Torr. & A. Gray","","Ranunculaceae"
"RALA2","RALAM","Ranunculus laxicaulis (Torr. & A. Gray) Darby var. mississippiensis (Small) L.D. Benson","","Ranunculaceae"
"RALA2","RAMI3","Ranunculus mississippiensis Small","","Ranunculaceae"
"RALA2","RASU3","Ranunculus subcordatus E.O. Beal","","Ranunculaceae"
"RALA2","RATE6","Ranunculus texensis Engelm.","","Ranunculaceae"
"RALO2","","Ranunculus longirostris Godr.","longbeak buttercup","Ranunculaceae"
"RALO2","BACI6","Batrachium circinatum (Sibth.) Rchb.","","Ranunculaceae"
"RALO2","BACIS","Batrachium circinatum (Sibth.) Rchb. ssp. subrigidum (W. Drew) Á. Löve & D. Löve","","Ranunculaceae"
"RALO2","BALO2","Batrachium longirostre (Godr.) F.W. Schultz","","Ranunculaceae"
"RALO2","RAAM2","Ranunculus amphibius James","","Ranunculaceae"
"RALO2","RAAQD","Ranunculus aquatilis L. var. diffusus With. p.p.","","Ranunculaceae"
"RALO2","RAAQL2","Ranunculus aquatilis L. var. longirostris (Godr.) G. Lawson","","Ranunculaceae"
"RALO2","RAAQS","Ranunculus aquatilis L. var. subrigidus (W. Drew) Breitung","","Ranunculaceae"
"RALO2","RACI2","Ranunculus circinatus auct. non Sibth.","","Ranunculaceae"
"RALO2","RACIS","Ranunculus circinatus Sibth. var. subrigidus (W. Drew) L.D. Benson","","Ranunculaceae"
"RALO2","RASU","Ranunculus subrigidus W. Drew","","Ranunculaceae"
"RALO2","RAUS","Ranunculus usneoides Greene","","Ranunculaceae"
"RAMI2","","Ranunculus micranthus Nutt.","rock buttercup","Ranunculaceae"
"RAMI2","RAMIC","Ranunculus micranthus Nutt. var. cymbalistes (Greene) Fernald","","Ranunculaceae"
"RAMI2","RAMID","Ranunculus micranthus Nutt. var. delitescens (Greene) Fernald","","Ranunculaceae"
"RANUN","","Ranunculus L.","buttercup","Ranunculaceae"
"RAPA3","","Ranunculus parviflorus L.","STICKTIGHT BUTTERCUP","Ranunculaceae"
"RAPI","","Ratibida pinnata (Vent.) Barnhart","GRAYHEAD PRAIRIECONEFLOWER","Asteraceae"
"RAPI","LEPI14","Lepachys pinnata (Vent.) Torr. & A. Gray","","Asteraceae"
"RAPI","RUPI3","Rudbeckia pinnata Vent.","","Asteraceae"
"RAPU","","Ranunculus pusillus Poir.","WEAK BUTTERCUP","Ranunculaceae"
"RAPUP","","Ranunculus pusillus Poir. var. pusillus","low spearwort","Ranunculaceae"
"RAPUP","RALI3","Ranunculus lindheimeri Engelm.","","Ranunculaceae"
"RAPUP","RAOB2","Ranunculus oblongifolius Elliott","","Ranunculaceae"
"RAPUP","RAPUL","Ranunculus pusillus Poir. var. lindheimeri (Engelm.) A. Gray","","Ranunculaceae"
"RAPUP","RAPUT2","Ranunculus pusillus Poir. var. typicus L.D. Benson","","Ranunculaceae"
"RARE2","","Ranunculus recurvatus Poir.","LITTLELEAF BUTTERCUP","Ranunculaceae"
"RARER2","","Ranunculus recurvatus Poir. var. recurvatus","blisterwort","Ranunculaceae"
"RARER2","RAREA","Ranunculus recurvatus Poir. var. adpressipilis Weath.","","Ranunculaceae"
"RARER2","RARET","Ranunculus recurvatus Poir. var. typicus L.D. Benson","","Ranunculaceae"
"RASA","","Ranunculus sardous Crantz","hairy buttercup","Ranunculaceae"
"RASA","RAPA6","Ranunculus parvulus L.","","Ranunculaceae"
"RASC3","","Ranunculus sceleratus L.","cursed buttercup","Ranunculaceae"
"RASCS","","Ranunculus sceleratus L. var. sceleratus","cursed buttercup","Ranunculaceae"
"RASCS","HESC9","Hecatonia scelerata (L.) Fourr.","","Ranunculaceae"
"RASCS","RASCT","Ranunculus sceleratus L. var. typicus L.D. Benson","","Ranunculaceae"
"RATA","","Ratibida tagetes (James) Barnhart","SHORTRAY PRAIRECONEFLOWER","Asteraceae"
"RATA","RUGL4","Rudbeckia globosa Nutt.","","Asteraceae"
"RATA","RUTA4","Rudbeckia tagetes James","","Asteraceae"
"RATIB","","Ratibida Raf.","prairie coneflower","Asteraceae"
"RAYJA","","Rayjacksonia R.L. Hartm. & M.A. Lane","tansyaster","Asteraceae"
"REAR","","Reverchonia arenaria A. Gray","SAND REVERCHONIA","Euphorbiaceae"
"REDFI","","Redfieldia Vasey","blowout grass","Poaceae"
"REFL","","Redfieldia flexuosa (Thurb.) Vasey","BLOWOUT GRASS","Poaceae"
"REVER","","Reverchonia A. Gray","reverchonia","Euphorbiaceae"
"RHAMN","","Rhamnus L.","buckthorn","Rhamnaceae"
"RHAR4","","Rhus aromatica Aiton","FRAGRANT SUMAC","Anacardiaceae"
"RHARA2","","Rhus aromatica Aiton var. aromatica","fragrant sumac","Anacardiaceae"
"RHARA2","RHARI","Rhus aromatica Aiton var. illinoensis (Greene) Rehder","","Anacardiaceae"
"RHARA2","SCCR3","Schmaltzia crenata (Mill.) Greene","","Anacardiaceae"
"RHARS","","Rhus aromatica Aiton var. serotina (Greene) Rehder","fragrant sumac","Anacardiaceae"
"RHARS","RHARS2","Rhus aromatica Aiton ssp. serotina (Greene) R.E. Brooks","","Anacardiaceae"
"RHARS","RHTRS2","Rhus trilobata Nutt. var. serotina (Greene) F.A. Barkley","","Anacardiaceae"
"RHCA11","","Rhynchospora capillacea Torr.","needle beaksedge","Cyperaceae"
"RHCA11","RHCAL","Rhynchospora capillacea Torr. var. leviseta E.J. Hill ex A. Gray","","Cyperaceae"
"RHCA11","RHSM2","Rhynchospora smallii Britton","","Cyperaceae"
"RHCA12","","Rhynchospora capitellata (Michx.) Vahl","brownish beaksedge","Cyperaceae"
"RHCA12","CYWE","×Cyperus weatherbianus Fernald, nom. inval.","","Cyperaceae"
"RHCA12","RAWE","Raymondiella weatherbiana (Fernald) B. Boivin (pro hybr.), nom. inval.","","Cyperaceae"
"RHCA12","RHGLC","Rhynchospora glomerata (L.) Vahl var. capitellata (Michx.) Kük.","","Cyperaceae"
"RHCA12","RHGLM","Rhynchospora glomerata (L.) Vahl var. minor Britton","","Cyperaceae"
"RHCA7","","Rhododendron canescens (Michx.) Sweet","PIEDMONT AZALEA","Ericaceae"
"RHCA7","AZCA4","Azalea candida Small","","Ericaceae"
"RHCA7","AZCA3","Azalea canescens Michx.","","Ericaceae"
"RHCA7","AZCAS","Azalea canescens Michx. var. subglabra (Rehder) Small","","Ericaceae"
"RHCA7","RHCA18","Rhododendron candidum (Small) Rehder","","Ericaceae"
"RHCA7","RHCAC5","Rhododendron canescens (Michx.) Sweet var. candidum (Small) Rehder","","Ericaceae"
"RHCA7","RHCAS","Rhododendron canescens (Michx.) Sweet var. subglabrum Rehder","","Ericaceae"
"RHCA9","","Rhynchospora caduca Elliott","anglestem beaksedge","Cyperaceae"
"RHCA9","RHPA4","Rhynchospora patula A. Gray","","Cyperaceae"
"RHCO","","Rhus copallinum L.","Flameleaf sumac","Anacardiaceae"
"RHCO","RHCO17","Rhus copallina L., orth. var.","","Anacardiaceae"
"RHCO2","","Rhynchospora corniculata (Lam.) A. Gray","shortbristle horned beaksedge","Cyperaceae"
"RHCO2","RHCOI","Rhynchospora corniculata (Lam.) A. Gray var. interior Fernald","","Cyperaceae"
"RHCOL2","","Rhus copallinum L. var. latifolia Engl.","winged sumac","Anacardiaceae"
"RHCOL2","RHCOL5","Rhus copallina L. var. latifolia Engl., orth. var.","","Anacardiaceae"
"RHDI2","","Rhynchosia difformis (Elliott) DC.","doubleform snoutbean","Fabaceae"
"RHDI2","ARDI13","Arcyphyllum difforme Elliott","","Fabaceae"
"RHDI2","DOTO","Dolicholus tomentosus (L.) Vail","","Fabaceae"
"RHDI2","RHTOV","Rhynchosia tomentosa (L.) Hook. & Arn. var. volubilis (Michx.) Torr. & A. Gray","","Fabaceae"
"RHEXI","","Rhexia L.","meadowbeauty","Melastomataceae"
"RHGL","","Rhus glabra L.","Smooth sumac","Anacardiaceae"
"RHGL","RHCA15","Rhus calophylla Greene","","Anacardiaceae"
"RHGL","RHGLC2","Rhus glabra L. var. cismontana (Greene) Cockerell","","Anacardiaceae"
"RHGL","RHGLL2","Rhus glabra L. var. laciniata Carrière","","Anacardiaceae"
"RHGL","RHGLO","Rhus glabra L. var. occidentalis Torr.","","Anacardiaceae"
"RHGL3","","Rhynchospora glomerata (L.) Vahl","clustered beaksedge","Cyperaceae"
"RHGL3","RHCY3","Rhynchospora cymosa Elliott","","Cyperaceae"
"RHGL3","RHGLA","Rhynchospora glomerata (L.) Vahl var. angusta Gale","","Cyperaceae"
"RHGL3","RHGLP2","Rhynchospora glomerata (L.) Vahl var. paniculata Chapm.","","Cyperaceae"
"RHGR","","Rhynchospora gracilenta A. Gray","slender beaksedge","Cyperaceae"
"RHHA","","Rhynchospora harveyi W. Boott","Harvey's beaksedge","Cyperaceae"
"RHHAH","","Rhynchospora harveyi W. Boott var. harveyi","Harvey's beaksedge","Cyperaceae"
"RHHAH","RHEA","Rhynchospora earlei Britton","","Cyperaceae"
"RHHAH","RHPL4","Rhynchospora planckii Britton","","Cyperaceae"
"RHIN4","","Rhynchospora inexpansa (Michx.) Vahl","nodding beaksedge","Cyperaceae"
"RHLA","","Rhamnus lanceolata Pursh","lanceleaf buckthorn","Rhamnaceae"
"RHLA3","","Rhus lanceolata (A. Gray) Britton","prairie sumac","Anacardiaceae"
"RHLA3","RHCOL4","Rhus copallina L. var. lanceolata A. Gray, orth. var.","","Anacardiaceae"
"RHLA3","RHCOL3","Rhus copallinum L. var. lanceolata A. Gray","","Anacardiaceae"
"RHLA5","","Rhynchosia latifolia Nutt. ex Torr. & A. Gray","BROADLEAF SNOUTBEAN","Fabaceae"
"RHLA5","DOLA4","Dolicholus latifolius (Nutt. ex Torr. & A. Gray) Vail","","Fabaceae"
"RHLA5","RHTO5","Rhynchosia torreyi Vail","","Fabaceae"
"RHLA7","","Rhynchospora latifolia (Baldw. ex Elliott) W.W. Thomas","sandswamp whitetop","Cyperaceae"
"RHLA7","DILA2","Dichromena latifolia Baldw. ex Elliott","","Cyperaceae"
"RHLAG2","","Rhamnus lanceolata Pursh ssp. glabrata (Gleason) Kartesz & Gandhi","lanceleaf buckthorn","Rhamnaceae"
"RHLAG2","RHLAG","Rhamnus lanceolata Pursh var. glabrata Gleason","","Rhamnaceae"
"RHMA","","Rhexia mariana L.","MARYLAND MEADOWBEAUTY","Melastomataceae"
"RHMA6","","Rhynchospora macrostachya Torr. ex A. Gray","tall horned beaksedge","Cyperaceae"
"RHMA6","RHMAC","Rhynchospora macrostachya Torr. ex A. Gray var. colpophila Fernald & Gale","","Cyperaceae"
"RHMAI","","Rhexia mariana L. var. interior (Pennell) Kral & Bostick","Maryland meadowbeauty","Melastomataceae"
"RHMAI","RHIN9","Rhexia interior Pennell","","Melastomataceae"
"RHMAM2","","Rhexia mariana L. var. mariana","Maryland meadowbeauty","Melastomataceae"
"RHMAM2","RHDE3","Rhexia delicatula Small","","Melastomataceae"
"RHMAM2","RHFI3","Rhexia filiformis Small","","Melastomataceae"
"RHMAM2","RHLA8","Rhexia lanceolata Walter","","Melastomataceae"
"RHMAM2","RHMAE","Rhexia mariana L. var. exalbida Michx.","","Melastomataceae"
"RHMAM2","RHMAL","Rhexia mariana L. var. leiosperma Fernald & Grisc.","","Melastomataceae"
"RHMI3","","Rhus microphylla Engelm. ex A. Gray","littleleaf sumac","Anacardiaceae"
"RHNI2","","Rhynchospora nivea Boeckeler","showy whitetop","Cyperaceae"
"RHNI2","DINI","Dichromena nivea (Boeckeler) Boeckeler ex Britton","","Cyperaceae"
"RHOB","","Rhododendron oblongifolium (Small) Millais","Texas azalea","Ericaceae"
"RHODO","","Rhododendron L.","rhododendron","Ericaceae"
"RHPH2","","Rhynchosida physocalyx (A. Gray) Fryxell","buffpetal","Malvaceae"
"RHPH2","SIPH2","Sida physocalyx A. Gray","","Malvaceae"
"RHPR","","Rhododendron prinophyllum (Small) Millais","early azalea","Ericaceae"
"RHPR","AZPR3","Azalea prinophylla Small","","Ericaceae"
"RHPR","RHNUR","Rhododendron nudiflorum (L.) Torr. var. roseum (Loisel.) Wiegand","","Ericaceae"
"RHPR","RHRO4","Rhododendron roseum (Loisel.) Rehder","","Ericaceae"
"RHRA2","","Rhynchospora rariflora (Michx.) Elliott","fewflower beaksedge","Cyperaceae"
"RHRA2","SCRA3","Schoenus rariflorus Michx.","","Cyperaceae"
"RHRE8","","Rhynchospora recognita (Gale) Kral","globe beaksedge","Cyperaceae"
"RHRE8","RHGLR","Rhynchospora globularis (Chapm.) Small var. recognita Gale","","Cyperaceae"
"RHRE8","RHOB2","Rhynchospora obliterata Gale","","Cyperaceae"
"RHTR","","Rhus trilobata Nutt.","Skunkbush","Anacardiaceae"
"RHTRP","","Rhus trilobata Nutt. var. pilosissima Engelm.","pubescent skunkbush sumac","Anacardiaceae"
"RHTRP","RHARP2","Rhus aromatica Aiton ssp. pilosissima (Engelm.) W.A. Weber","","Anacardiaceae"
"RHTRP","RHARM","Rhus aromatica Aiton var. mollis Ashe","","Anacardiaceae"
"RHTRP","RHARP","Rhus aromatica Aiton var. pilosissima (Engelm.) Shinners","","Anacardiaceae"
"RHTRP","RHTRM","Rhus trilobata Nutt. var. malacophylla (Greene) Munz","","Anacardiaceae"
"RHTRS","","Rhus trilobata Nutt. var. simplicifolia (Greene) F.A. Barkley","skunkbush sumac","Anacardiaceae"
"RHTRS","RHARS3","Rhus aromatica Aiton var. simplicifolia (Greene) Cronquist","","Anacardiaceae"
"RHTRT","","Rhus trilobata Nutt. var. trilobata","skunkbush sumac","Anacardiaceae"
"RHTRT","RHARF2","Rhus aromatica Aiton ssp. flabelliformis (Shinners) R.E. Brooks","","Anacardiaceae"
"RHTRT","RHART","Rhus aromatica Aiton ssp. trilobata (Nutt.) W.A. Weber","","Anacardiaceae"
"RHTRT","RHARF","Rhus aromatica Aiton var. flabelliformis Shinners","","Anacardiaceae"
"RHTRT","RHART2","Rhus aromatica Aiton var. trilobata (Nutt.) A. Gray ex S. Watson","","Anacardiaceae"
"RHTRT","SCTR4","Schmaltzia trilobata (Nutt.) Small","","Anacardiaceae"
"RHUS","","Rhus L.","SUMAC","Anacardiaceae"
"RHVI","","Rhexia virginica L.","COMMON MEADOWBEAUTY","Melastomataceae"
"RHVI","RHST5","Rhexia stricta Pursh","","Melastomataceae"
"RHVI","RHVIP","Rhexia virginica L. var. purshii (Spreng.) C.W. James","","Melastomataceae"
"RHVI","RHVIS2","Rhexia virginica L. var. septemnervia (Walter) Pursh","","Melastomataceae"
"RHVI2","","Rhododendron viscosum (L.) Torr.","swamp azalea","Ericaceae"
"RHVI2","AZSE","Azalea serrulata Small","","Ericaceae"
"RHVI2","AZVI","Azalea viscosa L.","","Ericaceae"
"RHVI2","RHCO5","Rhododendron coryi Shinners","","Ericaceae"
"RHVI2","RHSE","Rhododendron serrulatum (Small) Millais","","Ericaceae"
"RHVI2","RHVIA","Rhododendron viscosum (L.) Torr. var. aemulans Rehder","","Ericaceae"
"RHVI2","RHVIG","Rhododendron viscosum (L.) Torr. var. glaucum (Michx.) A. Gray","","Ericaceae"
"RHVI2","RHVIM","Rhododendron viscosum (L.) Torr. var. montanum Rehder","","Ericaceae"
"RHVI2","RHVIN","Rhododendron viscosum (L.) Torr. var. nitidum (Pursh) A. Gray","","Ericaceae"
"RHVI2","RHVIS","Rhododendron viscosum (L.) Torr. var. serrulatum (Small) H.E. Ahles","","Ericaceae"
"RHVI2","RHVIT","Rhododendron viscosum (L.) Torr. var. tomentosum Rehder","","Ericaceae"
"RHYNC2","","Rhynchosia Lour.","snoutbean","Fabaceae"
"RHYNC3","","Rhynchospora Vahl","beaksedge","Cyperaceae"
"RHYNC3","RAYMO","Raymondiella B. Boivin, nom. inval.","","Cyperaceae"
"RHYNC5","","Rhynchosida Fryxell","rhynchosida","Malvaceae"
"RIAU","","Ribes aureum Pursh","GOLDEN CURRANT","Grossulariaceae"
"RIAUV","","Ribes aureum Pursh var. villosum DC.","CLOVE CURRANT","Grossulariaceae"
"RIAUV","RIOD","Ribes odoratum H. Wendl.","","Grossulariaceae"
"RIBES","","Ribes L.","currant","Grossulariaceae"
"RICE","","Ribes cereum Douglas","wax currant","Grossulariaceae"
"RICEP","","Ribes cereum Douglas var. pedicellare W.H. Brewer & S. Watson","whisky currant","Grossulariaceae"
"RICEP","RICEI","Ribes cereum Douglas var. inebrians (Lindl.) C.L. Hitchc.","","Grossulariaceae"
"RICEP","RIIN3","Ribes inebrians Lindl.","","Grossulariaceae"
"RICU","","Ribes curvatum Small","granite gooseberry","Grossulariaceae"
"RICU","GRCA5","Grossularia campestris Small","","Grossulariaceae"
"RICU","GRCU2","Grossularia curvata (Small) Coville & Britton","","Grossulariaceae"
"RICU","GRTE2","Grossularia texensis Coville & A. Berger","","Grossulariaceae"
"RICY","","Ribes cynosbati L.","PASTURE CURRANT","Grossulariaceae"
"RICY","GRCY","Grossularia cynosbati (L.) Mill.","","Grossulariaceae"
"RICY","RICYA","Ribes cynosbati L. var. atrox Fernald","","Grossulariaceae"
"RICY","RICYG","Ribes cynosbati L. var. glabratum Fernald","","Grossulariaceae"
"RICY","RICYI","Ribes cynosbati L. var. inerme (Rehder) L.H. Bailey","","Grossulariaceae"
"RICY","RIHU4","Ribes huronense Rydb.","","Grossulariaceae"
"RIHU2","","Rivina humilis L.","BLOODBERRY ROUGEPLANT","Phytolaccaceae"
"RIMI","","Ribes missouriense Nutt.","Missouri gooseberry","Grossulariaceae"
"RIMI","GRMI2","Grossularia missouriensis (Nutt.) Coville & Britton","","Grossulariaceae"
"RIMI","RIMIO","Ribes missouriense Nutt. var. ozarkanum Fassett","","Grossulariaceae"
"RIVIN","","Rivina L.","rivina","Phytolaccaceae"
"ROAR3","","Rosa arkansana Porter","PRAIRIE ROSE","Rosaceae"
"ROARS","","Rosa arkansana Porter var. suffulta (Greene) Cockerell","prairie rose","Rosaceae"
"ROARS","ROAL5","Rosa alcea Greene","","Rosaceae"
"ROARS","ROCO9","Rosa conjuncta Rydb.","","Rosaceae"
"ROARS","ROPR2","Rosa pratincola Greene","","Rosaceae"
"ROARS","ROSU6","Rosa suffulta Greene","","Rosaceae"
"ROARS","ROSUR","Rosa suffulta Greene var. relicta (Erlanson) Deam","","Rosaceae"
"ROBIN","","Robinia L.","locust","Fabaceae"
"ROCA4","","Rosa carolina L.","CAROLINA ROSE","Rosaceae"
"ROCAC","","Rosa carolina L. var. carolina","Carolina rose","Rosaceae"
"ROCAC","ROCAD","Rosa carolina L. var. deamii (Erlanson) Deam","","Rosaceae"
"ROCAC","ROCAG","Rosa carolina L. var. glandulosa (Crép.) Farw.","","Rosaceae"
"ROCAC","ROCAG2","Rosa carolina L. var. grandiflora (Baker) Rehder","","Rosaceae"
"ROCAC","ROCAL","Rosa carolina L. var. lyonii (Pursh) Palmer & Steyerm.","","Rosaceae"
"ROCAC","ROCAO","Rosa carolina L. var. obovata (Raf.) Deam","","Rosaceae"
"ROCAC","ROCAS","Rosa carolina L. var. sabulosa Erlanson","","Rosaceae"
"ROCAC","ROCAV","Rosa carolina L. var. villosa (Best) Rehder","","Rosaceae"
"ROCAC","ROLY3","Rosa lyonii Pursh","","Rosaceae"
"ROCAC","ROPA6","Rosa palmeri Rydb.","","Rosaceae"
"ROCAC","ROSE5","Rosa serrulata Raf.","","Rosaceae"
"ROCAC","ROSU5","Rosa subserrulata Rydb.","","Rosaceae"
"ROCAC","ROTE3","Rosa texarkana Rydb.","","Rosaceae"
"ROCU2","","Rorippa curvipes Greene","bluntleaf yellowcress","Brassicaceae"
"ROCUT","","Rorippa curvipes Greene var. truncata (Jeps.) Rollins","bluntleaf yellowcress","Brassicaceae"
"ROCUT","RASIT","Radicula sinuata (Nutt.) Greene var. truncata Jeps.","","Brassicaceae"
"ROCUT","ROCUI","Rorippa curvipes Greene var. integra (Rydb.) R. Stuckey","","Brassicaceae"
"ROCUT","ROOBI","Rorippa obtusa (Nutt.) Britton var. integra (Rydb.) Vict.","","Brassicaceae"
"ROCUT","ROTE5","Rorippa teres auct. non (Michx.) R. Stuckey","","Brassicaceae"
"ROCUT","ROTR3","Rorippa truncata (Jeps.) R. Stuckey","","Brassicaceae"
"ROFO","","Rosa foliolosa Nutt. ex Torr. & A. Gray","white prairie rose","Rosaceae"
"ROFO","ROIG","Rosa ignota Shinners","","Rosaceae"
"ROHI","","Robinia hispida L.","ROSE ACACIA","Fabaceae"
"ROHIH","","Robinia hispida L. var. hispida","bristly locust","Fabaceae"
"ROHIH","ROGR3","Robinia grandiflora auct. non Ashe nec L. nec C.K. Schneid.","","Fabaceae"
"ROHIH","ROPA5","Robinia pallida Ashe","","Fabaceae"
"ROHIH","ROSP5","Robinia speciosa Ashe","","Fabaceae"
"ROMU","","Rosa multiflora Thunb.","MULTIFLORA ROSE","Rosaceae"
"ROMU","ROCA9","Rosa cathayensis (Rehder & Wilson) L.H. Bailey","","Rosaceae"
"ROMU","ROMUW","Rosa multiflora Thunb. f. watsoniana (Crép.) Matsum.","","Rosaceae"
"ROMU","ROWA4","Rosa watsoniana Crép.","","Rosaceae"
"ROPA2","","Rorippa palustris (L.) Besser","bog yellowcress","Brassicaceae"
"ROPAF2","","Rorippa palustris (L.) Besser ssp. fernaldiana (Butters & Abbe) Jonsell","Fernald's yellowcress","Brassicaceae"
"ROPAF2","ROHIG","Rorippa hispida (Desv.) Britton var. glabrata Lunell","","Brassicaceae"
"ROPAF2","ROISF3","Rorippa islandica (Oeder) Borbás ssp. fernaldiana (Butters & Abbe) Hultén","","Brassicaceae"
"ROPAF2","ROISF2","Rorippa islandica (Oeder) Borbás var. fernaldiana Butters & Abbe","","Brassicaceae"
"ROPAF2","ROISG","Rorippa islandica (Oeder) Borbás var. glabra (O.E. Schulz) S.L. Welsh & Reveal","","Brassicaceae"
"ROPAF2","ROISG2","Rorippa islandica (Oeder) Borbás var. glabrata (Lunell) Butters & Abbe","","Brassicaceae"
"ROPAF2","ROPAG","Rorippa palustris (L.) Besser ssp. glabra (O.E. Schulz) R. Stuckey","","Brassicaceae"
"ROPAF2","ROPAC3","Rorippa palustris (L.) Besser var. cernua (Nutt.) R. Stuckey","","Brassicaceae"
"ROPAF2","ROPAD2","Rorippa palustris (L.) Besser var. dictyota (Greene) R. Stuckey","","Brassicaceae"
"ROPAF2","ROPAG3","Rorippa palustris (L.) Besser var. glabra (O.E. Schulz) R. Stuckey","","Brassicaceae"
"ROPAF2","ROPAG4","Rorippa palustris (L.) Besser var. glabrata (Lunell) R. Stuckey","","Brassicaceae"
"ROPS","","Robinia pseudoacacia L.","Black locust","Fabaceae"
"ROPS","ROPSP","Robinia pseudoacacia L. var. pyramidalis Pepin","","Fabaceae"
"ROPS","ROPSR","Robinia pseudoacacia L. var. rectissima (L.) Raber","","Fabaceae"
"ROPS","ROPSI2","Robinia pseudoacacia L. f. inermis (Mirb.) Rehder","","Fabaceae"
"RORA","","Rotala ramosior (L.) Koehne","ROTALA","Lythraceae"
"RORA","ROCA5","Rotala catholica (Cham. & Schltdl.) van Leeuwen","","Lythraceae"
"RORA","RODE3","Rotala dentifera (A. Gray) Koehne","","Lythraceae"
"RORA","RORAI","Rotala ramosior (L.) Koehne var. interior Fernald & Grisc.","","Lythraceae"
"RORA","RORAT","Rotala ramosior (L.) Koehne var. typica Fernald & Grisc.","","Lythraceae"
"RORIP","","Rorippa Scop.","yellowcress","Brassicaceae"
"RORU3","","Rosa ×rudiuscula Greene (pro sp.) [arkansana × carolina]","hybrid rose","Rosaceae"
"RORU82","","Rosa rubiginosa L.","sweetbriar rose","Rosaceae"
