"LAPOP2","LADE4","Lathyrus decaphyllus Pursh","","Fabaceae"
"LAPOP2","LAST11","Lathyrus stipulaceus (Pursh) Butters & H. St. John","","Fabaceae"
"LAPOR","","Laportea Gaudich.","laportea","Urticaceae"
"LAPPU","","Lappula Moench","stickseed","Boraginaceae"
"LAPSA","","Lapsana L.","nipplewort","Asteraceae"
"LAPU12","","Landoltia punctata (G. Mey.) D.H. Les & D.J. Crawford","dotted duckmeat","Lemnaceae"
"LAPU12","SPOL2","Spirodela oligorrhiza (Kurz) Hegelm.","","Lemnaceae"
"LAPU12","SPPU4","Spirodela punctata (G. Mey.) C.H. Thomp.","","Lemnaceae"
"LAPU2","","Lamium purpureum L.","purple deadnettle","Lamiaceae"
"LAPU3","","Lathyrus pusillus Elliott","LOW PEAVINE","Fabaceae"
"LAPUI","","Lamium purpureum L. var. incisum (Willd.) Pers.","purple deadnettle","Lamiaceae"
"LAPUI","LADI9","Lamium dissectum With.","","Lamiaceae"
"LAPUI","LAHY2","Lamium hybridum auct. non Vill.","","Lamiaceae"
"LAPUP","","Lamium purpureum L. var. purpureum","purple deadnettle","Lamiaceae"
"LASA","","Lactuca saligna L.","willowleaf lettuce","Asteraceae"
"LASA","LASAR","Lactuca saligna L. var. runcinata Gren. & Godr.","","Asteraceae"
"LASA3","","Lactuca sativa L.","garden lettuce","Asteraceae"
"LASA3","LASCI","Lactuca scariola L. var. integrata Gren. & Godr.","","Asteraceae"
"LASA3","LASCI2","Lactuca scariola L. var. integrifolia (Bogenh.) G. Beck","","Asteraceae"
"LASE","","Lactuca serriola L.","PRICKLY LETTUCE","Asteraceae"
"LASE","LASC6","Lactuca scariola L.","","Asteraceae"
"LATA","","Lactuca tatarica (L.) C.A. Mey.","blue lettuce","Asteraceae"
"LATAP","","Lactuca tatarica (L.) C.A. Mey. var. pulchella (Pursh) Breitung","CHICORY LETTUCE","Asteraceae"
"LATAP","LAOB2","Lactuca oblongifolia Nutt.","","Asteraceae"
"LATAP","LAPU","Lactuca pulchella (Pursh) DC.","","Asteraceae"
"LATAP","LATAP2","Lactuca tatarica (L.) C.A. Mey. ssp. pulchella (Pursh) Stebbins","","Asteraceae"
"LATAP","LATAH","Lactuca tatarica (L.) C.A. Mey. var. heterophylla (Nutt.) B. Boivin","","Asteraceae"
"LATAP","MUPU3","Mulgedium pulchellum (Pursh) G. Don","","Asteraceae"
"LATAP","SOTA","Sonchus tataricus L. p.p.","","Asteraceae"
"LATHY","","Lathyrus L.","pea","Fabaceae"
"LAVE","","Lathyrus venosus Muhl. ex Willd.","VEINY PEAVINE","Fabaceae"
"LAVE","LAOR","Lathyrus oreophilus Wooton & Standl.","","Fabaceae"
"LAVE","LAVEA2","Lathyrus venosus Muhl. ex Willd. ssp. arkansanus (Fassett) C.L. Hitchc.","","Fabaceae"
"LAVE","LAVEA3","Lathyrus venosus Muhl. ex Willd. var. arkansanus Fassett","","Fabaceae"
"LAVE","LAVEI","Lathyrus venosus Muhl. ex Willd. var. intonsus Butters & H. St. John","","Fabaceae"
"LAVE","LAVEM","Lathyrus venosus Muhl. ex Willd. var. meridionalis Butters & H. St. John","","Fabaceae"
"LEAC","","Lespedeza ×acuticarpa Mack. & Bush (pro sp.) [violacea × virginica]","lespedeza","Fabaceae"
"LEAE2","","Lemna aequinoctialis Welw.","lesser duckweed","Lemnaceae"
"LEAE2","LEAN5","Lemna angolensis Welw. ex Hegelm.","","Lemnaceae"
"LEAE2","LEPA16","Lemna paucicostata Hegelm.","","Lemnaceae"
"LEAE2","LETR3","Lemna trinervis (Austin) Small","","Lemnaceae"
"LEAN2","","Lesquerella angustifolia (Nutt. ex Torr. & A. Gray) S. Watson","ANNUAL BLADDERPOD","Brassicaceae"
"LEAU","","Leavenworthia aurea Torr.","GOLDEN YELLOWEYE","Brassicaceae"
"LEAU3","","Lepidium austrinum Small","SOUTHERN PEPPERWEED","Brassicaceae"
"LEAU3","LELAO","Lepidium lasiocarpum Nutt. var. orbiculare (Thell.) C.L. Hitchc.","","Brassicaceae"
"LEAU4","","Lesquerella auriculata (Engelm. & A. Gray) S. Watson","EARLEAF BLADDERPOD","Brassicaceae"
"LEAUA2","","Leavenworthia aurea Torr. var. aurea","golden gladecress","Brassicaceae"
"LEAVE","","Leavenworthia Torr.","gladecress","Brassicaceae"
"LEBR2","","Lespedeza ×brittonii E.P. Bicknell (pro sp.) [procumbens × virginica]","lespedeza","Fabaceae"
"LEBR2","LEPRE","Lespedeza procumbens Michx. var. elliptica S.F. Blake","","Fabaceae"
"LECA2","","Leonurus cardiaca L.","common motherwort","Lamiaceae"
"LECA5","","Lepidium campestre (L.) W.T. Aiton","FIELD PEPPERWEED","Brassicaceae"
"LECA5","NECA5","Neolepia campestris (L.) W.A. Weber","","Brassicaceae"
"LECA5","THCA2","Thlaspi campestre L.","","Brassicaceae"
"LECA8","","Lespedeza capitata Michx.","Roundhead lespedeza","Fabaceae"
"LECA8","LEBI5","Lespedeza bicknellii House","","Fabaceae"
"LECA8","LECAS","Lespedeza capitata Michx. var. stenophylla Bissell & Fernald","","Fabaceae"
"LECA8","LECAV2","Lespedeza capitata Michx. var. velutina (E.P. Bicknell) Fernald","","Fabaceae"
"LECA8","LECAV4","Lespedeza capitata Michx. var. vulgaris Torr. & A. Gray","","Fabaceae"
"LECAC7","","Leonurus cardiaca L. ssp. cardiaca","common motherwort","Lamiaceae"
"LECAN4","","Lecanora Ach.","rim lichen","Lecanoraceae"
"LECHE","","Lechea L.","pinweed","Cistaceae"
"LECU","","Lespedeza cuneata (Dum. Cours.) G. Don","Sericea lespedeza","Fabaceae"
"LECU","LECUS","Lespedeza cuneata (Dum. Cours.) G. Don var. serpens (Nakai) Ohwi","","Fabaceae"
"LECU","LEJUS","Lespedeza juncea (L. f.) Pers. var. sericea Maxim.","","Fabaceae"
"LECU","LELA31","Lespedeza latissima (Matsum.) Nakai","","Fabaceae"
"LECU","LESE12","Lespedeza sericea Miq., nom. illeg.","","Fabaceae"
"LECU","LESE13","Lespedeza serpens Nakai","","Fabaceae"
"LEDE","","Lepidium densiflorum Schrad.","PRAIRIE PEPPERWEED","Brassicaceae"
"LEDE","LEDED","Lepidium densiflorum Schrad. var. densiflorum","","Brassicaceae"
"LEDE","LEDEE","Lepidium densiflorum Schrad. var. elongatum (Rydb.) Thell.","","Brassicaceae"
"LEDE","LEDEM","Lepidium densiflorum Schrad. var. macrocarpum G. Mulligan","","Brassicaceae"
"LEDE","LEDEP","Lepidium densiflorum Schrad. var. pubecarpum (A. Nelson) Thell.","","Brassicaceae"
"LEDE","LEDER","Lepidium densiflorum Schrad. var. ramosum (A. Nelson) Thell.","","Brassicaceae"
"LEDE","LEDET","Lepidium densiflorum Schrad. var. typicum Thell.","","Brassicaceae"
"LEDE","LEEL4","Lepidium elongatum Rydb.","","Brassicaceae"
"LEDE","LENE7","Lepidium neglectum Thell.","","Brassicaceae"
"LEDE","LEPU6","Lepidium pubecarpum A. Nelson","","Brassicaceae"
"LEDE","LERA6","Lepidium ramosum A. Nelson","","Brassicaceae"
"LEDE","LETE7","Lepidium texanum Buckley","","Brassicaceae"
"LEDU","","Leptochloa dubia (Kunth) Nees","Green sprangletop","Poaceae"
"LEDU","CHDU2","Chloris dubia Kunth","","Poaceae"
"LEDU","DIDU","Diplachne dubia (Kunth) Scribn.","","Poaceae"
"LEERS","","Leersia Sw.","cutgrass","Poaceae"
"LEFE","","Lesquerella fendleri (A. Gray) S. Watson","Fendler's bladderpod","Brassicaceae"
"LEFE","LEFO4","Lesquerella foliacea Greene","","Brassicaceae"
"LEFE","LEPR6","Lesquerella praecox Wooton & Standl.","","Brassicaceae"
"LEFR5","","Lespedeza frutescens (L.) Hornem.","shrubby lespedeza","Fabaceae"
"LEFR5","LEIN30","Lespedeza intermedia (S. Watson) Britton, nom. inq.","","Fabaceae"
"LEFR5","LEVI23","Lespedeza violacea auct. non (L.) Pers.","","Fabaceae"
"LEFU21","","Leptochloa fusca (L.) Kunth","Malabar sprangletop","Poaceae"
"LEFU21","DIFU7","Diplachne fusca (L.) P. Beauv. ex Roem. & Schult.","","Poaceae"
"LEFUF","","Leptochloa fusca (L.) Kunth ssp. fascicularis (Lam.) N. Snow","bearded sprangletop","Poaceae"
"LEFUF","DIAC3","Diplachne acuminata Nash","","Poaceae"
"LEFUF","DIFA4","Diplachne fascicularis (Lam.) P. Beauv.","","Poaceae"
"LEFUF","DIMA10","Diplachne maritima E.P. Bicknell","","Poaceae"
"LEFUF","LEAC2","Leptochloa acuminata (Nash) Mohlenbr.","","Poaceae"
"LEFUF","LEFA","Leptochloa fascicularis (Lam.) A. Gray","","Poaceae"
"LEFUF","LEFAA","Leptochloa fascicularis (Lam.) A. Gray var. acuminata (Nash) Gleason","","Poaceae"
"LEFUF","LEFAM","Leptochloa fascicularis (Lam.) A. Gray var. maritima (E.P. Bicknell) Gleason","","Poaceae"
"LEFUF","LEFUF2","Leptochloa fusca (L.) Kunth var. fascicularis (Lam.) Dorn","","Poaceae"
"LEFUU","","Leptochloa fusca (L.) Kunth ssp. uninervia (J. Presl) N. Snow","Mexican sprangletop","Poaceae"
"LEFUU","DIUN5","Diplachne uninervia (J. Presl) Parodi","","Poaceae"
"LEFUU","LEUN2","Leptochloa uninervia (J. Presl) Hitchc. & Chase","","Poaceae"
"LEFUU","MEUN4","Megastachya uninervia J. Presl","","Poaceae"
"LEGI","","Lemna gibba L.","swollen duckweed","Lemnaceae"
"LEGO","","Lesquerella gordonii (A. Gray) S. Watson","GORDON BLADDERPOD","Brassicaceae"
"LEGOG","","Lesquerella gordonii (A. Gray) S. Watson var. gordonii","Gordon's bladderpod","Brassicaceae"
"LEGR2","","Lesquerella gracilis (Hook.) S. Watson","LAX BLADDERPOD","Brassicaceae"
"LEGR2","PHGR6","Physaria gracilis (Hook.) O'Kane & Al-Shehbaz","","Brassicaceae"
"LEGRG","","Lesquerella gracilis (Hook.) S. Watson ssp. gracilis","spreading bladderpod","Brassicaceae"
"LEGRG","VEGR4","Vesicaria gracilis Hook.","","Brassicaceae"
"LEGRN","","Lesquerella gracilis (Hook.) S. Watson ssp. nuttallii (Torr. & A. Gray) Rollins & Shaw","Nuttall's bladderpod","Brassicaceae"
"LEGRN","LEGRR","Lesquerella gracilis (Hook.) S. Watson var. repanda (Nutt.) Payson","","Brassicaceae"
"LEGRN","LENU4","Lesquerella nuttallii (Torr. & A. Gray) S. Watson","","Brassicaceae"
"LEGRN","LERE9","Lesquerella repanda (Nutt.) S. Watson","","Brassicaceae"
"LEHI2","","Lespedeza hirta (L.) Hornem.","HAIRY LESPEDEZA","Fabaceae"
"LEHIH2","","Lespedeza hirta (L.) Hornem. ssp. hirta","hairy lespedeza","Fabaceae"
"LEHIH2","LECAC3","Lespedeza capitata Michx. var. calycina (Schindl.) Fernald","","Fabaceae"
"LEHIH2","LEHIS","Lespedeza hirta (L.) Hornem. var. sparsiflora Torr. & A. Gray","","Fabaceae"
"LEHIH2","LEPO3","Lespedeza polystachya Michx.","","Fabaceae"
"LELE2","","Leersia lenticularis Michx.","catchfly grass","Poaceae"
"LELE2","HOLE5","Homalocenchrus lenticularis (Michx.) Kuntze","","Poaceae"
"LELU","","Lesquerella ludoviciana (Nutt.) S. Watson","foothill bladderpod","Brassicaceae"
"LEMI3","","Lemna minor L.","COMMON DUCKWEED","Lemnaceae"
"LEMI3","LECY4","Lemna cyclostasa Elliott ex Schleid.","","Lemnaceae"
"LEMI3","LEMI2","Lemna minima Chevall. ex Schleid.","","Lemnaceae"
"LEMI6","","Lemna minuta Kunth","least duckweed","Lemnaceae"
"LEMI6","LEMI10","Lemna minima Phil., non Thuill. ex P. Beauv.","","Lemnaceae"
"LEMI6","LEMI9","Lemna minuscula Herter","","Lemnaceae"
"LEMI6","LEVAA","Lemna valdiviana Phil. var. abbreviata Hegelm.","","Lemnaceae"
"LEMI6","LEVAM","Lemna valdiviana Phil. var. minima (Phil.) Hegelm.","","Lemnaceae"
"LEMNA","","Lemna L.","duckweed","Lemnaceae"
"LEMU","","Leucospora multifida (Michx.) Nutt.","narrowleaf paleseed","Scrophulariaceae"
"LEMU","COMU4","Conobea multifida (Michx.) Benth.","","Scrophulariaceae"
"LEMU3","","Lechea mucronata Raf.","HAIRY PINWEED","Cistaceae"
"LEMU3","LEMIV","Lechea minor L. var. villosa (Elliott) B. Boivin","","Cistaceae"
"LEMU3","LEVI","Lechea villosa Elliott","","Cistaceae"
"LEMU3","LEVIM3","Lechea villosa Elliott var. macrotheca Hodgdon","","Cistaceae"
"LEMU3","LEVIS2","Lechea villosa Elliott var. schaffneri Hodgdon","","Cistaceae"
"LENE8","","Lespedeza ×neglecta Mack. & Bush (pro sp.) [stuevei × virginica]","lespedeza","Fabaceae"
"LENE8","LESTA","Lespedeza stuevei Nutt. var. angustifolia Britton, non Pursh","","Fabaceae"
"LENU","","Lespedeza ×nuttallii Darl. (pro sp.) [hirta × violacea]","lespedeza","Fabaceae"
"LEOB","","Lepidium oblongum Small","VEINY PEPPERWEED","Brassicaceae"
"LEOB2","","Lemna obscura (Austin) Daubs","little duckweed","Lemnaceae"
"LEOB2","LEMIO","Lemna minor L. var. obscura Austin","","Lemnaceae"
"LEOBO","","Lepidium oblongum Small var. oblongum","veiny pepperweed","Brassicaceae"
"LEOBO","LEBI3","Lepidium bipinnatifidum auct. non Desv.","","Brassicaceae"
"LEONU","","Leonurus L.","motherwort","Lamiaceae"
"LEOR","","Leersia oryzoides (L.) Sw.","RICE CUTGRASS","Poaceae"
"LEOR","HOOR3","Homalocenchrus oryzoides (L.) Pollich","","Poaceae"
"LEOR","PHOR5","Phalaris oryzoides L.","","Poaceae"
"LEOV","","Lesquerella ovalifolia Rydb. ex Britton","OVALLEAF BLADDERPOD","Brassicaceae"
"LEOVA","","Lesquerella ovalifolia Rydb. ex Britton ssp. alba (Goodman) Rollins & Shaw","roundleaf bladderpod","Brassicaceae"
"LEOVA","LEENA","Lesquerella engelmannii (A. Gray) S. Watson ssp. alba (Goodman) C. Clark","","Brassicaceae"
"LEOVA","LEOVA2","Lesquerella ovalifolia Rydb. ex Britton var. alba Goodman","","Brassicaceae"
"LEOVO","","Lesquerella ovalifolia Rydb. ex Britton ssp. ovalifolia","roundleaf bladderpod","Brassicaceae"
"LEOVO","LEENO","Lesquerella engelmannii (A. Gray) S. Watson ssp. ovalifolia (Rydb. ex Britton) C. Clark","","Brassicaceae"
"LEPA6","","Leptochloa panicea (Retz.) Ohwi","mucronate sprangletop","Poaceae"
"LEPA6","DIPA26","Dinebra panicea (Retz.) P.M. Peterson & N. Snow","","Poaceae"
"LEPAB","","Leptochloa panicea (Retz.) Ohwi ssp. brachiata (Steud.) N. Snow","mucronate sprangeltop","Poaceae"
"LEPAB","FEFI2","Festuca filiformis Lam.","","Poaceae"
"LEPAB","LEBR17","Leptochloa brachiata Steud.","","Poaceae"
"LEPAB","LEFI","Leptochloa filiformis (Lam.) P. Beauv.","","Poaceae"
"LEPAB","LEFIP","Leptochloa filiformis (Lam.) P. Beauv. var. pulchella (Scribn.) Beetle","","Poaceae"
"LEPAM","","Leptochloa panicea (Retz.) Ohwi ssp. mucronata (Michx.) Nowack","mucronate sprangletop","Poaceae"
"LEPAM","LEAT","Leptochloa attenuata (Nutt.) Steud.","","Poaceae"
"LEPAM","LEFIA","Leptochloa filiformis (Lam.) P. Beauv. var. attenuata (Nutt.) Steyerm. & Kucera","","Poaceae"
"LEPAM","LEMU10","Leptochloa mucronata (Michx.) Kunth","","Poaceae"
"LEPE","","Lemna perpusilla Torr.","MINUTE DUCKWEED","Lemnaceae"
"LEPE","LEPET","Lemna perpusilla Torr. var. trinervis Austin","","Lemnaceae"
"LEPE2","","Lepidium perfoliatum L.","CLASPING PEPPERWEED","Brassicaceae"
"LEPID","","Lepidium L.","pepperweed","Brassicaceae"
"LEPR","","Lespedeza procumbens Michx.","TRAILING LESPEDEZA","Fabaceae"
"LEPTO","","Leptochloa P. Beauv.","sprangletop","Poaceae"
"LEPUR","","Lepuropetalon Elliott","lepuropetalon","Saxifragaceae"
"LERE2","","Lespedeza repens (L.) W.P.C. Barton","CREEPING LESPEDEZA","Fabaceae"
"LERE2","HERE7","Hedysarum repens L.","","Fabaceae"
"LESI","","Leonurus sibiricus L.","honeyweed","Lamiaceae"
"LESI","LEAR7","Leonurus artemisia auct. non Lour.","","Lamiaceae"
"LESI2","","Lespedeza ×simulata Mack. & Bush (pro sp.) [capitata × virginica]","lespedeza","Fabaceae"
"LESP","","Lepuropetalon spathulatum Elliott","petiteplant","Saxifragaceae"
"LESP","PYSP2","Pyxidanthera spathulata Muhl., nom. nud.","","Saxifragaceae"
"LESPE","","Lespedeza Michx.","PERENNIAL LESPEDEZA","Fabaceae"
"LESQU","","Lesquerella S. Watson","Bladderpod","Brassicaceae"
"LEST5","","Lespedeza stuevei Nutt.","STUVES LESPEDEZA","Fabaceae"
"LETE","","Lechea tenuifolia Michx.","NARROWLEAF PINWEED","Cistaceae"
"LETE","LETEO","Lechea tenuifolia Michx. var. occidentalis Hodgdon","","Cistaceae"
"LETU2","","Lemna turionifera Landolt","turion duckweed","Lemnaceae"
"LEUCA4","","Leucanthemum Mill.","daisy","Asteraceae"
"LEUCO4","","Leucospora Nutt.","leucospora","Scrophulariaceae"
"LEVA","","Lemna valdiviana Phil.","VALDIVIA DUCKWEED","Lemnaceae"
"LEVA","LECY5","Lemna cyclostasa (Elliott) C.H. Thomp.","","Lemnaceae"
"LEVA","LETO3","Lemna torreyi Austin","","Lemnaceae"
"LEVI2","","Leersia virginica Willd.","WHITEGRASS","Poaceae"
"LEVI2","HOVI4","Homalocenchrus virginicus (Willd.) Britton","","Poaceae"
"LEVI2","LEVIO","Leersia virginica Willd. var. ovata (Poir.) Fernald","","Poaceae"
"LEVI3","","Lepidium virginicum L.","VIRGINIA PEPPERWEED","Brassicaceae"
"LEVI6","","Lespedeza violacea (L.) Pers.","Violet lespedeza","Fabaceae"
"LEVI6","HEVI7","Hedysarum violaceum L.","","Fabaceae"
"LEVI6","LEIN2","Lespedeza intermedia sensu Clewell, 1966","","Fabaceae"
"LEVI6","LEPR5","Lespedeza prairea (Mack. & Bush) Britton","","Fabaceae"
"LEVI7","","Lespedeza virginica (L.) Britton","Slender lespedeza","Fabaceae"
"LEVIM","","Lepidium virginicum L. var. medium (Greene) C.L. Hitchc.","intermediate pepperweed","Brassicaceae"
"LEVIM","LEID","Lepidium idahoense A. Heller","","Brassicaceae"
"LEVIM","LEME3","Lepidium medium Greene","","Brassicaceae"
"LEVIV2","","Lepidium virginicum L. var. virginicum","Virginia pepperweed","Brassicaceae"
"LEVIV2","LEVIT","Lepidium virginicum L. var. typicum C.L. Hitchc.","","Brassicaceae"
"LEVU","","Leucanthemum vulgare Lam.","oxeye daisy","Asteraceae"
"LEVU","CHLE80","Chrysanthemum leucanthemum L.","","Asteraceae"
"LEVU","CHLEB","Chrysanthemum leucanthemum L. var. boecheri B. Boivin","","Asteraceae"
"LEVU","CHLEP","Chrysanthemum leucanthemum L. var. pinnatifidum Lecoq & Lamotte","","Asteraceae"
"LEVU","LELE12","Leucanthemum leucanthemum (L.) Rydb., nom. inval.","","Asteraceae"
"LEVU","LEVUP","Leucanthemum vulgare Lam. var. pinnatifidum (Lecoq & Lamotte) Moldenke","","Asteraceae"
"LIAE3","","Liatris aestivalis G.L. Nesom & R. O'Kennon","blazing star","Asteraceae"
"LIAR","","Limnodea arkansana (Nutt.) L.H. Dewey","OZARKGRASS","Poaceae"
"LIAR","CIAR10","Cinna arkansana (Nutt.) G. Tucker","","Poaceae"
"LIAR6","","Lipocarpha aristulata (Coville) G. Tucker","awned halfchaff sedge","Cyperaceae"
"LIAR6","HEAR7","Hemicarpha aristulata (Coville) Smyth","","Cyperaceae"
"LIAR6","HEMIA2","Hemicarpha micrantha (Vahl) Pax var. aristulata Coville","","Cyperaceae"
"LIAR6","LIMI4","Lipocarpha microcephala auct. non Kunth","","Cyperaceae"
"LIAS","","Liatris aspera Michx.","Tall gayfeather","Asteraceae"
"LIASA","","Liatris aspera Michx. var. aspera","tall blazing star","Asteraceae"
"LIASA","LAAS2","Lacinaria aspera (Michx.) Greene","","Asteraceae"
"LIASI","","Liatris aspera Michx. var. intermedia (Lunell) Gaiser","tall blazing star","Asteraceae"
"LIASI","LASQI","Lacinaria squarrosa (L.) Hill var. intermedia (Lunell) DC.","","Asteraceae"
"LIATR","","Liatris Gaertn. ex Schreb.","Gayfeather","Asteraceae"
"LIAU3","","Listera australis Lindl.","southern twayblade","Orchidaceae"
"LIAU3","NEAU2","Neottia australis (Lindl.) Szlach.","","Orchidaceae"
"LIAU3","NEBI3","Neottia bifolia (Raf.) Baumbach","","Orchidaceae"
"LIAU3","OPAU6","Ophrys australis (Lindl.) House","","Orchidaceae"
"LIBE2","","Linum berlandieri Hook.","Berlandier's yellow flax","Linaceae"
"LIBE3","","Lindera benzoin (L.) Blume","SPICEBUSH","Lauraceae"
"LIBEB","","Lindera benzoin (L.) Blume var. benzoin","northern spicebush","Lauraceae"
"LIBEB","BEAE","Benzoin aestivale (L.) Nees","","Lauraceae"
"LIBEB2","","Linum berlandieri Hook. var. berlandieri","Berlandier's yellow flax","Linaceae"
"LIBEB2","CABE10","Cathartolinum berlandieri (Hook.) Small","","Linaceae"
"LIBEB2","CASA16","Cathartolinum sanctum (Small) Small","","Linaceae"
"LIBEB2","LIRIB","Linum rigidum Pursh var. berlandieri (Hook.) Torr. & A. Gray","","Linaceae"
"LIBEB2","LISA4","Linum sanctum Small","","Linaceae"
"LIBEP","","Lindera benzoin (L.) Blume var. pubescens (Palmer & Steyerm.) Rehder","northern spicebush","Lauraceae"
"LIBEP","BEAEP","Benzoin aestivale (L.) Nees var. pubescens Palmer & Steyerm.","","Lauraceae"
"LICA12","","Lithospermum canescens (Michx.) Lehm.","HOARY GROMWELL","Boraginaceae"
"LICA12","BACA7","Batschia canescens Michx.","","Boraginaceae"
"LICA13","","Lithospermum caroliniense (Walter ex J.F. Gmel.) MacMill.","CAROLINA GROMWELL","Boraginaceae"
"LICAC8","","Lithospermum caroliniense (Walter ex J.F. Gmel.) MacMill. var. caroliniense","Carolina puccoon","Boraginaceae"
"LICAC8","BACA5","Batschia caroliniensis Walter ex J.F. Gmel.","","Boraginaceae"
"LICAC8","LICA27","Lithospermum carolinianum Lam.","","Boraginaceae"
"LICAC8","LIGM","Lithospermum gmelini (Michx.) Hitchc.","","Boraginaceae"
"LICAC9","","Lithospermum caroliniense (Walter ex J.F. Gmel.) MacMill. var. croceum (Fernald) Cronquist","Carolina puccoon","Boraginaceae"
"LICAC9","LICAC7","Lithospermum caroliniense (Walter ex J.F. Gmel.) MacMill. ssp. croceum (Fernald) Cusick","","Boraginaceae"
"LICAC9","LICR4","Lithospermum croceum Fernald","","Boraginaceae"
"LICO3","","Linum compactum A. Nelson","Wyoming flax","Linaceae"
"LICO3","CACO46","Cathartolinum compactum (A. Nelson) Small","","Linaceae"
"LICO3","LIRIC","Linum rigidum Pursh var. compactum (A. Nelson) C.M. Rogers","","Linaceae"
"LIDA","","Linaria dalmatica (L.) Mill.","Dalmatian toadflax","Scrophulariaceae"
"LIDAD","","Linaria dalmatica (L.) Mill. ssp. dalmatica","Dalmatian toadflax","Scrophulariaceae"
"LIDAD","LIGED","Linaria genistifolia (L.) Mill. ssp. dalmatica (L.) Maire & Petitm.","","Scrophulariaceae"
"LIDAD","LIJA3","Linaria jattae Palanza","","Scrophulariaceae"
"LIDE4","","Liatris densispicata (Bush) Gaiser","densespike blazing star","Asteraceae"
"LIDEI","","Liatris densispicata (Bush) Gaiser var. interrupta Gaiser","densespike blazing star","Asteraceae"
"LIDEI","LIAN4","Liatris angustifolia (Bush) Gaiser","","Asteraceae"
"LIDR3","","Lipocarpha drummondii (Nees) G. Tucker","Drummond's halfchaff sedge","Cyperaceae"
"LIDR3","HEDR3","Hemicarpha drummondii Nees","","Cyperaceae"
"LIDR3","HEMID3","Hemicarpha micrantha (Vahl) Pax var. drummondii (Nees) Friedland","","Cyperaceae"
"LIDR3","SCMID","Scirpus micranthus Vahl var. drummondii (Nees) Mohlenbr.","","Cyperaceae"
"LIDU","","Lindernia dubia (L.) Pennell","MOISTBANK PIMPERNEL","Scrophulariaceae"
"LIDUA","","Lindernia dubia (L.) Pennell var. anagallidea (Michx.) Cooperr.","FALSE PIMPERNEL","Scrophulariaceae"
"LIDUA","ILAN3","Ilysanthes anagallidea (Michx.) B.L. Rob.","","Scrophulariaceae"
"LIDUA","ILIN","Ilysanthes inequalis (Walter) Pennell","","Scrophulariaceae"
"LIDUA","LIAN2","Lindernia anagallidea (Michx.) Pennell","","Scrophulariaceae"
"LIDUD","","Lindernia dubia (L.) Pennell var. dubia","yellowseed false pimpernel","Scrophulariaceae"
"LIDUD","GRDU","Gratiola dubia L.","","Scrophulariaceae"
"LIDUD","ILAT3","Ilysanthes attenuata (Spreng.) Small","","Scrophulariaceae"
"LIDUD","ILDU","Ilysanthes dubia (L.) Barnhart","","Scrophulariaceae"
"LIDUD","LIDUI","Lindernia dubia (L.) Pennell var. inundata (Pennell) Pennell","","Scrophulariaceae"
"LIDUD","LIDUM","Lindernia dubia (L.) Pennell var. major (Pursh) Pennell","","Scrophulariaceae"
"LIDUD","LIDUR","Lindernia dubia (L.) Pennell var. riparia (Raf.) Fernald","","Scrophulariaceae"
"LIDUD","LIDUT","Lindernia dubia (L.) Pennell var. typica Pennell","","Scrophulariaceae"
"LIDUD","LIPR2","Lindernia procumbens auct. non (Knock.) Borb.","","Scrophulariaceae"
"LIDUD","LIPY3","Lindernia pyxidaria sensu Pennell, non L.","","Scrophulariaceae"
"LIEL","","Liatris elegans (Walter) Michx.","PINKSCALE GAYFEATHER","Asteraceae"
"LIELE","","Liatris elegans (Walter) Michx. var. elegans","pinkscale blazing star","Asteraceae"
"LIELE","LAEL","Lacinaria elegans (Walter) Kuntze","","Asteraceae"
"LIELE","LAFL4","Lacinaria flabellata Small","","Asteraceae"
"LIELE","LIELF","Liatris elegans (Walter) Michx. var. flabellata (Small) Gaiser","","Asteraceae"
"LIGUS2","","Ligustrum L.","privet","Oleaceae"
"LIHU2","","Linum hudsonioides Planch.","Texas flax","Linaceae"
"LIHU2","CECL","Cerastium clawsonii Correll","","Linaceae"
"LIHU2","MEHU4","Mesynium hudsonioides (Planch.) W.A. Weber","","Linaceae"
"LIIM","","Linum imbricatum (Raf.) Shinners","TOOTHED FLAX","Linaceae"
"LIIM","CAMU17","Cathartolinum multicaule (Hook.) Small","","Linaceae"
"LIIM","MEIM2","Mesynium imbricatum (Raf.) W.A. Weber","","Linaceae"
"LIIM","NEIM","Nezera imbricata Raf.","","Linaceae"
"LIIN2","","Lithospermum incisum Lehm.","Fringed puccoon","Boraginaceae"
"LIIN2","BALI","Batschia linearifolia (Goldie) Small","","Boraginaceae"
"LIIN2","LIAN6","Lithospermum angustifolium Michx.","","Boraginaceae"
"LIIN2","LILI8","Lithospermum linearifolium Goldie","","Boraginaceae"
"LIIN2","LIMA14","Lithospermum mandanense Spreng.","","Boraginaceae"
"LILE3","","Linum lewisii Pursh","LEWIS FLAX","Linaceae"
"LILEL2","","Linum lewisii Pursh var. lewisii","prairie flax","Linaceae"
"LILEL2","ADLE","Adenolinum lewisii (Pursh) Á. Löve & D. Löve","","Linaceae"
"LILEL2","LIPEL3","Linum perenne L. ssp. lewisii (Pursh) Hultén","","Linaceae"
"LILEL2","LIPEL2","Linum perenne L. var. lewisii (Pursh) Eaton & J. Wright","","Linaceae"
"LILI3","","Liparis liliifolia (L.) Rich. ex Ker Gawl.","brown widelip orchid","Orchidaceae"
"LILI4","","Limonium limbatum Small","SEA LAVENDER","Plumbaginaceae"
"LILI4","LILIG","Limonium limbatum Small var. glabrescens Correll","","Plumbaginaceae"
"LILIU","","Lilium L.","lily","Liliaceae"
"LIME2","","Linum medium (Planch.) Britton","stiff yellow flax","Linaceae"
"LIMET","","Linum medium (Planch.) Britton var. texanum (Planch.) Fernald","SUCKER FLAS","Linaceae"
"LIMET","CACU12","Cathartolinum curtissii (Small) Small","","Linaceae"
"LIMET","LISTT","Linum striatum Walter var. texanum (Planch.) B. Boivin","","Linaceae"
"LIMET","LIVIT","Linum virginianum L. var. texanum Planch.","","Linaceae"
"LIMI12","","Lipocarpha micrantha (Vahl) G. Tucker","smallflower halfchaff sedge","Cyperaceae"
"LIMI12","HEMI5","Hemicarpha micrantha (Vahl) Pax","","Cyperaceae"
"LIMI12","HEMIM3","Hemicarpha micrantha (Vahl) Pax var. minor (Schrad.) Friedland","","Cyperaceae"
"LIMI12","SCMI11","Scirpus micranthus Vahl","","Cyperaceae"
"LIMI12","SCMIM2","Scirpus micranthus Vahl var. minor (Schrad. ex Roem. & Schult.) B. Boivin","","Cyperaceae"
"LIMI9","","Lilium michiganense Farw.","Michigan lily","Liliaceae"
"LIMI9","LICAM","Lilium canadense L. ssp. michiganense (Farw.) B. Boivin & Cody","","Liliaceae"
"LIMI9","LICAU","Lilium canadense L. var. umbelliferum (Farw.) B. Boivin","","Liliaceae"
"LIMI9","LIMIU","Lilium michiganense Farw. var. uniflorum Farw.","","Liliaceae"
"LIMNO","","Limnobium Rich.","spongeplant","Hydrocharitaceae"
"LIMNO2","","Limnodea L.H. Dewey","Ozark grass","Poaceae"
"LIMNO3","","Limnosciadium Mathias & Constance","dogshade","Apiaceae"
"LIMON","","Limonium Mill.","sea lavender","Plumbaginaceae"
"LIMU3","","Lithospermum multiflorum Torr. ex A. Gray","manyflowered stoneseed","Boraginaceae"
"LINAR","","Linaria Mill.","toadflax","Scrophulariaceae"
"LINDE","","Lindernia All.","false pimpernel","Scrophulariaceae"
"LINDE2","","Lindera Thunb.","spicebush","Lauraceae"
"LINDH","","Lindheimera A. Gray & Engelm.","lindheimera","Asteraceae"
"LINUM","","Linum L.","flax","Linaceae"
"LIPAR","","Liparis Rich.","widelip orchid","Orchidaceae"
"LIPI2","","Limnosciadium pinnatum (DC.) Mathias & Constance","tansy dogshade","Apiaceae"
"LIPI2","CYPI6","Cynosciadium pinnatum DC.","","Apiaceae"
