"Symbol","Synonym Symbol","Scientific Name with Author","State Common Name","Family"
"ABFR2","","Abronia fragrans Nutt. ex Hook.","SNOWBALL SANDVERBENA","Nyctaginaceae"
"ABFR2","ABFRG2","Abronia fragrans Nutt. ex Hook. var. glaucescens A. Nelson","","Nyctaginaceae"
"ABFR3","","Abutilon fruticosum Guill. & Perr.","Texas Indian mallow","Malvaceae"
"ABFR3","ABTE","Abutilon texense Torr. & A. Gray","","Malvaceae"
"ABRON","","Abronia Juss.","sand verbena","Nyctaginaceae"
"ABTH","","Abutilon theophrasti Medik.","velvetleaf","Malvaceae"
"ABTH","ABAB3","Abutilon abutilon (L.) Rusby, nom. inval.","","Malvaceae"
"ABTH","ABAV","Abutilon avicennae Gaertn.","","Malvaceae"
"ABUTI","","Abutilon Mill.","Indian mallow","Malvaceae"
"ACACI2","","Acaciella Britton & Rose","","Fabaceae"
"ACALY","","Acalypha L.","copperleaf","Euphorbiaceae"
"ACAN11","","Acaciella angustissima (Mill.) Britton & Rose","prairie acacia","Fabaceae"
"ACAN11","ACAN","Acacia angustissima (Mill.) Kuntze","","Fabaceae"
"ACANH2","","Acaciella angustissima (Mill.) Britton & Rose var. hirta (Nutt.) B.L. Turner","prairie acacia","Fabaceae"
"ACANH2","ACANC2","Acacia angustissima (Mill.) Kuntze var. cuspidata (Schltdl.) L.D. Benson","","Fabaceae"
"ACANH2","ACANH","Acacia angustissima (Mill.) Kuntze var. hirta (Nutt.) B.L. Rob.","","Fabaceae"
"ACANH2","ACANT4","Acacia angustissima (Mill.) Kuntze var. texensis (Torr. & A. Gray) Isely","","Fabaceae"
"ACANH2","ACCU","Acacia cuspidata Schltdl.","","Fabaceae"
"ACANH2","ACHI3","Acacia hirta Nutt.","","Fabaceae"
"ACANH2","ACTE2","Acacia texensis Torr. & A. Gray","","Fabaceae"
"ACANH2","ACANT5","Acaciella angustissima (Mill.) Britton & Rose var. texensis (Torr. & A. Gray) L. Rico","","Fabaceae"
"ACANH2","ACHI4","Acaciella hirta (Nutt.) Britton & Rose","","Fabaceae"
"ACARO2","","Acarospora A. Massal.","cracked lichen","Acarosporaceae"
"ACCA4","","Acorus calamus L.","SWEETFLAG","Acoraceae"
"ACER","","Acer L.","maple","Aceraceae"
"ACFL","","Acer floridanum (Chapm.) Pax","southern sugar maple","Aceraceae"
"ACFL","ACBA3","Acer barbatum Michx. p.p.","","Aceraceae"
"ACFL","ACBAL","Acer barbatum Michx. var. longii (Fernald) Fernald","","Aceraceae"
"ACFL","ACBAV","Acer barbatum Michx. var. villipes (Rehder) Ashe","","Aceraceae"
"ACFL","ACFLL","Acer floridanum (Chapm.) Pax var. longii Fernald","","Aceraceae"
"ACFL","ACFLV","Acer floridanum (Chapm.) Pax var. villipes Rehder","","Aceraceae"
"ACFL","ACNIF","Acer nigrum Michx. f. var. floridanum (Chapm.) Fosberg","","Aceraceae"
"ACFL","ACSAF2","Acer saccharinum L. var. floridanum Chapm.","","Aceraceae"
"ACFL","ACSAF","Acer saccharum Marshall ssp. floridanum (Chapm.) Desmarais","","Aceraceae"
"ACFL","ACSAF3","Acer saccharum Marshall var. floridanum (Chapm.) Small & A. Heller","","Aceraceae"
"ACFL","SABA13","Saccharodendron barbatum (Michx.) Nieuwl.","","Aceraceae"
"ACFL","SAFL8","Saccharodendron floridanum (Chapm.) Nieuwl.","","Aceraceae"
"ACGR2","","Acalypha gracilens A. Gray","SLENDER COPPERLEAF","Euphorbiaceae"
"ACGR2","ACGRD","Acalypha gracilens A. Gray var. delzii L. Mill.","","Euphorbiaceae"
"ACGR2","ACGRF","Acalypha gracilens A. Gray var. fraseri (Müll. Arg.) Weath.","","Euphorbiaceae"
"ACGR2","ACVIG","Acalypha virginica L. var. gracilens (A. Gray) Müll. Arg.","","Euphorbiaceae"
"ACHIL","","Achillea L.","yarrow","Asteraceae"
"ACHNA","","Achnatherum P. Beauv.","needlegrass","Poaceae"
"ACHY","","Achnatherum hymenoides (Roem. & Schult.) Barkworth","INDIAN RICEGRASS","Poaceae"
"ACHY","ERCU9","Eriocoma cuspidata Nutt.","","Poaceae"
"ACHY","ORHY","Oryzopsis hymenoides (Roem. & Schult.) Ricker ex Piper","","Poaceae"
"ACHY","STHY6","Stipa hymenoides Roem. & Schult.","","Poaceae"
"ACLE","","Acer leucoderme Small","CHALK MAPLE","Aceraceae"
"ACLE","ACNIL","Acer nigrum Michx. f. var. leucoderme (Small) Fosberg","","Aceraceae"
"ACLE","ACSAL","Acer saccharum Marshall ssp. leucoderme (Small) Desmarais","","Aceraceae"
"ACLE","ACSAL2","Acer saccharum Marshall var. leucoderme (Small) Rehder","","Aceraceae"
"ACLE","SALE8","Saccharodendron leucoderme (Small) Nieuwl.","","Aceraceae"
"ACMEL","","Acmella Rich. ex Pers.","spotflower","Asteraceae"
"ACMI2","","Achillea millefolium L.","Common yarrow","Asteraceae"
"ACMIO","","Achillea millefolium L. var. occidentalis DC.","western yarrow","Asteraceae"
"ACMIO","ACAN7","Achillea angustissima Rydb.","","Asteraceae"
"ACMIO","ACAS2","Achillea aspleniifolia auct. non Vent.","","Asteraceae"
"ACMIO","ACER2","Achillea eradiata Piper","","Asteraceae"
"ACMIO","ACGR5","Achillea gracilis Raf.","","Asteraceae"
"ACMIO","ACLA5","Achillea lanulosa Nutt.","","Asteraceae"
"ACMIO","ACLAT","Achillea lanulosa Nutt. ssp. typica D.D. Keck","","Asteraceae"
"ACMIO","ACLAA3","Achillea lanulosa Nutt. var. arachnoidea Lunell","","Asteraceae"
"ACMIO","ACLAE","Achillea lanulosa Nutt. var. eradiata (Piper) M. Peck","","Asteraceae"
"ACMIO","ACLA3","Achillea laxiflora Pollard & Cockerell","","Asteraceae"
"ACMIO","ACMIL","Achillea millefolium L. ssp. lanulosa (Nutt.) Piper","","Asteraceae"
"ACMIO","ACMIO2","Achillea millefolium L. ssp. occidentalis (DC.) Hyl.","","Asteraceae"
"ACMIO","ACMIP5","Achillea millefolium L. ssp. pallidotegula B. Boivin","","Asteraceae"
"ACMIO","ACMIA4","Achillea millefolium L. var. aspleniifolia (Vent.) Farw.","","Asteraceae"
"ACMIO","ACMIG2","Achillea millefolium L. var. gracilis (Raf.) Raf. ex DC.","","Asteraceae"
"ACMIO","ACMIL3","Achillea millefolium L. var. lanulosa (Nutt.) Piper","","Asteraceae"
"ACMIO","ACMIR","Achillea millefolium L. var. rosea (Desf.) Torr. & A. Gray","","Asteraceae"
"ACMIO","ACMIR2","Achillea millefolium L. var. russeolata B. Boivin","","Asteraceae"
"ACMIO","ACOC","Achillea occidentalis (DC.) Raf. ex Rydb.","","Asteraceae"
"ACMIO","ACRO4","Achillea rosea Desf.","","Asteraceae"
"ACMIO","ACTO3","Achillea tomentosa Pursh, non L.","","Asteraceae"
"ACMO4","","Acalypha monococca (Engelm. ex A. Gray) Lill. W. Mill. & Gandhi","slender threeseed mercury","Euphorbiaceae"
"ACMO4","ACGRM2","Acalypha gracilens A. Gray ssp. monococca (Engelm. ex A. Gray) G.L. Webster","","Euphorbiaceae"
"ACMO4","ACGRM","Acalypha gracilens A. Gray var. monococca Engelm. ex A. Gray","","Euphorbiaceae"
"ACMO4","ACVIM","Acalypha virginica L. var. monococca (Engelm. ex A. Gray) Müll. Arg.","","Euphorbiaceae"
"ACNE2","","Acer negundo L.","Boxelder","Aceraceae"
"ACNEI2","","Acer negundo L. var. interius (Britton) Sarg.","boxelder","Aceraceae"
"ACNEI2","ACIN3","Acer interius Britton","","Aceraceae"
"ACNEI2","ACNEI","Acer negundo L. ssp. interius (Britton) Á. Löve & D. Löve","","Aceraceae"
"ACNEI2","NEACI","Negundo aceroides (L.) Moench ssp. interius (Britton) Á. Löve & D. Löve","","Aceraceae"
"ACNEI2","NEIN3","Negundo interius (Britton) Rydb.","","Aceraceae"
"ACNEN","","Acer negundo L. var. negundo","boxelder","Aceraceae"
"ACNEN","ACNEV2","Acer negundo L. var. variegatum Jacques","","Aceraceae"
"ACNEN","NEAC","Negundo aceroides (L.) Moench","","Aceraceae"
"ACNEN","NENE","Negundo negundo (L.) Karst., nom. inval.","","Aceraceae"
"ACNET","","Acer negundo L. var. texanum Pax","boxelder","Aceraceae"
"ACNET","ACNEL","Acer negundo L. ssp. latifolium (Pax) Schwerin","","Aceraceae"
"ACNEV","","Acer negundo L. var. violaceum (G. Kirchn.) H. Jaeger","boxelder","Aceraceae"
"ACNEV","NEACV","Negundo aceroides (L.) Moench ssp. violaceum (G. Kirchn.) W.A. Weber","","Aceraceae"
"ACOP","","Acmella oppositifolia (Lam.) R.K. Jansen","oppositeleaf spotflower","Asteraceae"
"ACOPR","","Acmella oppositifolia (Lam.) R.K. Jansen var. repens (Walter) R.K. Jansen","CREEPING SPOTFLOWER","Asteraceae"
"ACOPR","ACRE6","Acmella repens (Walter) Rich.","","Asteraceae"
"ACOPR","SPAM3","Spilanthes americana auct. non Hieron. p.p.","","Asteraceae"
"ACOPR","SPAMR3","Spilanthes americana (Mutis ex L. f.) Hieron. var. repens (Walter) A.H. Moore","","Asteraceae"
"ACORU","","Acorus L.","sweetflag","Acoraceae"
"ACOS","","Acalypha ostryifolia Riddell","HOPHORNBEAM COPPERLEAF","Euphorbiaceae"
"ACOS","ACCA8","Acalypha caroliniana Elliott","","Euphorbiaceae"
"ACPA","","Actaea pachypoda Elliott","BANEBERRY","Ranunculaceae"
"ACPA","ACAL7","Actaea alba auct. non (L.) Mill.","","Ranunculaceae"
"ACRE3","","Acroptilon repens (L.) DC.","hardheads","Asteraceae"
"ACRE3","CEPI3","Centaurea picris Pall. ex Willd.","","Asteraceae"
"ACRE3","CERE6","Centaurea repens L.","","Asteraceae"
"ACRH","","Acalypha rhomboidea Raf.","common threeseed mercury","Euphorbiaceae"
"ACRH","ACVIR","Acalypha virginica L. var. rhomboidea (Raf.) Cooperr.","","Euphorbiaceae"
"ACROP","","Acroptilon Cass.","hardheads","Asteraceae"
"ACRU","","Acer rubrum L.","RED MAPLE","Aceraceae"
"ACRU","ACBA2","Acer barbatum Michx. p.p.","","Aceraceae"
"ACRUD","","Acer rubrum L. var. drummondii (Hook. & Arn. ex Nutt.) Sarg.","Drummond's maple","Aceraceae"
"ACRUD","ACDR","Acer drummondii Hook. & Arn. ex Nutt.","","Aceraceae"
"ACRUD","ACRUD2","Acer rubrum L. ssp. drummondii (Hook. & Arn. ex Nutt.) A.E. Murray","","Aceraceae"
"ACRUD","RUDR3","Rufacer drummondii (Hook. & Arn. ex Nutt.) Small","","Aceraceae"
"ACRUR","","Acer rubrum L. var. rubrum","red maple","Aceraceae"
"ACRUR","ACRUT2","Acer rubrum L. var. tomentosum Tausch","","Aceraceae"
"ACRUR","ACST","Acer stenocarpum Britton","","Aceraceae"
"ACRUR","RURU5","Rufacer rubrum (L.) Small","","Aceraceae"
"ACRUT","","Acer rubrum L. var. trilobum Torr. & A. Gray ex K. Koch","red maple","Aceraceae"
"ACRUT","ACCA9","Acer carolinianum Walter","","Aceraceae"
"ACRUT","ACRUT3","Acer rubrum L. var. tridens Alph. Wood","","Aceraceae"
"ACRUT","RUCA7","Rufacer carolinianum (Walter) Small","","Aceraceae"
"ACSA2","","Acer saccharinum L.","SILVER MAPLE","Aceraceae"
"ACSA2","ACDA2","Acer dasycarpum Ehrh.","","Aceraceae"
"ACSA2","ACSAL3","Acer saccharinum L. var. laciniatum Pax","","Aceraceae"
"ACSA2","ACSAW","Acer saccharinum L. var. wieri Rehder","","Aceraceae"
"ACSA2","ARSA9","Argentacer saccharinum (L.) Small","","Aceraceae"
"ACSA3","","Acer saccharum Marshall","SUGAR MAPLE","Aceraceae"
"ACSAS","","Acer saccharum Marshall var. saccharum","sugar maple","Aceraceae"
"ACSAS","ACNIG","Acer nigrum Michx. f. var. glaucum (F. Schmidt) Fosberg","","Aceraceae"
"ACSAS","ACNIS2","Acer nigrum Michx. f. var. saccharophorum (K. Koch) R.T. Clausen","","Aceraceae"
"ACSAS","ACSAG","Acer saccharum Marshall var. glaucum (F. Schmidt) Sarg.","","Aceraceae"
"ACSAS","ACSAR","Acer saccharum Marshall var. rugellii (Pax) Rehder","","Aceraceae"
"ACSAS","SASA18","Saccharodendron saccharum (Marshall) Moldenke","","Aceraceae"
"ACSC11","","Achnatherum scribneri (Vasey) Barkworth","Scribner needlegrass","Poaceae"
"ACSC11","STSC2","Stipa scribneri Vasey","","Poaceae"
"ACTAE","","Actaea L.","baneberry","Ranunculaceae"
"ACVI","","Acalypha virginica L.","VIRGINIA COPPERLEAF","Euphorbiaceae"
"ADCA","","Adiantum capillus-veneris L.","common maidenhair","Pteridaceae"
"ADCA","ADCAM","Adiantum capillus-veneris L. var. modestum (Underw.) Fernald","","Pteridaceae"
"ADCA","ADCAP","Adiantum capillus-veneris L. var. protrusum Fernald","","Pteridaceae"
"ADCA","ADMO2","Adiantum modestum Underw.","","Pteridaceae"
"ADIAN","","Adiantum L.","maidenhair fern","Pteridaceae"
"ADPE","","Adiantum pedatum L.","northern maidenhair","Pteridaceae"
"AEBU","","Aesculus ×bushii C.K. Schneid. (pro sp.) [glabra × pavia]","buckeye","Hippocastanaceae"
"AEBU","AEMI","Aesculus ×mississippiensis Sarg.","","Hippocastanaceae"
"AECY","","Aegilops cylindrica Host","JOINTED GOATGRASS","Poaceae"
"AECY","AECYR","Aegilops cylindrica Host var. rubiginosa Popova","","Poaceae"
"AECY","AETA3","Aegilops tauschii auct. non Coss.","","Poaceae"
"AECY","CYCY5","Cylindropyrum cylindricum (Host) Á. Löve","","Poaceae"
"AECY","TRCY3","Triticum cylindricum (Host) Ces., Pass. & Gibelli","","Poaceae"
"AEGIL","","Aegilops L.","goatgrass","Poaceae"
"AEGL","","Aesculus glabra Willd.","BUCKEYE","Hippocastanaceae"
"AEGLA","","Aesculus glabra Willd. var. arguta (Buckley) B.L. Rob.","Texas buckeye","Hippocastanaceae"
"AEGLA","AEAR2","Aesculus arguta Buckley","","Hippocastanaceae"
"AEGLA","AEGLB","Aesculus glabra Willd. var. buckleyi Sarg.","","Hippocastanaceae"
"AEGLG","","Aesculus glabra Willd. var. glabra","Ohio buckeye","Hippocastanaceae"
"AEGLG","AEGLL","Aesculus glabra Willd. var. leucodermis Sarg.","","Hippocastanaceae"
"AEGLG","AEGLM","Aesculus glabra Willd. var. micrantha Sarg.","","Hippocastanaceae"
"AEGLG","AEGLM2","Aesculus glabra Willd. var. monticola Sarg.","","Hippocastanaceae"
"AEGLG","AEGLP","Aesculus glabra Willd. var. pallida (Willd.) G. Kirchn.","","Hippocastanaceae"
"AEGLG","AEGLS","Aesculus glabra Willd. var. sargentii Rehder","","Hippocastanaceae"
"AEIN","","Aeschynomene indica L.","Indian jointvetch","Fabaceae"
"AEPA","","Aesculus pavia L.","RED BUCKEYE","Hippocastanaceae"
"AEPAP","","Aesculus pavia L. var. pavia","red buckeye","Hippocastanaceae"
"AEPAP","AEAU","Aesculus austrina Small","","Hippocastanaceae"
"AEPAP","AEDI","Aesculus discolor Pursh","","Hippocastanaceae"
"AEPAP","AEDIM","Aesculus discolor Pursh var. mollis (Raf.) Sarg.","","Hippocastanaceae"
"AEPAP","AEPAD","Aesculus pavia L. var. discolor (Pursh) A. Gray","","Hippocastanaceae"
"AEPAP","AESP","Aesculus splendens Sarg.","","Hippocastanaceae"
"AESCH","","Aeschynomene L.","jointvetch","Fabaceae"
"AESCU","","Aesculus L.","buckeye","Hippocastanaceae"
"AGAL5","","Ageratina altissima (L.) R.M. King & H. Rob.","white snakeroot","Asteraceae"
"AGALA","","Ageratina altissima (L.) R.M. King & H. Rob. var. altissima","WHITE SNAKEROOT","Asteraceae"
"AGALA","AGAL9","Ageratum altissimum L., non Eupatorium altissimum L.","","Asteraceae"
"AGALA","EURU6","Eupatorium rugosum Houtt.","","Asteraceae"
"AGALA","EURUC","Eupatorium rugosum Houtt. var. chlorolepis Fernald","","Asteraceae"
"AGALA","EURUT","Eupatorium rugosum Houtt. var. tomentellum (B.L. Rob.) S.F. Blake","","Asteraceae"
"AGALA","EURUV","Eupatorium rugosum Houtt. var. villicaule (Fernald) S.F. Blake","","Asteraceae"
"AGALA","EUURT","Eupatorium urticifolium Reichard var. tomentellum B.L. Rob.","","Asteraceae"
"AGALA2","","Ageratina altissima (L.) R.M. King & H. Rob. var. angustata (A. Gray) Clewell & Wooten","white snakeroot","Asteraceae"
"AGALA2","EURUA","Eupatorium rugosum Houtt. var. angustata (A. Gray) S.F. Blake","","Asteraceae"
"AGALI","","Agalinis Raf.","false foxglove","Scrophulariaceae"
"AGAS2","","Agalinis aspera (Douglas ex Benth.) Britton","tall false foxglove","Scrophulariaceae"
"AGAS2","GEAS2","Gerardia aspera Douglas ex Benth.","","Scrophulariaceae"
"AGAST","","Agastache Clayton ex Gronov.","giant hyssop","Lamiaceae"
"AGAU3","","Agalinis auriculata (Michx.) S.F. Blake","earleaf false foxglove","Scrophulariaceae"
"AGAU3","AUAU","Aureolaria auriculata (Michx.) Farw.","","Scrophulariaceae"
"AGAU3","GEAU7","Gerardia auriculata Michx.","","Scrophulariaceae"
"AGAU3","OTAU","Otophylla auriculata (Michx.) Small","","Scrophulariaceae"
"AGAU3","TOAU","Tomanthera auriculata (Michx.) Raf.","","Scrophulariaceae"
"AGCR","","Agropyron cristatum (L.) Gaertn.","Crested wheatgrass","Poaceae"
"AGCRP8","","Agropyron cristatum (L.) Gaertn. ssp. pectinatum (M. Bieb.) Tzvelev","crested wheatgrass","Poaceae"
"AGCRP8","AGCR3","Agropyron cristatiforme Sarkar","","Poaceae"
"AGCRP8","AGPE6","Agropyron pectinatum (M. Bieb.) P. Beauv.","","Poaceae"
"AGCRP8","AGPE5","Agropyron pectiniforme Roem. & Schult.","","Poaceae"
"AGDE6","","Agalinis densiflora (Benth.) S.F. Blake","Osage false foxglove","Scrophulariaceae"
"AGDE6","GEDE6","Gerardia densiflora Benth.","","Scrophulariaceae"
"AGDE6","OTDE","Otophylla densiflora (Benth.) Small","","Scrophulariaceae"
"AGDE6","TODE","Tomanthera densiflora (Benth.) Pennell","","Scrophulariaceae"
"AGEL4","","Agrostis elliottiana Schult.","ELLIOT BENTGRASS","Poaceae"
"AGEL4","AGEX2","Agrostis exigua Thurb.","","Poaceae"
"AGERA2","","Ageratina Spach","snakeroot","Asteraceae"
"AGEX","","Agrostis exarata Trin.","SPIKE BENTGRASS","Poaceae"
"AGEX","AGAE2","Agrostis aenea Trin.","","Poaceae"
"AGEX","AGAL2","Agrostis alaskana Hultén","","Poaceae"
"AGEX","AGAM2","Agrostis ampla Hitchc.","","Poaceae"
"AGEX","AGAS4","Agrostis asperifolia Trin.","","Poaceae"
"AGEX","AGEXM3","Agrostis exarata Trin. ssp. minor (Hook.) C.L. Hitchc.","","Poaceae"
"AGEX","AGEXM","Agrostis exarata Trin. var. minor Hook.","","Poaceae"
"AGEX","AGEXM2","Agrostis exarata Trin. var. monolepis (Torr.) Hitchc.","","Poaceae"
"AGEX","AGEXP2","Agrostis exarata Trin. var. pacifica Vasey","","Poaceae"
"AGEX","AGEXP","Agrostis exarata Trin. var. purpurascens Hultén","","Poaceae"
"AGEX","AGLO2","Agrostis longiligula Hitchc.","","Poaceae"
"AGEX","AGLOA","Agrostis longiligula Hitchc. var. australis J.T. Howell","","Poaceae"
"AGEX","AGME","Agrostis melaleuca (Trin.) Hitchc.","","Poaceae"
"AGEX","AGMIM","Agrostis microphylla Steud. var. major Vasey","","Poaceae"
"AGFA2","","Agalinis fasciculata (Elliott) Raf.","beach false foxglove","Scrophulariaceae"
"AGFA2","AGFAP","Agalinis fasciculata (Elliott) Raf. var. peninsularis Pennell","","Scrophulariaceae"
"AGFA2","AGGE","Agalinis georgiana (C.L. Boynt.) Pennell","","Scrophulariaceae"
"AGFA2","AGPUR","Agalinis purpurea (L.) Pennell var. racemulosa (Pennell) B. Boivin","","Scrophulariaceae"
"AGFA2","AGVI4","Agalinis virgata Raf.","","Scrophulariaceae"
"AGFA2","GEFA2","Gerardia fasciculata Elliott","","Scrophulariaceae"
"AGFA2","GEFAP","Gerardia fasciculata Elliott ssp. peninsularis (Pennell) Pennell","","Scrophulariaceae"
"AGFA2","GEGE2","Gerardia georgiana C.L. Boynt.","","Scrophulariaceae"
"AGFA2","GEPUR","Gerardia purpurea L. var. racemulosa (Pennell) Gleason","","Scrophulariaceae"
"AGFA2","GERA6","Gerardia racemulosa Pennell","","Scrophulariaceae"
"AGGA","","Agalinis gattingeri (Small) Small","roundstem false foxglove","Scrophulariaceae"
"AGGA","GEGA2","Gerardia gattingeri Small","","Scrophulariaceae"
"AGGI","","Agrostemma githago L.","CORNCOCKLE","Caryophyllaceae"
"AGGI2","","Agrostis gigantea Roth","redtop","Poaceae"
"AGGI2","AGAL3","Agrostis alba auct. non L.","","Poaceae"
"AGGI2","AGGID","Agrostis gigantea Roth var. dispar (Michx.) Philipson","","Poaceae"
"AGGI2","AGNI","Agrostis nigra With.","","Poaceae"
"AGGI2","AGSTG","Agrostis stolonifera L. ssp. gigantea (Roth) Schübl. & G. Martens","","Poaceae"
"AGGI2","AGSTM","Agrostis stolonifera L. var. major (Gaudin) Farw.","","Poaceae"
"AGHE4","","Agalinis heterophylla (Nutt.) Small ex Britton","prairie false foxglove","Scrophulariaceae"
"AGHE4","GEHE5","Gerardia heterophylla Nutt.","","Scrophulariaceae"
"AGHO4","","Agalinis homalantha Pennell","San Antonio false foxglove","Scrophulariaceae"
"AGHO4","GEHO4","Gerardia homalantha (Pennell) Pennell","","Scrophulariaceae"
"AGHY","","Agrostis hyemalis (Walter) Britton, Sterns & Poggenb.","Winter bentgrass","Poaceae"
"AGHY","AGAN2","Agrostis antecedens E.P. Bicknell","","Poaceae"
"AGHY","COHY2","Cornucopiae hyemalis Walter","","Poaceae"
"AGNE2","","Agastache nepetoides (L.) Kuntze","CATNIP GIANT HYSSOP","Lamiaceae"
"AGPA6","","Agrimonia parviflora Aiton","MANYFLOWERED GROOVEBUR","Rosaceae"
"AGPE","","Agrostis perennans (Walter) Tuck.","AUTUMM BENTGRASS","Poaceae"
"AGPE","AGAL8","Agrostis altissima (Walter) Tuck.","","Poaceae"
"AGPE","AGEL5","Agrostis elata (Pursh) Trin.","","Poaceae"
"AGPE","AGOR3","Agrostis oreophila Trin.","","Poaceae"
"AGPE","AGPEA","Agrostis perennans (Walter) Tuck. var. aestivalis Vasey","","Poaceae"
"AGPE","AGPEE","Agrostis perennans (Walter) Tuck. var. elata (Pursh) Hitchc.","","Poaceae"
"AGPE","AGSC6","Agrostis schweinitzii Trin.","","Poaceae"
"AGPE","COPE7","Cornucopiae perennans Walter","","Poaceae"
"AGPU","","Agrimonia pubescens Wallr.","GROOVEBUR","Rosaceae"
"AGPU","AGBI","Agrimonia bicknellii (Kearney) Rydb.","","Rosaceae"
"AGPU","AGMO3","Agrimonia mollis (Torr. & A. Gray) Britton","","Rosaceae"
"AGRIM","","Agrimonia L.","agrimony","Rosaceae"
"AGRO3","","Agrimonia rostellata Wallr.","WOODLAND GROOVEBUR","Rosaceae"
"AGROP2","","Agropyron Gaertn.","wheatgrass","Poaceae"
"AGROS","","Agrostemma L.","corncockle","Caryophyllaceae"
"AGROS2","","Agrostis L.","bentgrass","Poaceae"
"AGSK","","Agalinis skinneriana (Alph. Wood) Britton","Skinner's false foxglove","Scrophulariaceae"
"AGSK","GESK2","Gerardia skinneriana Alph. Wood","","Scrophulariaceae"
"AGST","","Agrimonia striata Michx.","ROADSIDE AGRIMONY","Rosaceae"
"AGTE3","","Agalinis tenuifolia (Vahl) Raf.","slenderleaf false foxglove","Scrophulariaceae"
"AGTEM","","Agalinis tenuifolia (Vahl) Raf. var. macrophylla (Benth.) S.F. Blake","slenderleaf false foxglove","Scrophulariaceae"
"AGTEM","AGBE","Agalinis besseyana (Britton) Britton","","Scrophulariaceae"
"AGTEM","GEBE","Gerardia besseyana Britton","","Scrophulariaceae"
"AGTEM","GETEM3","Gerardia tenuifolia Vahl ssp. macrophylla (Benth.) Pennell","","Scrophulariaceae"
"AGTEM","GETEM2","Gerardia tenuifolia Vahl var. macrophylla Benth.","","Scrophulariaceae"
"AGTEP2","","Agalinis tenuifolia (Vahl) Raf. var. parviflora (Nutt.) Pennell","slenderleaf false foxglove","Scrophulariaceae"
"AGTEP2","GETEP6","Gerardia tenuifolia Vahl ssp. parviflora (Nutt.) Pennell","","Scrophulariaceae"
"AGTEP2","GETEP4","Gerardia tenuifolia Vahl var. parviflora Nutt.","","Scrophulariaceae"
"AGVI5","","Agalinis viridis (Small) Pennell","green false foxglove","Scrophulariaceae"
"AGVI5","GEVI9","Gerardia viridis Small","","Scrophulariaceae"
"AIAL","","Ailanthus altissima (Mill.) Swingle","AILANTHUS","Simaroubaceae"
"AIAL","AIGL","Ailanthus glandulosa Desf.","","Simaroubaceae"
"AIAL","TOAL4","Toxicodendron altissimum Mill.","","Simaroubaceae"
"AICA","","Aira caryophyllea L.","silver hairgrass","Poaceae"
"AICAC2","","Aira caryophyllea L. var. caryophyllea","silver hairgrass","Poaceae"
"AICAC2","ASCA22","Aspris caryophyllea (L.) Nash","","Poaceae"
"AIEL4","","Aira elegans Willd. ex Kunth","annual silver hairgrass","Poaceae"
"AIEL4","AICA3","Aira capillaris Host, non Savi","","Poaceae"
"AIEL4","AICAC","Aira caryophyllea L. var. capillaris (Host) Mutel","","Poaceae"
"AIEL4","AIELA","Aira elegans Willd. ex Kunth ssp. ambigua (Arcang.) Holub","","Poaceae"
"AIEL4","AIEL2","Aira elegantissima Schur","","Poaceae"
"AIEL4","ASCA23","Aspris capillaris (Host) Hitchc.","","Poaceae"
"AILAN","","Ailanthus Desf.","ailanthus","Simaroubaceae"
"AIRA","","Aira L.","hairgrass","Poaceae"
"ALAM","","Allium ampeloprasum L.","broadleaf wild leek","Liliaceae"
"ALAM","ALAMA2","Allium ampeloprasum L. var. ampeloprasum","","Liliaceae"
"ALAU","","Aletris aurea Walter","golden colicroot","Liliaceae"
"ALBIZ","","Albizia Durazz.","albizia","Fabaceae"
"ALCA3","","Allium canadense L.","Wild onion","Liliaceae"
"ALCA4","","Alopecurus carolinianus Walter","Carolina foxtail","Poaceae"
"ALCA4","ALMA15","Alopecurus macounii Vasey","","Poaceae"
"ALCA4","ALRA4","Alopecurus ramosus Poir.","","Poaceae"
"ALCA5","","Alternanthera caracasana Kunth","washerwoman","Amaranthaceae"
"ALCA5","ACPE3","Achyranthes peploides (Humb. & Bonpl. ex Schult.) Britton & P. Wilson","","Amaranthaceae"
"ALCA5","ALPE6","Alternanthera peploides (Humb. & Bonpl. ex Schult.) Urb.","","Amaranthaceae"
"ALCAC","","Allium canadense L. var. canadense","CANADA GARLIC","Liliaceae"
"ALCAC","ALAC3","Allium acetabulum (Raf.) Shinners","","Liliaceae"
"ALCAC","ALCAO","Allium canadense L. var. ovoideum Farw.","","Liliaceae"
"ALCAC","ALCAR","Allium canadense L. var. robustum Farw.","","Liliaceae"
"ALCAC","ALCO4","Allium continuum Small","","Liliaceae"
"ALCAF","","Allium canadense L. var. fraseri Ownbey","Fraser meadow garlic","Liliaceae"
"ALCAF","ALFR","Allium fraseri (Ownbey) Shinners","","Liliaceae"
"ALCAF","ALLAF2","Allium lavandulare Bates ssp. fraseri (Ownbey) Traub & Owenbey","","Liliaceae"
"ALCAF","ALLAF","Allium lavandulare Bates var. fraseri (Ownbey) Shinners","","Liliaceae"
"ALCAH","","Allium canadense L. var. hyacinthoides (Bush) Ownbey & Aase","hyacinth meadow garlic","Liliaceae"
"ALCAH","ALCAH2","Allium canadense L. ssp. hyacinthoides (Bush) Traub & Ownbey","","Liliaceae"
"ALCAH","ALHY3","Allium hyacinthoides Bush","","Liliaceae"
"ALCAL","","Allium canadense L. var. lavandulare (Bates) Ownbey & Aase","meadow garlic","Liliaceae"
"ALCAL","ALCAL2","Allium canadense L. ssp. lavandulare (Bates) Traub & Ownbey","","Liliaceae"
"ALCAL","ALLA8","Allium lavandulare Bates","","Liliaceae"
"ALCAM","","Allium canadense L. var. mobilense (Regel) Ownbey","meadow garlic","Liliaceae"
"ALCAM","ALAR4","Allium arenicola Small","","Liliaceae"
"ALCAM","ALCAM2","Allium canadense L. ssp. mobilense (Regel) Traub & Ownbey","","Liliaceae"
"ALCAM","ALMI6","Allium microscordion Small","","Liliaceae"
"ALCAM","ALMO10","Allium mobilense Regel","","Liliaceae"
"ALCAM","ALMU4","Allium mutabile Michx.","","Liliaceae"
"ALCAM","ALZE2","Allium zenobine Cory","","Liliaceae"
"ALDR","","Allium drummondii Regel","DRUMMOND ONION","Liliaceae"
"ALDR","ALHE2","Allium helleri Small","","Liliaceae"
"ALDR","ALNU2","Allium nuttallii S. Watson","","Liliaceae"
"ALDR2","","Alophia drummondii (Graham) R.C. Foster","propeller flower","Iridaceae"
"ALDR2","CYDR","Cypella drummondii Graham","","Iridaceae"
"ALDR2","EUPU6","Eustylis purpurea (Herb.) Engelm. & A. Gray","","Iridaceae"
"ALDR2","HEDR5","Herbertia drummondii (Graham) Small","","Iridaceae"
"ALDR2","NEPU5","Nemastylis purpurea Herb.","","Iridaceae"
"ALDR2","TIPU3","Tigridia purpurea (Herb.) Shinners","","Iridaceae"
"ALETR","","Aletris L.","colicroot","Liliaceae"
"ALFA2","","Aletris farinosa L.","white colicroot","Liliaceae"
"ALGE2","","Alopecurus geniculatus L.","water foxtail","Poaceae"
"ALGEG4","","Alopecurus geniculatus L. var. geniculatus","water foxtail","Poaceae"
"ALGEG4","ALPA9","Alopecurus pallescens Piper","","Poaceae"
"ALIN","","Allionia incarnata L.","TRAILING ALLIONIA","Nyctaginaceae"
"ALINI","","Allionia incarnata L. var. incarnata","trailing windmills","Nyctaginaceae"
"ALINI","ALCR2","Allionia cristata (Standl.) Standl.","","Nyctaginaceae"
"ALINI","WECR","Wedelia cristata Standl.","","Nyctaginaceae"
"ALISM","","Alisma L.","water plantain","Alismataceae"
"ALJU","","Albizia julibrissin Durazz.","MIMOSA","Fabaceae"
