"POPUP5","POPA22","Potamogeton panormitanus Biv.","","Potamogetonaceae"
"POPUP5","POPAM","Potamogeton panormitanus Biv. var. major G. Fisch.","","Potamogetonaceae"
"POPUP5","POPAM2","Potamogeton panormitanus Biv. var. minor Biv.","","Potamogetonaceae"
"POPUP5","POPUM2","Potamogeton pusillus L. var. minor (Biv.) Fernald & B.G. Schub.","","Potamogetonaceae"
"POPUP5","POPUP9","Potamogeton pusillus L. var. pusillus","","Potamogetonaceae"
"PORA3","","Polygonum ramosissimum Michx.","bushy knotweed","Polygonaceae"
"PORAR","","Polygonum ramosissimum Michx. var. ramosissimum","bushy knotweed","Polygonaceae"
"PORAR","POAL10","Polygonum allocarpum S.F. Blake","","Polygonaceae"
"PORAR","POAT5","Polygonum atlanticum (B.L. Rob.) E.P. Bicknell p.p.","","Polygonaceae"
"PORAR","POAU5","Polygonum autumnale Brenckle","","Polygonaceae"
"PORAR","POEX4","Polygonum exsertum auct. non Small. p.p.","","Polygonaceae"
"PORAR","POIN16","Polygonum interius Brenckle","","Polygonaceae"
"PORAR","POTR17","Polygonum triangulum E.P. Bicknell","","Polygonaceae"
"PORE2","","Polemonium reptans L.","Greek valerian","Polemoniaceae"
"PORE5","","Potentilla recta L.","sulphur cinquefoil","Rosaceae"
"PORE5","POREO","Potentilla recta L. var. obscura (Nestler) W.D.J. Koch","","Rosaceae"
"PORE5","POREP","Potentilla recta L. var. pilosa (Willd.) Ledeb.","","Rosaceae"
"PORE5","PORES","Potentilla recta L. var. sulphurea (Lam. & DC.) Peyr.","","Rosaceae"
"PORER","","Polemonium reptans L. var. reptans","Greek valerian","Polemoniaceae"
"PORI2","","Potamogeton richardsonii (Benn.) Rydb.","Richardson's pondweed","Potamogetonaceae"
"PORI2","POPER5","Potamogeton perfoliatus L. ssp. richardsonii (Benn.) Hultén","","Potamogetonaceae"
"PORI2","POPER4","Potamogeton perfoliatus L. var. richardsonii Benn.","","Potamogetonaceae"
"PORI3","","Potentilla rivalis Nutt.","brook cinquefoil","Rosaceae"
"PORI3","POLE13","Potentilla leucocarpa Rydb.","","Rosaceae"
"PORI3","POMI6","Potentilla millegrana Engelm. ex Lehm.","","Rosaceae"
"PORI3","POPE12","Potentilla pentandra Engelm.","","Rosaceae"
"PORI3","PORIM2","Potentilla rivalis Nutt. var. millegrana (Engelm. ex Lehm.) S. Watson","","Rosaceae"
"PORI3","PORIP","Potentilla rivalis Nutt. var. pentandra (Engelm.) S. Watson","","Rosaceae"
"PORI3","PORIR2","Potentilla rivalis Nutt. var. rivalis","","Rosaceae"
"PORTU","","Portulaca L.","purslane","Portulacaceae"
"POSA19","","Polypodium saximontanum Windham","Rocky Mountain polypody","Polypodiaceae"
"POSA3","","Polygala sanguinea L.","purple milkwort","Polygalaceae"
"POSA3","POVI15","Polygala viridescens L.","","Polygalaceae"
"POSA5","","Polygonum sagittatum L.","arrowleaf tearthumb","Polygonaceae"
"POSA5","PESA20","Persicaria sagittata (L.) Gross.","","Polygonaceae"
"POSA5","POSAG","Polygonum sagittatum L. var. gracilentum Fernald","","Polygonaceae"
"POSA5","TRSA4","Tracaulon sagittatum (L.) Small","","Polygonaceae"
"POSA5","TRSAG","Tracaulon sagittatum (L.) Small var. gracilentum (Fernald) C.F. Reed","","Polygonaceae"
"POSA5","TRSA7","Truellum sagittatum (L.) Soják","","Polygonaceae"
"POSC3","","Polygonum scandens L.","climbing false buckwheat","Polygonaceae"
"POSCS","","Polygonum scandens L. var. scandens","climbing false buckwheat","Polygonaceae"
"POSCS","BISC","Bilderdykia scandens (L.) Greene","","Polygonaceae"
"POSCS","FASC","Fallopia scandens (L.) Holub","","Polygonaceae"
"POSCS","PODUS","Polygonum dumetorum L. var. scandens (L.) A. Gray","","Polygonaceae"
"POSCS","RESC","Reynoutria scandens (L.) Shinners","","Polygonaceae"
"POSCS","TISC","Tiniaria scandens (L.) Small","","Polygonaceae"
"POSE","","Poa secunda J. Presl","Sandberg bluegrass","Poaceae"
"POSE","FEOR","Festuca oregona Vasey","","Poaceae"
"POSE","POAM","Poa ampla Merr.","","Poaceae"
"POSE","POBR12","Poa brachyglossa Piper","","Poaceae"
"POSE","POBU4","Poa buckleyana Nash","","Poaceae"
"POSE","POCA","Poa canbyi (Scribn.) Howell","","Poaceae"
"POSE","POCO17","Poa confusa Rydb.","","Poaceae"
"POSE","POEN2","Poa englishii H. St. John & Hardin","","Poaceae"
"POSE","POGR","Poa gracillima Vasey","","Poaceae"
"POSE","POGRM","Poa gracillima Vasey var. multnomae (Piper) C.L. Hitchc.","","Poaceae"
"POSE","POIN24","Poa incurva Scribn. & T.A. Williams","","Poaceae"
"POSE","POJU","Poa juncifolia Scribn.","","Poaceae"
"POSE","POJUP","Poa juncifolia Scribn. ssp. porteri D.D. Keck","","Poaceae"
"POSE","POJUA","Poa juncifolia Scribn. var. ampla (Merr.) Dorn","","Poaceae"
"POSE","POJUJ","Poa juncifolia Scribn. var. juncifolia","","Poaceae"
"POSE","POLA15","Poa laevigata Scribn.","","Poaceae"
"POSE","PONE3","Poa nevadensis Vasey ex Scribn.","","Poaceae"
"POSE","PONEJ","Poa nevadensis Vasey ex Scribn. var. juncifolia (Scribn.) Beetle","","Poaceae"
"POSE","POOR4","Poa orcuttiana Vasey","","Poaceae"
"POSE","POSA12","Poa sandbergii Vasey","","Poaceae"
"POSE","POSC","Poa scabrella (Thurb.) Benth. ex Vasey","","Poaceae"
"POSE","POSEJ","Poa secunda J. Presl ssp. juncifolia (Scribn.) Soreng","","Poaceae"
"POSE","POSES6","Poa secunda J. Presl ssp. secunda","","Poaceae"
"POSE","POSEE","Poa secunda J. Presl var. elongata (Vasey) Dorn","","Poaceae"
"POSE","POSEI2","Poa secunda J. Presl var. incurva (Scribn. & T.A. Williams) Beetle","","Poaceae"
"POSE","POSES3","Poa secunda J. Presl var. stenophylla (Vasey) Beetle","","Poaceae"
"POSE","POSTS","Poa stenantha Trin. var. sandbergii (Vasey) B. Boivin","","Poaceae"
"POSE3","","Polygala senega L.","Seneca snakeroot","Polygalaceae"
"POSE3","POSEL","Polygala senega L. var. latifolia Torr. & A. Gray","","Polygalaceae"
"POSP3","","Potamogeton spirillus Tuck.","spiral pondweed","Potamogetonaceae"
"POSP3","PODI10","Potamogeton dimorphus Raf.","","Potamogetonaceae"
"POST2","","Potamogeton strictifolius Benn.","narrowleaf pondweed","Potamogetonaceae"
"POST2","POLO6","Potamogeton longiligulatus Fernald","","Potamogetonaceae"
"POST2","POPUR2","Potamogeton pusillus L. var. rutiloides (Fernald) B. Boivin","","Potamogetonaceae"
"POST2","PORU11","Potamogeton rutilus auct. non Wolfgang","","Potamogetonaceae"
"POST2","POSTR","Potamogeton strictifolius Benn. var. rutiloides Fernald","","Potamogetonaceae"
"POST2","POSTT","Potamogeton strictifolius Benn. var. typicus Fernald","","Potamogetonaceae"
"POSY","","Poa sylvestris A. Gray","woodland bluegrass","Poaceae"
"POTAM","","Potamogeton L.","pondweed","Potamogetonaceae"
"POTE2","","Polygonum tenue Michx.","pleatleaf knotweed","Polygonaceae"
"POTE2","POTEP","Polygonum tenue Michx. var. protrusum Fernald","","Polygonaceae"
"POTEN","","Potentilla L.","cinquefoil","Rosaceae"
"POTR2","","Poa trivialis L.","rough bluegrass","Poaceae"
"POTR2","POAT8","Poa attica Boiss. & Heldr.","","Poaceae"
"POTR5","","Populus tremuloides Michx.","quaking aspen","Salicaceae"
"POTR5","POAU8","Populus aurea Tidestr.","","Salicaceae"
"POTR5","POCE6","Populus cercidiphylla Britton","","Salicaceae"
"POTR5","POPO12","Populus ×polygonifolia Bernard","","Salicaceae"
"POTR5","POTRT","Populus tremula L. ssp. tremuloides (Michx.) Á. Löve & D. Löve","","Salicaceae"
"POTR5","POTRA","Populus tremuloides Michx. var. aurea (Tidestr.) Daniels","","Salicaceae"
"POTR5","POTRC2","Populus tremuloides Michx. var. cercidiphylla (Britton) Sudw.","","Salicaceae"
"POTR5","POTRI2","Populus tremuloides Michx. var. intermedia Vict.","","Salicaceae"
"POTR5","POTRM","Populus tremuloides Michx. var. magnifica Vict.","","Salicaceae"
"POTR5","POTRR","Populus tremuloides Michx. var. rhomboidea Vict.","","Salicaceae"
"POTR5","POTRV","Populus tremuloides Michx. var. vancouveriana (Trel.) Sarg.","","Salicaceae"
"POTR5","POVA11","Populus vancouveriana Trel.","","Salicaceae"
"POVE","","Polygala verticillata L.","whorled milkwort","Polygalaceae"
"POVEI","","Polygala verticillata L. var. isocycla Fernald","whorled milkwort","Polygalaceae"
"POVEI","POVES","Polygala verticillata L. var. sphenostachya Pennell","","Polygalaceae"
"POVI3","","Polygonum viviparum L.","alpine bistort","Polygonaceae"
"POVI3","BIVI2","Bistorta vivipara (L.) Gray","","Polygonaceae"
"POVI3","PEVI19","Persicaria vivipara (L.) Ronse Decr.","","Polygonaceae"
"POVI3","POFU3","Polygonum fugax Small","","Polygonaceae"
"POVI3","POMA28","Polygonum macounii Small ex Macoun","","Polygonaceae"
"POVI3","POVIA","Polygonum viviparum L. var. alpinum Wahlenb.","","Polygonaceae"
"POVI3","POVIM2","Polygonum viviparum L. var. macounii (Small ex Macoun) Hultén","","Polygonaceae"
"POVI7","","Polypodium virginianum L.","rock polypody","Polypodiaceae"
"POVI7","POVU3","Polypodium vulgare auct. non L. p.p.","","Polypodiaceae"
"POVI7","POVUV2","Polypodium vulgare L. var. virginianum (L.) Eaton","","Polypodiaceae"
"POZO","","Potamogeton zosteriformis Fernald","flatstem pondweed","Potamogetonaceae"
"POZO","POCO18","Potamogeton compressus auct. non L.","","Potamogetonaceae"
"POZO","POZOZ","Potamogeton zosterifolius Schumach. ssp. zosteriformis (Fernald) Hultén","","Potamogetonaceae"
"PRAL2","","Prenanthes alba L.","white rattlesnakeroot","Asteraceae"
"PRAL2","NAAL2","Nabalus albus (L.) Hook.","","Asteraceae"
"PRAM","","Prunus americana Marshall","American plum","Rosaceae"
"PRAS","","Prenanthes aspera Michx.","rough rattlesnakeroot","Asteraceae"
"PRAS","NAAS","Nabalus asperus (Michx.) Torr. & A. Gray","","Asteraceae"
"PRENA","","Prenanthes L.","rattlesnakeroot","Asteraceae"
"PRLO","","Proboscidea louisianica (Mill.) Thell.","ram's horn","Pedaliaceae"
"PRLO","PRLO3","Proboscidea louisiana (Mill.) Wooton & Standl., orth. var.","","Pedaliaceae"
"PRLOL","","Proboscidea louisianica (Mill.) Thell. ssp. louisianica","ram's horn","Pedaliaceae"
"PRLOL","MALO6","Martynia louisiana Mill., orth. var.","","Pedaliaceae"
"PRLOL","MALO4","Martynia louisianica Mill.","","Pedaliaceae"
"PRLOL","MAPR7","Martynia proboscidea Gloxin","","Pedaliaceae"
"PRLOL","PRJU2","Proboscidea jussieui auct.","","Pedaliaceae"
"PRME","","Prunus mexicana S. Watson","Mexican plum","Rosaceae"
"PRME","PRAML2","Prunus americana Marshall var. lanata Sudw.","","Rosaceae"
"PRME","PRLA8","Prunus lanata (Sudw.) Mack. & Bush","","Rosaceae"
"PRME","PRMEF","Prunus mexicana S. Watson var. flutonensis (Sarg.) Sarg.","","Rosaceae"
"PRME","PRMEP","Prunus mexicana S. Watson var. polyandra (Sarg.) Sarg.","","Rosaceae"
"PRME","PRPEM","Prunus pensylvanica L. f. var. mollis (Douglas) B. Boivin","","Rosaceae"
"PROBO","","Proboscidea Schmidel","unicorn-plant","Pedaliaceae"
"PROSA","","Prosartes D. Don","fairybells","Liliaceae"
"PRPE2","","Prunus pensylvanica L. f.","pin cherry","Rosaceae"
"PRPEP","","Prunus pensylvanica L. f. var. pensylvanica","pin cherry","Rosaceae"
"PRPEP","CEPE7","Cerasus pensylvanica (L. f.) Loisel.","","Rosaceae"
"PRPU3","","Prunus pumila L.","sandcherry","Rosaceae"
"PRPUB","","Prunus pumila L. var. besseyi (L.H. Bailey) Gleason","western sandcherry","Rosaceae"
"PRPUB","CEPUB","Cerasus pumila (L.) Michx. ssp. besseyi (L.H. Bailey) W.A. Weber","","Rosaceae"
"PRPUB","PRBE2","Prunus besseyi L.H. Bailey","","Rosaceae"
"PRPUB","PRPUB2","Prunus pumila L. ssp. besseyi (L.H. Bailey) Nizhnikev","","Rosaceae"
"PRRA","","Prenanthes racemosa Michx.","purple rattlesnakeroot","Asteraceae"
"PRRAM2","","Prenanthes racemosa Michx. var. multiflora (Cronquist) Dorn","purple rattlesnakeroot","Asteraceae"
"PRRAM2","PRRAM","Prenanthes racemosa Michx. ssp. multiflora Cronquist","","Asteraceae"
"PRTO80","","Prunus tomentosa Thunb.","Nanking cherry","Rosaceae"
"PRTO80","CETO3","Cerasus tomentosa (Thunb.) Wall.","","Rosaceae"
"PRTR4","","Prosartes trachycarpa S. Watson","roughfruit fairybells","Liliaceae"
"PRTR4","DITR2","Disporum trachycarpum (S. Watson) Benth. & Hook. f.","","Liliaceae"
"PRTR4","DITRS","Disporum trachycarpum (S. Watson) Benth. & Hook. f. var. subglabrum E.H. Kelso","","Liliaceae"
"PRUNE","","Prunella L.","selfheal","Lamiaceae"
"PRUNU","","Prunus L.","plum","Rosaceae"
"PRVI","","Prunus virginiana L.","chokecherry","Rosaceae"
"PRVIM","","Prunus virginiana L. var. melanocarpa (A. Nelson) Sarg.","black chokecherry","Rosaceae"
"PRVIM","PAME5","Padus melanocarpa (A. Nelson) Shafer","","Rosaceae"
"PRVIM","PAVIM2","Padus virginiana (L.) M. Roem. ssp. melanocarpa (A. Nelson) W.A. Weber","","Rosaceae"
"PRVIM","PRME2","Prunus melanocarpa (A. Nelson) Rydb.","","Rosaceae"
"PRVIM","PRVIM2","Prunus virginiana L. ssp. melanocarpa (A. Nelson) Roy L. Taylor & MacBryde","","Rosaceae"
"PRVU","","Prunella vulgaris L.","common selfheal","Lamiaceae"
"PRVUL2","","Prunella vulgaris L. ssp. lanceolata (W. Bartram) Hultén","lance selfheal","Lamiaceae"
"PRVUL2","PRVUE","Prunella vulgaris L. var. elongata Benth.","","Lamiaceae"
"PRVUL2","PRVUL3","Prunella vulgaris L. var. lanceolata (W.P.C. Barton) Fernald","","Lamiaceae"
"PSATH2","","Psathyrostachys Nevski","wildrye","Poaceae"
"PSEUD22","","Pseudoroegneria (Nevski) Á. Löve","wheatgrass","Poaceae"
"PSEUD23","","×Pseudelymus Barkworth & D.R. Dewey","foxtail wheatgrass","Poaceae"
"PSEUD43","","Pseudognaphalium Kirp.","cudweed","Asteraceae"
"PSJU3","","Psathyrostachys juncea (Fisch.) Nevski","Russian wildrye","Poaceae"
"PSJU3","ELJU","Elymus junceus Fisch.","","Poaceae"
"PSJU3","LEKO","×Leymostachys korovinii Tzvelev","","Poaceae"
"PSLA3","","Psoralidium lanceolatum (Pursh) Rydb.","lemon scurfpea","Fabaceae"
"PSLA3","PSLA","Psoralea lanceolata Pursh","","Fabaceae"
"PSLA3","PSLAS3","Psoralea lanceolata Pursh ssp. scabra (Nutt.) Piper","","Fabaceae"
"PSLA3","PSLAP2","Psoralea lanceolata Pursh var. purshii (Vail) Piper","","Fabaceae"
"PSLA3","PSLAS","Psoralea lanceolata Pursh var. stenophylla (Rydb.) Toft & S.L. Welsh","","Fabaceae"
"PSLA3","PSLAS2","Psoralea lanceolata Pursh var. stenostachys (Rydb.) S.L. Welsh","","Fabaceae"
"PSLA3","PSMI5","Psoralea micrantha A. Gray","","Fabaceae"
"PSLA3","PSSC7","Psoralea scabra Nutt.","","Fabaceae"
"PSLA3","PSST3","Psoralea stenostachys Rydb.","","Fabaceae"
"PSLA3","PSLAS4","Psoralidium lanceolatum (Pursh) Rydb. var. stenophyllum (Rydb.) S.L. Welsh","","Fabaceae"
"PSLA3","PSLAS5","Psoralidium lanceolatum (Pursh) Rydb. var. stenostachys (Rydb.) S.L. Welsh","","Fabaceae"
"PSLA3","PSST4","Psoralidium stenophyllum (Rydb.) Rydb.","","Fabaceae"
"PSMA11","","Pseudognaphalium macounii (Greene) Kartesz","Macoun's cudweed","Asteraceae"
"PSMA11","GNDE","Gnaphalium decurrens Ives, non L.","","Asteraceae"
"PSMA11","GNMA","Gnaphalium macounii Greene","","Asteraceae"
"PSMA11","PSVI5","Pseudognaphalium viscosum auct. non (Kunth) W.A. Weber","","Asteraceae"
"PSORA2","","Psoralidium Rydb.","scurfpea","Fabaceae"
"PSSA2","","×Pseudelymus saxicola (Scribn. & J.G. Sm.) Barkworth & D.R. Dewey [Elymus elymoides × Pseudoroegneria spicata]","foxtail wheatgrass","Poaceae"
"PSSA2","AGSA2","Agropyron saxicola (Scribn. & J.G. Sm.) Piper","","Poaceae"
"PSSA2","AGSA5","×Agrositanion saxicola (Scribn. & J.G. Sm.) Bowden","","Poaceae"
"PSSA2","ELSA6","Elymus saxicola Scribn. & J.G. Sm.","","Poaceae"
"PSSP6","","Pseudoroegneria spicata (Pursh) Á. Löve","bluebunch wheatgrass","Poaceae"
"PSSPS","","Pseudoroegneria spicata (Pursh) Á. Löve ssp. spicata","bluebunch wheatgrass","Poaceae"
"PSSPS","AGSP","Agropyron spicatum Pursh","","Poaceae"
"PSSPS","AGSPP","Agropyron spicatum Pursh var. pubescens Elmer","","Poaceae"
"PSSPS","AGVA2","Agropyron vaseyi Scribn. & J.G. Sm.","","Poaceae"
"PSSPS","ELSP3","Elymus spicatus (Pursh) Gould","","Poaceae"
"PSSPS","ELSP4","Elytrigia spicata (Pursh) D.R. Dewey","","Poaceae"
"PSSPS","ROSP6","Roegneria spicata (Pursh) Beetle","","Poaceae"
"PSTE5","","Psoralidium tenuiflorum (Pursh) Rydb.","slimflower scurfpea","Fabaceae"
"PSTE5","PSFL","Psoralea floribunda Nutt. ex Torr. & A. Gray","","Fabaceae"
"PSTE5","PSOB80","Psoralea obtusifolia Torr. & A. Gray","","Fabaceae"
"PSTE5","PSTE3","Psoralea tenuiflora Pursh","","Fabaceae"
"PSTE5","PSTEB2","Psoralea tenuiflora Pursh var. bigelovii (Rydb.) J.F. Macbr.","","Fabaceae"
"PSTE5","PSTEF2","Psoralea tenuiflora Pursh var. floribunda (Nutt. ex Torr. & A. Gray) Rydb.","","Fabaceae"
"PSTE5","PSBA7","Psoralidium batesii Rydb.","","Fabaceae"
"PTAN2","","Pterospora andromedea Nutt.","woodland pinedrops","Monotropaceae"
"PTAQ","","Pteridium aquilinum (L.) Kuhn","western brackenfern","Dennstaedtiaceae"
"PTAQL","","Pteridium aquilinum (L.) Kuhn var. latiusculum (Desv.) Underw. ex A. Heller","western brackenfern","Dennstaedtiaceae"
"PTAQL","PTLA","Pteridium latiusculum (Desv.) Hieron.","","Dennstaedtiaceae"
"PTAQP2","","Pteridium aquilinum (L.) Kuhn var. pubescens Underw.","hairy brackenfern","Dennstaedtiaceae"
"PTAQP2","PTAQL2","Pteridium aquilinum (L.) Kuhn ssp. lanuginosum (Bong.) Hultén","","Dennstaedtiaceae"
"PTAQP2","PTAQL3","Pteridium aquilinum (L.) Kuhn var. lanuginosum (Bong.) Fernald","","Dennstaedtiaceae"
"PTCA","","Ptilimnium capillaceum (Michx.) Raf.","herbwilliam","Apiaceae"
"PTERI","","Pteridium Gleditsch ex Scop.","brackenfern","Dennstaedtiaceae"
"PTERO3","","Pterospora Nutt.","pinedrops","Monotropaceae"
"PTILI","","Ptilimnium Raf.","mock bishopweed","Apiaceae"
"PUCCI","","Puccinellia Parl.","alkaligrass","Poaceae"
"PUDI","","Puccinellia distans (Jacq.) Parl.","weeping alkaligrass","Poaceae"
"PUDID","","Puccinellia distans (Jacq.) Parl. ssp. distans","weeping alkaligrass","Poaceae"
"PUDID","PODI11","Poa distans Jacq.","","Poaceae"
"PUDID","PUDIT","Puccinellia distans (Jacq.) Parl. var. tenuis (Uechtr.) Fernald & Weath.","","Poaceae"
"PUDID","PURE","Puccinellia retroflexa (W. Curtis) Holmb.","","Poaceae"
"PUDID","PUSU3","Puccinellia suksdorfii H. St. John","","Poaceae"
"PULSA","","Pulsatilla Mill.","pasqueflower","Ranunculaceae"
"PUNU2","","Puccinellia nuttalliana (Schult.) Hitchc.","Nuttall's alkaligrass","Poaceae"
"PUNU2","PUAI","Puccinellia airoides (Nutt.) S. Watson & J.M. Coult.","","Poaceae"
"PUNU2","PUCU","Puccinellia cusickii Weath.","","Poaceae"
"PUPA5","","Pulsatilla patens (L.) Mill.","eastern pasqueflower","Ranunculaceae"
"PUPAM","","Pulsatilla patens (L.) Mill. ssp. multifida (Pritz.) Zamels","cutleaf anemone","Ranunculaceae"
"PUPAM","ANLU5","Anemone ludoviciana Nutt., nom. illeg.","","Ranunculaceae"
"PUPAM","ANMU8","Anemone multifida (Pritz.) Zamels, non Poir.","","Ranunculaceae"
"PUPAM","ANNU5","Anemone nuttalliana DC.","","Ranunculaceae"
"PUPAM","ANPAM","Anemone patens L. var. multifida Pritz.","","Ranunculaceae"
"PUPAM","ANPAN","Anemone patens L. var. nuttalliana (DC.) A. Gray","","Ranunculaceae"
"PUPAM","ANPAW","Anemone patens L. var. wolfgangiana (Besser) Koch","","Ranunculaceae"
"PUPAM","PUHI","Pulsatilla hirsutissima (Pursh) Britton","","Ranunculaceae"
"PUPAM","PULU","Pulsatilla ludoviciana A. Heller, nom. illeg.","","Ranunculaceae"
"PUPAM","PUNU3","Pulsatilla nuttalliana (DC.) Spreng.","","Ranunculaceae"
"PUPAM","PUPAH2","Pulsatilla patens (L.) Mill. ssp. hirsutissima (Pursh) Zamels","","Ranunculaceae"
"PYAM","","Pyrola americana Sweet","American wintergreen","Pyrolaceae"
"PYAM","PYASA2","Pyrola asarifolia Michx. ssp. americana (Sweet) Krísa","","Pyrolaceae"
"PYAM","PYOB","Pyrola obovata Bertol.","","Pyrolaceae"
"PYAM","PYRO","Pyrola rotundifolia auct. non L. p.p.","","Pyrolaceae"
"PYAM","PYROA2","Pyrola rotundifolia L. ssp. americana (Sweet) R.T. Clausen","","Pyrolaceae"
"PYAM","PYROA","Pyrola rotundifolia L. var. americana (Sweet) Fernald","","Pyrolaceae"
"PYAM","PYROR","Pyrola rotundifolia L. var. rotundifolia","","Pyrolaceae"
"PYAS","","Pyrola asarifolia Michx.","liverleaf wintergreen","Pyrolaceae"
"PYASA","","Pyrola asarifolia Michx. ssp. asarifolia","liverleaf wintergreen","Pyrolaceae"
"PYASA","PYASI","Pyrola asarifolia Michx. var. incarnata (DC.) Fernald","","Pyrolaceae"
"PYASA","PYASO","Pyrola asarifolia Michx. var. ovata Farw.","","Pyrolaceae"
"PYASA","PYASP","Pyrola asarifolia Michx. var. purpurea (Bunge) Fernald","","Pyrolaceae"
"PYASA","PYCA6","Pyrola californica Krísa","","Pyrolaceae"
"PYASA","PYEL2","Pyrola elata Nutt.","","Pyrolaceae"
"PYASA","PYROA3","Pyrola rotundifolia L. ssp. asarifolia (Michx.) Á. Löve & D. Löve","","Pyrolaceae"
"PYASA","PYUL","Pyrola uliginosa Torr. & A. Gray ex Torr.","","Pyrolaceae"
"PYASA","PYULG","Pyrola uliginosa Torr. & A. Gray ex Torr. var. gracilis Jennings","","Pyrolaceae"
"PYCH","","Pyrola chlorantha Sw.","greenflowered wintergreen","Pyrolaceae"
"PYCH","PYCHC","Pyrola chlorantha Sw. var. convoluta (W. Bartram) Fernald","","Pyrolaceae"
"PYCH","PYCHP","Pyrola chlorantha Sw. var. paucifolia Fernald","","Pyrolaceae"
"PYCH","PYCHR","Pyrola chlorantha Sw. var. revoluta Jennings","","Pyrolaceae"
"PYCH","PYCO3","Pyrola convoluta W.P.C. Barton","","Pyrolaceae"
"PYCH","PYOX","Pyrola oxypetala Austin ex A. Gray","","Pyrolaceae"
"PYCH","PYVI3","Pyrola virens Schreb.","","Pyrolaceae"
"PYCH","PYVIC","Pyrola virens Schreb. var. convoluta (W. Bartram) Fernald","","Pyrolaceae"
"PYCH","PYVIS","Pyrola virens Schreb. var. saximontana Fernald","","Pyrolaceae"
"PYCNA","","Pycnanthemum Michx.","mountainmint","Lamiaceae"
"PYEL","","Pyrola elliptica Nutt.","waxflower shinleaf","Pyrolaceae"
"PYEL","PYCO6","Pyrola compacta Jennings","","Pyrolaceae"
"PYPI2","","Pyrola picta Sm.","whiteveined wintergreen","Pyrolaceae"
"PYPI2","PYAP","Pyrola aphylla Sm.","","Pyrolaceae"
"PYPI2","PYAPL","Pyrola aphylla Sm. var. leptosepala Nutt.","","Pyrolaceae"
"PYPI2","PYAPP","Pyrola aphylla Sm. var. paucifolia Howell","","Pyrolaceae"
"PYPI2","PYBL","Pyrola blanda Andres","","Pyrolaceae"
"PYPI2","PYCO5","Pyrola conardiana Andres","","Pyrolaceae"
"PYPI2","PYDE","Pyrola dentata Sm.","","Pyrolaceae"
"PYPI2","PYDEA","Pyrola dentata Sm. var. apophylla Copeland","","Pyrolaceae"
"PYPI2","PYDEI","Pyrola dentata Sm. var. integra A. Gray","","Pyrolaceae"
"PYPI2","PYPA","Pyrola pallida Greene","","Pyrolaceae"
"PYPI2","PYPA2","Pyrola paradoxa Andres","","Pyrolaceae"
"PYPI2","PYPID","Pyrola picta Sm. ssp. dentata (Sm.) Piper","","Pyrolaceae"
"PYPI2","PYPII","Pyrola picta Sm. ssp. integra (A. Gray) Piper","","Pyrolaceae"
"PYPI2","PYPIP","Pyrola picta Sm. ssp. pallida (Greene) Andres","","Pyrolaceae"
"PYPI2","PYPID2","Pyrola picta Sm. var. dentata (Sm.) Dorn","","Pyrolaceae"
"PYPI2","PYSE4","Pyrola septentrionalis Andres","","Pyrolaceae"
"PYPI2","PYSP","Pyrola sparsifolia Suksd.","","Pyrolaceae"
"PYROL","","Pyrola L.","wintergreen","Pyrolaceae"
"PYVI","","Pycnanthemum virginianum (L.) T. Dur. & B.D. Jacks. ex B.L. Rob. & Fernald","Virginia mountainmint","Lamiaceae"
"PYVI","KOVI3","Koellia virginiana (L.) MacMill.","","Lamiaceae"
"QUERC","","Quercus L.","oak","Fagaceae"
"QUGA","","Quercus gambelii Nutt.","Gambel oak","Fagaceae"
"QUGAG","","Quercus gambelii Nutt. var. gambelii","Gambel oak","Fagaceae"
"QUGAG","QUEA","Quercus eastwoodiae Rydb.","","Fagaceae"
"QUGAG","QUGU3","Quercus gunnisonii (Torr. & A. Gray) Rydb.","","Fagaceae"
"QUGAG","QULE3","Quercus leptophylla Rydb.","","Fagaceae"
"QUGAG","QUNI2","Quercus nitescens Rydb.","","Fagaceae"
"QUGAG","QUNO","Quercus novomexicana (A. DC.) Rydb.","","Fagaceae"
"QUGAG","QUSU11","Quercus submollis Rydb.","","Fagaceae"
"QUGAG","QUUT","Quercus utahensis (A. DC.) Rydb.","","Fagaceae"
"QUGAG","QUVR","Quercus vreelandii Rydb.","","Fagaceae"
"QUMA2","","Quercus macrocarpa Michx.","bur oak","Fagaceae"
"QUMAD","","Quercus macrocarpa Michx. var. depressa (Nutt.) Engelm.","bur oak","Fagaceae"
"QUMAD","QUMA9","Quercus mandanensis Rydb.","","Fagaceae"
"QUMAM","","Quercus macrocarpa Michx. var. macrocarpa","bur oak","Fagaceae"
"QUMAM","QUMAO","Quercus macrocarpa Michx. var. oliviformis (Michx. f.) A. Gray","","Fagaceae"
"RAAB","","Ranunculus abortivus L.","littleleaf buttercup","Ranunculaceae"
"RAAB","RAABA","Ranunculus abortivus L. ssp. acrolasius (Fernald) Kapoor & Á. Löve & D. Löve","","Ranunculaceae"
"RAAB","RAABA3","Ranunculus abortivus L. var. acrolasius Fernald","","Ranunculaceae"
"RAAB","RAABE","Ranunculus abortivus L. var. eucyclus Fernald","","Ranunculaceae"
"RAAB","RAABI","Ranunculus abortivus L. var. indivisus Fernald","","Ranunculaceae"
"RAAB","RAABT","Ranunculus abortivus L. var. typicus Fernald","","Ranunculaceae"
"RAAC3","","Ranunculus acris L.","tall buttercup","Ranunculaceae"
"RAACA3","","Ranunculus acris L. var. acris","showy buttercup","Ranunculaceae"
"RAACA3","RAACS","Ranunculus acris L. ssp. strigulosus (Schur) Hyl.","","Ranunculaceae"
"RAACA3","RAACL","Ranunculus acris L. var. latisectus G. Beck","","Ranunculaceae"
"RAACA3","RAACS2","Ranunculus acris L. var. stevenii (Andrz. ex Besser) Lange","","Ranunculaceae"
"RAACA3","RAACT2","Ranunculus acris L. var. typicus G. Beck","","Ranunculaceae"
"RAACA3","RAACV","Ranunculus acris L. var. villosus (Drab.) S.M. Coles","","Ranunculaceae"
"RAACA3","RABO3","Ranunculus boreanus Jord.","","Ranunculaceae"
"RACA4","","Ranunculus cardiophyllus Hook.","heartleaf buttercup","Ranunculaceae"
"RACA4","RACAS","Ranunculus cardiophyllus Hook. var. subsagittatus (A. Gray) L.D. Benson","","Ranunculaceae"
"RACA4","RACAT3","Ranunculus cardiophyllus Hook. var. typicus L.D. Benson","","Ranunculaceae"
"RACO3","","Ratibida columnifera (Nutt.) Wooton & Standl.","upright prairie coneflower","Asteraceae"
"RACO3","LECO48","Lepachys columnaris (Pursh) Torr. & A. Gray","","Asteraceae"
"RACO3","LECO13","Lepachys columnifera (Nutt.) J.F. Macbr.","","Asteraceae"
"RACO3","RACO7","Ratibida columnaris (Pursh) D. Don","","Asteraceae"
"RACO3","RACOP","Ratibida columnaris (Pursh) D. Don var. pulcherrima (DC.) D. Don","","Asteraceae"
"RACO3","RUCO23","Rudbeckia columnaris Pursh, non Sims","","Asteraceae"
"RACO3","RUCO24","Rudbeckia columnifera Nutt.","","Asteraceae"
"RACY","","Ranunculus cymbalaria Pursh","alkali buttercup","Ranunculaceae"
"RACY","CYCY9","Cyrtorhyncha cymbalaria (Pursh) Britton","","Ranunculaceae"
"RACY","CYCYA","Cyrtorhyncha cymbalaria (Pursh) Britton ssp. alpina (Hook.) Á. Löve & D. Löve","","Ranunculaceae"
"RACY","HACY2","Halerpestes cymbalaria (Pursh) Greene","","Ranunculaceae"
"RACY","HACYS","Halerpestes cymbalaria (Pursh) Greene ssp. saximontana (Fernald) Moldenke","","Ranunculaceae"
"RACY","RACYS2","Ranunculus cymbalaria Pursh ssp. saximontanus (Fernald) Thorne","","Ranunculaceae"
"RACY","RACYA","Ranunculus cymbalaria Pursh var. alpinus Hook.","","Ranunculaceae"
