"IPHE","IPHI4","Ipomoea hirsutula auct. non Jacq. f.","","Convolvulaceae"
"IPHE","IPNI2","Ipomoea nil auct. non (L.) Roth","","Convolvulaceae"
"IPHE","PHBA5","Pharbitis barbigera (Sweet) G. Don","","Convolvulaceae"
"IPHE","PHHE12","Pharbitis hederacea (Jacq.) Choisy","","Convolvulaceae"
"IPLE","","Ipomoea leptophylla Torr.","bush morning-glory","Convolvulaceae"
"IPLO2","","Ipomopsis longiflora (Torr.) V.E. Grant","flaxflowered ipomopsis","Polemoniaceae"
"IPLOL","","Ipomopsis longiflora (Torr.) V.E. Grant ssp. longiflora","flaxflowered ipomopsis","Polemoniaceae"
"IPLOL","GILO2","Gilia longiflora (Torr.) G. Don","","Polemoniaceae"
"IPOMO","","Ipomoea L.","morning-glory","Convolvulaceae"
"IPOMO2","","Ipomopsis Michx.","ipomopsis","Polemoniaceae"
"IPPU2","","Ipomoea purpurea (L.) Roth","tall morning-glory","Convolvulaceae"
"IPPU2","COPU11","Convolvulus purpureus L.","","Convolvulaceae"
"IPPU2","IPHI2","Ipomoea hirsutula Jacq. f.","","Convolvulaceae"
"IPPU2","IPPUD","Ipomoea purpurea (L.) Roth var. diversifolia (Lindl.) O'Donell","","Convolvulaceae"
"IPPU2","PHPU13","Pharbitis purpurea (L.) Voigt","","Convolvulaceae"
"IPSP","","Ipomopsis spicata (Nutt.) V.E. Grant","spiked ipomopsis","Polemoniaceae"
"IPSPS","","Ipomopsis spicata (Nutt.) V.E. Grant ssp. spicata","spiked ipomopsis","Polemoniaceae"
"IPSPS","GISP4","Gilia spicata Nutt.","","Polemoniaceae"
"IRIS","","Iris L.","iris","Iridaceae"
"IRMI","","Iris missouriensis Nutt.","Rocky Mountain iris","Iridaceae"
"IRMI","IRLO","Iris longipetala Herb.","","Iridaceae"
"IRMI","IRMIA","Iris missouriensis Nutt. var. arizonica (Dykes) R.C. Foster","","Iridaceae"
"IRMI","IRMIP","Iris missouriensis Nutt. var. pelogonus (Goodding) R.C. Foster","","Iridaceae"
"IRMI","IRPA5","Iris pariensis S.L. Welsh","","Iridaceae"
"IRMI","IRTO","Iris tolmieana Herb.","","Iridaceae"
"ISME","","Isoetes melanopoda Gay & Durieu ex Durieu","blackfoot quillwort","Isoetaceae"
"ISOET","","Isoetes L.","quillwort","Isoetaceae"
"IVA","","Iva L.","marsh elder","Asteraceae"
"IVAN2","","Iva annua L.","annual marsh elder","Asteraceae"
"IVANA","","Iva annua L. var. annua","annual marsh elder","Asteraceae"
"IVANA","IVCI2","Iva ciliata Willd.","","Asteraceae"
"IVAX","","Iva axillaris Pursh","povertyweed","Asteraceae"
"IVAX","IVAXR","Iva axillaris Pursh ssp. robustior (Hook.) Bassett","","Asteraceae"
"IVAX","IVAXR2","Iva axillaris Pursh var. robustior Hook.","","Asteraceae"
"JUAL4","","Juncus alpinoarticulatus Chaix","northern green rush","Juncaceae"
"JUALN","","Juncus alpinoarticulatus Chaix ssp. nodulosus (Wahlenb.) Hämet-Ahti","northern green rush","Juncaceae"
"JUALN","JUALA2","Juncus alpinoarticulatus Chaix ssp. americanus (Farw.) Hämet-Ahti","","Juncaceae"
"JUALN","JUALF2","Juncus alpinoarticulatus Chaix ssp. fuscescens (Fernald) Hämet-Ahti","","Juncaceae"
"JUALN","JUAL","Juncus alpinus auct. non Vill.","","Juncaceae"
"JUALN","JUALN2","Juncus alpinus Vill. ssp. nodulosus (Wahlenb.) Lindm.","","Juncaceae"
"JUALN","JUALF","Juncus alpinus Vill. var. fuscescens Fernald","","Juncaceae"
"JUALN","JUALR","Juncus alpinus Vill. var. rariflorus Hartm.","","Juncaceae"
"JUALN","JUALU","Juncus alpinus Vill. var. uniceps Hartm.","","Juncaceae"
"JUALN","JURI2","Juncus richardsonianus Schult.","","Juncaceae"
"JUAR2","","Juncus arcticus Willd.","arctic rush","Juncaceae"
"JUAR4","","Juncus articulatus L.","jointleaf rush","Juncaceae"
"JUAR4","JUARO","Juncus articulatus L. var. obtusatus Engelm.","","Juncaceae"
"JUARL","","Juncus arcticus Willd. ssp. littoralis (Engelm.) Hultén","mountain rush","Juncaceae"
"JUARL","JUARA4","Juncus arcticus Willd. ssp. ater (Rydb.) Hultén","","Juncaceae"
"JUARL","JUARB4","Juncus arcticus Willd. ssp. balticus (Willd.) Hyl.","","Juncaceae"
"JUARL","JUARB5","Juncus arcticus Willd. var. balticus (Willd.) Trautv.","","Juncaceae"
"JUARL","JUARL2","Juncus arcticus Willd. var. littoralis (Engelm.) B. Boivin","","Juncaceae"
"JUARL","JUARM","Juncus arcticus Willd. var. montanus (Engelm.) S.L. Welsh","","Juncaceae"
"JUARL","JUAT","Juncus ater Rydb.","","Juncaceae"
"JUARL","JUBA","Juncus balticus Willd.","","Juncaceae"
"JUARL","JUBAB2","Juncus balticus Willd. var. balticus","","Juncaceae"
"JUARL","JUBAL","Juncus balticus Willd. var. littoralis Engelm.","","Juncaceae"
"JUARL","JUBAM4","Juncus balticus Willd. var. melanogenus Fernald & Wiegand","","Juncaceae"
"JUARL","JUBAM","Juncus balticus Willd. var. montanus Engelm.","","Juncaceae"
"JUARL","JUBAS2","Juncus balticus Willd. var. stenocarpus Buchenau & Fernald","","Juncaceae"
"JUARL","JUBAV","Juncus balticus Willd. var. vallicola Rydb.","","Juncaceae"
"JUBU","","Juncus bufonius L.","toad rush","Juncaceae"
"JUBUB","","Juncus bufonius L. var. bufonius","toad rush","Juncaceae"
"JUCA3","","Juncus canadensis J. Gay ex Laharpe","Canadian rush","Juncaceae"
"JUCA3","JUCAE","Juncus canadensis J. Gay ex Laharpe var. euroauster Fernald","","Juncaceae"
"JUCA3","JUCAS","Juncus canadensis J. Gay ex Laharpe var. sparsiflorus Fernald","","Juncaceae"
"JUCO2","","Juncus confusus Coville","Colorado rush","Juncaceae"
"JUCO2","JUEX","Juncus exilis Osterh.","","Juncaceae"
"JUCO6","","Juniperus communis L.","common juniper","Cupressaceae"
"JUCOD","","Juniperus communis L. var. depressa Pursh","common juniper","Cupressaceae"
"JUCOD","JUCA13","Juniperus canadensis Lodd. ex Burgsd.","","Cupressaceae"
"JUCOD","JUCOD2","Juniperus communis L. ssp. depressa (Pursh) Franco","","Cupressaceae"
"JUCOD","JUDE4","Juniperus depressa (Pursh) Raf.","","Cupressaceae"
"JUDU2","","Juncus dudleyi Wiegand","Dudley's rush","Juncaceae"
"JUDU2","JUTED","Juncus tenuis Willd. var. dudleyi (Wiegand) F.J. Herm.","","Juncaceae"
"JUDU2","JUTEU","Juncus tenuis Willd. var. uniflorus auct. non Farw. p.p.","","Juncaceae"
"JUEN","","Juncus ensifolius Wikstr.","swordleaf rush","Juncaceae"
"JUEN","JUENM","Juncus ensifolius Wikstr. var. major Hook.","","Juncaceae"
"JUEN","JUXIT","Juncus xiphioides E. Mey. var. triandrus Engelm.","","Juncaceae"
"JUGLA","","Juglans L.","walnut","Juglandaceae"
"JUHO2","","Juniperus horizontalis Moench","creeping juniper","Cupressaceae"
"JUHO2","JUHOA2","Juniperus horizontalis Moench var. argentea hort.","","Cupressaceae"
"JUHO2","JUHOD","Juniperus horizontalis Moench var. douglasii hort.","","Cupressaceae"
"JUHO2","JUHOG2","Juniperus horizontalis Moench var. glauca Hornibr.","","Cupressaceae"
"JUHO2","JUHOV","Juniperus horizontalis Moench var. variegata Beissn.","","Cupressaceae"
"JUHO2","JUHU3","Juniperus hudsonica Forbes","","Cupressaceae"
"JUHO2","JUPR2","Juniperus prostrata Pers.","","Cupressaceae"
"JUHO2","JURE4","Juniperus repens Nutt.","","Cupressaceae"
"JUHO2","JUVIP","Juniperus virginiana L. var. prostrata (Pers.) Torr.","","Cupressaceae"
"JUHO2","SAHO7","Sabina horizontalis (Moench) Rydb.","","Cupressaceae"
"JUHO2","SAPR10","Sabina prostrata (Pers.) Antoine","","Cupressaceae"
"JUIN2","","Juncus interior Wiegand","inland rush","Juncaceae"
"JUINI","","Juncus interior Wiegand var. interior","inland rush","Juncaceae"
"JULO","","Juncus longistylis Torr.","longstyle rush","Juncaceae"
"JULOL","","Juncus longistylis Torr. var. longistylis","longstyle rush","Juncaceae"
"JUMA4","","Juncus marginatus Rostk.","grassleaf rush","Juncaceae"
"JUMA4","JUMAM2","Juncus marginatus Rostk. var. marginatus","","Juncaceae"
"JUMA4","JUMAS","Juncus marginatus Rostk. var. setosus Coville","","Juncaceae"
"JUMA4","JUSE4","Juncus setosus (Coville) Small","","Juncaceae"
"JUME3","","Juncus mertensianus Bong.","Mertens' rush","Juncaceae"
"JUME3","JUSL","Juncus slwookoorum S.B. Young","","Juncaceae"
"JUNCU","","Juncus L.","rush","Juncaceae"
"JUNI","","Juglans nigra L.","black walnut","Juglandaceae"
"JUNI","WANI","Wallia nigra (L.) Alef.","","Juglandaceae"
"JUNIP","","Juniperus L.","juniper","Cupressaceae"
"JUNO2","","Juncus nodosus L.","knotted rush","Juncaceae"
"JUNON","","Juncus nodosus L. var. nodosus","knotted rush","Juncaceae"
"JUSA","","Juncus saximontanus A. Nelson","Rocky Mountain rush","Juncaceae"
"JUSA","JUENB","Juncus ensifolius Wikstr. var. brunnescens (Rydb.) Cronquist","","Juncaceae"
"JUSA","JUENM2","Juncus ensifolius Wikstr. var. montanus (Engelm.) C.L. Hitchc.","","Juncaceae"
"JUSA","JUSAR","Juncus saximontanus A. Nelson var. robustior M. Peck","","Juncaceae"
"JUSA","JUXIM","Juncus xiphioides E. Mey. var. macranthus Engelm.","","Juncaceae"
"JUSA","JUXIM2","Juncus xiphioides E. Mey. var. montanus Engelm.","","Juncaceae"
"JUSC2","","Juniperus scopulorum Sarg.","Rocky Mountain juniper","Cupressaceae"
"JUSC2","JUSCC2","Juniperus scopulorum Sarg. var. columnaris Fassett","","Cupressaceae"
"JUSC2","JUVIS2","Juniperus virginiana L. ssp. scopulorum (Sarg.) A.E. Murray","","Cupressaceae"
"JUSC2","JUVIM","Juniperus virginiana L. var. montana Vasey","","Cupressaceae"
"JUSC2","JUVIS4","Juniperus virginiana L. var. scopulorum (Sarg.) Lemmon","","Cupressaceae"
"JUSC2","SASC5","Sabina scopulorum (Sarg.) Rydb.","","Cupressaceae"
"JUTE","","Juncus tenuis Willd.","poverty rush","Juncaceae"
"JUTE","JUMA7","Juncus macer Gray","","Juncaceae"
"JUTE","JUTEM","Juncus tenuis Willd. var. multicornis E. Mey.","","Juncaceae"
"JUTE","JUTEW","Juncus tenuis Willd. var. williamsii Fernald","","Juncaceae"
"JUTO","","Juncus torreyi Coville","Torrey's rush","Juncaceae"
"JUVA","","Juncus vaseyi Engelm.","Vasey's rush","Juncaceae"
"JUVA","JUGRV","Juncus greenei Oakes & Tuck. var. vaseyi (Engelm.) B. Boivin","","Juncaceae"
"JUVI","","Juniperus virginiana L.","eastern redcedar","Cupressaceae"
"JUVIV","","Juniperus virginiana L. var. virginiana","eastern redcedar","Cupressaceae"
"JUVIV","JUVIC","Juniperus virginiana L. ssp. crebra (Fernald & Grisc.) A.E. Murray","","Cupressaceae"
"JUVIV","JUVIC2","Juniperus virginiana L. var. crebra Fernald & Grisc.","","Cupressaceae"
"JUVIV","SAVI11","Sabina virginiana (L.) Antoine","","Cupressaceae"
"KNAR","","Knautia arvensis (L.) J.M. Coult.","field scabiosa","Dipsacaceae"
"KNAR","SCAR6","Scabiosa arvensis L.","","Dipsacaceae"
"KNAUT","","Knautia L.","scabiosa","Dipsacaceae"
"KOELE","","Koeleria Pers.","Junegrass","Poaceae"
"KOMA","","Koeleria macrantha (Ledeb.) Schult.","prairie Junegrass","Poaceae"
"KOMA","KOAL5","Koeleria albescens auct.","","Poaceae"
"KOMA","KOCR","Koeleria cristata auct. non Pers. p.p.","","Poaceae"
"KOMA","KOCRL","Koeleria cristata Pers. var. longifolia Vasey ex Burtt Davy","","Poaceae"
"KOMA","KOCRP","Koeleria cristata Pers. var. pinetorum Abrams","","Poaceae"
"KOMA","KOGR2","Koeleria gracilis Pers.","","Poaceae"
"KOMA","KONI","Koeleria nitida Nutt., nom. utique rej.","","Poaceae"
"KOMA","KOPY","Koeleria pyramidata auct. non (Lam.) P. Beauv. p.p.","","Poaceae"
"KOMA","KOYU","Koeleria yukonensis Hultén","","Poaceae"
"KRASC","","Krascheninnikovia Guldenstaedt","winterfat","Chenopodiaceae"
"KRLA2","","Krascheninnikovia lanata (Pursh) A. Meeuse & Smit","winterfat","Chenopodiaceae"
"KRLA2","CELA4","Ceratoides lanata (Pursh) J.T. Howell","","Chenopodiaceae"
"KRLA2","CELAR2","Ceratoides lanata (Pursh) J.T. Howell var. ruinina S.L. Welsh","","Chenopodiaceae"
"KRLA2","CELAS2","Ceratoides lanata (Pursh) J.T. Howell var. subspinosa (Rydb.) J.T. Howell","","Chenopodiaceae"
"KRLA2","EULA5","Eurotia lanata (Pursh) Moq.","","Chenopodiaceae"
"KRLA2","EULAS","Eurotia lanata (Pursh) Moq. var. subspinosa (Rydb.) Kearney & Peebles","","Chenopodiaceae"
"LAAM","","Lamium amplexicaule L.","henbit deadnettle","Lamiaceae"
"LAAM","LAAMA","Lamium amplexicaule L. var. album A.L. Pickens & M.C. Pickens","","Lamiaceae"
"LABI","","Lactuca biennis (Moench) Fernald","tall blue lettuce","Asteraceae"
"LABI","LASP4","Lactuca spicata auct. non (Lam.) Hitchc.","","Asteraceae"
"LABI","LASPI","Lactuca spicata (Lam.) Hitchc. var. integrifolia (Torr. & A. Gray) Britton","","Asteraceae"
"LABI","MUSP2","Mulgedium spicatum auct. non (Lam.) Small","","Asteraceae"
"LABI","MUSPI","Mulgedium spicatum (Lam.) Small var. integrifolium (Torr. & A. Gray) Small","","Asteraceae"
"LACA","","Lactuca canadensis L.","Canada lettuce","Asteraceae"
"LACA","LACAI","Lactuca canadensis L. var. integrifolia (Bigelow) Torr. & A. Gray","","Asteraceae"
"LACA","LACAL","Lactuca canadensis L. var. latifolia Kuntze","","Asteraceae"
"LACA","LACAL2","Lactuca canadensis L. var. longifolia (Michx.) Farw.","","Asteraceae"
"LACA","LACAO","Lactuca canadensis L. var. obovata Wiegand","","Asteraceae"
"LACA","LACAT","Lactuca canadensis L. var. typica Wiegand","","Asteraceae"
"LACA","LASA4","Lactuca sagittifolia Elliott","","Asteraceae"
"LACA","LAST8","Lactuca steelei Britton","","Asteraceae"
"LACA3","","Laportea canadensis (L.) Weddell","Canadian woodnettle","Urticaceae"
"LACA3","URCA6","Urtica canadensis L.","","Urticaceae"
"LACA3","URDI3","Urticastrum divaricatum (L.) Kuntze","","Urticaceae"
"LACE","","Lappula cenchrusoides A. Nelson","Great Plains stickseed","Boraginaceae"
"LACTU","","Lactuca L.","lettuce","Asteraceae"
"LAFL","","Lactuca floridana (L.) Gaertn.","woodland lettuce","Asteraceae"
"LAFLF","","Lactuca floridana (L.) Gaertn. var. floridana","woodland lettuce","Asteraceae"
"LAFLF","MUFL","Mulgedium floridanum (L.) DC.","","Asteraceae"
"LALA4","","Lathyrus latifolius L.","perennial pea","Fabaceae"
"LALA4","LALAS2","Lathyrus latifolius L. var. splendens Groenl. & Rümpler","","Fabaceae"
"LALU","","Lactuca ludoviciana (Nutt.) Riddell","biannual lettuce","Asteraceae"
"LALU","LACA6","Lactuca campestris Greene","","Asteraceae"
"LALU","LACAT2","Lactuca campestris Greene var. typica Wiegand","","Asteraceae"
"LAMIU","","Lamium L.","deadnettle","Lamiaceae"
"LAOC2","","Lathyrus ochroleucus Hook.","cream pea","Fabaceae"
"LAOC3","","Lappula occidentalis (S. Watson) Greene","flatspine stickseed","Boraginaceae"
"LAOCC","","Lappula occidentalis (S. Watson) Greene var. cupulata (A. Gray) Higgins","flatspine stickseed","Boraginaceae"
"LAOCC","LAREC","Lappula redowskii (Hornem.) Greene var. cupulata (A. Gray) M.E. Jones","","Boraginaceae"
"LAOCC","LARET","Lappula redowskii (Hornem.) Greene var. texana (Scheele) Brand","","Boraginaceae"
"LAOCC","LATE3","Lappula texana (Scheele) Britton","","Boraginaceae"
"LAOCC","LATEC","Lappula texana (Scheele) Britton var. coronata (Greene) A. Nelson & J.F. Macbr.","","Boraginaceae"
"LAOCC","LATEH","Lappula texana (Scheele) Britton var. heterosperma (Greene) A. Nelson & J.F. Macbr.","","Boraginaceae"
"LAOCC","LATEH2","Lappula texana (Scheele) Britton var. homosperma (A. Nelson) A. Nelson & J.F. Macbr.","","Boraginaceae"
"LAOCO","","Lappula occidentalis (S. Watson) Greene var. occidentalis","flatspine stickseed","Boraginaceae"
"LAOCO","LAECO","Lappula echinata Gilib. var. occidentalis (S. Watson) B. Boivin","","Boraginaceae"
"LAOCO","LARE","Lappula redowskii auct. non (Hornem.) Greene","","Boraginaceae"
"LAOCO","LARED","Lappula redowskii (Hornem.) Greene var. desertorum (Greene) I.M. Johnst.","","Boraginaceae"
"LAOCO","LAREO","Lappula redowskii (Hornem.) Greene var. occidentalis (S. Watson) Rydb.","","Boraginaceae"
"LAOCO","LARER","Lappula redowskii (Hornem.) Greene var. redowskii","","Boraginaceae"
"LAPA4","","Lathyrus palustris L.","marsh pea","Fabaceae"
"LAPA4","LAMY","Lathyrus myrtifolius Muhl. ex Willd.","","Fabaceae"
"LAPA4","LAPAP3","Lathyrus palustris L. ssp. pilosus (Cham.) Hultén","","Fabaceae"
"LAPA4","LAPAL","Lathyrus palustris L. var. linearifolius Ser.","","Fabaceae"
"LAPA4","LAPAM2","Lathyrus palustris L. var. macranthus (T.G. White) Fernald","","Fabaceae"
"LAPA4","LAPAM3","Lathyrus palustris L. var. meridionalis Butters & H. St. John","","Fabaceae"
"LAPA4","LAPAM","Lathyrus palustris L. var. myrtifolius (Muhl. ex Willd.) A. Gray","","Fabaceae"
"LAPA4","LAPAP","Lathyrus palustris L. var. pilosus (Cham.) Ledeb.","","Fabaceae"
"LAPA4","LAPAR","Lathyrus palustris L. var. retusus Fernald & H. St. John","","Fabaceae"
"LAPA4","ORMY","Orobus myrtifolius Alef.","","Fabaceae"
"LAPO2","","Lathyrus polymorphus Nutt.","manystem pea","Fabaceae"
"LAPOI","","Lathyrus polymorphus Nutt. ssp. incanus (J.G. Sm. & Rydb.) C.L. Hitchc.","hoary pea","Fabaceae"
"LAPOI","LAIN11","Lathyrus incanus (J.G. Sm. & Rydb.) Rydb.","","Fabaceae"
"LAPOI","LAPOI2","Lathyrus polymorphus Nutt. var. incanus (J.G. Sm. & Rydb.) Dorn","","Fabaceae"
"LAPOI","LASTI2","Lathyrus stipulaceus (Pursh) Butters & H. St. John var. incanus (J.G. Sm. & Rydb.) Butters & H. St. John","","Fabaceae"
"LAPOP","","Lathyrus polymorphus Nutt. ssp. polymorphus","manystem pea","Fabaceae"
"LAPOP2","","Lathyrus polymorphus Nutt. ssp. polymorphus var. polymorphus","manystem pea","Fabaceae"
"LAPOP2","LADE4","Lathyrus decaphyllus Pursh","","Fabaceae"
"LAPOP2","LAST11","Lathyrus stipulaceus (Pursh) Butters & H. St. John","","Fabaceae"
"LAPOR","","Laportea Gaudich.","laportea","Urticaceae"
"LAPPU","","Lappula Moench","stickseed","Boraginaceae"
"LASE","","Lactuca serriola L.","prickly lettuce","Asteraceae"
"LASE","LASC6","Lactuca scariola L.","","Asteraceae"
"LASQ","","Lappula squarrosa (Retz.) Dumort.","European stickseed","Boraginaceae"
"LASQ","LAEC","Lappula echinata Gilib.","","Boraginaceae"
"LASQ","LAER4","Lappula erecta A. Nelson","","Boraginaceae"
"LASQ","LAFR5","Lappula fremontii (Torr.) Greene","","Boraginaceae"
"LASQ","LALA11","Lappula lappula (L.) Karst., nom. inval.","","Boraginaceae"
"LASQ","LAMY3","Lappula myosotis Moench","","Boraginaceae"
"LASQ","LASQE","Lappula squarrosa (Retz.) Dumort. var. erecta (A. Nelson) Dorn","","Boraginaceae"
"LATA","","Lactuca tatarica (L.) C.A. Mey.","blue lettuce","Asteraceae"
"LATAP","","Lactuca tatarica (L.) C.A. Mey. var. pulchella (Pursh) Breitung","blue lettuce","Asteraceae"
"LATAP","LAOB2","Lactuca oblongifolia Nutt.","","Asteraceae"
"LATAP","LAPU","Lactuca pulchella (Pursh) DC.","","Asteraceae"
"LATAP","LATAP2","Lactuca tatarica (L.) C.A. Mey. ssp. pulchella (Pursh) Stebbins","","Asteraceae"
"LATAP","LATAH","Lactuca tatarica (L.) C.A. Mey. var. heterophylla (Nutt.) B. Boivin","","Asteraceae"
"LATAP","MUPU3","Mulgedium pulchellum (Pursh) G. Don","","Asteraceae"
"LATAP","SOTA","Sonchus tataricus L. p.p.","","Asteraceae"
"LATHY","","Lathyrus L.","pea","Fabaceae"
"LAVE","","Lathyrus venosus Muhl. ex Willd.","veiny pea","Fabaceae"
"LAVE","LAOR","Lathyrus oreophilus Wooton & Standl.","","Fabaceae"
"LAVE","LAVEA2","Lathyrus venosus Muhl. ex Willd. ssp. arkansanus (Fassett) C.L. Hitchc.","","Fabaceae"
"LAVE","LAVEA3","Lathyrus venosus Muhl. ex Willd. var. arkansanus Fassett","","Fabaceae"
"LAVE","LAVEI","Lathyrus venosus Muhl. ex Willd. var. intonsus Butters & H. St. John","","Fabaceae"
"LAVE","LAVEM","Lathyrus venosus Muhl. ex Willd. var. meridionalis Butters & H. St. John","","Fabaceae"
"LEAL","","Lesquerella alpina (Nutt.) S. Watson","alpine bladderpod","Brassicaceae"
"LEALA5","","Lesquerella alpina (Nutt.) S. Watson var. alpina","alpine bladderpod","Brassicaceae"
"LEALA5","LEALL","Lesquerella alpina (Nutt.) S. Watson var. laevis (Payson) C.L. Hitchc.","","Brassicaceae"
"LEALA5","VEAL9","Vesicaria alpina Nutt.","","Brassicaceae"
"LEALS","","Lesquerella alpina (Nutt.) S. Watson var. spatulata (Rydb.) Payson","alpine bladderpod","Brassicaceae"
"LEALS","LECU3","Lesquerella curvipes A. Nelson","","Brassicaceae"
"LEALS","LESP4","Lesquerella spatulata Rydb.","","Brassicaceae"
"LEALS","PHRES","Physaria reediana O'Kane & Al-Shehbaz ssp. spatulata (Rydb.) O'Kane & Al-Shehbaz","","Brassicaceae"
"LEAR6","","Lesquerella arenosa (Richardson) Rydb.","Great Plains bladderpod","Brassicaceae"
"LEARA","","Lesquerella arenosa (Richardson) Rydb. var. argillosa Rollins & Shaw","Great Plains bladderpod","Brassicaceae"
"LEARA2","","Lesquerella arenosa (Richardson) Rydb. var. arenosa","Great Plains bladderpod","Brassicaceae"
"LEARA2","LELUA","Lesquerella ludoviciana (Nutt.) S. Watson var. arenosa (Richardson) S. Watson","","Brassicaceae"
"LECA2","","Leonurus cardiaca L.","common motherwort","Lamiaceae"
"LECA5","","Lepidium campestre (L.) W.T. Aiton","field pepperweed","Brassicaceae"
"LECA5","NECA5","Neolepia campestris (L.) W.A. Weber","","Brassicaceae"
"LECA5","THCA2","Thlaspi campestre L.","","Brassicaceae"
"LECA8","","Lespedeza capitata Michx.","roundhead lespedeza","Fabaceae"
"LECA8","LEBI5","Lespedeza bicknellii House","","Fabaceae"
"LECA8","LECAS","Lespedeza capitata Michx. var. stenophylla Bissell & Fernald","","Fabaceae"
"LECA8","LECAV2","Lespedeza capitata Michx. var. velutina (E.P. Bicknell) Fernald","","Fabaceae"
"LECA8","LECAV4","Lespedeza capitata Michx. var. vulgaris Torr. & A. Gray","","Fabaceae"
"LECAC7","","Leonurus cardiaca L. ssp. cardiaca","common motherwort","Lamiaceae"
"LECAN4","","Lecanora Ach.","rim lichen","Lecanoraceae"
"LECHE","","Lechea L.","pinweed","Cistaceae"
"LECI4","","Leymus cinereus (Scribn. & Merr.) Á. Löve","basin wildrye","Poaceae"
"LECI4","ANPI6","Aneurolepidium piperi (Bowden) Baum","","Poaceae"
"LECI4","ELCI2","Elymus cinereus Scribn. & Merr.","","Poaceae"
"LECI4","ELCIP","Elymus cinereus Scribn. & Merr. var. pubens (Piper) C.L. Hitchc.","","Poaceae"
"LECI4","ELCOP","Elymus condensatus J. Presl var. pubens Piper","","Poaceae"
"LECI4","ELPI2","Elymus piperi Bowden","","Poaceae"
"LEDE","","Lepidium densiflorum Schrad.","common pepperweed","Brassicaceae"
"LEDE","LEDED","Lepidium densiflorum Schrad. var. densiflorum","","Brassicaceae"
"LEDE","LEDEE","Lepidium densiflorum Schrad. var. elongatum (Rydb.) Thell.","","Brassicaceae"
"LEDE","LEDEM","Lepidium densiflorum Schrad. var. macrocarpum G. Mulligan","","Brassicaceae"
"LEDE","LEDEP","Lepidium densiflorum Schrad. var. pubecarpum (A. Nelson) Thell.","","Brassicaceae"
"LEDE","LEDER","Lepidium densiflorum Schrad. var. ramosum (A. Nelson) Thell.","","Brassicaceae"
"LEDE","LEDET","Lepidium densiflorum Schrad. var. typicum Thell.","","Brassicaceae"
"LEDE","LEEL4","Lepidium elongatum Rydb.","","Brassicaceae"
"LEDE","LENE7","Lepidium neglectum Thell.","","Brassicaceae"
"LEDE","LEPU6","Lepidium pubecarpum A. Nelson","","Brassicaceae"
"LEDE","LERA6","Lepidium ramosum A. Nelson","","Brassicaceae"
"LEDE","LETE7","Lepidium texanum Buckley","","Brassicaceae"
"LEDUM","","Ledum L.","Labrador tea","Ericaceae"
"LEERS","","Leersia Sw.","cutgrass","Poaceae"
"LEFU21","","Leptochloa fusca (L.) Kunth","Malabar sprangletop","Poaceae"
"LEFU21","DIFU7","Diplachne fusca (L.) P. Beauv. ex Roem. & Schult.","","Poaceae"
"LEFUF","","Leptochloa fusca (L.) Kunth ssp. fascicularis (Lam.) N. Snow","bearded sprangletop","Poaceae"
"LEFUF","DIAC3","Diplachne acuminata Nash","","Poaceae"
"LEFUF","DIFA4","Diplachne fascicularis (Lam.) P. Beauv.","","Poaceae"
"LEFUF","DIMA10","Diplachne maritima E.P. Bicknell","","Poaceae"
"LEFUF","LEAC2","Leptochloa acuminata (Nash) Mohlenbr.","","Poaceae"
"LEFUF","LEFA","Leptochloa fascicularis (Lam.) A. Gray","","Poaceae"
"LEFUF","LEFAA","Leptochloa fascicularis (Lam.) A. Gray var. acuminata (Nash) Gleason","","Poaceae"
"LEFUF","LEFAM","Leptochloa fascicularis (Lam.) A. Gray var. maritima (E.P. Bicknell) Gleason","","Poaceae"
"LEFUF","LEFUF2","Leptochloa fusca (L.) Kunth var. fascicularis (Lam.) Dorn","","Poaceae"
"LEGR","","Ledum groenlandicum Oeder","bog Labrador tea","Ericaceae"
"LEGR","LEPAG","Ledum palustre L. ssp. groenlandicum (Oeder) Hultén","","Ericaceae"
"LEGR","LEPAL","Ledum palustre L. var. latifolium (Jacq.) Michx.","","Ericaceae"
"LEGR","RHGR3","Rhododendron groenlandicum (Oeder) K.A. Kron & W.S. Judd","","Ericaceae"
"LEGR7","","Leucophysalis grandiflora (Hook.) Rydb.","large false groundcherry","Solanaceae"
"LEGR7","CHGR8","Chamaesaracha grandiflora (Hook.) Fernald","","Solanaceae"
"LEGR7","PHGR14","Physalis grandiflora Hook.","","Solanaceae"
"LEIN","","Lechea intermedia Leggett ex Britton","largepod pinweed","Cistaceae"
"LEIN6","","Leymus innovatus (Beal) Pilg.","downy ryegrass","Poaceae"
"LEIN6","ELBR8","Elymus brownii Scribn. & J.G. Sm.","","Poaceae"
"LEIN6","ELIN4","Elymus innovatus Beal","","Poaceae"
"LEIN6","ELING","Elymus innovatus Beal var. glabratus Bowden","","Poaceae"
"LEIN6","ELINV","Elymus innovatus Beal var. velutinus Bowden","","Poaceae"
"LEIN6","LEVE4","Leymus velutinus (Bowden) Á. Löve & D. Löve","","Poaceae"
"LEINI2","","Lechea intermedia Leggett ex Britton var. intermedia","largepod pinweed","Cistaceae"
"LEKI2","","Leucopoa kingii (S. Watson) W.A. Weber","spike fescue","Poaceae"
"LEKI2","FECO5","Festuca confinis Vasey","","Poaceae"
"LEKI2","FEKI2","Festuca kingii (S. Watson) Cassidy","","Poaceae"
"LEKI2","HEKI","Hesperochloa kingii (S. Watson) Rydb.","","Poaceae"
"LEKI2","POKI","Poa kingii S. Watson","","Poaceae"
"LELU","","Lesquerella ludoviciana (Nutt.) S. Watson","foothill bladderpod","Brassicaceae"
"LEMI3","","Lemna minor L.","common duckweed","Lemnaceae"
"LEMI3","LECY4","Lemna cyclostasa Elliott ex Schleid.","","Lemnaceae"
"LEMI3","LEMI2","Lemna minima Chevall. ex Schleid.","","Lemnaceae"
"LEMNA","","Lemna L.","duckweed","Lemnaceae"
"LEMO3","","Lesquerella montana (A. Gray) S. Watson","mountain bladderpod","Brassicaceae"
"LEMO4","","Leucocrinum montanum Nutt. ex A. Gray","common starlily","Liliaceae"
"LEOB2","","Lemna obscura (Austin) Daubs","little duckweed","Lemnaceae"
"LEOB2","LEMIO","Lemna minor L. var. obscura Austin","","Lemnaceae"
"LEONU","","Leonurus L.","motherwort","Lamiaceae"
"LEOR","","Leersia oryzoides (L.) Sw.","rice cutgrass","Poaceae"
"LEOR","HOOR3","Homalocenchrus oryzoides (L.) Pollich","","Poaceae"
"LEOR","PHOR5","Phalaris oryzoides L.","","Poaceae"
"LEPA6","","Leptochloa panicea (Retz.) Ohwi","mucronate sprangletop","Poaceae"
"LEPA6","DIPA26","Dinebra panicea (Retz.) P.M. Peterson & N. Snow","","Poaceae"
"LEPAB","","Leptochloa panicea (Retz.) Ohwi ssp. brachiata (Steud.) N. Snow","mucronate sprangeltop","Poaceae"
"LEPAB","FEFI2","Festuca filiformis Lam.","","Poaceae"
"LEPAB","LEBR17","Leptochloa brachiata Steud.","","Poaceae"
"LEPAB","LEFI","Leptochloa filiformis (Lam.) P. Beauv.","","Poaceae"
"LEPAB","LEFIP","Leptochloa filiformis (Lam.) P. Beauv. var. pulchella (Scribn.) Beetle","","Poaceae"
"LEPE","","Lemna perpusilla Torr.","minute duckweed","Lemnaceae"
"LEPE","LEPET","Lemna perpusilla Torr. var. trinervis Austin","","Lemnaceae"
