"Symbol","Synonym Symbol","Scientific Name with Author","State Common Name","Family"
"ABFR2","","Abronia fragrans Nutt. ex Hook.","snowball sand verbena","Nyctaginaceae"
"ABFR2","ABFRG2","Abronia fragrans Nutt. ex Hook. var. glaucescens A. Nelson","","Nyctaginaceae"
"ABRON","","Abronia Juss.","sand verbena","Nyctaginaceae"
"ABTH","","Abutilon theophrasti Medik.","velvetleaf","Malvaceae"
"ABTH","ABAB3","Abutilon abutilon (L.) Rusby, nom. inval.","","Malvaceae"
"ABTH","ABAV","Abutilon avicennae Gaertn.","","Malvaceae"
"ABUTI","","Abutilon Mill.","Indian mallow","Malvaceae"
"ACALY","","Acalypha L.","copperleaf","Euphorbiaceae"
"ACAM","","Acorus americanus (Raf.) Raf.","sweetflag","Acoraceae"
"ACAM","ACCA10","Acorus calamus auct. non L.","","Acoraceae"
"ACAM","ACCAA2","Acorus calamus L. var. americanus (Raf.) H.D. Wulff.","","Acoraceae"
"ACARO2","","Acarospora A. Massal.","cracked lichen","Acarosporaceae"
"ACCA4","","Acorus calamus L.","calamus","Acoraceae"
"ACCO4","","Aconitum columbianum Nutt.","Columbian monkshood","Ranunculaceae"
"ACCOC3","","Aconitum columbianum Nutt. ssp. columbianum","Columbian monkshood","Ranunculaceae"
"ACCOC3","ACCOP","Aconitum columbianum Nutt. ssp. pallidum Piper","","Ranunculaceae"
"ACCOC3","ACCOB","Aconitum columbianum Nutt. var. bakeri (Greene) Harrington","","Ranunculaceae"
"ACCOC3","ACCOO","Aconitum columbianum Nutt. var. ochroleucum A. Nelson","","Ranunculaceae"
"ACCOC3","ACGE3","Aconitum geranioides Greene","","Ranunculaceae"
"ACCOC3","ACLE6","Aconitum leibergii Greene","","Ranunculaceae"
"ACCOC3","ACMO3","Aconitum mogollonicum Greene","","Ranunculaceae"
"ACER","","Acer L.","maple","Aceraceae"
"ACGL","","Acer glabrum Torr.","Rocky Mountain maple","Aceraceae"
"ACGLG2","","Acer glabrum Torr. var. glabrum","Rocky Mountain maple","Aceraceae"
"ACGLG2","ACGLT3","Acer glabrum Torr. var. tripartitum (Nutt. ex Torr. & A. Gray) Pax","","Aceraceae"
"ACGLG2","ACGLT4","Acer glabrum Torr. var. typicum (Wesmael) Keller","","Aceraceae"
"ACGLG2","ACTR3","Acer tripartitum Nutt. ex Torr. & A. Gray","","Aceraceae"
"ACHIL","","Achillea L.","yarrow","Asteraceae"
"ACHNA","","Achnatherum P. Beauv.","needlegrass","Poaceae"
"ACHY","","Achnatherum hymenoides (Roem. & Schult.) Barkworth","Indian ricegrass","Poaceae"
"ACHY","ERCU9","Eriocoma cuspidata Nutt.","","Poaceae"
"ACHY","ORHY","Oryzopsis hymenoides (Roem. & Schult.) Ricker ex Piper","","Poaceae"
"ACHY","STHY6","Stipa hymenoides Roem. & Schult.","","Poaceae"
"ACMI2","","Achillea millefolium L.","common yarrow","Asteraceae"
"ACMIO","","Achillea millefolium L. var. occidentalis DC.","western yarrow","Asteraceae"
"ACMIO","ACAN7","Achillea angustissima Rydb.","","Asteraceae"
"ACMIO","ACAS2","Achillea aspleniifolia auct. non Vent.","","Asteraceae"
"ACMIO","ACER2","Achillea eradiata Piper","","Asteraceae"
"ACMIO","ACGR5","Achillea gracilis Raf.","","Asteraceae"
"ACMIO","ACLA5","Achillea lanulosa Nutt.","","Asteraceae"
"ACMIO","ACLAT","Achillea lanulosa Nutt. ssp. typica D.D. Keck","","Asteraceae"
"ACMIO","ACLAA3","Achillea lanulosa Nutt. var. arachnoidea Lunell","","Asteraceae"
"ACMIO","ACLAE","Achillea lanulosa Nutt. var. eradiata (Piper) M. Peck","","Asteraceae"
"ACMIO","ACLA3","Achillea laxiflora Pollard & Cockerell","","Asteraceae"
"ACMIO","ACMIL","Achillea millefolium L. ssp. lanulosa (Nutt.) Piper","","Asteraceae"
"ACMIO","ACMIO2","Achillea millefolium L. ssp. occidentalis (DC.) Hyl.","","Asteraceae"
"ACMIO","ACMIP5","Achillea millefolium L. ssp. pallidotegula B. Boivin","","Asteraceae"
"ACMIO","ACMIA4","Achillea millefolium L. var. aspleniifolia (Vent.) Farw.","","Asteraceae"
"ACMIO","ACMIG2","Achillea millefolium L. var. gracilis (Raf.) Raf. ex DC.","","Asteraceae"
"ACMIO","ACMIL3","Achillea millefolium L. var. lanulosa (Nutt.) Piper","","Asteraceae"
"ACMIO","ACMIR","Achillea millefolium L. var. rosea (Desf.) Torr. & A. Gray","","Asteraceae"
"ACMIO","ACMIR2","Achillea millefolium L. var. russeolata B. Boivin","","Asteraceae"
"ACMIO","ACOC","Achillea occidentalis (DC.) Raf. ex Rydb.","","Asteraceae"
"ACMIO","ACRO4","Achillea rosea Desf.","","Asteraceae"
"ACMIO","ACTO3","Achillea tomentosa Pursh, non L.","","Asteraceae"
"ACNE2","","Acer negundo L.","boxelder","Aceraceae"
"ACNE9","","Achnatherum nelsonii (Scribn.) Barkworth","Columbia needlegrass","Poaceae"
"ACNED","","Achnatherum nelsonii (Scribn.) Barkworth ssp. dorei (Barkworth & Maze) Barkworth","Dore's needlegrass","Poaceae"
"ACNED","ACNED2","Achnatherum nelsonii (Scribn.) Barkworth var. dorei (Barkworth & Maze) Dorn","","Poaceae"
"ACNED","STCO3","Stipa columbiana Macoun, nom. utique rej.","","Poaceae"
"ACNED","STMI6","Stipa minor (Vasey) Scribn.","","Poaceae"
"ACNED","STNED","Stipa nelsonii Scribn. ssp. dorei Barkworth & Maze","","Poaceae"
"ACNED","STNED2","Stipa nelsonii Scribn. var. dorei (Barkworth & Maze) Dorn","","Poaceae"
"ACNED","STOCM","Stipa occidentalis Thurb. var. minor sensu C.L. Hitchc., non (Vasey) C.L. Hitchc.","","Poaceae"
"ACNEI2","","Acer negundo L. var. interius (Britton) Sarg.","boxelder","Aceraceae"
"ACNEI2","ACIN3","Acer interius Britton","","Aceraceae"
"ACNEI2","ACNEI","Acer negundo L. ssp. interius (Britton) Á. Löve & D. Löve","","Aceraceae"
"ACNEI2","NEACI","Negundo aceroides (L.) Moench ssp. interius (Britton) Á. Löve & D. Löve","","Aceraceae"
"ACNEI2","NEIN3","Negundo interius (Britton) Rydb.","","Aceraceae"
"ACNEN","","Acer negundo L. var. negundo","boxelder","Aceraceae"
"ACNEN","ACNEV2","Acer negundo L. var. variegatum Jacques","","Aceraceae"
"ACNEN","NEAC","Negundo aceroides (L.) Moench","","Aceraceae"
"ACNEN","NENE","Negundo negundo (L.) Karst., nom. inval.","","Aceraceae"
"ACNEV","","Acer negundo L. var. violaceum (G. Kirchn.) H. Jaeger","boxelder","Aceraceae"
"ACNEV","NEACV","Negundo aceroides (L.) Moench ssp. violaceum (G. Kirchn.) W.A. Weber","","Aceraceae"
"ACNI5","","Acer nigrum Michx. f.","black maple","Aceraceae"
"ACNI5","ACNIP","Acer nigrum Michx. f. var. palmeri Sarg.","","Aceraceae"
"ACNI5","ACSAN","Acer saccharum Marshall ssp. nigrum (Michx. f.) Desmarais","","Aceraceae"
"ACNI5","ACSAN2","Acer saccharum Marshall var. nigrum (Michx. f.) Britton","","Aceraceae"
"ACNI5","ACSAV","Acer saccharum Marshall var. viride (Schmidt) A.E. Murray","","Aceraceae"
"ACNI5","SANI9","Saccharodendron nigrum (Michx. f.) Small","","Aceraceae"
"ACONI","","Aconitum L.","monkshood","Ranunculaceae"
"ACORU","","Acorus L.","sweetflag","Acoraceae"
"ACRE3","","Acroptilon repens (L.) DC.","hardheads","Asteraceae"
"ACRE3","CEPI3","Centaurea picris Pall. ex Willd.","","Asteraceae"
"ACRE3","CERE6","Centaurea repens L.","","Asteraceae"
"ACRH","","Acalypha rhomboidea Raf.","common threeseed mercury","Euphorbiaceae"
"ACRH","ACVIR","Acalypha virginica L. var. rhomboidea (Raf.) Cooperr.","","Euphorbiaceae"
"ACRI8","","Achnatherum richardsonii (Link) Barkworth","Richardson's needlegrass","Poaceae"
"ACRI8","STRI2","Stipa richardsonii Link","","Poaceae"
"ACRO7","","Achnatherum robustum (Vasey) Barkworth","sleepygrass","Poaceae"
"ACRO7","STRO3","Stipa robusta (Vasey) Scribn.","","Poaceae"
"ACRO7","STVA4","Stipa vaseyi Scribn.","","Poaceae"
"ACROP","","Acroptilon Cass.","hardheads","Asteraceae"
"ACRU2","","Actaea rubra (Aiton) Willd.","red baneberry","Ranunculaceae"
"ACRUR2","","Actaea rubra (Aiton) Willd. ssp. rubra","red baneberry","Ranunculaceae"
"ACRUR2","ACRUR3","Actaea rubra (Aiton) Willd. var. rubra","","Ranunculaceae"
"ACRUR2","ACSPR3","Actaea spicata L. ssp. rubra (Aiton) Hultén","","Ranunculaceae"
"ACSA2","","Acer saccharinum L.","silver maple","Aceraceae"
"ACSA2","ACDA2","Acer dasycarpum Ehrh.","","Aceraceae"
"ACSA2","ACSAL3","Acer saccharinum L. var. laciniatum Pax","","Aceraceae"
"ACSA2","ACSAW","Acer saccharinum L. var. wieri Rehder","","Aceraceae"
"ACSA2","ARSA9","Argentacer saccharinum (L.) Small","","Aceraceae"
"ACSA3","","Acer saccharum Marshall","sugar maple","Aceraceae"
"ACSAS","","Acer saccharum Marshall var. saccharum","sugar maple","Aceraceae"
"ACSAS","ACNIG","Acer nigrum Michx. f. var. glaucum (F. Schmidt) Fosberg","","Aceraceae"
"ACSAS","ACNIS2","Acer nigrum Michx. f. var. saccharophorum (K. Koch) R.T. Clausen","","Aceraceae"
"ACSAS","ACSAG","Acer saccharum Marshall var. glaucum (F. Schmidt) Sarg.","","Aceraceae"
"ACSAS","ACSAR","Acer saccharum Marshall var. rugellii (Pax) Rehder","","Aceraceae"
"ACSAS","SASA18","Saccharodendron saccharum (Marshall) Moldenke","","Aceraceae"
"ACTAE","","Actaea L.","baneberry","Ranunculaceae"
"ACVI","","Acalypha virginica L.","Virginia threeseed mercury","Euphorbiaceae"
"ACWE3","","Achnatherum webberi (Thurb.) Barkworth","Webber needlegrass","Poaceae"
"ACWE3","ORWE","Oryzopsis webberi (Thurb.) Benth. ex Vasey","","Poaceae"
"ACWE3","STWE","Stipa webberi (Thurb.) B.L. Johnson","","Poaceae"
"ADBI","","Adenocaulon bicolor Hook.","American trailplant","Asteraceae"
"ADCA","","Adiantum capillus-veneris L.","common maidenhair","Pteridaceae"
"ADCA","ADCAM","Adiantum capillus-veneris L. var. modestum (Underw.) Fernald","","Pteridaceae"
"ADCA","ADCAP","Adiantum capillus-veneris L. var. protrusum Fernald","","Pteridaceae"
"ADCA","ADMO2","Adiantum modestum Underw.","","Pteridaceae"
"ADENO","","Adenocaulon Hook.","trailplant","Asteraceae"
"ADIAN","","Adiantum L.","maidenhair fern","Pteridaceae"
"ADMO","","Adoxa moschatellina L.","muskroot","Adoxaceae"
"ADOXA","","Adoxa L.","adoxa","Adoxaceae"
"ADPE","","Adiantum pedatum L.","northern maidenhair","Pteridaceae"
"AECY","","Aegilops cylindrica Host","jointed goatgrass","Poaceae"
"AECY","AECYR","Aegilops cylindrica Host var. rubiginosa Popova","","Poaceae"
"AECY","AETA3","Aegilops tauschii auct. non Coss.","","Poaceae"
"AECY","CYCY5","Cylindropyrum cylindricum (Host) Á. Löve","","Poaceae"
"AECY","TRCY3","Triticum cylindricum (Host) Ces., Pass. & Gibelli","","Poaceae"
"AEGIL","","Aegilops L.","goatgrass","Poaceae"
"AGAL5","","Ageratina altissima (L.) R.M. King & H. Rob.","white snakeroot","Asteraceae"
"AGALA","","Ageratina altissima (L.) R.M. King & H. Rob. var. altissima","white snakeroot","Asteraceae"
"AGALA","AGAL9","Ageratum altissimum L., non Eupatorium altissimum L.","","Asteraceae"
"AGALA","EURU6","Eupatorium rugosum Houtt.","","Asteraceae"
"AGALA","EURUC","Eupatorium rugosum Houtt. var. chlorolepis Fernald","","Asteraceae"
"AGALA","EURUT","Eupatorium rugosum Houtt. var. tomentellum (B.L. Rob.) S.F. Blake","","Asteraceae"
"AGALA","EURUV","Eupatorium rugosum Houtt. var. villicaule (Fernald) S.F. Blake","","Asteraceae"
"AGALA","EUURT","Eupatorium urticifolium Reichard var. tomentellum B.L. Rob.","","Asteraceae"
"AGALI","","Agalinis Raf.","false foxglove","Scrophulariaceae"
"AGAS2","","Agalinis aspera (Douglas ex Benth.) Britton","tall false foxglove","Scrophulariaceae"
"AGAS2","GEAS2","Gerardia aspera Douglas ex Benth.","","Scrophulariaceae"
"AGAST","","Agastache Clayton ex Gronov.","giant hyssop","Lamiaceae"
"AGAU2","","Agoseris aurantiaca (Hook.) Greene","orange agoseris","Asteraceae"
"AGAUA","","Agoseris aurantiaca (Hook.) Greene var. aurantiaca","orange agoseris","Asteraceae"
"AGAUA","AGGR7","Agoseris graminifolia Greene","","Asteraceae"
"AGAUA","AGRO2","Agoseris rostrata Rydb.","","Asteraceae"
"AGAUA","TRAU8","Troximon aurantiacum Hook.","","Asteraceae"
"AGCR","","Agropyron cristatum (L.) Gaertn.","crested wheatgrass","Poaceae"
"AGCRP8","","Agropyron cristatum (L.) Gaertn. ssp. pectinatum (M. Bieb.) Tzvelev","crested wheatgrass","Poaceae"
"AGCRP8","AGCR3","Agropyron cristatiforme Sarkar","","Poaceae"
"AGCRP8","AGPE6","Agropyron pectinatum (M. Bieb.) P. Beauv.","","Poaceae"
"AGCRP8","AGPE5","Agropyron pectiniforme Roem. & Schult.","","Poaceae"
"AGDE2","","Agropyron desertorum (Fisch. ex Link) Schult.","desert wheatgrass","Poaceae"
"AGDE2","AGCRD","Agropyron cristatum (L.) Gaertn. ssp. desertorum (Fisch. ex Link) Á. Löve","","Poaceae"
"AGDE2","AGCRD2","Agropyron cristatum (L.) Gaertn. var. desertorum (Fisch. ex Link) Dorn","","Poaceae"
"AGERA2","","Ageratina Spach","snakeroot","Asteraceae"
"AGEX","","Agrostis exarata Trin.","spike bentgrass","Poaceae"
"AGEX","AGAE2","Agrostis aenea Trin.","","Poaceae"
"AGEX","AGAL2","Agrostis alaskana Hultén","","Poaceae"
"AGEX","AGAM2","Agrostis ampla Hitchc.","","Poaceae"
"AGEX","AGAS4","Agrostis asperifolia Trin.","","Poaceae"
"AGEX","AGEXM3","Agrostis exarata Trin. ssp. minor (Hook.) C.L. Hitchc.","","Poaceae"
"AGEX","AGEXM","Agrostis exarata Trin. var. minor Hook.","","Poaceae"
"AGEX","AGEXM2","Agrostis exarata Trin. var. monolepis (Torr.) Hitchc.","","Poaceae"
"AGEX","AGEXP2","Agrostis exarata Trin. var. pacifica Vasey","","Poaceae"
"AGEX","AGEXP","Agrostis exarata Trin. var. purpurascens Hultén","","Poaceae"
"AGEX","AGLO2","Agrostis longiligula Hitchc.","","Poaceae"
"AGEX","AGLOA","Agrostis longiligula Hitchc. var. australis J.T. Howell","","Poaceae"
"AGEX","AGME","Agrostis melaleuca (Trin.) Hitchc.","","Poaceae"
"AGEX","AGMIM","Agrostis microphylla Steud. var. major Vasey","","Poaceae"
"AGFO","","Agastache foeniculum (Pursh) Kuntze","blue giant hyssop","Lamiaceae"
"AGFO","AGAN3","Agastache anethiodora (Nutt.) Britton","","Lamiaceae"
"AGFR","","Agropyron fragile (Roth) P. Candargy","Siberian wheatgrass","Poaceae"
"AGFR","AGCRF","Agropyron cristatum (L.) Gaertn. ssp. fragile (Roth) Á. Löve","","Poaceae"
"AGFR","AGCRF2","Agropyron cristatum (L.) Gaertn. var. fragile (Roth) Dorn","","Poaceae"
"AGFR","AGFRM","Agropyron fragile (Roth) P. Candargy ssp. mongolicum (Keng) D.R. Dewey","","Poaceae"
"AGFR","AGFRS","Agropyron fragile (Roth) P. Candargy ssp. sibiricum (Willd.) Melderis","","Poaceae"
"AGFR","AGFRS2","Agropyron fragile (Roth) P. Candargy var. sibiricum (Willd.) Tzvelev","","Poaceae"
"AGFR","AGMO6","Agropyron mongolicum Keng","","Poaceae"
"AGFR","AGSI","Agropyron sibiricum (Willd.) P. Beauv.","","Poaceae"
"AGGI","","Agrostemma githago L.","common corncockle","Caryophyllaceae"
"AGGL","","Agoseris glauca (Pursh) Raf.","pale agoseris","Asteraceae"
"AGGLD","","Agoseris glauca (Pursh) Raf. var. dasycephala (Torr. & A. Gray) Jeps.","pale agoseris","Asteraceae"
"AGGLD","AGGLS","Agoseris glauca (Pursh) Raf. ssp. scorzonerifolia (Schrad.) Piper","","Asteraceae"
"AGGLD","AGGLA2","Agoseris glauca (Pursh) Raf. var. asper (Rydb.) Cronquist","","Asteraceae"
"AGGLD","AGGLP2","Agoseris glauca (Pursh) Raf. var. pumila (Nutt.) Garrett","","Asteraceae"
"AGGLD","AGSC7","Agoseris scorzonerifolia (Schrad.) Greene","","Asteraceae"
"AGGLD","TRGLD","Troximon glaucum Pursh var. dasycephalum Torr. & A. Gray","","Asteraceae"
"AGGLG","","Agoseris glauca (Pursh) Raf. var. glauca","pale agoseris","Asteraceae"
"AGGLG","AGTU3","Agoseris turbinata Rydb.","","Asteraceae"
"AGGLG","TRGL7","Troximon glaucum Pursh","","Asteraceae"
"AGGR2","","Agrimonia gryposepala Wallr.","tall hairy agrimony","Rosaceae"
"AGHY","","Agrostis hyemalis (Walter) Britton, Sterns & Poggenb.","winter bentgrass","Poaceae"
"AGHY","AGAN2","Agrostis antecedens E.P. Bicknell","","Poaceae"
"AGHY","COHY2","Cornucopiae hyemalis Walter","","Poaceae"
"AGNE2","","Agastache nepetoides (L.) Kuntze","yellow giant hyssop","Lamiaceae"
"AGOSE","","Agoseris Raf.","agoseris","Asteraceae"
"AGPA6","","Agrimonia parviflora Aiton","harvestlice","Rosaceae"
"AGPE","","Agrostis perennans (Walter) Tuck.","upland bentgrass","Poaceae"
"AGPE","AGAL8","Agrostis altissima (Walter) Tuck.","","Poaceae"
"AGPE","AGEL5","Agrostis elata (Pursh) Trin.","","Poaceae"
"AGPE","AGOR3","Agrostis oreophila Trin.","","Poaceae"
"AGPE","AGPEA","Agrostis perennans (Walter) Tuck. var. aestivalis Vasey","","Poaceae"
"AGPE","AGPEE","Agrostis perennans (Walter) Tuck. var. elata (Pursh) Hitchc.","","Poaceae"
"AGPE","AGSC6","Agrostis schweinitzii Trin.","","Poaceae"
"AGPE","COPE7","Cornucopiae perennans Walter","","Poaceae"
"AGPU","","Agrimonia pubescens Wallr.","soft agrimony","Rosaceae"
"AGPU","AGBI","Agrimonia bicknellii (Kearney) Rydb.","","Rosaceae"
"AGPU","AGMO3","Agrimonia mollis (Torr. & A. Gray) Britton","","Rosaceae"
"AGRIM","","Agrimonia L.","agrimony","Rosaceae"
"AGROP2","","Agropyron Gaertn.","wheatgrass","Poaceae"
"AGROS","","Agrostemma L.","corncockle","Caryophyllaceae"
"AGROS2","","Agrostis L.","bentgrass","Poaceae"
"AGSC","","Agastache scrophulariifolia (Willd.) Kuntze","purple giant hyssop","Lamiaceae"
"AGSC","AGSCM","Agastache scrophulariifolia (Willd.) Kuntze var. mollis (Fernald) A. Heller","","Lamiaceae"
"AGSC5","","Agrostis scabra Willd.","rough bentgrass","Poaceae"
"AGSC5","AGGE2","Agrostis geminata Trin.","","Poaceae"
"AGSC5","AGHYG","Agrostis hyemalis (Walter) Britton, Sterns & Poggenb. var. geminata (Trin.) Hitchc.","","Poaceae"
"AGSC5","AGHYS","Agrostis hyemalis (Walter) Britton, Sterns & Poggenb. var. scabra (Willd.) Blomquist","","Poaceae"
"AGSC5","AGHYT","Agrostis hyemalis (Walter) Britton, Sterns & Poggenb. var. tenuis (Tuck.) Gleason","","Poaceae"
"AGSC5","AGSCS4","Agrostis scabra Willd. ssp. septentrionalis (Fernald) Á. Löve & D. Löve","","Poaceae"
"AGSC5","AGSCG","Agrostis scabra Willd. var. geminata (Trin.) Swallen","","Poaceae"
"AGSC5","AGSCS","Agrostis scabra Willd. var. septentrionalis Fernald","","Poaceae"
"AGST","","Agrimonia striata Michx.","roadside agrimony","Rosaceae"
"AGST2","","Agrostis stolonifera L.","creeping bentgrass","Poaceae"
"AGST2","AGALP","Agrostis alba L. var. palustris (Huds.) Pers.","","Poaceae"
"AGST2","AGALS","Agrostis alba L. var. stolonifera (L.) Sm.","","Poaceae"
"AGST2","AGMA10","Agrostis maritima Lam.","","Poaceae"
"AGST2","AGPA17","Agrostis palustris Huds.","","Poaceae"
"AGST2","AGSTC","Agrostis stolonifera L. var. compacta Hartm.","","Poaceae"
"AGST2","AGSTP","Agrostis stolonifera L. var. palustris (Huds.) Farw.","","Poaceae"
"AGTE3","","Agalinis tenuifolia (Vahl) Raf.","slenderleaf false foxglove","Scrophulariaceae"
"AGTEP2","","Agalinis tenuifolia (Vahl) Raf. var. parviflora (Nutt.) Pennell","slenderleaf false foxglove","Scrophulariaceae"
"AGTEP2","GETEP6","Gerardia tenuifolia Vahl ssp. parviflora (Nutt.) Pennell","","Scrophulariaceae"
"AGTEP2","GETEP4","Gerardia tenuifolia Vahl var. parviflora Nutt.","","Scrophulariaceae"
"ALAE","","Alopecurus aequalis Sobol.","shortawn foxtail","Poaceae"
"ALAEA","","Alopecurus aequalis Sobol. var. aequalis","shortawn foxtail","Poaceae"
"ALAEA","ALAEN","Alopecurus aequalis Sobol. var. natans (Wahlenb.) Fernald","","Poaceae"
"ALAEA","ALAR5","Alopecurus aristulatus Michx.","","Poaceae"
"ALAEA","ALGEA","Alopecurus geniculatus L. var. aristulatus (Michx.) Torr.","","Poaceae"
"ALAL3","","Alyssum alyssoides (L.) L.","pale madwort","Brassicaceae"
"ALAL3","ALCA11","Alyssum calycinum L.","","Brassicaceae"
"ALAL3","CLAL10","Clypeola alyssoides L.","","Brassicaceae"
"ALAR","","Alopecurus arundinaceus Poir.","creeping meadow foxtail","Poaceae"
"ALAR","ALVE","Alopecurus ventricosus Pers., non (Gouan) Huds.","","Poaceae"
"ALBU2","","Allium burdickii (Hanes) A.G. Jones","narrowleaf wild leek","Liliaceae"
"ALBU2","ALTRB","Allium tricoccum Aiton var. burdickii Hanes","","Liliaceae"
"ALCA3","","Allium canadense L.","meadow garlic","Liliaceae"
"ALCA4","","Alopecurus carolinianus Walter","Carolina foxtail","Poaceae"
"ALCA4","ALMA15","Alopecurus macounii Vasey","","Poaceae"
"ALCA4","ALRA4","Alopecurus ramosus Poir.","","Poaceae"
"ALCAC","","Allium canadense L. var. canadense","meadow garlic","Liliaceae"
"ALCAC","ALAC3","Allium acetabulum (Raf.) Shinners","","Liliaceae"
"ALCAC","ALCAO","Allium canadense L. var. ovoideum Farw.","","Liliaceae"
"ALCAC","ALCAR","Allium canadense L. var. robustum Farw.","","Liliaceae"
"ALCAC","ALCO4","Allium continuum Small","","Liliaceae"
"ALCAF","","Allium canadense L. var. fraseri Ownbey","Fraser meadow garlic","Liliaceae"
"ALCAF","ALFR","Allium fraseri (Ownbey) Shinners","","Liliaceae"
"ALCAF","ALLAF2","Allium lavandulare Bates ssp. fraseri (Ownbey) Traub & Owenbey","","Liliaceae"
"ALCAF","ALLAF","Allium lavandulare Bates var. fraseri (Ownbey) Shinners","","Liliaceae"
"ALCAL","","Allium canadense L. var. lavandulare (Bates) Ownbey & Aase","meadow garlic","Liliaceae"
"ALCAL","ALCAL2","Allium canadense L. ssp. lavandulare (Bates) Traub & Ownbey","","Liliaceae"
"ALCAL","ALLA8","Allium lavandulare Bates","","Liliaceae"
"ALCE2","","Allium cernuum Roth","nodding onion","Liliaceae"
"ALCEA","","Alcea L.","hollyhock","Malvaceae"
"ALCEC2","","Allium cernuum Roth var. cernuum","nodding onion","Liliaceae"
"ALDE","","Alyssum desertorum Stapf","desert madwort","Brassicaceae"
"ALDED","","Alyssum desertorum Stapf var. desertorum","desert madwort","Brassicaceae"
"ALDED","ALTU2","Alyssum turkestanicum auct. non Regel & Schmalh.","","Brassicaceae"
"ALDR","","Allium drummondii Regel","Drummond's onion","Liliaceae"
"ALDR","ALHE2","Allium helleri Small","","Liliaceae"
"ALDR","ALNU2","Allium nuttallii S. Watson","","Liliaceae"
"ALGE","","Allium geyeri S. Watson","Geyer's onion","Liliaceae"
"ALGE2","","Alopecurus geniculatus L.","water foxtail","Poaceae"
"ALGEG","","Allium geyeri S. Watson var. geyeri","Geyer's onion","Liliaceae"
"ALGEG","ALDI5","Allium dictyotum Greene","","Liliaceae"
"ALGEG4","","Alopecurus geniculatus L. var. geniculatus","water foxtail","Poaceae"
"ALGEG4","ALPA9","Alopecurus pallescens Piper","","Poaceae"
"ALGR","","Alisma gramineum Lej.","narrowleaf water plantain","Alismataceae"
"ALGR","ALGE3","Alisma geyeri Torr.","","Alismataceae"
"ALGR","ALGRA","Alisma gramineum Lej. var. angustissimum (DC.) A.J. Hendricks","","Alismataceae"
"ALGR","ALGRG2","Alisma gramineum Lej. var. geyeri (Torr.) Lam.","","Alismataceae"
"ALGR","ALGRG3","Alisma gramineum Lej. var. graminifolium (Wahlenb.) A.J. Hendricks","","Alismataceae"
"ALGR","ALGRW","Alisma gramineum Lej. var. wahlenbergii auct. non (Holmb.) Raymond & Kucyniak","","Alismataceae"
"ALGR","ALLA5","Alisma lanceolatum A. Gray","","Alismataceae"
"ALISM","","Alisma L.","water plantain","Alismataceae"
"ALLIU","","Allium L.","onion","Liliaceae"
"ALMUT2","","Almutaster Á. Löve & D. Löve","alkali marsh aster","Asteraceae"
"ALOPE","","Alopecurus L.","foxtail","Poaceae"
"ALPA14","","Almutaster pauciflorus (Nutt.) Á. Löve & D. Löve","alkali marsh aster","Asteraceae"
"ALPA14","ASHY6","Aster hydrophilus Greene ex Wooton & Standl.","","Asteraceae"
"ALPA14","ASPA8","Aster pauciflorus Nutt.","","Asteraceae"
"ALPE2","","Allium perdulce S.V. Fraser","plains onion","Liliaceae"
"ALPEP","","Allium perdulce S.V. Fraser var. perdulce","plains onion","Liliaceae"
"ALPR3","","Alopecurus pratensis L.","meadow foxtail","Poaceae"
"ALRO3","","Alcea rosea L.","hollyhock","Malvaceae"
"ALRO3","ALFI9","Alcea ficifolia L.","","Malvaceae"
"ALRO3","ALRO4","Althaea rosea (L.) Cav.","","Malvaceae"
"ALST","","Allium stellatum Fraser ex Ker Gawl.","autumn onion","Liliaceae"
"ALSU","","Alisma subcordatum Raf.","American water plantain","Alismataceae"
"ALSU","ALPLS","Alisma plantago-aquatica L. ssp. subcordatum (Raf.) Hultén","","Alismataceae"
"ALSU","ALPLP","Alisma plantago-aquatica L. var. parviflorum (Pursh) Torr.","","Alismataceae"
"ALTE","","Allium textile A. Nelson & J.F. Macbr.","textile onion","Liliaceae"
"ALTE","ALAR6","Allium aridum Rydb.","","Liliaceae"
"ALTE","ALGET3","Allium geyeri S. Watson var. textile (A. Nelson & J.F. Macbr.) B. Boivin","","Liliaceae"
"ALTE","ALRE5","Allium reticulatum G. Don","","Liliaceae"
"ALTE","ALREP","Allium reticulatum G. Don var. playanum M.E. Jones","","Liliaceae"
"ALTR3","","Allium tricoccum Aiton","ramp","Liliaceae"
"ALTR3","VATR","Validallium tricoccum (Aiton) Small","","Liliaceae"
"ALTR7","","Alisma triviale Pursh","northern water plantain","Alismataceae"
"ALTR7","ALBR10","Alisma brevipes Greene","","Alismataceae"
"ALTR7","ALPLB","Alisma plantago-aquatica L. ssp. brevipes (Greene) Sam.","","Alismataceae"
"ALTR7","ALPLA","Alisma plantago-aquatica L. var. americanum Schult.","","Alismataceae"
"ALTR7","ALPLB2","Alisma plantago-aquatica L. var. brevipes (Greene) Vict.","","Alismataceae"
"ALYSS","","Alyssum L.","madwort","Brassicaceae"
"AMAC2","","Ambrosia acanthicarpa Hook.","flatspine bur ragweed","Asteraceae"
"AMAC2","FRAC2","Franseria acanthicarpa (Hook.) Coville","","Asteraceae"
"AMAC2","GAAC2","Gaertneria acanthicarpa (Hook.) Britton","","Asteraceae"
"AMAL","","Amaranthus albus L.","prostrate pigweed","Amaranthaceae"
"AMAL","AMALP3","Amaranthus albus L. var. pubescens (Uline & Bray) Fernald","","Amaranthaceae"
"AMAL","AMGRP","Amaranthus graecizans L. var. pubescens Uline & Bray","","Amaranthaceae"
"AMAL","AMPU","Amaranthus pubescens (Uline & Bray) Rydb.","","Amaranthaceae"
"AMAL2","","Amelanchier alnifolia (Nutt.) Nutt. ex M. Roem.","Saskatoon serviceberry","Rosaceae"
"AMALA","","Amelanchier alnifolia (Nutt.) Nutt. ex M. Roem. var. alnifolia","Saskatoon serviceberry","Rosaceae"
"AMAR","","Amaranthus arenicola I.M. Johnst.","sandhill amaranth","Amaranthaceae"
"AMAR2","","Ambrosia artemisiifolia L.","annual ragweed","Asteraceae"
"AMARA","","Amaranthus L.","pigweed","Amaranthaceae"
"AMARE","","Ambrosia artemisiifolia L. var. elatior (L.) Descourtils","annual ragweed","Asteraceae"
"AMARE","AMEL2","Ambrosia elatior L.","","Asteraceae"
"AMAU2","","Ammannia auriculata Willd.","eared redstem","Lythraceae"
"AMAU2","AMAUA","Ammannia auriculata Willd. var. arenaria (Kunth) Koehne","","Lythraceae"
"AMBL","","Amaranthus blitoides S. Watson","mat amaranth","Amaranthaceae"
"AMBL","AMGR","Amaranthus graecizans auct. non L.","","Amaranthaceae"
"AMBR2","","Amphicarpaea bracteata (L.) Fernald","American hogpeanut","Fabaceae"
"AMBRB","","Amphicarpaea bracteata (L.) Fernald var. bracteata","American hogpeanut","Fabaceae"
"AMBRB","AMMO5","Amphicarpaea monoica (L.) Elliott","","Fabaceae"
"AMBRO","","Ambrosia L.","ragweed","Asteraceae"
"AMCA","","Amaranthus californicus (Moq.) S. Watson","California amaranth","Amaranthaceae"
"AMCA","AMAL4","Amaranthus albomarginatus Uline & Bray","","Amaranthaceae"
"AMCA","AMMI5","Amaranthus microphyllus Shinners","","Amaranthaceae"
"AMCA6","","Amorpha canescens Pursh","leadplant","Fabaceae"
"AMCA6","AMBR6","Amorpha brachycarpa Palmer","","Fabaceae"
"AMCO","","Ammannia coccinea Rottb.","valley redstem","Lythraceae"
