"COAM8","","Corispermum americanum (Nutt.) Nutt.","American bugseed","Chenopodiaceae"
"COAMA2","","Corispermum americanum (Nutt.) Nutt. var. americanum","American bugseed","Chenopodiaceae"
"COAMA2","COMA23","Corispermum marginale Rydb. p.p.","","Chenopodiaceae"
"COAMA2","COOR3","Corispermum orientale auct. non Lam.","","Chenopodiaceae"
"COAMA2","COSI6","Corispermum simplicissimum Lunell","","Chenopodiaceae"
"COAR4","","Convolvulus arvensis L.","field bindweed","Convolvulaceae"
"COAR4","COAM10","Convolvulus ambigens House","","Convolvulaceae"
"COAR4","COIN7","Convolvulus incanus auct. non Vahl","","Convolvulaceae"
"COAR4","STAR7","Strophocaulos arvensis (L.) Small","","Convolvulaceae"
"COAU2","","Corydalis aurea Willd.","scrambled eggs","Fumariaceae"
"COAU2","CAAU11","Capnoides aureum (Willd.) Kuntze","","Fumariaceae"
"COAU2","COWA5","Corydalis washingtoniana Fedde","","Fumariaceae"
"COCA13","","Cornus canadensis L.","bunchberry dogwood","Cornaceae"
"COCA13","CHCA24","Chamaepericlymenum canadense (L.) Asch. & Graebn.","","Cornaceae"
"COCA13","COCA27","Cornella canadensis (L.) Rydb.","","Cornaceae"
"COCA13","COCAD","Cornus canadensis L. var. dutillyi (Lepage) B. Boivin","","Cornaceae"
"COCA5","","Conyza canadensis (L.) Cronquist","Canadian horseweed","Asteraceae"
"COCAC3","","Conyza canadensis (L.) Cronquist var. canadensis","Canadian horseweed","Asteraceae"
"COCAC3","ERCA20","Erigeron canadensis L.","","Asteraceae"
"COCAC3","LECA16","Leptilon canadense (L.) Britton","","Asteraceae"
"COCO3","","Commelina communis L.","Asiatic dayflower","Commelinaceae"
"COCO3","COCOC3","Commelina communis L. var. communis","","Commelinaceae"
"COCO3","COCOL","Commelina communis L. var. ludens (Miq.) C.B. Clarke","","Commelinaceae"
"COCO3","CODE9","Commelina debilis Ledeb.","","Commelinaceae"
"COCO3","COWI4","Commelina willdenowii Kunth","","Commelinaceae"
"COCO6","","Corylus cornuta Marshall","beaked hazelnut","Betulaceae"
"COCOC2","","Corylus cornuta Marshall var. cornuta","beaked hazelnut","Betulaceae"
"COCOC2","CORO5","Corylus rostrata Aiton","","Betulaceae"
"COCU2","","Corydalis curvisiliqua Engelm.","curvepod fumewort","Fumariaceae"
"COCUO","","Corydalis curvisiliqua Engelm. ssp. occidentalis (Engelm. ex A. Gray) W.A. Weber","curvepod fumewort","Fumariaceae"
"COCUO","CAMO18","Capnoides montanum (Engelm.) Britton","","Fumariaceae"
"COCUO","COAUO2","Corydalis aurea Willd. ssp. occidentalis (Engelm. ex A. Gray) G.B. Ownbey","","Fumariaceae"
"COCUO","COAUO","Corydalis aurea Willd. var. occidentalis Engelm. ex A. Gray","","Fumariaceae"
"COCUO","COMO6","Corydalis montana Engelm.","","Fumariaceae"
"CODR","","Cornus drummondii C.A. Mey.","roughleaf dogwood","Cornaceae"
"CODR","COPR4","Cornus priceae Small","","Cornaceae"
"CODR","SWPR","Swida priceae (Small) Small","","Cornaceae"
"COER","","Commelina erecta L.","whitemouth dayflower","Commelinaceae"
"COERA","","Commelina erecta L. var. angustifolia (Michx.) Fernald","whitemouth dayflower","Commelinaceae"
"COERA","COAN8","Commelina angustifolia Michx.","","Commelinaceae"
"COERA","COCR4","Commelina crispa Wooton","","Commelinaceae"
"COERA","COERC","Commelina erecta L. var. crispa (Wooton) Palmer & Steyerm.","","Commelinaceae"
"COERA","CONA","Commelina nashii Small","","Commelinaceae"
"COLI2","","Collomia linearis Nutt.","tiny trumpet","Polemoniaceae"
"COLLI","","Collinsia Nutt.","blue eyed Mary","Scrophulariaceae"
"COLLO","","Collomia Nutt.","trumpet","Polemoniaceae"
"COMA2","","Conium maculatum L.","poison hemlock","Apiaceae"
"COMA25","","Corallorhiza maculata (Raf.) Raf.","summer coralroot","Orchidaceae"
"COMA25","COMA4","Corallorrhiza maculata (Raf.) Raf., orth. var.","","Orchidaceae"
"COMAN","","Comandra Nutt.","bastard toadflax","Santalaceae"
"COMAO5","","Corallorhiza maculata (Raf.) Raf. var. occidentalis (Lindl.) Ames","summer coralroot","Orchidaceae"
"COMAO5","COMAO4","Corallorhiza maculata (Raf.) Raf. ssp. occidentalis (Lindl.) Cockerell","","Orchidaceae"
"COMAO5","COMAI3","Corallorhiza maculata (Raf.) Raf. var. immaculata M. Peck","","Orchidaceae"
"COMAO5","COMAI4","Corallorhiza maculata (Raf.) Raf. var. intermedia Farw.","","Orchidaceae"
"COMAO5","COMAP4","Corallorhiza maculata (Raf.) Raf. var. punicea Bartlett","","Orchidaceae"
"COMAO5","COMAO3","Corallorrhiza maculata (Raf.) Raf. ssp. occidentalis (Lindl.) Cockerell, orth. var.","","Orchidaceae"
"COMAO5","COMAI","Corallorrhiza maculata (Raf.) Raf. var. immaculata M. Peck, orth. var.","","Orchidaceae"
"COMAO5","COMAI2","Corallorrhiza maculata (Raf.) Raf. var. intermedia Farw., orth. var.","","Orchidaceae"
"COMAO5","COMAO","Corallorrhiza maculata (Raf.) Raf. var. occidentalis (Lindl.) Ames, orth. var.","","Orchidaceae"
"COMAO5","COMAP2","Corallorrhiza maculata (Raf.) Raf. var. punicea Bartlett, orth. var.","","Orchidaceae"
"COMI2","","Corydalis micrantha (Engelm. ex A. Gray) A. Gray","smallflower fumewort","Fumariaceae"
"COMIM2","","Corydalis micrantha (Engelm. ex A. Gray) A. Gray ssp. micrantha","smallflower fumewort","Fumariaceae"
"COMIM2","CAMI32","Capnoides micranthum (Engelm. ex A. Gray) Britton","","Fumariaceae"
"COMIM2","COAUM","Corydalis aurea Willd. var. micrantha Engelm. ex A. Gray","","Fumariaceae"
"COMME","","Commelina L.","dayflower","Commelinaceae"
"CONIU","","Conium L.","poison hemlock","Apiaceae"
"CONRI","","Conringia Heist. ex Fabr.","hare's ear mustard","Brassicaceae"
"CONSO","","Consolida Gray","knight's-spur","Ranunculaceae"
"CONVO","","Convolvulus L.","bindweed","Convolvulaceae"
"CONYZ","","Conyza Less.","horseweed","Asteraceae"
"COOB9","","Cornus obliqua Raf.","silky dogwood","Cornaceae"
"COOB9","COAMO","Cornus amomum Mill. ssp. obliqua (Raf.) J.S. Wilson","","Cornaceae"
"COOB9","COAMS","Cornus amomum Mill. var. schuetzeana (C.A. Mey.) Rickett","","Cornaceae"
"COOB9","COPU10","Cornus purpusii Koehne","","Cornaceae"
"COOB9","SWAMS","Swida amomum (Mill.) Small var. schuetzeana (C.A. Mey.) A.Haines","","Cornaceae"
"COOD7","","Corallorhiza odontorhiza (Willd.) Poir.","autumn coralroot","Orchidaceae"
"COOD7","COOD","Corallorrhiza odontorhiza (Willd.) Poir., orth. var.","","Orchidaceae"
"COODO2","","Corallorhiza odontorhiza (Willd.) Poir. var. odontorhiza","autumn coralroot","Orchidaceae"
"COODO2","COMI17","Corallorhiza micrantha Chapm.","","Orchidaceae"
"COODO2","COMI7","Corallorrhiza micrantha Chapm., orth. var.","","Orchidaceae"
"COODO2","COODO","Corallorrhiza odontorhiza (Willd.) Poir. var. odontorhiza (Willd.) Poir., orth. var.","","Orchidaceae"
"COOR","","Conringia orientalis (L.) Dumort.","hare's ear mustard","Brassicaceae"
"COOR","BROR4","Brassica orientalis L.","","Brassicaceae"
"COPA10","","Coreopsis palmata Nutt.","stiff tickseed","Asteraceae"
"COPA3","","Collinsia parviflora Lindl.","maiden blue eyed Mary","Scrophulariaceae"
"COPA3","ANTE7","Antirrhinum tenellum Pursh","","Scrophulariaceae"
"COPA3","COGRP","Collinsia grandiflora Lindl. var. pusilla A. Gray","","Scrophulariaceae"
"COPA3","COTE11","Collinsia tenella (Pursh) Piper","","Scrophulariaceae"
"COPA38","","Corispermum pallasii Steven","Siberian bugseed","Chenopodiaceae"
"COPA38","COLE9","Corispermum leptopterum (Asch.) Iljin","","Chenopodiaceae"
"COPA38","COSI8","Corispermum sibiricum Iljin p.p.","","Chenopodiaceae"
"CORA4","","Conyza ramosissima Cronquist","dwarf horseweed","Asteraceae"
"CORA4","ERDI12","Erigeron divaricatus Michx.","","Asteraceae"
"CORA4","LEDI8","Leptilon divaricatum (Michx.) Raf.","","Asteraceae"
"CORA6","","Cornus racemosa Lam.","gray dogwood","Cornaceae"
"CORA6","COFOR","Cornus foemina Mill. ssp. racemosa (Lam.) J.S. Wilson","","Cornaceae"
"CORA6","COPA23","Cornus paniculata L'Hér.","","Cornaceae"
"CORA6","SWRA2","Swida racemosa (Lam.) Moldenke","","Cornaceae"
"CORAL5","","Corallorhiza Gagnebin, orth. cons.","coralroot","Orchidaceae"
"CORAL5","CORAL2","Corallorrhiza Gagnebin, orth. rej.","","Orchidaceae"
"COREO2","","Coreopsis L.","tickseed","Asteraceae"
"CORIA","","Coriandrum L.","coriander","Apiaceae"
"CORIS","","Corispermum L.","bugseed","Chenopodiaceae"
"CORNU","","Cornus L.","dogwood","Cornaceae"
"CORYD","","Corydalis DC.","fumewort","Fumariaceae"
"CORYL","","Corylus L.","hazelnut","Betulaceae"
"COSA","","Coriandrum sativum L.","coriander","Apiaceae"
"COSE16","","Cornus sericea L.","redosier dogwood","Cornaceae"
"COSES","","Cornus sericea L. ssp. sericea","redosier dogwood","Cornaceae"
"COSES","COAL80","Cornus alba L. p.p.","","Cornaceae"
"COSES","COALS","Cornus alba L. ssp. stolonifera (Michx.) Wangerin","","Cornaceae"
"COSES","COALB","Cornus alba L. var. baileyi (J.M. Coult. & Evans) B. Boivin","","Cornaceae"
"COSES","COALI","Cornus alba L. var. interior (Rydb.) B. Boivin","","Cornaceae"
"COSES","COALS2","Cornus alba L. var. sibirica Lodd. ex Loudon","","Cornaceae"
"COSES","COBA6","Cornus baileyi J.M. Coult. & Evans","","Cornaceae"
"COSES","COIN5","Cornus instolonea A. Nelson","","Cornaceae"
"COSES","COIN6","Cornus interior (Rydb.) N. Petersen","","Cornaceae"
"COSES","COSES2","Cornus sericea L. ssp. stolonifera (Michx.) Fosberg","","Cornaceae"
"COSES","COSEI","Cornus sericea L. var. interior (Rydb.) H. St. John","","Cornaceae"
"COSES","COST4","Cornus stolonifera Michx.","","Cornaceae"
"COSES","COSTB","Cornus stolonifera Michx. var. baileyi (J.M. Coult. & Evans) Drescher","","Cornaceae"
"COSES","COSTC2","Cornus stolonifera Michx. var. coloradensis (Koehne) C.K. Schneid.","","Cornaceae"
"COSES","COSTI","Cornus stolonifera Michx. var. interior (Rydb.) H. St. John","","Cornaceae"
"COSES","COSTS2","Cornus stolonifera Michx. var. stolonifera","","Cornaceae"
"COSES","SWIN","Swida instolonea (A. Nelson) Rydb.","","Cornaceae"
"COSES","SWSE","Swida sericea (L.) Holub","","Cornaceae"
"COSES","SWST2","Swida stolonifera (Michx.) Rydb.","","Cornaceae"
"COST19","","Corallorhiza striata Lindl.","hooded coralroot","Orchidaceae"
"COST19","COST","Corallorrhiza striata Lindl., orth. var.","","Orchidaceae"
"COSTV2","","Corallorhiza striata Lindl. var. vreelandii (Rydb.) L.O. Williams","Vreeland's coralroot","Orchidaceae"
"COSTV2","COBI13","Corallorhiza bigelovii S. Watson","","Orchidaceae"
"COSTV2","COBI11","Corallorrhiza bigelovii S. Watson, orth. var.","","Orchidaceae"
"COSTV2","COSTV","Corallorrhiza striata Lindl. var. vreelandii (Rydb.) L.O. Williams, orth. var.","","Orchidaceae"
"COTI3","","Coreopsis tinctoria Nutt.","golden tickseed","Asteraceae"
"COTIT","","Coreopsis tinctoria Nutt. var. tinctoria","golden tickseed","Asteraceae"
"COTIT","COCA12","Coreopsis cardaminefolia (DC.) Torr. & A. Gray","","Asteraceae"
"COTIT","COST11","Coreopsis stenophylla Boynt.","","Asteraceae"
"COTIT","COTII","Coreopsis tinctoria Nutt. var. imminuta Sherff","","Asteraceae"
"COTR18","","Corallorhiza trifida Chatelain","yellow coralroot","Orchidaceae"
"COTR18","COCO40","Corallorhiza corallorhiza (L.) Karst., nom. inval.","","Orchidaceae"
"COTR18","COTRV2","Corallorhiza trifida Chatelain var. verna (Nutt.) Fernald","","Orchidaceae"
"COTR18","COCO23","Corallorrhiza corallorrhiza (L.) Karst., orth. var., nom. inval.","","Orchidaceae"
"COTR18","COTR3","Corallorrhiza trifida Chatelain, orth. var.","","Orchidaceae"
"COTR18","COTRV","Corallorrhiza trifida Chatelain var. verna (Nutt.) Fernald, orth. var.","","Orchidaceae"
"COUM","","Comandra umbellata (L.) Nutt.","bastard toadflax","Santalaceae"
"COUMP","","Comandra umbellata (L.) Nutt. ssp. pallida (A. DC.) Piehl","pale bastard toadflax","Santalaceae"
"COUMP","COPA26","Comandra pallida A. DC.","","Santalaceae"
"COUMP","COUMA","Comandra umbellata (L.) Nutt. var. angustifolia (A. DC.) Torr.","","Santalaceae"
"COUMP","COUMP2","Comandra umbellata (L.) Nutt. var. pallida (A. DC.) M.E. Jones","","Santalaceae"
"COUMU","","Comandra umbellata (L.) Nutt. ssp. umbellata","bastard toadflax","Santalaceae"
"COUMU","CORI3","Comandra richardsiana Fernald","","Santalaceae"
"COVI5","","Corispermum villosum Rydb.","hairy bugseed","Chenopodiaceae"
"COVI5","COEM2","Corispermum emarginatum Rydb.","","Chenopodiaceae"
"COVI5","COHYE","Corispermum hyssopifolium L. var. emarginatum (Rydb.) B. Boivin","","Chenopodiaceae"
"COVI5","COORE","Corispermum orientale Lam. var. emarginatum (Rydb.) J.F. Macbr.","","Chenopodiaceae"
"COWI5","","Corallorhiza wisteriana Conrad","spring coralroot","Orchidaceae"
"COWI5","COWI2","Corallorrhiza wisteriana Conrad, orth. var.","","Orchidaceae"
"CRAC3","","Cryptogramma acrostichoides R. Br.","American rockbrake","Pteridaceae"
"CRAC3","CRCRA2","Cryptogramma crispa (L.) R. Br. ex Hook. ssp. acrostichoides (R. Br.) Hultén","","Pteridaceae"
"CRAF","","Cryptantha affinis (A. Gray) Greene","quill cryptantha","Boraginaceae"
"CRATA","","Crataegus L.","hawthorn","Rosaceae"
"CRCA6","","Croton capitatus Michx.","hogwort","Euphorbiaceae"
"CRCA8","","Cryptantha cana (A. Nelson) Payson","mountain cryptantha","Boraginaceae"
"CRCA8","ORCA11","Oreocarya cana A. Nelson","","Boraginaceae"
"CRCA9","","Cryptotaenia canadensis (L.) DC.","Canadian honewort","Apiaceae"
"CRCA9","DECA12","Deringa canadensis (L.) Kuntze","","Apiaceae"
"CRCAC2","","Croton capitatus Michx. var. capitatus","hogwort","Euphorbiaceae"
"CRCE","","Cryptantha celosioides (Eastw.) Payson","buttecandle","Boraginaceae"
"CRCE","CRBR11","Cryptantha bradburiana Payson","","Boraginaceae"
"CRCE","CRMA16","Cryptantha macounii (Eastw.) Payson","","Boraginaceae"
"CRCE","CRNUM","Cryptantha nubigena (Greene) Payson var. macounii (Eastw.) B. Boivin","","Boraginaceae"
"CRCE","CRSH2","Cryptantha sheldonii (Brand) Payson","","Boraginaceae"
"CRCE","ORCE2","Oreocarya celosioides Eastw.","","Boraginaceae"
"CRCE","ORGL","Oreocarya glomerata (Pursh) Greene, non Lehm. ex Fisch.","","Boraginaceae"
"CRCE","ORMA5","Oreocarya macounii Eastw.","","Boraginaceae"
"CRCE","ORSH","Oreocarya sheldonii Brand","","Boraginaceae"
"CRCH","","Crataegus chrysocarpa Ashe","fireberry hawthorn","Rosaceae"
"CRCHC2","","Crataegus chrysocarpa Ashe var. chrysocarpa","red haw","Rosaceae"
"CRCHC2","CRAB4","Crataegus aboriginum Sarg.","","Rosaceae"
"CRCHC2","CRBR14","Crataegus brunetiana Sarg.","","Rosaceae"
"CRCHC2","CRBRF","Crataegus brunetiana Sarg. var. fernaldii (Sarg.) Palmer","","Rosaceae"
"CRCHC2","CRCA19","Crataegus caliciglabrata Schuette","","Rosaceae"
"CRCHC2","CRCHA","Crataegus chrysocarpa Ashe var. aboriginum (Sarg.) Kruschke","","Rosaceae"
"CRCHC2","CRCHL","Crataegus chrysocarpa Ashe var. longiacuminata Kruschke","","Rosaceae"
"CRCHC2","CRCHP","Crataegus chrysocarpa Ashe var. phoenicea Palmer","","Rosaceae"
"CRCHC2","CRCHR","Crataegus chrysocarpa Ashe var. rotundifolia (Moench) Sarg.","","Rosaceae"
"CRCHC2","CRCO31","Crataegus coccinata Sarg.","","Rosaceae"
"CRCHC2","CRCO","Crataegus coccinea L. p.p.","","Rosaceae"
"CRCHC2","CRCOC2","Crataegus columbiana Howell var. chrysocarpa (Ashe) Dorn","","Rosaceae"
"CRCHC2","CRDO4","Crataegus doddsii Ramaley","","Rosaceae"
"CRCHC2","CRFA4","Crataegus faxonii Sarg.","","Rosaceae"
"CRCHC2","CRFAD","Crataegus faxonii Sarg. var. durifrucata Kruschke","","Rosaceae"
"CRCHC2","CRFAP","Crataegus faxonii Sarg. var. praecoqua (Sarg.) Kruschke","","Rosaceae"
"CRCHC2","CRFAP2","Crataegus faxonii Sarg. var. praetermissa (Sarg.) Palmer","","Rosaceae"
"CRCHC2","CRIL3","Crataegus illuminata Sarg.","","Rosaceae"
"CRCHC2","CRJA6","Crataegus jackii Sarg.","","Rosaceae"
"CRCHC2","CRKE4","Crataegus keepii Sarg.","","Rosaceae"
"CRCHC2","CRLAB","Crataegus laurentiana Sarg. var. brunetiana (Sarg.) Kruschke","","Rosaceae"
"CRCHC2","CRLAD","Crataegus laurentiana Sarg. var. dissimilifolia Kruschke","","Rosaceae"
"CRCHC2","CRME10","Crataegus mercerensis Sarg.","","Rosaceae"
"CRCHC2","CRPU11","Crataegus putnamiana Sarg.","","Rosaceae"
"CRCHC2","CRRO12","Crataegus rotundifolia Moench p.p., non Lamb.","","Rosaceae"
"CRCHC2","CRSI8","Crataegus sicca Sarg.","","Rosaceae"
"CRCHC2","CRSIG","Crataegus sicca Sarg. var. glabrifolia (Sarg.) Palmer","","Rosaceae"
"CRCHC2","CRSU11","Crataegus subrotundifolia Sarg.","","Rosaceae"
"CRCI3","","Cryptantha cinerea (Greene) Cronquist","James' cryptantha","Boraginaceae"
"CRCIJ","","Cryptantha cinerea (Greene) Cronquist var. jamesii (Torr.) Cronquist","James' cryptantha","Boraginaceae"
"CRCIJ","CRJA2","Cryptantha jamesii Payson, nom. illeg.","","Boraginaceae"
"CRCIJ","CRJAD","Cryptantha jamesii Payson var. disticha (Eastw.) Payson","","Boraginaceae"
"CRCIJ","CRJAT","Cryptantha jamesii Payson var. typica Payson","","Boraginaceae"
"CRCIJ","CRSU14","Cryptantha suffruticosa Piper","","Boraginaceae"
"CRCIJ","KRJA","Krynitzkia jamesii (Torr.) A. Gray","","Boraginaceae"
"CRCIJ","ORSU2","Oreocarya suffruticosa (Torr.) Greene","","Boraginaceae"
"CRDO2","","Crataegus douglasii Lindl.","black hawthorn","Rosaceae"
"CRDO2","CRCO6","Crataegus columbiana Howell","","Rosaceae"
"CRDO2","CRDOD","Crataegus douglasii Lindl. var. douglasii","","Rosaceae"
"CREPI","","Crepis L.","hawksbeard","Asteraceae"
"CRFE3","","Cryptantha fendleri (A. Gray) Greene","sanddune cryptantha","Boraginaceae"
"CRFE3","CRPA7","Cryptantha pattersonii (A. Gray) Greene","","Boraginaceae"
"CRGL2","","Croton glandulosus L.","vente conmigo","Euphorbiaceae"
"CRGLS","","Croton glandulosus L. var. septentrionalis Müll. Arg.","vente conmigo","Euphorbiaceae"
"CRGLS","CRGLA","Croton glandulosus L. var. angustifolius Müll. Arg.","","Euphorbiaceae"
"CRGLS","CRGLS2","Croton glandulosus L. var. simpsonii A.M. Ferguson","","Euphorbiaceae"
"CRMI5","","Cryptantha minima Rydb.","little cryptantha","Boraginaceae"
"CRMO2","","Crataegus mollis Scheele","downy hawthorn","Rosaceae"
"CRMO2","CRAL7","Crataegus albicans Ashe","","Rosaceae"
"CRMO2","CRAR9","Crataegus arkansana Sarg.","","Rosaceae"
"CRMO2","CRBR9","Crataegus brachyphylla Sarg.","","Rosaceae"
"CRMO2","CRCI4","Crataegus cibaria Beadle","","Rosaceae"
"CRMO2","CRGR10","Crataegus gravida Beadle","","Rosaceae"
"CRMO2","CRIN22","Crataegus induta Sarg.","","Rosaceae"
"CRMO2","CRIN23","Crataegus invisa Sarg.","","Rosaceae"
"CRMO2","CRLA","Crataegus lacera Sarg.","","Rosaceae"
"CRMO2","CRLI8","Crataegus limaria Sarg.","","Rosaceae"
"CRMO2","CRMOD","Crataegus mollis Scheele var. dumetosa (Sarg.) Kruschke","","Rosaceae"
"CRMO2","CRMOG2","Crataegus mollis Scheele var. gigantea Kruschke","","Rosaceae"
"CRMO2","CRMOI","Crataegus mollis Scheele var. incisifolia Kruschke","","Rosaceae"
"CRMO2","CRMOS2","Crataegus mollis Scheele var. sera (Sarg.) Eggl.","","Rosaceae"
"CRMO2","CRNO3","Crataegus noelensis Sarg.","","Rosaceae"
"CRMO2","CRPEA","Crataegus pedicellata Sarg. var. albicans (Ashe) Palmer","","Rosaceae"
"CRMO2","CRPL4","Crataegus placens Sarg., nom. inq.","","Rosaceae"
"CROC","","Crepis occidentalis Nutt.","largeflower hawksbeard","Asteraceae"
"CROCO2","","Crepis occidentalis Nutt. ssp. occidentalis","largeflower hawksbeard","Asteraceae"
"CROCO2","CROCT","Crepis occidentalis Nutt. ssp. typica Babc. & Stebbins","","Asteraceae"
"CROCO2","PSOC","Psilochenia occidentalis (Nutt.) Nutt.","","Asteraceae"
"CROTA","","Crotalaria L.","rattlebox","Fabaceae"
"CROTO","","Croton L.","croton","Euphorbiaceae"
"CROTO","CROTO2","Crotonopsis Michx.","","Euphorbiaceae"
"CRRU3","","Crepis runcinata (James) Torr. & A. Gray","fiddleleaf hawksbeard","Asteraceae"
"CRRUG","","Crepis runcinata (James) Torr. & A. Gray ssp. glauca (Nutt.) Babc. & Stebbins","fiddleleaf hawksbeard","Asteraceae"
"CRRUG","CRGL5","Crepis glauca (Nutt.) Torr. & A. Gray","","Asteraceae"
"CRRUG","CRRUG2","Crepis runcinata (James) Torr. & A. Gray var. glauca (Nutt.) B. Boivin","","Asteraceae"
"CRRUG","PSRUG","Psilochenia runcinata (James) Á. Löve & D. Löve ssp. glauca (Nutt.) W.A. Weber","","Asteraceae"
"CRRUR","","Crepis runcinata (James) Torr. & A. Gray ssp. runcinata","fiddleleaf hawksbeard","Asteraceae"
"CRRUR","CRAL5","Crepis alpicola (Rydb.) A. Nelson","","Asteraceae"
"CRRUR","CRGL6","Crepis glaucella Rydb.","","Asteraceae"
"CRRUR","CRNE3","Crepis neomexicana Wooton & Standl.","","Asteraceae"
"CRRUR","CRPE12","Crepis perplexans Rydb.","","Asteraceae"
"CRRUR","CRRUT","Crepis runcinata (James) Torr. & A. Gray ssp. typica Babc. & Stebbins","","Asteraceae"
"CRRUR","PSRU2","Psilochenia runcinata (James) Á. Löve & D. Löve","","Asteraceae"
"CRSA4","","Crotalaria sagittalis L.","arrowhead rattlebox","Fabaceae"
"CRSA4","CRPI81","Crotalaria pilosa Raf.","","Fabaceae"
"CRSA4","CRSAB","Crotalaria sagittalis L. var. blumeriana H. Senn","","Fabaceae"
"CRSA4","CRSAF","Crotalaria sagittalis L. var. fruticosa (Mill.) Fawc. & Rendle","","Fabaceae"
"CRSU5","","Crataegus succulenta Schrad. ex Link","fleshy hawthorn","Rosaceae"
"CRSU5","CRAM6","Crataegus ambrosia Sarg.","","Rosaceae"
"CRSU5","CRAR10","Crataegus ardula Sarg.","","Rosaceae"
"CRSU5","CRBI7","Crataegus bicknellii Eggl.","","Rosaceae"
"CRSU5","CRCE2","Crataegus celsa Sarg.","","Rosaceae"
"CRSU5","CRCHB","Crataegus chrysocarpa Ashe var. bicknellii (Eggl.) Palmer","","Rosaceae"
"CRSU5","CRCOO","Crataegus columbiana Howell var. occidentalis (Britton) Dorn","","Rosaceae"
"CRSU5","CRDI15","Crataegus divida Sarg.","","Rosaceae"
"CRSU5","CRFE6","Crataegus ferta Sarg.","","Rosaceae"
"CRSU5","CRFL10","Crataegus florifera Sarg.","","Rosaceae"
"CRSU5","CRFLC","Crataegus florifera Sarg. var. celsa (Sarg.) Kruschke","","Rosaceae"
"CRSU5","CRFLM","Crataegus florifera Sarg. var. mortonis (Laughlin) Kruschke","","Rosaceae"
"CRSU5","CRFLS","Crataegus florifera Sarg. var. shirleyensis (Sarg.) Kruschke","","Rosaceae"
"CRSU5","CRFLV","Crataegus florifera Sarg. var. virilis (Sarg.) Kruschke","","Rosaceae"
"CRSU5","CRGE2","Crataegus gemmosa Sarg.","","Rosaceae"
"CRSU5","CRIN27","Crataegus incerta Sarg.","","Rosaceae"
"CRSU5","CRIN11","Crataegus integriloba Sarg.","","Rosaceae"
"CRSU5","CRLA12","Crataegus laxiflora Sarg.","","Rosaceae"
"CRSU5","CRLE14","Crataegus leucantha Laughlin","","Rosaceae"
"CRSU5","CRMA14","Crataegus macracantha Lodd. ex Loudon","","Rosaceae"
"CRSU5","CRMAC","Crataegus macracantha Lodd. ex Loudon var. colorado (Ashe) Kruschke","","Rosaceae"
"CRSU5","CRMAD2","Crataegus macracantha Lodd. ex Loudon var. divida (Sarg.) Kruschke","","Rosaceae"
"CRSU5","CRMAI","Crataegus macracantha Lodd. ex Loudon var. integriloba (Sarg.) Kruschke","","Rosaceae"
"CRSU5","CRMAO","Crataegus macracantha Lodd. ex Loudon var. occidentalis (Britton) Eggl.","","Rosaceae"
"CRSU5","CRMAP3","Crataegus macracantha Lodd. ex Loudon var. pertomentosa (Ashe) Kruschke","","Rosaceae"
"CRSU5","CRMO12","Crataegus mortonis Laughlin","","Rosaceae"
"CRSU5","CRNE5","Crataegus neofluvialis Ashe","","Rosaceae"
"CRSU5","CRPE9","Crataegus pertomentosa Ashe","","Rosaceae"
"CRSU5","CRPI5","Crataegus pisifera Sarg.","","Rosaceae"
"CRSU5","CRSA11","Crataegus saeva Sarg.","","Rosaceae"
"CRSU5","CRSH4","Crataegus shirleyensis Sarg.","","Rosaceae"
"CRSU5","CRSI10","Crataegus silvestris Sarg.","","Rosaceae"
"CRSU5","CRSUG","Crataegus succulenta Schrad. ex Link var. gemmosa (Sarg.) Kruschke","","Rosaceae"
"CRSU5","CRSUL","Crataegus succulenta Schrad. ex Link var. laxiflora (Sarg.) Kruschke","","Rosaceae"
"CRSU5","CRSUM","Crataegus succulenta Schrad. ex Link var. macracantha (Lodd. ex Loudon) Eggl.","","Rosaceae"
"CRSU5","CRSUM2","Crataegus succulenta Schrad. ex Link var. michiganensis (Ashe) Palmer","","Rosaceae"
"CRSU5","CRSUN","Crataegus succulenta Schrad. ex Link var. neofluvialis (Ashe) Palmer","","Rosaceae"
"CRSU5","CRSUO","Crataegus succulenta Schrad. ex Link var. occidentalis Britton","","Rosaceae"
"CRSU5","CRSUP","Crataegus succulenta Schrad. ex Link var. pertomentosa (Ashe) Palmer","","Rosaceae"
"CRSU5","CRSUP2","Crataegus succulenta Schrad. ex Link var. pisifera (Sarg.) Kruschke","","Rosaceae"
"CRSU5","CRSUR","Crataegus succulenta Schrad. ex Link var. rutila (Sarg.) Kruschke","","Rosaceae"
"CRSU5","CRSY","Crataegus sylvestris Sarg.","","Rosaceae"
"CRSU5","CRVE8","Crataegus venulosa Sarg.","","Rosaceae"
"CRSU5","CRVI11","Crataegus virilis Sarg.","","Rosaceae"
"CRTE4","","Croton texensis (Klotzsch) Müll. Arg.","Texas croton","Euphorbiaceae"
"CRTET","","Croton texensis (Klotzsch) Müll. Arg. var. texensis","Texas croton","Euphorbiaceae"
"CRTH","","Cryptantha thyrsiflora (Greene) Payson","calcareous cryptantha","Boraginaceae"
"CRTH","ORTH3","Oreocarya thyrsiflora Greene","","Boraginaceae"
"CRYPT","","Cryptantha Lehm. ex G. Don","cryptantha","Boraginaceae"
"CRYPT3","","Cryptogramma R. Br.","rockbrake","Pteridaceae"
"CRYPT5","","Cryptotaenia DC.","honewort","Apiaceae"
"CUCE","","Cuscuta cephalanthi Engelm.","buttonbush dodder","Cuscutaceae"
"CUCE","GRCE","Grammica cephalanthi (Engelm.) Hadac & Chrtek","","Cuscutaceae"
"CUCO3","","Cuscuta coryli Engelm.","hazel dodder","Cuscutaceae"
"CUCO3","GRCO2","Grammica coryli (Engelm.) Hadac & Chrtek","","Cuscutaceae"
"CUCU2","","Cuscuta cuspidata Engelm.","cusp dodder","Cuscutaceae"
"CUCU2","GRCU3","Grammica cuspidata (Engelm.) Hadac & Chrtek","","Cuscutaceae"
"CUEP","","Cuscuta epithymum (L.) L.","clover dodder","Cuscutaceae"
"CUGL3","","Cuscuta glomerata Choisy","rope dodder","Cuscutaceae"
"CUGR","","Cuscuta gronovii Willd. ex Schult.","scaldweed","Cuscutaceae"
"CUGRG","","Cuscuta gronovii Willd. ex Schult. var. gronovii","scaldweed","Cuscutaceae"
"CUGRG","CUGRL","Cuscuta gronovii Willd. ex Schult. var. latiflora Engelm.","","Cuscutaceae"
"CUGRG","CUGRS","Cuscuta gronovii Willd. ex Schult. var. saururi (Engelm.) MacMill.","","Cuscutaceae"
"CUGRG","CUUM2","Cuscuta umbrosa auct. non Bey. ex Hook.","","Cuscutaceae"
"CUGRG","GRGR3","Grammica gronovii (Willd. ex Schult.) Hadac & Chrtek","","Cuscutaceae"
"CUGRG","GRUM","Grammica umbrosa auct. non (Bey. ex Hook.) W.A. Weber","","Cuscutaceae"
"CUIN","","Cuscuta indecora Choisy","bigseed alfalfa dodder","Cuscutaceae"
"CUINN","","Cuscuta indecora Choisy var. neuropetala (Engelm.) Hitchc.","bigseed dodder","Cuscutaceae"
"CUINN","GRINN","Grammica indecora (Choisy) W.A. Weber ssp. neuropetala (Engelm.) W.A. Weber","","Cuscutaceae"
"CUME4","","Cuscuta megalocarpa Rydb.","bigfruit dodder","Cuscutaceae"
"CUME4","CUCU3","Cuscuta curta (Engelm.) Rydb.","","Cuscutaceae"
"CUME4","CUGRC2","Cuscuta gronovii Willd. ex Schult. var. curta Engelm.","","Cuscutaceae"
