Record,Current name (from Valid Names),Galls,Name in record,Source,Description,Host associations mentioned,Photos,Page link,Taxonomic Info,Biology Note,Phenology,Range,Original Description?
1,Aceria elongata,Aceria elongata,Aceria elongata,Amrine Catalog,Red erineum patches on the upper surfaces of leaves.,Acer saccharum,,,"Note about Erineum roseum Schultz (Harlow): Hagen (1885) p. 24, # 25, ""Acer saccharinum Wang"". Pl. [Place] Shelburne, NH, August 1882. Prof. Harlow [collector of fungi]. Erineum roseum Schult. (Farlow); small velvety patches [red] on the upper surface of leaves. [This shows the great confusion in the names of the maples; Silver Maple, Acer saccharinum, never has red erineum on the upper surface of the leaves. The host was actually Acer dasycarpum Ehrh., regarded by , the old name for the sugar maple, Acer saccharum L. I have collected it many times from Sugar Maple.] 

Aceria regula is the deutogyne and a junior synonym; Aceria elongata is the protogyne; Aceria elongata has seniority by pagination in the 1913 paper (#272)"" based on comments in #4062. Aceria regula is not the deutogyne; the deutogyne lacks MT on dorsal opisthosomal annuli; Hodgkiss illustrated a mite with complete dorsal microtuberculation and a distinctive shield pattern. Aceria regula is probably an inquiline that occurs in the red erineum in New York.",,,,No
2,Aceria elongata,Aceria elongata,Eriophyes elongatus,New Species of Maple Mites,"Described from individuals found among red erineum galls on the upper surfaces of leaves of the sugar maple, Acer saccharum L.",Acer saccharum,,,,,,,Yes
3,Aceria major,Aceria major,Eriophyes major,New Species of Maple Mites,"Described from individuals found among galls of pinkish erineum on the under surface of leaves of the red maple, Acer rubrum L.",Acer rubrum,,,,,,,Yes
4,Aceria modesta,Aceria modesta,Eriophyes modestus,New Species of Maple Mites,"Described from individuals found among greenish erineum galls on the under surface of leaves of the sugar maple, Acer saccharum L.",Acer saccharum,,,,,,,Yes
5,Aceria negundi,Aceria negundi,Eriophyes negundi,New Species of Maple Mites,"Described from individuals found in wart-like swellings of leaves of the black maple, Acer negundo L.
",Acer negundo,,,,,,,Yes
6,Aceria spicati,Aceria spicati,Eriophyes parallelus,New Species of Maple Mites,"Described from individuals found in a whitish erineum on the under surfaces of leaves of the mountain maple, Acer spicatum L.",Acer spicatum,,,,,,,Yes
7,Vasates quadripedes,Vasates quadripedes,Eriophyes confusus,New Species of Maple Mites,"Described from individuals found associated with P quadripes Shimer in bladder galls on the leaves of the soft maple, Acer saccharinum.",Acer saccharinum,,,,,,,Yes
8,Aceria major,Aceria major,Eriophyes ornatus,New Species of Maple Mites,"Described from individuals found among pinkish erineum galls on the under surfaces of leaves of the red maple, Acer rubrum L.",Acer rubrum,,,,,,,Yes
9,Aceria elongata,Aceria elongata,Eriophyes regulus,New Species of Maple Mites,"Described from individuals found among red erineum galls on the upper surfaces of leaves of the sugar maple, Acer saccharum L.",Acer saccharum,,,,,,,Yes
10,Rhyncaphytoptus magnificus,Rhyncaphytoptus magnificus,Phyllocoptes magnificus,New Species of Maple Mites,"Described from individuals found in epidermal hairy growths which occur in the axils of the veins on the under surfaces of leaves of the Norway maple, Acer platanoides L.",Acer platanoides,,,,,,,Yes
11,Aculus minutissimus,Aculus minutissimus,Phyllocoptes minutissimus,New Species of Maple Mites,"Described from individuals found among red erineum galls on the upper surfaces of leaves of the red maple, Acer rubrum L.",Acer rubrum,,,,,,,Yes
12,Aculus quinquilobus,Aculus quinquilobus,Phyllocoptes quinquilobus,New Species of Maple Mites,"Described from individuals found among pinkish erineum galls on the under surfaces of leaves of the red maple, Acer rubrum L.",Acer rubrum,,,,,,,Yes
13,Vasates quadripedes,Vasates quadripedes,Vasates quadripedes,Amrine Catalog,Bladder galls on leaf upper surface.,"Acer saccharinum,Acer rubrum",,,"Keifer restored the concept of Vasates in papers 316 and 322 (described protogynes & deutogynes). Misspelled as quadripes Shimer by Osborn 1879, Banks, 1901, 1904 & 1907, Chadwick, 1907, Miller 1925, Nalepa 1923, 1929, and many other authors until Banks, 1915 and Hodgkiss, 1930 corrected it to quadripedes. Eriophyes confusus Hodgkiss is probably the deutogyne. The gall in each maple is caused by a different species of Vasates.",,,,No
14,Aceria major,Aceria major,Aceria major,Amrine Catalog,"Pale-greenish or greenish-yellow lower surface, leaf erineum often with a reddish tint, later becoming red, then brown and dry.",Acer rubrum,,,Aceria major could be the protogyne and A. ornatus the deutogyne [2411].,,,,No
15,Aceria modesta,Aceria modesta,Aceria modesta,Amrine Catalog,Whitish or greenish erineum patches on the lower surfaces of leaves or along the veins.,Acer saccharum,,,,,,,No
16,Aceria negundi,Aceria negundi,Aceria negundi,Amrine Catalog,"Wart-like swellings or pouch galls on leaves, lower surface erineum.",Acer negundo,,,"At least Briones & McDaniel's use of Aceria calaceris Keifer, 1952 [310] is a junior synonym of negundi Hodgkiss; Baker et al. 1996 [2411] figues both mites; there are no clear-cut distinctions. All three erineum mites should be carefully studied and rearing studies conducted.",,,,No
17,Aceria spicati,Aceria spicati,Aceria spicati,Amrine Catalog,"Small white ""frost"" (= erineum) galls on leaf underside at vein angles; cylindrical galls on leaf surface on Acer insulare.",Acer spicatum,,,"Listed as nomen nudum by Nalepa (1929b) and Amrine & Stasny (1994), Baker et al. (1996), but meets all criteria for a valid species. The mite on Acer insulare in Taiwan is a different species [4768,4761].",,,,No
18,Rhyncaphytoptus magnificus,Rhyncaphytoptus magnificus,Rhyncaphytoptus magnificus,Amrine Catalog,Epidermal hairy growths which occur in the axils of the veins on the under surfaces of leaves.,"Acer platanoides,Acer rubrum",,,,,,,No
19,Aculus minutissimus,Aculus minutissimus,Aculus minutissimus,Amrine Catalog,White or red erineum consisting of large capitate multicellular processes on the upper surfaces of leaves. It may be an inquiline.,Acer rubrum,,,,,,,No
20,Aculus quinquilobus,Aculus quinquilobus,Aculus quinquilobus,Amrine Catalog,Causes whitish or pinkish erineum galls on the lower surfaces of leaves.,Acer rubrum,,,,,,,No
21,Eriophyes aceris,Eriophyes aceris,Eriophyes aceris,Amrine Catalog,"Elongate red carmine galls, filled with hairs, with large open aperture on underside of leaf; hairs protruding from aperture.",Acer saccharinum,,,"Listed in Nalepa 1923 [#1084, p. 28]. Need to find and redescribe the mite. Aceria aceris (Murray, 1877) is a senior, valid name, according to the code. But, because of the confusion this change would cause to the understanding of the taxonomy of European maple mites, we recommend that Eriophyes aceris (Murray, 1877) be suppressed in favor of Eriophyes macrorhynchus Nalepa, 1889, now listed as Aceria macrorhyncha (Nalepa, 1889).",,,,No
22,Aceria calaceris,Aceria calaceris,Aceria calaceris,Amrine Catalog,"""These mites are found in and probably cause the red erineum on leaf tips [upper surface]""; produce bright red erineum on upper leaf surfaces.","Acer glabrum,Acer heldreichii,Acer macrophyllum",,,"This mite's records from Acer negundo L. in the east are probably Aceria negundi (Hodgkiss, 1913) [white or brown erineum, not red]. All three erineum mites should be carefully studied and rearing studies conducted.",,,,No
23,Vasates aceriscrumena,Vasates aceriscrumena,Vasates aceriscrumena,Amrine Catalog,"Upper surface, leaf finger galls with lower surface opening.","Acer saccharum,Acer leucoderme",,,,,,,No
24,Aceria myriadeum,Aceria myriadeum,Aceria myriadeum,Amrine Catalog,"Numerous cephaloneon galls on leaf surface, Cephaloneon myriadeum Bremi","Acer campestre,Acer pseudoplatanus",,,"This name was found in Nalepa 1923c [1084:40, as nomen nudum]; added to the catalog 18 Jun 1999. This is a valid name, according to the code, and replaces a very unwieldly name. See synonymy and references under aceriscampestris Nalepa, 1922 [#185].",,,,No
25,Cecidophyes naulti,Cecidophyes naulti,Cecidophyes naulti,Amrine Catalog,The mites were found on the lower surface of leaf curling.,Acer rubrum,,,,,,,No
26,Aceria negundi,Aceria negundi,Eriophyes negundi,An Illustrated Guide to Plant Abnormalities Caused by Eriophyid Mites in North America,"The galls are large, rounded, and peculiarly pouchtype. They develop on the underside of the leaf blade as thickened cavities filled with a dense mass of felty, whitish, unicellular hairs. They protrude on the upper side and have slightly wrinkled domes. Their dimensions are variable. The galls are solitary and widespread on the leaf blade but are not on the veins. 
Specimens were collected in galls on box elder in New York, Illinois, and Canada and recently in Ohio. Hodgkiss {1930) reported two species of Phyllocoptes in galls of box elder in New York; they should not be confused with E. negundi. ",Acer negundo,8A,,,The life cycle apparently involves alternation of generations. The mites usually are found in the galls until the leaves mature.,,,No
27,Vasates quadripedes,Vasates quadripedes,Vasates quadripedes,An Illustrated Guide to Plant Abnormalities Caused by Eriophyid Mites in North America,"The mite causes a pouch gall type known as bladder gall, which is periodically common and abundant on the upper leaf surface of red and silver maples. The galls on the latter are variable in shape, rounded or elongate. Each has a slender short stem or neck. The length varies from 1.5 to 5 mm. They are solitary and are usually crowded and numerous at the basal part of the leaf blade in the angles between the larger veins. The exterior of the galls appears wrinkled and glossy. They change from yellowish green or dark green to pink, to brown, to black. The interior is hollow, and the exit hole, which is on the underside of the leaf, is lined with unicellular whitish hairs. In heavy infestations, the leaves become curled, form cylindrical rolls, and drop prematurely. The galls on red maple differ in size and form. They are smaller, I to 2 mm, somewhat beadlike, and without a basal constriction or neck. 
Vasates quadripedes is found on red and silver maples in the United States and Canada.","Acer saccharinum,Acer rubrum","9A, 9B, 9C, 9D",,"An inquiline in the galls, Eriophyes confusus Hodgkiss, is probably the protogyne of V. quadripedes. ",The life history apparently involves alternation of generations. The mites inhabit the galls throughout the summer and begin to migrate to trunk and branches as the galls become discolored. They overwinter under bark scales. ,,,No
28,Eriophyes aceris,Eriophyes aceris,Eriophyes aceris,An Illustrated Guide to Plant Abnormalities Caused by Eriophyid Mites in North America,"In erineum on leaves of silver maple, E. aceris Hodgkiss is abundant. The erineum patches, which are on the undersurface of the leaves, are pale greenish or greenish yellow, often with a reddish tint, and later red. In July most of the erineum turns brown and becomes dry. ",Acer saccharinum,,,,,,,No
29,Vasates aceriscrumena,Vasates aceriscrumena,Vasates aceriscrumena,An Illustrated Guide to Plant Abnormalities Caused by Eriophyid Mites in North America,"Another common and abundant pouch gall that develops on the upper surface of sugar maple leaves is the spindle or finger gall, which is caused by Vasates aceriscrumena. The gall is distinguished from that of V. quadripedes Shimer by its form, position, color, and texture. The galls are solitary, elongate, with pointed or truncate apices, or spindle shaped. They are variable in size, up to 5 mm in length, and tend to crowd at the apical half of the leaf blade. They vary from greenish tinged with yellow to pink, to crimson. The exit hole on the underside of the leaf has a tuft of unicellular hairs, but the interior of the gall is thin walled and lacks hairs. 
Vasates aceriscrumena is similar to V. quadripedes. It is recognized by having two spinules on the anterior lobe of the dorsal shield, by the forward-centrad direction of the dorsal setae, and by the well pronounced design of the dorsal shield. 
Specimens are found in galls through July on sugar maple in the Eastern United States and Canada. 
",Acer saccharum,"10A, 10B",,"This mite was described in 1883 as Phytoptus acericola by Garman, who reported that it caused galls on maple in Illinois. It is a synonym of V. aceriscrumena. ",The life history is similar [to V aceriscrumena]: The life history apparently involves alternation of generations. The mites inhabit the galls throughout the summer and begin to migrate to trunk and branches as the galls become discolored. They overwinter under bark scales. ,,,No
30,Aculops rhois,Aculops rhois,Aculops toxicophagus,An Illustrated Guide to Plant Abnormalities Caused by Eriophyid Mites in North America,"Infestation is common and typical of the leaf galls. It consists of puckered, irregular, rounded, or wartlike pouches affecting both upper and lower surfaces of the leaves. The galls are usually scattered about indiscriminately on the leaf blade. They range from green to pinkish, to red brown. Poison oak leaves are often so heavily attacked that they become visibly crinkled and distorted. 
Specimens were collected on poison oak in Oregon and California and on poison ivy in Ohio and Maryland. It has also been found on poison sumac (Rhus vernix L.) in Ohio. The mite is probably present throughout its host range. ","Toxicodendron diversilobum,Toxicodendron radicans,Toxicodendron vernix","11C, 11A , 11B, 11D",,,,,,No
31,Aculops rhois,Aculops rhois,Aculops rhois,Amrine Catalog,"""Corrugations [galls] on upper and lower surfaces of leaf with numerous, whitish hairs or erinea""; leaf deformation; stunting of plant? [5041]. Flowers of large vines sometimes become deformed producing numerous long narrow filaments that are narrow rolled leaves; mites deveop in large numbers within the rolls; in some cases the filaments are somewhat more leaflike [West Virginia: Monongalia, Nicholas, Preston and Tucker counties; Maryland: near mouth of Susquehanna River]. Are these a different species?","Toxicodendron radicans,Toxicodendron diversilobum,Toxicodendron vernix",,,"Amrine & Stasny, 1994, erroneously listed this mite as nomen nudum. The mite described by Stebbins meets all code requirements for an older description: ""a name, a mention of the animal and a description of the work of the animal""; thus her name is valid and has priority over Ewing's toxicophagus. We hereby elevate her name, Eriophyes rhois Stebbins 1909 to the accepted name for the poison ivy ( Toxicodendron radicans) gall mite. Ewing's Phyllocoptes toxicophagus is valid and occurs on Toxicodendron diversilobum. The deutogyne of rhois was photographed by Briones & McDaniel, 1976, 41, f. 88 and was observed by J. Amrine, 2 Sep. 1998 on specimens collected from Monongalia Co. WV, Cobun Creek Trail, by pasture, south of Cobun Creek Rd, 1 Sep, 1998, ex poison ivy [Toxicodendron radicans]; they need to be described. The name rhois is a modified form of Rhus. Mites, if they occur on Toxicodendron pubescens Mill. (Atlantic Poison Ivy) and T. rydberghi (Small ex Rydb.) Greene (Western Poison Ivy) may all be separate, distinct species.  
Nalepa 1929 listed on p. 124, under Rhus radicans, Eriophyes rhois Stebbins 1909, and under Rhus diversilobus, Phyllocoptes toxicophagus Ewing, 1922; it may be that galls on each species of Rhus is caused by a different mite. Very careful morphological studies should be done, with rearing experiments and DNA studies. Probably, Aculops toxicophagus (Ewing) will be the name for the mite causing galls on Rhus diversiobus, and Aculops rhois (Stebbins, 1909) for the mite causing erineum galls on Rhus radicans.

NOTE: Inflorescences of Rhus radicans often have flowers & fruits formed into long foliar filaments, with the edges curled in toward the upper midrib, containing numerous mites and a few hairs. Much of this dries up during the season and becomes brown or black and brittle, resembling Spanish Moss on poison ivy. But, many deformations continue to have parts of the deformity growing, tender and green containing mites eggs and offspring even into November. Deutogynes in August were more common in older filaments; protogynes and developing mites in the tender growth. Deformed fruiting bodies have been found at cliffs at Blackwater Falls St. Park (Tucker Co., WV),at the Summersville Library on several large plants on three large trees (Nicholas Co.), at I-79 Rest Area N. Bound, north of Clarksburg, Harrison Co., WV, at Cheat Lake south of Mont Chateau (WV Geological Survey), at Cheat Lake, Morgan's Run Park and Trail, at Monongahela River, just south of the Morgantown Dam, east side along bike path, and at 24 Pinnacle Lane, Monongalia Co., WV. Originally, the foliated fruit was thought to be injury from glyphosate (A.I. of Roundup herbicide), but, symptoms have been found where pesticides have never been used. These mites are very similar to Aculops rhois and careful descriptions should be made to determine if one and the same species causes both kinds of deformities. It is not known if this symptom occurs on Poison Oak, Poison Sumac or other species of Rhus in North America. Examination of large hedgerows of poison ivy in New Orleans failed to find any of this new symptom. So far, it has only been found in several locations in West Virginia, in Bridgeport, Morgantown, Cooper's Rock State Forest, and Black Water St. Park in Tucker Co. ",,,,No
32,Eriophyes laevis,Eriophyes laevis,Eriophyes laevis,An Illustrated Guide to Plant Abnormalities Caused by Eriophyid Mites in North America,"These beadlike galls are particularly striking because they appear on both surfaces of the leaves. They are small, hemispherical, of variable size and are scattered singly or crowded alongside the midrib. The galls are firmly attached, with the exit holes on the underside. They are shiny externally and the interior contains fleshy tissue. They range from green to yellowish, to red, to reddish brown as they mature. A single leaf may carry numerous galls so that it becomes distorted and its growth inhibited. Although P. laevis is a common species on alder, little is known of its seasonal history and habits. Specimens were abundant in August. The hosts are Oregon or red alder, white alder, and mountain alder in California and hazel alder in Ohio and Georgia. ","Alnus rubra,Alnus rhombifolia,Alnus rugosa,Alnus tenuifolia","12A, 10B",,,The life history involves alternation of generations. ,,,No
33,Eriophyes laevis,Eriophyes laevis,Phytoptus laevis,Amrine Catalog,"Numerous cephaloneon galls of various sizes, on both leaf surfaces [mostly upper]; Cephaloneon pustulatum Bremi.","Alnus glutinosa,Alnus incana,Alnus rugosa,Alnus tenuifolia,Alnus pubescens,Alnus rhombifolia,Alnus rubra,Alnus viridis",,,"Host associations on some plants are probably missidentifications, such as Betula papyrifera.
This may be a complex of very similar species, each restricted to one or two species of Alnus.
Amrine & Stasny (1994) mistakenly made laevis (Nalepa, 1889) a nomen nudum; they did not see the brief description on p. 132, which is sufficient according to the code.",,,,No
34,Aceria baccharipha,Aceria baccharipha,Eriophyes baccharipha,An Illustrated Guide to Plant Abnormalities Caused by Eriophyid Mites in North America,"This gall is known as Baccharis leaf blister, a pimplelike swelling that develops on both sides of the leaf blade, with the exit hole on the underside. Generally an infestation gives the leaf a pimply, blistered appearance. The galls vary in size and from greenish to yellow, to brown. The mites occur among the fleshy tissue in the galls and presumably leave the galls and migrate to the buds during unfavorable weather. The host plant is locally known as chaparral broom, a spreading evergreen shrub that occurs in coastal and inland hills in California and southern Oregon. The mite specimens were first collected in California in April. Eriophyes baccharipha should not be confused with two other eriophyids that infest Baccharis in California. They are Eriophyes calibaccharis Keifer, which occurs in the terminal buds of chaparral broom, and E. baccharices (Keifer), which causes irregular, wartlike, rough-looking galls on the upper surface of the leaves of seep willow (Baccharis glutinosa Pers.) and mule-fat (B. viminea D. C.). ",Baccharis pilularis,"13A, 13B",,,Nothing is known of the life cycle of this species. ,,,No
35,Aceria baccharipha,Aceria baccharipha,Aceria baccharipha,Amrine Catalog,Leaf blisters.,Baccharis pilularis,,,,,,,No
36,"Aceria brachytarsa,Aceria brachytarsa",Aceria brachytarsa,"Aceria brachytarsa,Eriophyes brachytarsus",An Illustrated Guide to Plant Abnormalities Caused by Eriophyid Mites in North America,"The pouch galls induced by this mite on the upper surface of the leaves invariably appear at random between the lateral veins and on the midrib. The galls are often solitary, 3.6 mm in dimension, irregularly globular, and shiny with roughened surface. They range from green to yellowish green with red-dish or brown tinge. The interior of the gall, which becomes red as it matures, consists of multicellular structures, as shown in plate 6, E. Galls at times are numerous on some trees, causing considerable distortion to the foliage. ","Juglans hindsii,Juglans californica","14A, 14B, 14C, 14D",,"Specimens were collected in the galls on California and Hind's walnuts in California. Eriophyes brachytarsus is similar to E. microcarpae Keifer, which causes similar pouch galls on little walnut (Juglans microcarpa Berland) and Arizona walnut (J. major (Tort.) A. Heller) in Texas, New Mexico, and Mexico. Eriophyes amiculus was subsequently observed to be the bi-sexual form (male and protogyne) of E. brachytarsus and is therefore a synonym. Eriophyes brevitatsus is a preoccupied name. ","The life history involves alternation of generations (see Jeppson et al. (1975)). Overwintering females are found in the terminal buds in late winter and in new galls in April. The males and protogynes appear in May, inhabiting the galls through August. Both forms are found in the galls during this period. ",,,No
37,Aceria brachytarsa,Aceria brachytarsa,Aceria brachytarsa,Amrine Catalog,"Undersurface purse galls; purse galls filled with parenchymatous tissue and sparse hairs, with channels for mite development. The leaf gall on Juglans nigra is mostly on the upper surface and hollow with hairs; nothing like this gall. ","Juglans hindsii,Juglans californica",,,"Eriophyes brevitarsus was preoccupied by the senior homonym, Eriophyes brevitarsus Fockeu, 1890, which was later assigned to Acalitus brevitarsus (Fockeu). Farkas (1965) changed the spelling to Aceria brevitarsa (Fockeu).
Aceria amiculus (Keifer, 1940) is the deutogyne and junior synonym according to Keifer (1969), in C3 [358: 15].
The mite causing leaf galls in Juglans nigra is a different species.
",,,,No
38,Aceria caulis,Aceria caulis,Eriophyes caulis,An Illustrated Guide to Plant Abnormalities Caused by Eriophyid Mites in North America,"This is an exceptionally interesting and beautiful pubescent gall, often brightly colored, passing from greenish through pink and crimson to reddish brown. The gall most frequently develops as an irregular, solid, hard mass on the leaf petiole. It is often solitary and variable in size. The exterior is covered with a dense mass of silky, unicellular, erineumlike hairs (see pl. 7, A). The gall tends to be large and to spread to and partly envelop the stem and leaf. The affected structure is greatly distorted and twisted, and leaflets fail to develop. This mite was found infesting black walnut in New Jersey and Pennsylvania in July-August. It is probably distributed throughout the range of its host from Ontario to Massachusetts and south to Florida and eastern Texas. ",Juglans nigra,"15A, 15B",,"E caulis is similar to and may be confused with E. brachytarsus Keifer, which causes pouch galls on leaves of California walnut. ",The life history involves alternation of generations; only the deutogynes overwinter in the buds. Both forms may be found among the dense mass of erineum hairs during the summer. ,,,No
39,Aceria caulis,Aceria caulis,Aceria caulis,Amrine Catalog,"The mites produce the Petiole Gall, peculiar reddish to purplish erineum-covered wooden swellings on the petioles; leaves often distorted and shortened; may be many galls per leaf.",Juglans nigra,,,"Missed by Davis et al., 1982 and by Amrine & Stasny, 1994. Cook did not put his name as author for caulis, but cited the author as Walsh. So, the name caulis (Cook, 1904)[138] never existed, but began in Banks 1907, p. 620. Banks may have thought that the description by Walsh, 1867, [1067] was nomen nudum, thus substituting Cook as the author. The description by Walsh is adequate according to the code, therefore Aceria caulis (Cook)  is a junior synonym of Aceria caulis (Walsh). This mite was not listed in Walsh's earlier paper in 1864 [787: 608].",,,,No
