77,Disholcaspis quercusmamma,Disholcaspis quercusmamma,Disholcaspis mamma,Some plant galls of Illinois,"These round, nipple-tipped galls are found on several species of oaks. They are colored green and red when young, velvety to touch, later becoming red or dark brown. In winter the galls are very hard and may be cut with difficulty. Rough Bullet Galls are generally found on young shoots of oak.",Quercus bicolor,16,https://www.biodiversitylibrary.org/page/16658335#page/23/mode/1up,,,,,No
78,Disholcaspis quercusmamma,Disholcaspis quercusmamma,Disholcaspis mamma,Field notes on gall-inhabiting cynipid wasps with descriptions of new species,"In the Chicago area the galls start about the middle or end of July and some are full grown by end of August, adults emerging in different years from October 20 to November 10. 
","Quercus macrocarpa,Quercus lyrata,Quercus bicolor",,https://www.biodiversitylibrary.org/page/7610694#page/306/mode/1up,,,"July, August, September, October, November","ND, MN, IL, NE, KA, IN, MI, NY, MO, AR",No
79,Disholcaspis quercusmamma,Disholcaspis quercusmamma,Disholcaspis mamma,Cynipid Galls of the Chicago Area,"Pointed bullet gall. Similar [to Disholcaspis quercusglobulus] but pointed at the apex, subclasping at base, often distorted by crowding and extending along the stem for several inches sometimes. Frequently on sprouts from stumps or on small trees in large numbers in the fall. On Q macrocarpa and bicolor. Adults emerge Oct 20-Nov 10.","Quercus bicolor,Quercus macrocarpa",,https://www.biodiversitylibrary.org/page/57505974#page/193/mode/1up,,,Fall,IL,No
80,Disholcaspis bassetti,Disholcaspis bassetti,Disholcaspis bassetti,Cynipid Galls of the Chicago Area,"Bassett's bullet gall. Broadest at the clasping sessile base and tapering gradually above, the apex often lop-sided, 15-20 mm high, the larval cell basal. Single or in crowded clusters on twigs of trees of Q bicolor in fall. Adults emerge in early Oct.",Quercus bicolor,,https://www.biodiversitylibrary.org/page/57505974#page/193/mode/1up,,,,,No
81,Disholcaspis bassetti,Disholcaspis bassetti,Disholcaspis bassetti,Field notes on gall-inhabiting cynipid wasps with descriptions of new species,,Quercus bicolor,,https://www.biodiversitylibrary.org/page/7610694#page/304/mode/1up,,,,"IL, ON",No
82,Callirhytis tubicola,Callirhytis tubicola,Cynips tubicola,On the Cynipidae of the North American Oaks and their Galls,"On Quercus obtusiloba [stellata] Clusters of yellow, tubular galls with red spines, on the underside of the leaves. The gall is a perpendicular tube 0.3 to 0.4 [no unit given] long, slightly narrowed at its point of attachment, open at the other end, yellowish and covered on its outer surface with numerous red spines. If cut open longitudinally, its inside appears divided into three compartments like so many floors, by two horizontal partitions; the compartment nearest to the base is empty, the intermediate one contains the insect and the third one is open at the top. 
If the red spines are removed with a knife and the surface of the gall examined under a strong lens, it shows dense longitudinal fibres and numerous little pale yellow crystals. The substance of the gall itself is hard, as if crystalline. From 30 to 40 of these galls are found sometimes on the underside of a single leaf. I frequently found them near Washington, in October and obtained the fly soon afterwards, each tube containing a single fly.",Quercus stellata,,https://www.biodiversitylibrary.org/item/22852#page/80/mode/1up,,,October,DC,Yes
83,Callirhytis tubicola,Callirhytis tubicola,Callirhytis tubicola,Cynipid galls of the eastern United States,"On Quercus stellata: Cluster of yellow tubular galls bearing red spines, erect on under side of leaf in fall, 12 mm. high.
Galls stand erect in a group on under side of leaf. Adults May 11-28 the next spring.",Quercus stellata,240,https://archive.org/details/cynipidgallseas00weld/page/78/mode/1up?q=tubicola,,,Fall,,No
84,Neuroterus saltarius,Neuroterus saltarius,Neuroterus saltarius,Field notes on gall-inhabiting cynipid wasps with descriptions of new species,"Small, seed-like bodies, inserted in cup-like depressions on the under surface of leaf and causing a prominent light-colored bulging on the upper side of the leaf opposite, often two or three hundred on a leaf, less numerous on the basal part of leaf blade. When growing the galls are greenish-white, somewhat globular, flattened above with a papilla in center and a raised rim, not pubescent. They start to develop in June and in July or August drop to the ground where they exhibit the phenomenon of bouncing about until the lodge in some crevice in the soil where they pass the winter. When detached a large scar is left on base of gall. During the winter the galls become tan-colored and somewhat compressed laterally, one measured 1.2 mm long by .9 mm thick and 1.1 mm high. ","Quercus macrocarpa,Quercus bicolor",,https://www.biodiversitylibrary.org/page/7610595#page/279/mode/1up,This gall seems to have been first described in 1876 by Riley who unfortunately applied to it the name of a California species with similar jumping habits. Under this name the eastern gall has been mentioned many times in literature and good figures have been published of it but up to the present no one seems to have reared the adult.,,"June, July, August","IN, DC, IL, NY, MI, IO, MO, MN",Yes
85,Andricus pattoni,Andricus pattoni,Cynips pattoni,New Cynipidae,"Galls, clusters of larval cells along the midvein of the leaves of Quercus obtusiloba [stellata], on the under side, and standing perpendicular to its surface. The cells are completely hidden in a short, dense brownish wool. The largest clusters often extend along the midvein more than half the length of the leaf. They are found on young trees, and usually on the leaves near the top of the stronger growing shoots. The insects live over winter in the galls. My specimens gathered in October were kept in a warm room and the insects came out in the February following. The galls resemble in their woolly covering those of C. flocci [Andricus quercusflocci] of Walsh, but the latter are round and the woolly hairs are longer, and the species is only found on Quercus alba. ",Quercus stellata,,https://www.biodiversitylibrary.org/item/22092#page/108/mode/1up,"C pattoni was discovered in 1876 on West Rock, in New Haven Conn by Mr W H Patton, from whom I have received several interesting species of gall insects, and to whom, in acknowledgement of my indebtedness, I dedicate this species. ",,October,CT,Yes
86,Andricus ignotus,Andricus ignotus,Cynips ignota,New Cynipidae,"Small oval cells, found singly or in small clusters of from two to eight together on the under side of the leaves of Q. bicolor. They are sessile on the midrib and principal veins, and usually lie in a position nearly horizontal to the surface of the leaf They are at first covered with short woolly hairs, but when ripe become more or less denuded. The naked surface when examined with a microscope shows numerous minute papillae, and between these a fine and regular reticulation. They are .10 of an inch in length and . 05 in diameter, and might easily be mistaken for the cocoons of some species of Microgaster. 
About fifteen years ago I found a few of these galls on the fallen leaves of a large oak and also on a small tree a few rods distant. The next year the greater part of the leaves on the large tree were covered with galls, a hundred or more being sometimes found on a single leaf I gathered a large quantity after the leaves fell, and the flies came out the next spring. I have examined this tree every year since and have never found any of these galls, nor have I ever seen them on other trees. 
There are some specimens of this species in the Museum at Cambridge, which Dr. Hagen informs me were found on oaks in the University grounds. I examined some oaks of the same species in the borders of the Botanical Garden at Cambridge last fall, and found several species of galls, but none of these. Can it be that the species has disappeared entirely ?",Quercus bicolor,,https://www.biodiversitylibrary.org/page/3043689#page/116/mode/1up,,,,MA,Yes
87,Andricus quercusstrobilanus,Andricus quercusstrobilanus,Cynips quercus strobilana,"""Additions and corrections to the paper entitled """"On the Cynipidae of the North American Oaks and their Galls""""""","On Quercus prinos, var bicolor [Quercus bicolor]. Large gall, at the tip of twigs, consisting of a number of wedge-shaped bodies, fastened by their poitned ends to a common centre. Diameter about an inch and a half. C q. stobilana [sic] (as yet not reared)
These specimens measure rather more than an inch and a half in diameter and look somewhat like the cones of some kinds of pine, for instance, of the scrub-pine, as they consist of a number from 20 to 25 or more of wedge-shaped bodies, closely packed together, with their pointed ends attached to a common centre. These wedges are hard and corky and break off very easily when the gall is dry. Each of them contains a hollow kernel with a plump, large larva inside. This gall is evidently produced by the sting of the insect on the single leaves of a bud, each leaf growing into the shape of a wedge.",Quercus bicolor,,https://www.biodiversitylibrary.org/page/3328795#page/296/mode/1up,,,,"PA, MD",Yes
88,Callirhytis vaccinii,Callirhytis vaccinii,(undescribed),"""Additions and corrections to the paper entitled """"On the Cynipidae of the North American Oaks and their Galls""""""","On Quercus obtusiloba [stellata] Post oak. Clusters of small, somewhat bell-shaped, petiolate, greenish galls on the under side of the leaves, along the midrib. Their shape may be compared to that of the flowers of vaccinium. They are attenuated at the basis into a short petiole, fastened to the midrib of the leaf; the opposite end is truncated the truncature being excavated; the length, from the foot of the petiole to the truncated end, is from 0.12 to 0.15. They grow in numbers, sometimes of ten or more together, so that six, for instance, form a row on one side of the midrib and four or five on the opposite. When found by me on the tree in October 1861, these galls were pale green; the dry specimens are brownish. Inside of each was a small whitish larva, probably of a cynips.",Quercus stellata,,https://www.biodiversitylibrary.org/page/3328795#page/297/mode/1up,,,October,,Yes
89,Callirhytis vaccinii,Callirhytis vaccinii,Acraspis vaccinii,On The Cynipidous Galls of Florida,"[Ashmead quotes the entire Osten Sacken original description]
This gall is common; begins developing in August, but does not reach maturity until last of December. I have found the same gall on the Post Oak at Asheville, N. C. ",Quercus stellata,,https://www.biodiversitylibrary.org/item/32293#page/146/mode/1up,"Baron Osten Sacken mentions having found this species in his second paper on North American Oak Galls 1862, p. 255, from whom the description of the gall is taken; he did not, however, breed the fly.",,August,NC,No
90,Callirhytis vaccinii,Callirhytis vaccinii,Zopheroteras vaccinii,"""The species of Biorhiza, Philonix and allied genera, and their galls""","In clusters on the midrib on the under side of the leaves of post oak (Quercus minor [stellata]) in autumn. They grow in numbers on the opposite sides of the rib. Monothalamous, somewhat bell shaped and greenish in color gradually becoming reddish late in the season. They are attenuated at the base into a short petiole, fastened to the rib, and at the opposite end they are truncated, and excavated, making their shape somewhat like that of a huckleberry blossom. Length 3 to 4 mm.",Quercus stellata,PXLII_6,http://digitallibrary.amnh.org/bitstream/handle/2246/660//v2/dspace/ingest/pdfSource/bul/B026a18.pdf?sequence=1&isAllowed=y,"[Synonymized with Acraspis vaccinii, Zopheroteras vaccinii, and Trigonaspis vaccinii. Ashmead created the species in Acraspis, moved it to Zopheroteras when he created that genus, Kieffer moved it to Trigonaspis (with no real explanation given) and Beutenmuller now moves it back to Zopheroteras.]","The gall begins to develop in August, but does not reach maturity until late in the fall.","August, Fall","FL, TX, New England",No
91,Zopheroteras hubbardi,Zopheroteras hubbardi,Parateras hubbardi,"""The species of Biorhiza, Philonix and allied genera, and their galls""",Nothing is known regarding the habits of this species.,,,http://digitallibrary.amnh.org/bitstream/handle/2246/660//v2/dspace/ingest/pdfSource/bul/B026a18.pdf?sequence=1&isAllowed=y,,,,MI,No
92,Callirhytis vaccinii,Callirhytis vaccinii,Andricus lustrans,Descriptions of New Cynipidae,The gall and male are not known.,,,https://www.jstor.org/stable/pdf/25076912.pdf,,,,TX,Yes
93,Callirhytis vaccinii,Callirhytis vaccinii,Andricus impositus,"""Notes on Cynipidae, with description of a new species (Hym.)""","On the under sides of the leaves of post oak (Quercus minor [stellata]) in clusters from about 4-40 individuals closely packed together, on the mid-rib and lateral veins, September to November. Monothalamous. Green, sometimes tinged with red. Elongate, rounded at the sides, narrow at the point of attachment and concave at the apex with a small central nipple. Outside it is rather densely covered with small pustules. When young, the gall is almost solid, but as it grows older the larval chamber gradually occupies the entire interior. After it drops to the ground, late in the fall, the gall gradually changes its shape to almost globular (berry-like) with the concave apex flattened and the surrounding rim less prominent. The crystal-like pustules change, the gall becoming evenly rugose. The point of attachment becomes long, narrow, and sharply pointed. The entire inside becomes hollow with the outer wall thin and brittle. Length 2.5 to 5 mm, width 2 to 4 mm, length of clusters 5 to 35 mm.",Quercus stellata,,https://www.biodiversitylibrary.org/page/2570776#page/411/mode/1up,"My observations on the galls were made from at least 500 clusters. At first I considered it to be that of Zopheroteras vaccinii Ashm., which it resembles when immature. But the flies are different, the female of vaccinii being apterous. The gall of A. impositus when mature resembles somewhat those of Cynips dimorphus and C. vacciniiformis. My galls were collected during September and until November 1st, 1915, but they evidently also occur earlier in the season, because some of the flies emerged in June and July and others in September, 1916. But the majority remained over until 19t7, the flies emerging indoors in January and February. My specimens were collected on a small rocky elevation in a, swamp, close to the Bronx River. near Westchester, New York City. This locality is gradually being filled in for streets and other improvement and soon %%rill become extinct. I have also taken the gall at Lakehurst, New Jersey, and it probably will be found in other places where Quercus minor [stellata] grows. 
",,,"NY, NJ",Yes
94,Dryocosmus deciduus,Dryocosmus deciduus,Dryocosmus deciduus,Field notes on gall-inhabiting cynipid wasps with descriptions of new species,,,,https://www.biodiversitylibrary.org/page/7610635#page/309/mode/1up,"These galls long known in literature under the name decidua before the adult was reared are the ones to which Dr. A. D. Hopkins referred under the name of ""black oak wheat"" in a note. These specimens were from Wescott, Mo., and Texarkana, Ark. Doctor Hopkins collected galls at Kanawha Station, W. Va., September 25, 1923. The writer collected galls at Evanston and High-land Park, Ill.; Ironton and Poplar Bluff, Mo., and at Bluemont, Va. Galls collected at Evanston on October 8, 1910 contained pupae on September 22, 1917 and adults on November 16 which emerged March 23—April 22, 1918. As the flies reared agree with the type in having the mesoscutum smooth, parapsidal grooves complete, head sculptured, no malar groove, antennal segment 3 longer than 4 and claws simple, the species is here transferred to Dryocosmus. ","After the galls drop they change shape somewhat as the thick nutritive layer is used up, becoming distinctly spindle-shaped and only a thin brittle shell is left in the swollen central region. ","September, October","MO, AR, VA, IL",No
95,Andricus robustus,Andricus robustus,Andricus robustus,Field notes on gall-inhabiting cynipid wasps with descriptions of new species,"A midrib cluster on under side of leaf in fall, the galls dropping to the ground when mature. The individual galls are somewhat globular, tapering to a pedicel at base and pointed with a slight scar at apex, greenish and mottled with white when fresh turning brown during winter on ground. 
The type material was collected at Arlington, Texas, November 3. 1917, when the galls were still dropping to the ground. On December 1.1919. living flies (that would probably have emerged in spring of 1930) were cut from the galls. Some of the same lot of fresh galls were sent to William Benteninueller, who reared adults January 10. February 11. 15. 20, 21. 1919, and more in February. 19211. Paratype flies were cut out December 1, 1919. from galls collected Texarkana, Ark.. in October. 1917. The galls have been collected also at Webster Groves. Poplar Bluff. and Ironton. Mo. Hoxie,. Little Rork. and Hot Springs. Ark:: Palestine. Cuero. and Austin, Tex.: Cottondale. Fla.: Washington. D. Falls Church. Va. Galls collected at Washington in late October. 1923. gave adults February 22 March 1. 14. 17. 1925. and these have been included among the paratypes. ",Quercus stellata,18,https://www.biodiversitylibrary.org/page/7610635#page/349/mode/1up,This is the gall described in connection with the fly of Cynips vacciniformis Beutenmuller which seems to have come from an accidentally included gall of a different sort in the breeding cage.,,November,"AR, MO, TX, FL, DC, VA",Yes
96,Callirhytis infuscata,Callirhytis infuscata,Callirhytis infuscata,Field notes on gall-inhabiting cynipid wasps with descriptions of new species,,"Quercus laevis,Quercus marilandica,Quercus incana,Quercus laurifolia,Quercus myrtifolia",,https://www.biodiversitylibrary.org/page/7610635#page/362/mode/1up,"This species was described from Jacksonville. Fla.. from galls on Quercus catesbaei [laevis], the adults emerging in March. As the tarsal claws are simple the species is here transferred to Callirhytis. The writer has collected the galls on the above host at Green Cove Springs. Marianna, River Junction, Madison, Tallahassee, Carabelle, Gainesville, Ocala. St. Petersburg. and Clearwater. FL. Similar galls were seen at Marianna on Q. marilandica and Q. cinerea [incana] and on Q. laurifolia at Gainesville, Ocala, and Clearwater. Galls collected November 20, 1919, at Daytona on Q. laurifolia and sent to Washington and Evanston for rearing gave flies May 23, 26, June 3 and 15 1920. From galls collected at Savannah. Ga.. November 20, 1919, living flies were cut March 14. 1921, having pupated the previous November. Galls on Q myrtifolia collected at Daytona November 20, 1919 gave flies May 23, 1920, but some galls still contained larvae as late as September I. 1924, so that the emergence may be distributed over at least two seasons. The writer has been unable to separate these reared specimens from the types of infuscata. ",,November,"FL, GA",No
97,Callirhytis vaccinii,Callirhytis vaccinii,Callirhytis lustrans,Field notes on gall-inhabiting cynipid wasps with descriptions of new species,"These galls occur as midrib clusters on under side of leaves of Quercus stellata in the fall, dropping when mature. When fresh the individual galls are shaped like huckleberry flowers, somewhat cylindrical with the end distinctly truncate and depressed, but during the winter on the ground they become globular except for a short pedical, and the depressed end becomes a flattened circular scar at apex with a slightly raised rim, and the greenish or reddish color changes to brown.","Quercus stellata,Quercus breviloba",,https://www.biodiversitylibrary.org/page/7610635#page/363/mode/1up,"Lustrans was described from two adults captured at Austin, TX, gall and host unknown. One of these specimens was given in 1921 to the writer, who recognized its close relation to impositus. lustrans is described as without a median groove, but this specimen in certain positions shows a faint median line, while the groove in some of the many available partaypes of impositus is fully as faintly defined. The writer is unable to separate paratypes of verifactor from lustrans. The gall of this species was first described by Osten Sacken in 1862, but Ashmead was evidently in error in thinking he had reared it in 1887, associating the wingless fly he reared with the wrong gall. ",,"July, November, October","NY, MO, TX, OK",No
98,Callirhytis vaccinii,Callirhytis vaccinii,Andricus dimorphus verifactor,Studies of some new and described Cynipidae (Hymenoptera),"Clustered, seed-like leaf galls. Each gall monothalamous, elongate, rather cylindrical, urn-shape, broadest at the middle, less broad apically, flattened at the end, taper pointed basally, up to 4 mm in diameter by 6 mm in length; colored dark green when young, becoming a dark red or purplish red when old. Mostly solid and fleshy when young, becoming hard, thin -walled, and hollow when old, without a distinct larval cell lining. In compact clusters of up to 30 galls, attached to the midrib, on the under sides of leaves of Quercus stellata (and Q breviloba?)
This gall is very common on the post oaks in Texas. Patterson states that the punctures from which the galls will arise may be detected about the first of May, that the galls do not develop from the scars until about the middle of July, that the galls are fully grown in size by the first of October, and in a couple of weeks most of them fall to the ground. I have collected them in late November and December, but the larva are then still so small that they do not mature after becoming dry. Evidently they need to be kept moist, as they are when lying on the ground, to allow the insect to develop. Patterson secured over a hundred adults which emerged from February 12, 1922, to March 8. Inasmuch as the breeding of the insect is difficult unless carefully handled on the field, we are considerably indebted to Dr. Patterson for successfully rearing the adult. I collected the galls, but did not obtain the insects from the other Texas localities listed. It is possible but not prob-able that other varieties occur at some of those points. The gall occurs on Q. breviloba at Leander, and Patterson reports it as occasionally on breviloba at Austin. It is not unlikely that the breviloba insect is a distinct variety with a range centering about Burnett County, Texas. 
","Quercus stellata,Quercus breviloba",,https://www.biodiversitylibrary.org/page/45387508#page/77/mode/1up,"This is certainly a variety of Andricus dimorphus, described as a Cynips (Beutenmuller, 1913, Trans. Amer. Ent. Soc., XXXIX, p. 245) from galls taken by Weld at Evanston, Illinois, on Q. macromrpa. Similar galls have been recorded and are common on white oaks of many species from the whole of eastern United States. Unfortunately I cannot examine the types of dimorphus, and cannot furnish a comparative description. Probably several different varieties occur in several faunal areas, and possibly different varieties on different hosts. This variety appears to differ from dimorphus in having the thorax less roughly rugose, the parapsidal grooves and lateral lines smooth, and the first abscissa of the radius not infuscated. Probably an examination of the dimorphus type would modify this comparison and disclose other points of difference. 
Cynips vacciniiformis was described from Q. stellata galls which are undoubtedly those of verifactor, and from Austin. But the description of the single insect obtained is far from correct for the true producer of this gall, and apparently applies to a different species mistakenly supposed to have come from verifactor galls. Vaccinliformis was described in 1913. Of course insects bred from galls collected in 1917 and now labelled cotypes in at least a couple of collections, cannot have any standing as type material. [Kinsey seems to have been mistaken about the synonymy of his galls with Beutenmuller's Callirhytis vacciniiformis?]
",,,"TX, OK, LA",No
99,Andricus robustus,Andricus robustus,Cynips vacciniiformis,Descriptions of New Cynipidae,"In clusters on the midrib of post oak (Quercus minor [stellata]). Monothalamous and moderately thick-walled with a large round larval chamber. Globular and almost like a huckleberry or fruit of hackberry (Celtis occidentalis) with a more or less distinct nipple at the apex and long petiole or stem at the base by means of which it is attached to the leaf. Brown when old and probably green when fresh. The outer surface is slightly roughened or almost smooth. Diameter 4-7 mm; petiole 1-2.5 mm long. The gall somewhat resembles that of C dimorphus, but is larger and more globose. It occurs in clusters like dimorphus, but the galls as less closely together and not pressed out of shape, each individual gall retains its globose shape. The male is not known.",Quercus stellata,,https://www.biodiversitylibrary.org/item/27823#page/323/mode/1up,,,,TX,Yes
100,Andricus robustus,Andricus robustus,Cynips vacciniiformis,Key to American Insect Galls,"Globose, clustered, monothalamous, midrib gall with a more or less distinct nipple apically and a long stem basally, brown when old, probably green when fresh, diameter 4 to 7 mm, stem 1 to 2.5 mm, resembles a huckleberry, on post oak.",Quercus stellata,,https://www.biodiversitylibrary.org/page/8635512#page/84/mode/1up,,,,,No
