40,Aceria aloinis,Aceria aloinis,Eriophyes aloinis,An Illustrated Guide to Plant Abnormalities Caused by Eriophyid Mites in North America,"An affected plant shows a remarkable proliferation of unsightly, irregular outgrowth, clustered densely on the surface of the leaf blades or in leaf axils. The infestation may be con-fined to the base in the leaf axils as bunched, greenish, tiny-to-large globular sprouts or as a lumpy, rough-looking thickening in the form of wartlike growths from the base of the leaf blade extending to the tip. The longitudinal pattern of growth follows that of the lanceolate shape of the leaf. It ranges from yellowish to brownish, to green tinged with yellow. The mites also attack the inflorescence and cause galled blooms. This eriophyid attacks golden-tooth aloe, spider aloe, and star cactus or wart plant in southern California and Florida. It is probably found wherever these plants are grown. ","Aloe nobilis,Aloe spinosissima","16A, 16B, 16C, 16D",,,The mites live in crevices among the various growths and were collected in November. ,,,No
41,Aceria aloinis,Aceria aloinis,Aceria aloinis,Amrine Catalog,The mites cause severe deformation on the inner sides of leaf axils and on inflorescences.,"Aloe spinosissima,Aloe striata,Haworthia retusa",,,,,,,No
42,Aceria sandorici,Aceria sandorici,Eriophyes sandorici,An Illustrated Guide to Plant Abnormalities Caused by Eriophyid Mites in North America,"This is an unsightly pouch gall that develops on the underside of the leaf blade as a concavity filled with erineum and on the upper side as a rounded outpocketing with irregular puckered domes. The pouch is greenish, becoming blackish, and the erineum turns brownish at maturity. The galls are variable in size and are frequently coalesced and crowded, giving a lumpy appearance to the leaf blade. Eriophyes sandorici has been found only on santol of the mahogany family Meliaceae, a tropical tree with edible fruit from the lndomalayan region and Mauritius. ",Sandoricum koetjape,17A,,,The life cycle and seasonal distribution are unknown. ,,,No
43,Aceria sandorici,Aceria sandorici,Aceria sandorici,Amrine Catalog,"Erineum pockets on upper and lower sides of leaves, the pockets protruding out of both surfaces.",Sandoricum koetjape,,,,,,,No
44,Aceria fraxini,Aceria fraxini,Eriophyes chondriphora,An Illustrated Guide to Plant Abnormalities Caused by Eriophyid Mites in North America,"The galls on the upper surface of ash leaves are unmistakable and often particularly numerous on the terminal leaves. They are small and solitary, somewhat reniform in shape, and gen-erally scattered at random on the lateral veins. Their greenish-yellow color and shape give a striking effect on an infested leaf. Specimens were found in galls on leaves of white, Oregon, and green or red ash in California, Wisconsin, Virginia, New York, Vermont, and Canada. In Europe, Eriophyes fraxinicola (Nalepa), a closely related species of E. chondriphora, makes similar galls on leaves of European ash (Fraxinus excelsior L.). ","Fraxinus americana,Fraxinus latifolia,Fraxinus pennsylvanica",18A,,,The mites inhabit the galls until the leaves mature in late summer. The life history apparently involves alternation of generations. ,,,No
45,Aceria fraxini,Aceria fraxini,Aceria fraxini,Amrine Catalog,"Masses of bead galls on leaves, with most openings on the lower surface of the leaf; [deformed flowers [892], error, symptoms of Aceria fraxiniflora (Felt, 1906)].","Fraxinus americana,Fraxinus latifolia,Fraxinus pennsylvanica,Fraxinus nigra",,,"Misspelled as chrondiphora by Keifer 1967 [3223] & Keifer 1975 in Jeppson et al. [295]. Determined to be a junior synonym of Aceria fraxini (Garman, 1883) by Amrine & Stasny 1994 (#1099:34). If these mites are cryptic species [sibling species], specific to each species of ash, then chondriphora will be restored for the Oregon Ash.",,,,No
46,Callirhytis furva,Callirhytis furva,Callirhytis furva,New American Cynipid Wasps From Galls,"Small, somewhat globular galls, 3-4 mm in diameter covered with short, straight, stiff brown hairs, scattered along midrib or main veins on upper side of leaf in the fall and dropping off singly when mature. The hairs do not weather away during winter. Similar to galls of C infuscata on Quercus laevis in Florida.",Quercus palustris,21,https://www.biodiversitylibrary.org/page/15672479#page/385/mode/1up,,The types were reared from galls collected on ground in VA in October. Adults emerged March 20. Similar galls have been noted on nine other species of red oaks. [Type host is Q palustris],,,Yes
47,Callirhytis infuscata,Callirhytis infuscata,Andricus infuscatus,On The Cynipidous Galls of Florida,"A globular, fleshy gall, densely covered with yellow wool; diameter .23 to .25 inch. It is attached by a slight point to the upper surface of the leaf and when mature is in reality nothing but a hard, tough, larval cell, covered with wool; the wooly covering is easily detached. It is monothalamous; occasionally several galls occur together on the leaf compressing one another into odd shapes but the galls fall to the ground, separate and renew their globular form, and the fly reaches maturity in the damp earth. Described from several specimens reared in March.",Quercus laevis,,https://www.biodiversitylibrary.org/item/32293#page/154/mode/1up,,,,,Yes
48,Callirhytis piperoides,Callirhytis piperoides,Andricus piperoides,New Species of North American Cynipidae (1900),"Galls from one-eighth to three-eighths of an inch in diameter, in dense clusters along the mid-vein of full grown red oak leaves (Quercus rubra). They are found only on the largest leaves of the thriftiest shoots of young oaks. The clusters contain from one or two dozen galls up to a hundred or more, and extend along the vein two, three or even four inches. The vein is considerably enlarged, and is often split by the crowding of the galls as they increase in size. The blade of the leaf is often torn by the same force and the galls appear on both surfaces. When on the tree they are covered with a dense, coarse pubescence which is, in color, a dusky drab, or when exposed to the sun a brownish red. They are round except a very slight elongation at the point of attachment to the leaf. After falling to the ground they soon turn black, and after losing their pubescence they resemble quite closely small black pepper corns. At this time they are a solid mass of vegetable cells with a minute jelly-like center, which is the undeveloped larva. The growing larva devours the gall till at maturity nothing remains but a thin shell. ",Quercus rubra,,https://www.biodiversitylibrary.org/page/7522373#page/338/mode/1up,,"My galls were collected in October and were kept until late the next Summer under conditions as nearly normal as possible. As the flies seemed mature in August I placed the galls in dry boxes, expecting the insects would soon appear. During October and November I removed from the galls some two hundred insects. They were somewhat torpid but seemingly mature. These were alive in January of the next year, and those in the galls had undergone no change. A few individuals emerged from the galls in the Winter, though most remained alive in the galls many months after.",,,Yes
49,Callirhytis infuscata,Callirhytis infuscata,Andricus infuscatus,Key to American Insect Galls,"Globular, fleshy, monothalamous leaf gall with dense, yellow wool, diameter 5 to 6 mm, on upper surface, on Q catesbaei [laevis].",Quercus laevis,,https://www.biodiversitylibrary.org/page/8635512#page/118/mode/1up,,,,,No
50,Callirhytis lanata,Callirhytis lanata,Dryophanta lanata,Descriptions of new Cynipidae in the Collection of the Illinois State Laboratory of Natural History,"During late summer and autumn the galls of this species are found on the under side of leaves of Quercus rubra and Q coccinea, appearing externally as little bunches of compact brown wool and hardly distinguishable in outward appearance from the galls of Andricus flocci Walsh. The galls seldom occur singly, but usually in clusters of from four to eight. A cluster of eight galls when fully grown will measure about 3/8 of an inch in width by 5/8 of an inch in length. An individual gall when denuded of its covering is in the form of an irregularly shaped cone with a bulging base, the diameter of the base being three or four sixteenths of an inch, which is nearly twice the height. The galls fall to the ground in the autumn in advance of the leaves, and the flies emerge the following summer. ","Quercus rubra,Quercus coccinea",P9F5,https://www.biodiversitylibrary.org/page/8571764#page/205/mode/1up,,,,,Yes
51,Callirhytis lanata,Callirhytis lanata,Dryophanta lanata,Key to American Insect Galls,"Bunches of pale brown wool on under surface of leaf, each with 2 to 8 triangular or irregularly conical cells, diameter 5 to 15 mm, on Q rubra, coccinea, velutina, marilandica, phellos, nana.","Quercus rubra,Quercus coccinea,Quercus velutina,Quercus marilandica,Quercus phellos,Quercus ilicifolia",F108_1-3,https://www.biodiversitylibrary.org/page/8635512#page/117/mode/1up,,,,,No
52,Callirhytis lanata,Callirhytis lanata,Callirhytis lanata,Field notes on gall-inhabiting cynipid wasps with descriptions of new species,"This species is here recorded from two new host oaks, Q rubra and Q texana from IL, MN, WI, PA, NY, VA, MO, OK, TX, and AL. Galls collected in fall of 1916 contained pupae and larvae in September and adults and larvae in November. Adults issued in April. Brodie found the galls common about Toronto on red and black oak, forest trees as well as second growth. They appear in August, mature in October dropping before the leaves, the producers emerging May and June from galls collected on the ground under the trees the previous fall. ","Quercus rubra,Quercus texana",,https://www.biodiversitylibrary.org/page/7610635#page/363/mode/1up,,,,,No
53,Callirhytis lanata,Callirhytis lanata,Dryophanta lanata,"""Insect galls of Springfield, Massachusetts, and vicinity""","A cluster of several light brown, wooly galls, sometimes pink-tinted, found on the under side of the leaf. Individual galls cone-shaped, monothalamous, attached by tip of cone to common center. About 5 mm wide, 5-7 mm high. The galls fall from the leaf in early autumn. The flies emerge the following spring. Common on Q coccinea.",Quercus coccinea,P6F25,https://www.biodiversitylibrary.org/page/21941228#page/25/mode/1up,(The photo Stebbins includes as D lanata resembles C piperoides; presumably an error),,,,No
54,Callirhytis piperoides,Callirhytis piperoides,Andricus piperoides,"""Insect galls of Springfield, Massachusetts, and vicinity""","These galls are found in clusters of one to five dozen along the midrib, looking as if they had burst out from the inside of the leaf or vein. Each is smooth, spherical, attached by a small stem, 3.8 mm in diameter, monothalamous, grayish or tinged with red. They fall to the ground, where the larva completes its metamorphosis, which sometimes requires two years. Insects in second summer. Leaves of red oak Q rubra. Not rare.",Quercus rubra,,https://www.biodiversitylibrary.org/page/21941228#page/23/mode/1up,,,,,No
55,Callirhytis lanata,Callirhytis lanata,Callirhytis lanata,Cynipid Galls of the Chicago Area,"Hemispherical brownish woolly mass on midrib on underside of leaf of Q rubra and velutina. Made up of a cluster of easily detached separate angular galls which drop to the group in the fall in Oct before the leaves, each covered with a dense coating of wool. They are then fleshy and apparently solid as the larval cavity is very minute. Adults emerge the second and third springs in April.","Quercus rubra,Quercus velutina",,https://www.biodiversitylibrary.org/page/57505981#page/200/mode/1up,,,,IL,No
56,Callirhytis piperoides,Callirhytis piperoides,Dryocosmus piperoides,Cynipid Galls of the Chicago Area,"Similar in size and shape [to Andricus dimorphus] but red in color, in an elongated less compact cluster on upper or lower side of large leaves on thrifty shoots of Q rubra, dropping in October. Pubescent under lens. Adults emerged April-May the second spring and some hang over to emerge still later.",Quercus rubra,,https://www.biodiversitylibrary.org/page/57505981#page/201/mode/1up,,,,IL,No
57,Callirhytis lanata,Callirhytis lanata,Callirhytis lanata,50 common plant galls of the Chicago area,"This gall, which occurs as a woolly mass on the under side of the leaves of several species of the red oak group, is composed of angular galls closely joined. When young the galls are covered with a whitish wool which later turns brown.",,Callirhytis lanata,https://www.biodiversitylibrary.org/item/25182#page/24/mode/1up,,,,IL,No
58,Callirhytis piperoides,Callirhytis piperoides,Andricus piperoides,An illustrated catalogue of American insect galls,"Fuzzy, globular. Red oaks.",,286,https://www.biodiversitylibrary.org/item/37925#page/80/mode/1up,,,,,No
59,Callirhytis piperoides,Callirhytis piperoides,Andricus piperoides,Key to American Insect Galls,"Clustered, pubescent, globular, drab or brownish red midvein galls, frequently splitting and extending along the vein 4 to 8 cm, diameter 3 to 9 mm, occur in clusters of 10 to 100 or more on a leaf, on Q rubra. ",Quercus rubra,,https://www.biodiversitylibrary.org/page/8635512#page/114/mode/1up,,,,,No
60,Callirhytis piperoides,Callirhytis piperoides,Dryocosmus piperoides,Field notes on gall-inhabiting cynipid wasps with descriptions of new species,"Galls of this species were noted on the leaves of Q maxima [rubra] in IL, NY, and VA. Some specimens sent from Maine were determined by the writer as those of this species. Galls collected in IL in October contained both pupae and larvae in September and adults and larvae in November. Adults emerged April to May. The emergence is evidently distributed over at least two seasons. Beutenmueller notes that the galls were very common in the fall of 1916 and again in 1918, but none were noticed in 1917. ",Quercus rubra,,https://www.biodiversitylibrary.org/page/7610700#page/312/mode/1up,,,,,No
61,Callirhytis furva,Callirhytis furva,Callirhytis furva,Cynipid galls of the eastern United States,"On Quercus catesbaei [laevis], coccinea, falcata, ilicifolia, imbricaria, laurifolia, marilandica, myrtifolia, nigra, palustris, phellos, velutina: Small cluster of globular galls, 3-4 mm in dia., each covered with short, straight brown hairs, on upper side of leaf in fall.","Quercus laevis,Quercus coccinea,Quercus falcata,Quercus ilicifolia,Quercus imbricaria,Quercus laurifolia,Quercus marilandica,Quercus myrtifolia,Quercus nigra,Quercus palustris,Quercus phellos,Quercus velutina",212,https://www.biodiversitylibrary.org/item/273718#page/156/mode/1up,,,,,No
62,Callirhytis infuscata,Callirhytis infuscata,Callirhytis infuscata,Cynipid galls of the eastern United States,"On Quercus catesbaei [laevis]: Woolly midrib cluster on under side in fall dropping in late Nov. When wool weathers away each element is white and flat-topped. [contradicts original description, which states that this gall is found on the upper side of the leaf on this host]
On Quercus cinerea [incana]: Globular, fleshy, densely covered with yellow wool, on upper surface in fall, dropping when mature.
On Quercus laurifolia: Globular, fleshy, densely covered with yellowish wool, single or cluster on midrib on  upper surface in fall, dropping when mature, then the wool coming away clean.
On Quercus marilandica: Globular, fleshy, densely covered with yellow wool, on upper surface in fall, dropping when mature.
On Quercus myrtifolia: Globular, fleshy, densely covered with yellow hairs, on upper surface in fall, dropping when mature.
On Quercus phellos: Globular, densely covered with yellow wool, on midrib on upper surface in fall, dropping when mature.
On Quercus pumila: Globular, densely covered with yellow wool, in cluster on midrib in upper surface in fall, dropping when mature and becoming plump on ground, the wool easily detached.","Quercus laevis,Quercus incana,Quercus laurifolia,Quercus marilandica,Quercus myrtifolia,Quercus phellos,Quercus pumila",,,,,,,No
63,Callirhytis piperoides,Callirhytis piperoides,Callirhytis piperoides,Cynipid galls of the eastern United States,"On Quercus coccinea, ilicifolia, rubra, velutina: Cluster on upper or lower side of leaf, each spherical, red, pubescent, 1-4 mm in dia, dropping in fall.","Quercus coccinea,Quercus ilicifolia,Quercus velutina,Quercus rubra",201,https://www.biodiversitylibrary.org/item/273718#page/154/mode/1up,,,,,No
64,Callirhytis lanata,Callirhytis lanata,Callirhytis lanata,Cynipid galls of the eastern United States,"On Quercus coccinea, falcata, ilicifolia, marilandica, rubra, texana, velutina: Woolly midrib cluster on under side of leaf in fall, dropping before the leaves.","Quercus coccinea,Quercus falcata,Quercus ilicifolia,Quercus marilandica,Quercus velutina,Quercus rubra,Quercus texana",206,https://www.biodiversitylibrary.org/item/273718#page/155/mode/1up,,,,,No
65,Neuroterus laurifoliae,Neuroterus laurifoliae,Neuroterus laurifoliae,On The Cynipidous Galls of Florida,"An oblong, wooly gall on the upper or lower surface of the leaves; the wool is fawn colored, long and fine, covering three or four, sometimes more irregularly rounded, flattened disks, in the centre of which live the flies; they are attached to the midrib by a nipple-like point; the disk or cell is concave above and measures .08 to .10 inch in diameter. ",Quercus laurifolia,,https://www.biodiversitylibrary.org/item/32293#page/150/mode/1up,,,,,Yes
66,Neuroterus laurifoliae,Neuroterus laurifoliae,(undescribed),Cynipid galls of the eastern United States,Woolly midrib cluster on under side of leaf in fall. Wool comes off clean leaving a conical gall with a sunken crenate top.,Quercus imbricaria,209,https://www.biodiversitylibrary.org/item/273718#page/155/mode/1up,"Caption for F209: This gall on Q imbricaria with the wool easily detached may be what Ashmead described as the ""Laurel-oak Woolly Gall,"" Neuroterus laurifoliae Ashm., (the type now lost) (no Neuroterus on a red oak) or Callirhytis perplexa (Ashm.), from an unknown oak in MO or Callirhytis infuscata (Ashm) described from Q catesbaei [laevis].",,,,No
67,Neuroterus laurifoliae,Neuroterus laurifoliae,Neuroterus laurifoliae,Key to American Insect Galls,"Globose, kernel-like leaf galls occurring singly or in clusters and covered with long, loose, fawn-colored wool, diameter of kernel 2 to 2.5 mm, on Q laurifolia, Q imbricaria.","Quercus laurifolia,Quercus imbricaria",F107_7-8,https://www.biodiversitylibrary.org/page/8635512#page/116/mode/1up,,,,,No
68,Disholcaspis bassetti,Disholcaspis bassetti,Disholcaspis bassetti,A Study of the Cynipidae,"The gall occurs, sometimes singly, but usually in clusters about the twigs. The cluster represented at Fig. 2 was composed of 30 of these galls closely crowded together. The galls resemble very much the galls of Holcaspis duricoria Bass (Cynips mamma Wal) (Fig 3). The galls are very much the shape that a thick waxy material would take if dropped on the twigs and then suddenly congealed, leaved stout, test-like projections standing out from each drop. The central cell is placed low in the gall and can usually be seen protruding when the latter is broken off. Some entomologists have thought this gall to be identical with Walsh's C. mamma, but I have examined a large number of both forms and find the following points of difference, which convince me that this, if not a new species, is certainly a well marked variety:
H bassetti as compared with H duricoria, is rather larger and more irregular in outline. The teat-like projection is much heavier and longer in proportion to the size of the gall and appears to be a drawn-out portion of the substance of the gall, while in duricoria it is a small, hard pointed projection much resembling a spine in many cases, and often almost entirely wanting. In bassetti the substance of the gall is more corky and easy to cut. The central cell, as before stated, is at the base of the gall, and when the latter is removed the point of the cell can usually be seen protruding below. Before the gall is detached the central cell is situated with its greatest diameter perpendicular to the limb at the point of attachment of the gall. In duricoria the cell is situated at the center of the gall; it never protrudes from below when the gall is detached; and it always has its greatest diameter parallel with the limb at the point of attachment of the gall. The central or larval cells are also differently shaped. In duricoria the cell is egg-shaped, while in bassetti the end towards the twig is somewhat pointed, so that the cell is very much the shape of a plump apple seed with the point rounded off. ",Quercus bicolor,2,https://babel.hathitrust.org/cgi/pt?id=msu.31293101462541&view=1up&seq=508,,,,,Yes
69,Disholcaspis quercusmamma,Disholcaspis quercusmamma,Holscaspis duricoria,A Study of the Cynipidae,"The galls are very common on the twigs of Quercus bicolor and macrocarpa. They may appear singly but are usually crowded in the cluster, are sub-globular in outline with a small teat-like projection. The fly, which much resembles Holcaspis globulus, rugosa, and bassetti, began to appear in the breeding cages Oct 27. Fig 3 is a full size representation of a cluster of these galls.","Quercus bicolor,Quercus macrocarpa",3,https://babel.hathitrust.org/cgi/pt?id=msu.31293101462541&view=1up&seq=506,"This is probably the gall-fly referred to by Walsh in a foot-note in the American Entomologist Vol 1, page 102, for which he suggests the specific name mamma. Mr Bassett described this insect and gave it the specific name duricoria, a name that has been accepted by European entomologists [Weld lists duricoria in the genus Synergus, suggesting it was an inquiline mistaken for the gallformer]. For this reason, and for the farther reason that Walsh's description is not sufficient to distinguish the species with any certainty, I have given Bassett's name the preference. ",,,,No
70,Disholcaspis bassetti,Disholcaspis bassetti,Disholcaspis bassetti,An illustrated catalogue of American insect galls,,Quercus bicolor,214,https://www.biodiversitylibrary.org/item/37925#page/72/mode/1up,,,,,No
71,Disholcaspis bassetti,Disholcaspis bassetti,Disholcaspis bassetti,A contribution to the morphology and biology of insect galls ,"A monothalamous gall occurring singly or in clusters around the stems of the host. When grouped the galls often cover completely 4 to 5 inches of the stem.
When the gall is not deformed by crowding, it is irregularly circular in outline at the base, gradually tapering to a distinct point that is recurved in most cases. The gall is attached to the host by a small stalk at the centre of the base. Colour green, often tinged with pink when young; becoming brown when more mature. The larval chamber resembles closely that found in the former species [Disholcaspis quercusglobulus] in being oval and free at maturity, but it differs in being placed nearer the base of the gall and in tapering to a point at the end nearer the twig. 
Diameter at base, average, 16 mm.
",Quercus macrocarpa,,https://www.biodiversitylibrary.org/page/31983254#page/55/mode/1up,,,,,No
72,Andricus apiarium,Andricus apiarium,Liodora apiarium,New American Cynipid Wasps From Galls,"Solitary, sessile, on underside of leaf close to edge in October, shaped like an old-fashioned straw beehive, white or pinkish, measuring up to 4.6 mm broad by 4.0 mm high. Inside is a large cavity with a transverse larval cell at very base. During the winter on the ground the outer fleshy layer shrivels and the gall becomes more cylindrical. Not common. ",Quercus alba,9,https://www.biodiversitylibrary.org/page/7735404#page/18/mode/1up,,,October,"VA, MD, DC",Yes
73,Disholcaspis quercusmamma,Disholcaspis quercusmamma,Disholcaspis quercusmamma,Key to shelterbelt insects in the northern great plains,"Twig gall. Light tan globular woody gall with a rough surface, found in groups of 3 or more. Bur oak. Summer. Oak bullet gall",Quercus macrocarpa,79,https://www.biodiversitylibrary.org/page/46598504#page/83/mode/1up,,,Summer,,No
74,Disholcaspis quercusmamma,Disholcaspis quercusmamma,Disholcaspis mamma,Key to American Insect Galls,"Globose, obscurely pointed, green, bright red, turning to brown or dark red, diameter 6 to 18 mm, on Q platanoides [bicolor] Q macrocarpa. ","Quercus bicolor,Quercus macrocarpa",F64_1,https://www.biodiversitylibrary.org/page/4885269#page/342/mode/1up,,,,,No
75,Disholcaspis bassetti,Disholcaspis bassetti,Disholcaspis bassetti,Key to American Insect Galls,"Globose, usually with a produced, curved apex, single or clustered twig gall, green turning to brown, on Q platanoides [bicolor], Q imbricaria [mistake? confused with Callirhytis ventricosa?]","Quercus bicolor,Quercus imbricaria",F64_6-7,https://www.biodiversitylibrary.org/page/4885269#page/342/mode/1up,,,,,No
76,Disholcaspis quercusmamma,Disholcaspis quercusmamma,Disholcaspis mamma,50 common plant galls of the Chicago area,"This gall may be confused easily with the preceding [Disholcaspis quercusglobulus]. The distinguishing characters are a velvety surface and pointed apex. It usually occurs in large numbers and in variable sizes on the branches of the burr oak, Quercus macrocarpa. Color: green, turning brown.",Quercus macrocarpa,Disholcaspis quercusmamma,https://www.biodiversitylibrary.org/page/4257877#page/24/mode/1up,,,,IL,No
