"Symbol","Synonym Symbol","Scientific Name with Author","State Common Name","Family"
"ABELM","","Abelmoschus Medik.","okra","Malvaceae"
"ABES","","Abelmoschus esculentus (L.) Moench","okra","Malvaceae"
"ABES","HIES","Hibiscus esculentus L.","","Malvaceae"
"ABTH","","Abutilon theophrasti Medik.","velvetleaf","Malvaceae"
"ABTH","ABAB3","Abutilon abutilon (L.) Rusby, nom. inval.","","Malvaceae"
"ABTH","ABAV","Abutilon avicennae Gaertn.","","Malvaceae"
"ABUTI","","Abutilon Mill.","Indian mallow","Malvaceae"
"ACACI","","Acacia Mill.","acacia","Fabaceae"
"ACALY","","Acalypha L.","copperleaf","Euphorbiaceae"
"ACANT3","","Acanthospermum Schrank","starbur","Asteraceae"
"ACAU2","","Acanthospermum australe (Loefl.) Kuntze","Paraguayan starbur","Asteraceae"
"ACAU2","ACXA","Acanthospermum xanthioides DC.","","Asteraceae"
"ACAU2","MEAU","Melampodium australe Loefl.","","Asteraceae"
"ACCA4","","Acorus calamus L.","calamus","Acoraceae"
"ACER","","Acer L.","maple","Aceraceae"
"ACFL","","Acer floridanum (Chapm.) Pax","southern sugar maple","Aceraceae"
"ACFL","ACBA3","Acer barbatum Michx. p.p.","","Aceraceae"
"ACFL","ACBAL","Acer barbatum Michx. var. longii (Fernald) Fernald","","Aceraceae"
"ACFL","ACBAV","Acer barbatum Michx. var. villipes (Rehder) Ashe","","Aceraceae"
"ACFL","ACFLL","Acer floridanum (Chapm.) Pax var. longii Fernald","","Aceraceae"
"ACFL","ACFLV","Acer floridanum (Chapm.) Pax var. villipes Rehder","","Aceraceae"
"ACFL","ACNIF","Acer nigrum Michx. f. var. floridanum (Chapm.) Fosberg","","Aceraceae"
"ACFL","ACSAF2","Acer saccharinum L. var. floridanum Chapm.","","Aceraceae"
"ACFL","ACSAF","Acer saccharum Marshall ssp. floridanum (Chapm.) Desmarais","","Aceraceae"
"ACFL","ACSAF3","Acer saccharum Marshall var. floridanum (Chapm.) Small & A. Heller","","Aceraceae"
"ACFL","SABA13","Saccharodendron barbatum (Michx.) Nieuwl.","","Aceraceae"
"ACFL","SAFL8","Saccharodendron floridanum (Chapm.) Nieuwl.","","Aceraceae"
"ACGR2","","Acalypha gracilens A. Gray","slender threeseed mercury","Euphorbiaceae"
"ACGR2","ACGRD","Acalypha gracilens A. Gray var. delzii L. Mill.","","Euphorbiaceae"
"ACGR2","ACGRF","Acalypha gracilens A. Gray var. fraseri (Müll. Arg.) Weath.","","Euphorbiaceae"
"ACGR2","ACVIG","Acalypha virginica L. var. gracilens (A. Gray) Müll. Arg.","","Euphorbiaceae"
"ACHIL","","Achillea L.","yarrow","Asteraceae"
"ACLE","","Acer leucoderme Small","chalk maple","Aceraceae"
"ACLE","ACNIL","Acer nigrum Michx. f. var. leucoderme (Small) Fosberg","","Aceraceae"
"ACLE","ACSAL","Acer saccharum Marshall ssp. leucoderme (Small) Desmarais","","Aceraceae"
"ACLE","ACSAL2","Acer saccharum Marshall var. leucoderme (Small) Rehder","","Aceraceae"
"ACLE","SALE8","Saccharodendron leucoderme (Small) Nieuwl.","","Aceraceae"
"ACMEL","","Acmella Rich. ex Pers.","spotflower","Asteraceae"
"ACMI2","","Achillea millefolium L.","common yarrow","Asteraceae"
"ACMIO","","Achillea millefolium L. var. occidentalis DC.","western yarrow","Asteraceae"
"ACMIO","ACAN7","Achillea angustissima Rydb.","","Asteraceae"
"ACMIO","ACAS2","Achillea aspleniifolia auct. non Vent.","","Asteraceae"
"ACMIO","ACER2","Achillea eradiata Piper","","Asteraceae"
"ACMIO","ACGR5","Achillea gracilis Raf.","","Asteraceae"
"ACMIO","ACLA5","Achillea lanulosa Nutt.","","Asteraceae"
"ACMIO","ACLAT","Achillea lanulosa Nutt. ssp. typica D.D. Keck","","Asteraceae"
"ACMIO","ACLAA3","Achillea lanulosa Nutt. var. arachnoidea Lunell","","Asteraceae"
"ACMIO","ACLAE","Achillea lanulosa Nutt. var. eradiata (Piper) M. Peck","","Asteraceae"
"ACMIO","ACLA3","Achillea laxiflora Pollard & Cockerell","","Asteraceae"
"ACMIO","ACMIL","Achillea millefolium L. ssp. lanulosa (Nutt.) Piper","","Asteraceae"
"ACMIO","ACMIO2","Achillea millefolium L. ssp. occidentalis (DC.) Hyl.","","Asteraceae"
"ACMIO","ACMIP5","Achillea millefolium L. ssp. pallidotegula B. Boivin","","Asteraceae"
"ACMIO","ACMIA4","Achillea millefolium L. var. aspleniifolia (Vent.) Farw.","","Asteraceae"
"ACMIO","ACMIG2","Achillea millefolium L. var. gracilis (Raf.) Raf. ex DC.","","Asteraceae"
"ACMIO","ACMIL3","Achillea millefolium L. var. lanulosa (Nutt.) Piper","","Asteraceae"
"ACMIO","ACMIR","Achillea millefolium L. var. rosea (Desf.) Torr. & A. Gray","","Asteraceae"
"ACMIO","ACMIR2","Achillea millefolium L. var. russeolata B. Boivin","","Asteraceae"
"ACMIO","ACOC","Achillea occidentalis (DC.) Raf. ex Rydb.","","Asteraceae"
"ACMIO","ACRO4","Achillea rosea Desf.","","Asteraceae"
"ACMIO","ACTO3","Achillea tomentosa Pursh, non L.","","Asteraceae"
"ACNE2","","Acer negundo L.","boxelder","Aceraceae"
"ACNEN","","Acer negundo L. var. negundo","boxelder","Aceraceae"
"ACNEN","ACNEV2","Acer negundo L. var. variegatum Jacques","","Aceraceae"
"ACNEN","NEAC","Negundo aceroides (L.) Moench","","Aceraceae"
"ACNEN","NENE","Negundo negundo (L.) Karst., nom. inval.","","Aceraceae"
"ACNET","","Acer negundo L. var. texanum Pax","boxelder","Aceraceae"
"ACNET","ACNEL","Acer negundo L. ssp. latifolium (Pax) Schwerin","","Aceraceae"
"ACOP","","Acmella oppositifolia (Lam.) R.K. Jansen","oppositeleaf spotflower","Asteraceae"
"ACOPR","","Acmella oppositifolia (Lam.) R.K. Jansen var. repens (Walter) R.K. Jansen","oppositeleaf spotflower","Asteraceae"
"ACOPR","ACRE6","Acmella repens (Walter) Rich.","","Asteraceae"
"ACOPR","SPAM3","Spilanthes americana auct. non Hieron. p.p.","","Asteraceae"
"ACOPR","SPAMR3","Spilanthes americana (Mutis ex L. f.) Hieron. var. repens (Walter) A.H. Moore","","Asteraceae"
"ACORU","","Acorus L.","sweetflag","Acoraceae"
"ACOS","","Acalypha ostryifolia Riddell","pineland threeseed mercury","Euphorbiaceae"
"ACOS","ACCA8","Acalypha caroliniana Elliott","","Euphorbiaceae"
"ACPA","","Actaea pachypoda Elliott","white baneberry","Ranunculaceae"
"ACPA","ACAL7","Actaea alba auct. non (L.) Mill.","","Ranunculaceae"
"ACRA7","","Actaea racemosa L.","black baneberry","Ranunculaceae"
"ACRAR","","Actaea racemosa L. var. racemosa","black bugbane","Ranunculaceae"
"ACRAR","CIRA","Cimicifuga racemosa (L.) Nutt.","","Ranunculaceae"
"ACRH","","Acalypha rhomboidea Raf.","common threeseed mercury","Euphorbiaceae"
"ACRH","ACVIR","Acalypha virginica L. var. rhomboidea (Raf.) Cooperr.","","Euphorbiaceae"
"ACRU","","Acer rubrum L.","red maple","Aceraceae"
"ACRU","ACBA2","Acer barbatum Michx. p.p.","","Aceraceae"
"ACRUD","","Acer rubrum L. var. drummondii (Hook. & Arn. ex Nutt.) Sarg.","Drummond's maple","Aceraceae"
"ACRUD","ACDR","Acer drummondii Hook. & Arn. ex Nutt.","","Aceraceae"
"ACRUD","ACRUD2","Acer rubrum L. ssp. drummondii (Hook. & Arn. ex Nutt.) A.E. Murray","","Aceraceae"
"ACRUD","RUDR3","Rufacer drummondii (Hook. & Arn. ex Nutt.) Small","","Aceraceae"
"ACRUR","","Acer rubrum L. var. rubrum","red maple","Aceraceae"
"ACRUR","ACRUT2","Acer rubrum L. var. tomentosum Tausch","","Aceraceae"
"ACRUR","ACST","Acer stenocarpum Britton","","Aceraceae"
"ACRUR","RURU5","Rufacer rubrum (L.) Small","","Aceraceae"
"ACRUT","","Acer rubrum L. var. trilobum Torr. & A. Gray ex K. Koch","red maple","Aceraceae"
"ACRUT","ACCA9","Acer carolinianum Walter","","Aceraceae"
"ACRUT","ACRUT3","Acer rubrum L. var. tridens Alph. Wood","","Aceraceae"
"ACRUT","RUCA7","Rufacer carolinianum (Walter) Small","","Aceraceae"
"ACSA2","","Acer saccharinum L.","silver maple","Aceraceae"
"ACSA2","ACDA2","Acer dasycarpum Ehrh.","","Aceraceae"
"ACSA2","ACSAL3","Acer saccharinum L. var. laciniatum Pax","","Aceraceae"
"ACSA2","ACSAW","Acer saccharinum L. var. wieri Rehder","","Aceraceae"
"ACSA2","ARSA9","Argentacer saccharinum (L.) Small","","Aceraceae"
"ACSA3","","Acer saccharum Marshall","sugar maple","Aceraceae"
"ACSAS","","Acer saccharum Marshall var. saccharum","sugar maple","Aceraceae"
"ACSAS","ACNIG","Acer nigrum Michx. f. var. glaucum (F. Schmidt) Fosberg","","Aceraceae"
"ACSAS","ACNIS2","Acer nigrum Michx. f. var. saccharophorum (K. Koch) R.T. Clausen","","Aceraceae"
"ACSAS","ACSAG","Acer saccharum Marshall var. glaucum (F. Schmidt) Sarg.","","Aceraceae"
"ACSAS","ACSAR","Acer saccharum Marshall var. rugellii (Pax) Rehder","","Aceraceae"
"ACSAS","SASA18","Saccharodendron saccharum (Marshall) Moldenke","","Aceraceae"
"ACSE","","Acalypha setosa A. Rich.","Cuban copperleaf","Euphorbiaceae"
"ACTAE","","Actaea L.","baneberry","Ranunculaceae"
"ACVI","","Acalypha virginica L.","Virginia threeseed mercury","Euphorbiaceae"
"ADCA","","Adiantum capillus-veneris L.","common maidenhair","Pteridaceae"
"ADCA","ADCAM","Adiantum capillus-veneris L. var. modestum (Underw.) Fernald","","Pteridaceae"
"ADCA","ADCAP","Adiantum capillus-veneris L. var. protrusum Fernald","","Pteridaceae"
"ADCA","ADMO2","Adiantum modestum Underw.","","Pteridaceae"
"ADIAN","","Adiantum L.","maidenhair fern","Pteridaceae"
"ADPE","","Adiantum pedatum L.","northern maidenhair","Pteridaceae"
"AEBU","","Aesculus ×bushii C.K. Schneid. (pro sp.) [glabra × pavia]","buckeye","Hippocastanaceae"
"AEBU","AEMI","Aesculus ×mississippiensis Sarg.","","Hippocastanaceae"
"AEFL","","Aesculus flava Aiton","yellow buckeye","Hippocastanaceae"
"AEFL","AEOC2","Aesculus octandra Marshall","","Hippocastanaceae"
"AEFL","AEOCV","Aesculus octandra Marshall var. vestita Sarg.","","Hippocastanaceae"
"AEFL","AEOCV2","Aesculus octandra Marshall var. virginica Sarg.","","Hippocastanaceae"
"AEGL","","Aesculus glabra Willd.","Ohio buckeye","Hippocastanaceae"
"AEGLG","","Aesculus glabra Willd. var. glabra","Ohio buckeye","Hippocastanaceae"
"AEGLG","AEGLL","Aesculus glabra Willd. var. leucodermis Sarg.","","Hippocastanaceae"
"AEGLG","AEGLM","Aesculus glabra Willd. var. micrantha Sarg.","","Hippocastanaceae"
"AEGLG","AEGLM2","Aesculus glabra Willd. var. monticola Sarg.","","Hippocastanaceae"
"AEGLG","AEGLP","Aesculus glabra Willd. var. pallida (Willd.) G. Kirchn.","","Hippocastanaceae"
"AEGLG","AEGLS","Aesculus glabra Willd. var. sargentii Rehder","","Hippocastanaceae"
"AEIN","","Aeschynomene indica L.","Indian jointvetch","Fabaceae"
"AEPA","","Aesculus pavia L.","red buckeye","Hippocastanaceae"
"AEPAP","","Aesculus pavia L. var. pavia","red buckeye","Hippocastanaceae"
"AEPAP","AEAU","Aesculus austrina Small","","Hippocastanaceae"
"AEPAP","AEDI","Aesculus discolor Pursh","","Hippocastanaceae"
"AEPAP","AEDIM","Aesculus discolor Pursh var. mollis (Raf.) Sarg.","","Hippocastanaceae"
"AEPAP","AEPAD","Aesculus pavia L. var. discolor (Pursh) A. Gray","","Hippocastanaceae"
"AEPAP","AESP","Aesculus splendens Sarg.","","Hippocastanaceae"
"AESCH","","Aeschynomene L.","jointvetch","Fabaceae"
"AESCU","","Aesculus L.","buckeye","Hippocastanaceae"
"AEVI","","Aeschynomene viscidula Michx.","sticky jointvetch","Fabaceae"
"AEVI","SEVI9","Secula viscidula (Michx.) Small","","Fabaceae"
"AGAL5","","Ageratina altissima (L.) R.M. King & H. Rob.","white snakeroot","Asteraceae"
"AGALA","","Ageratina altissima (L.) R.M. King & H. Rob. var. altissima","white snakeroot","Asteraceae"
"AGALA","AGAL9","Ageratum altissimum L., non Eupatorium altissimum L.","","Asteraceae"
"AGALA","EURU6","Eupatorium rugosum Houtt.","","Asteraceae"
"AGALA","EURUC","Eupatorium rugosum Houtt. var. chlorolepis Fernald","","Asteraceae"
"AGALA","EURUT","Eupatorium rugosum Houtt. var. tomentellum (B.L. Rob.) S.F. Blake","","Asteraceae"
"AGALA","EURUV","Eupatorium rugosum Houtt. var. villicaule (Fernald) S.F. Blake","","Asteraceae"
"AGALA","EUURT","Eupatorium urticifolium Reichard var. tomentellum B.L. Rob.","","Asteraceae"
"AGALI","","Agalinis Raf.","false foxglove","Scrophulariaceae"
"AGAP3","","Agalinis aphylla (Nutt.) Raf.","scaleleaf false foxglove","Scrophulariaceae"
"AGAP3","GEAP2","Gerardia aphylla Nutt.","","Scrophulariaceae"
"AGAR4","","Ageratina aromatica (L.) Spach","lesser snakeroot","Asteraceae"
"AGARA","","Ageratina aromatica (L.) Spach var. aromatica","lesser snakeroot","Asteraceae"
"AGARA","EUAR7","Eupatorium aromaticum L.","","Asteraceae"
"AGARA","EUARA","Eupatorium aromaticum L. var. aromaticum","","Asteraceae"
"AGARA","EULA11","Eupatorium latidens Small","","Asteraceae"
"AGAU3","","Agalinis auriculata (Michx.) S.F. Blake","earleaf false foxglove","Scrophulariaceae"
"AGAU3","AUAU","Aureolaria auriculata (Michx.) Farw.","","Scrophulariaceae"
"AGAU3","GEAU7","Gerardia auriculata Michx.","","Scrophulariaceae"
"AGAU3","OTAU","Otophylla auriculata (Michx.) Small","","Scrophulariaceae"
"AGAU3","TOAU","Tomanthera auriculata (Michx.) Raf.","","Scrophulariaceae"
"AGCA5","","Agrostis capillaris L.","colonial bentgrass","Poaceae"
"AGCA5","AGSY2","Agrostis sylvatica Huds.","","Poaceae"
"AGCA5","AGTE","Agrostis tenuis Sibth.","","Poaceae"
"AGCA5","AGTEA","Agrostis tenuis Sibth. var. aristata (Parnell) Druce","","Poaceae"
"AGCA5","AGTEH","Agrostis tenuis Sibth. var. hispida (Willd.) Philipson","","Poaceae"
"AGCA5","AGTEP","Agrostis tenuis Sibth. var. pumila (L.) Druce","","Poaceae"
"AGCA5","AGVU2","Agrostis vulgaris With.","","Poaceae"
"AGCO","","Ageratum conyzoides L.","tropical whiteweed","Asteraceae"
"AGEL4","","Agrostis elliottiana Schult.","Elliott's bentgrass","Poaceae"
"AGEL4","AGEX2","Agrostis exigua Thurb.","","Poaceae"
"AGERA","","Ageratum L.","whiteweed","Asteraceae"
"AGERA2","","Ageratina Spach","snakeroot","Asteraceae"
"AGFA2","","Agalinis fasciculata (Elliott) Raf.","beach false foxglove","Scrophulariaceae"
"AGFA2","AGFAP","Agalinis fasciculata (Elliott) Raf. var. peninsularis Pennell","","Scrophulariaceae"
"AGFA2","AGGE","Agalinis georgiana (C.L. Boynt.) Pennell","","Scrophulariaceae"
"AGFA2","AGPUR","Agalinis purpurea (L.) Pennell var. racemulosa (Pennell) B. Boivin","","Scrophulariaceae"
"AGFA2","AGVI4","Agalinis virgata Raf.","","Scrophulariaceae"
"AGFA2","GEFA2","Gerardia fasciculata Elliott","","Scrophulariaceae"
"AGFA2","GEFAP","Gerardia fasciculata Elliott ssp. peninsularis (Pennell) Pennell","","Scrophulariaceae"
"AGFA2","GEGE2","Gerardia georgiana C.L. Boynt.","","Scrophulariaceae"
"AGFA2","GEPUR","Gerardia purpurea L. var. racemulosa (Pennell) Gleason","","Scrophulariaceae"
"AGFA2","GERA6","Gerardia racemulosa Pennell","","Scrophulariaceae"
"AGFI","","Agalinis filicaulis (Benth.) Pennell","Jackson false foxglove","Scrophulariaceae"
"AGFI","GEFI","Gerardia filicaulis (Benth.) Chapm.","","Scrophulariaceae"
"AGGA","","Agalinis gattingeri (Small) Small","roundstem false foxglove","Scrophulariaceae"
"AGGA","GEGA2","Gerardia gattingeri Small","","Scrophulariaceae"
"AGGI","","Agrostemma githago L.","common corncockle","Caryophyllaceae"
"AGGI2","","Agrostis gigantea Roth","redtop","Poaceae"
"AGGI2","AGAL3","Agrostis alba auct. non L.","","Poaceae"
"AGGI2","AGGID","Agrostis gigantea Roth var. dispar (Michx.) Philipson","","Poaceae"
"AGGI2","AGNI","Agrostis nigra With.","","Poaceae"
"AGGI2","AGSTG","Agrostis stolonifera L. ssp. gigantea (Roth) Schübl. & G. Martens","","Poaceae"
"AGGI2","AGSTM","Agrostis stolonifera L. var. major (Gaudin) Farw.","","Poaceae"
"AGGR2","","Agrimonia gryposepala Wallr.","tall hairy agrimony","Rosaceae"
"AGHA3","","Agalinis harperi Pennell","coastal plain false foxglove","Scrophulariaceae"
"AGHA3","AGDE8","Agalinis delicatula Pennell","","Scrophulariaceae"
"AGHA3","AGPI3","Agalinis pinetorum Pennell","","Scrophulariaceae"
"AGHA3","AGPID","Agalinis pinetorum Pennell var. delicatula (Pennell) Pennell","","Scrophulariaceae"
"AGHA3","GEPU10","Gerardia pulchella Pennell","","Scrophulariaceae"
"AGHA3","GEPUD","Gerardia pulchella Pennell var. delicatula (Pennell) Pennell","","Scrophulariaceae"
"AGHE4","","Agalinis heterophylla (Nutt.) Small ex Britton","prairie false foxglove","Scrophulariaceae"
"AGHE4","GEHE5","Gerardia heterophylla Nutt.","","Scrophulariaceae"
"AGHY","","Agrostis hyemalis (Walter) Britton, Sterns & Poggenb.","winter bentgrass","Poaceae"
"AGHY","AGAN2","Agrostis antecedens E.P. Bicknell","","Poaceae"
"AGHY","COHY2","Cornucopiae hyemalis Walter","","Poaceae"
"AGIN3","","Agrimonia incisa Torr. & A. Gray","incised agrimony","Rosaceae"
"AGLI2","","Agalinis linifolia (Nutt.) Britton","flaxleaf false foxglove","Scrophulariaceae"
"AGLI2","GELI4","Gerardia linifolia Nutt.","","Scrophulariaceae"
"AGMA3","","Agalinis maritima (Raf.) Raf.","saltmarsh false foxglove","Scrophulariaceae"
"AGMAG","","Agalinis maritima (Raf.) Raf. var. grandiflora (Benth.) Shinners","saltmarsh false foxglove","Scrophulariaceae"
"AGMAG","AGSP3","Agalinis spiciflora (Engelm.) Pennell","","Scrophulariaceae"
"AGMAG","GEMAG","Gerardia maritima Raf. ssp. grandiflora (Benth.) Pennell","","Scrophulariaceae"
"AGMAG","GEMAG2","Gerardia maritima Raf. var. grandiflora Benth.","","Scrophulariaceae"
"AGMAG","GESP2","Gerardia spiciflora Engelm.","","Scrophulariaceae"
"AGMI2","","Agrimonia microcarpa Wallr.","smallfruit agrimony","Rosaceae"
"AGMI2","AGPL2","Agrimonia platycarpa Wallr.","","Rosaceae"
"AGMI2","AGPUM","Agrimonia pubescens Wallr. var. microcarpa (Wallr.) H.E. Ahles","","Rosaceae"
"AGMI2","AGPU6","Agrimonia pumila Muhl. ex E.P. Bicknell","","Rosaceae"
"AGOB","","Agalinis obtusifolia Raf.","tenlobe false foxglove","Scrophulariaceae"
"AGOB","AGDE5","Agalinis decemloba (Greene) Pennell","","Scrophulariaceae"
"AGOB","AGPA16","Agalinis parvifolia (Benth.) Small ex Britton","","Scrophulariaceae"
"AGOB","AGTE2","Agalinis tenella Pennell","","Scrophulariaceae"
"AGOB","GEDE7","Gerardia decemloba Greene","","Scrophulariaceae"
"AGOB","GEOB","Gerardia obtusifolia (Raf.) Pennell","","Scrophulariaceae"
"AGOB","GEPA7","Gerardia parvifolia (Benth.) Chapm.","","Scrophulariaceae"
"AGOB","GESEP","Gerardia setacea J.F. Gmel. var. parvifolia Benth.","","Scrophulariaceae"
"AGOB","GETE5","Gerardia tenella (Pennell) Pennell","","Scrophulariaceae"
"AGOL","","Agalinis oligophylla Pennell","ridgestem false foxglove","Scrophulariaceae"
"AGOL","AGKE3","Agalinis keyensis Pennell","","Scrophulariaceae"
"AGOL","AGOLP","Agalinis oligophylla Pennell var. pseudaphylla Pennell","","Scrophulariaceae"
"AGOL","AGPS3","Agalinis pseudaphylla (Pennell) Shinners","","Scrophulariaceae"
"AGOL","GEAPG","Gerardia aphylla Nutt. var. grandiflora Benth.","","Scrophulariaceae"
"AGOL","GEKE","Gerardia keyensis (Pennell) Pennell","","Scrophulariaceae"
"AGOL","GEMI5","Gerardia microphylla (A. Gray) Small","","Scrophulariaceae"
"AGOL","GEPLM","Gerardia plukenetii Elliott var. microphylla A. Gray","","Scrophulariaceae"
"AGOL","GEPS","Gerardia pseudaphylla (Pennell) Pennell","","Scrophulariaceae"
"AGPA6","","Agrimonia parviflora Aiton","harvestlice","Rosaceae"
"AGPE","","Agrostis perennans (Walter) Tuck.","upland bentgrass","Poaceae"
"AGPE","AGAL8","Agrostis altissima (Walter) Tuck.","","Poaceae"
"AGPE","AGEL5","Agrostis elata (Pursh) Trin.","","Poaceae"
"AGPE","AGOR3","Agrostis oreophila Trin.","","Poaceae"
"AGPE","AGPEA","Agrostis perennans (Walter) Tuck. var. aestivalis Vasey","","Poaceae"
"AGPE","AGPEE","Agrostis perennans (Walter) Tuck. var. elata (Pursh) Hitchc.","","Poaceae"
"AGPE","AGSC6","Agrostis schweinitzii Trin.","","Poaceae"
"AGPE","COPE7","Cornucopiae perennans Walter","","Poaceae"
"AGPL","","Agalinis plukenetii (Elliott) Raf.","Chattahoochee false foxglove","Scrophulariaceae"
"AGPL","GEFIG","Gerardia filifolia Nutt. var. gatesii Benth.","","Scrophulariaceae"
"AGPL","GEGA3","Gerardia gatesii (Benth.) Pennell","","Scrophulariaceae"
"AGPL","GEPL5","Gerardia plukenetii Elliott","","Scrophulariaceae"
"AGPU","","Agrimonia pubescens Wallr.","soft agrimony","Rosaceae"
"AGPU","AGBI","Agrimonia bicknellii (Kearney) Rydb.","","Rosaceae"
"AGPU","AGMO3","Agrimonia mollis (Torr. & A. Gray) Britton","","Rosaceae"
"AGPU4","","Agalinis pulchella Pennell","St. Mark's false foxglove","Scrophulariaceae"
"AGPU4","GEPU6","Gerardia pulcherrima Pennell","","Scrophulariaceae"
"AGPU5","","Agalinis purpurea (L.) Pennell","purple false foxglove","Scrophulariaceae"
"AGPU5","AGPUC","Agalinis purpurea (L.) Pennell var. carteri Pennell","","Scrophulariaceae"
"AGPU5","GEPU7","Gerardia purpurea L.","","Scrophulariaceae"
"AGPU5","GEPUP2","Gerardia purpurea L. ssp. parvula Pennell","","Scrophulariaceae"
"AGPU5","GEPUC","Gerardia purpurea L. var. carteri (Pennell) Pennell","","Scrophulariaceae"
"AGPU5","GEPUG","Gerardia purpurea L. var. grandiflora Benth.","","Scrophulariaceae"
"AGRIM","","Agrimonia L.","agrimony","Rosaceae"
"AGRO3","","Agrimonia rostellata Wallr.","beaked agrimony","Rosaceae"
"AGROS","","Agrostemma L.","corncockle","Caryophyllaceae"
"AGROS2","","Agrostis L.","bentgrass","Poaceae"
"AGSC5","","Agrostis scabra Willd.","rough bentgrass","Poaceae"
"AGSC5","AGGE2","Agrostis geminata Trin.","","Poaceae"
"AGSC5","AGHYG","Agrostis hyemalis (Walter) Britton, Sterns & Poggenb. var. geminata (Trin.) Hitchc.","","Poaceae"
"AGSC5","AGHYS","Agrostis hyemalis (Walter) Britton, Sterns & Poggenb. var. scabra (Willd.) Blomquist","","Poaceae"
"AGSC5","AGHYT","Agrostis hyemalis (Walter) Britton, Sterns & Poggenb. var. tenuis (Tuck.) Gleason","","Poaceae"
"AGSC5","AGSCS4","Agrostis scabra Willd. ssp. septentrionalis (Fernald) Á. Löve & D. Löve","","Poaceae"
"AGSC5","AGSCG","Agrostis scabra Willd. var. geminata (Trin.) Swallen","","Poaceae"
"AGSC5","AGSCS","Agrostis scabra Willd. var. septentrionalis Fernald","","Poaceae"
"AGSE3","","Agalinis setacea (J.F. Gmel.) Raf.","threadleaf false foxglove","Scrophulariaceae"
"AGSE3","AGHO6","Agalinis holmiana Pennell","","Scrophulariaceae"
"AGSE3","AGST3","Agalinis stenophylla Pennell","","Scrophulariaceae"
"AGSE3","GESE5","Gerardia setacea J.F. Gmel.","","Scrophulariaceae"
"AGSE3","GEST3","Gerardia stenophylla (Pennell) Pennell","","Scrophulariaceae"
"AGST2","","Agrostis stolonifera L.","creeping bentgrass","Poaceae"
"AGST2","AGALP","Agrostis alba L. var. palustris (Huds.) Pers.","","Poaceae"
"AGST2","AGALS","Agrostis alba L. var. stolonifera (L.) Sm.","","Poaceae"
"AGST2","AGMA10","Agrostis maritima Lam.","","Poaceae"
"AGST2","AGPA17","Agrostis palustris Huds.","","Poaceae"
"AGST2","AGSTC","Agrostis stolonifera L. var. compacta Hartm.","","Poaceae"
"AGST2","AGSTP","Agrostis stolonifera L. var. palustris (Huds.) Farw.","","Poaceae"
"AGTE3","","Agalinis tenuifolia (Vahl) Raf.","slenderleaf false foxglove","Scrophulariaceae"
"AGTEM","","Agalinis tenuifolia (Vahl) Raf. var. macrophylla (Benth.) S.F. Blake","slenderleaf false foxglove","Scrophulariaceae"
"AGTEM","AGBE","Agalinis besseyana (Britton) Britton","","Scrophulariaceae"
"AGTEM","GEBE","Gerardia besseyana Britton","","Scrophulariaceae"
"AGTEM","GETEM3","Gerardia tenuifolia Vahl ssp. macrophylla (Benth.) Pennell","","Scrophulariaceae"
"AGTEM","GETEM2","Gerardia tenuifolia Vahl var. macrophylla Benth.","","Scrophulariaceae"
"AGTET","","Agalinis tenuifolia (Vahl) Raf. var. tenuifolia","slenderleaf false foxglove","Scrophulariaceae"
"AGTET","GETE6","Gerardia tenuifolia Vahl","","Scrophulariaceae"
"AGTET","GETEH","Gerardia tenuifolia Vahl var. humilis Benth.","","Scrophulariaceae"
"AGTET","GETET2","Gerardia tenuifolia Vahl var. typica Pennell","","Scrophulariaceae"
"AGVI5","","Agalinis viridis (Small) Pennell","green false foxglove","Scrophulariaceae"
"AGVI5","GEVI9","Gerardia viridis Small","","Scrophulariaceae"
"AIAL","","Ailanthus altissima (Mill.) Swingle","tree of heaven","Simaroubaceae"
"AIAL","AIGL","Ailanthus glandulosa Desf.","","Simaroubaceae"
"AIAL","TOAL4","Toxicodendron altissimum Mill.","","Simaroubaceae"
"AICA","","Aira caryophyllea L.","silver hairgrass","Poaceae"
"AICAC2","","Aira caryophyllea L. var. caryophyllea","silver hairgrass","Poaceae"
"AICAC2","ASCA22","Aspris caryophyllea (L.) Nash","","Poaceae"
"AIEL4","","Aira elegans Willd. ex Kunth","annual silver hairgrass","Poaceae"
"AIEL4","AICA3","Aira capillaris Host, non Savi","","Poaceae"
"AIEL4","AICAC","Aira caryophyllea L. var. capillaris (Host) Mutel","","Poaceae"
"AIEL4","AIELA","Aira elegans Willd. ex Kunth ssp. ambigua (Arcang.) Holub","","Poaceae"
"AIEL4","AIEL2","Aira elegantissima Schur","","Poaceae"
"AIEL4","ASCA23","Aspris capillaris (Host) Hitchc.","","Poaceae"
"AILAN","","Ailanthus Desf.","ailanthus","Simaroubaceae"
"AIRA","","Aira L.","hairgrass","Poaceae"
"AJPY","","Ajuga pyramidalis L.","pyramid bugle","Lamiaceae"
"AJRE","","Ajuga reptans L.","common bugle","Lamiaceae"
"AJUGA","","Ajuga L.","bugle","Lamiaceae"
"ALAM","","Allium ampeloprasum L.","broadleaf wild leek","Liliaceae"
"ALAM","ALAMA2","Allium ampeloprasum L. var. ampeloprasum","","Liliaceae"
"ALAU","","Aletris aurea Walter","golden colicroot","Liliaceae"
"ALBIZ","","Albizia Durazz.","albizia","Fabaceae"
"ALCA3","","Allium canadense L.","meadow garlic","Liliaceae"
"ALCA4","","Alopecurus carolinianus Walter","Carolina foxtail","Poaceae"
"ALCA4","ALMA15","Alopecurus macounii Vasey","","Poaceae"
"ALCA4","ALRA4","Alopecurus ramosus Poir.","","Poaceae"
"ALCA5","","Alternanthera caracasana Kunth","washerwoman","Amaranthaceae"
"ALCA5","ACPE3","Achyranthes peploides (Humb. & Bonpl. ex Schult.) Britton & P. Wilson","","Amaranthaceae"
"ALCA5","ALPE6","Alternanthera peploides (Humb. & Bonpl. ex Schult.) Urb.","","Amaranthaceae"
"ALCAC","","Allium canadense L. var. canadense","meadow garlic","Liliaceae"
"ALCAC","ALAC3","Allium acetabulum (Raf.) Shinners","","Liliaceae"
"ALCAC","ALCAO","Allium canadense L. var. ovoideum Farw.","","Liliaceae"
"ALCAC","ALCAR","Allium canadense L. var. robustum Farw.","","Liliaceae"
"ALCAC","ALCO4","Allium continuum Small","","Liliaceae"
"ALCAM","","Allium canadense L. var. mobilense (Regel) Ownbey","meadow garlic","Liliaceae"
"ALCAM","ALAR4","Allium arenicola Small","","Liliaceae"
"ALCAM","ALCAM2","Allium canadense L. ssp. mobilense (Regel) Traub & Ownbey","","Liliaceae"
"ALCAM","ALMI6","Allium microscordion Small","","Liliaceae"
"ALCAM","ALMO10","Allium mobilense Regel","","Liliaceae"
"ALCAM","ALMU4","Allium mutabile Michx.","","Liliaceae"
"ALCAM","ALZE2","Allium zenobine Cory","","Liliaceae"
"ALCE","","Allium cepa L.","garden onion","Liliaceae"
"ALCE","ALCEA2","Allium cepa L. var. aggregatum G. Don","","Liliaceae"
"ALCE","ALCEC","Allium cepa L. var. cepa","","Liliaceae"
"ALCE","ALCEM","Allium cepa L. var. multiplicans L.H. Bailey","","Liliaceae"
"ALCE","ALCEP","Allium cepa L. var. proliferum (Moench) Regel","","Liliaceae"
"ALCE","ALCES","Allium cepa L. var. solaninum Alef.","","Liliaceae"
