"LEBI2","","Lespedeza bicolor Turcz.","shrub lespedeza","Fabaceae"
"LEBR2","","Lespedeza ×brittonii E.P. Bicknell (pro sp.) [procumbens × virginica]","lespedeza","Fabaceae"
"LEBR2","LEPRE","Lespedeza procumbens Michx. var. elliptica S.F. Blake","","Fabaceae"
"LECA2","","Leonurus cardiaca L.","common motherwort","Lamiaceae"
"LECA5","","Lepidium campestre (L.) W.T. Aiton","field pepperweed","Brassicaceae"
"LECA5","NECA5","Neolepia campestris (L.) W.A. Weber","","Brassicaceae"
"LECA5","THCA2","Thlaspi campestre L.","","Brassicaceae"
"LECA8","","Lespedeza capitata Michx.","roundhead lespedeza","Fabaceae"
"LECA8","LEBI5","Lespedeza bicknellii House","","Fabaceae"
"LECA8","LECAS","Lespedeza capitata Michx. var. stenophylla Bissell & Fernald","","Fabaceae"
"LECA8","LECAV2","Lespedeza capitata Michx. var. velutina (E.P. Bicknell) Fernald","","Fabaceae"
"LECA8","LECAV4","Lespedeza capitata Michx. var. vulgaris Torr. & A. Gray","","Fabaceae"
"LECAC7","","Leonurus cardiaca L. ssp. cardiaca","common motherwort","Lamiaceae"
"LECAN4","","Lecanora Ach.","rim lichen","Lecanoraceae"
"LECHE","","Lechea L.","pinweed","Cistaceae"
"LECU","","Lespedeza cuneata (Dum. Cours.) G. Don","sericea lespedeza","Fabaceae"
"LECU","LECUS","Lespedeza cuneata (Dum. Cours.) G. Don var. serpens (Nakai) Ohwi","","Fabaceae"
"LECU","LEJUS","Lespedeza juncea (L. f.) Pers. var. sericea Maxim.","","Fabaceae"
"LECU","LELA31","Lespedeza latissima (Matsum.) Nakai","","Fabaceae"
"LECU","LESE12","Lespedeza sericea Miq., nom. illeg.","","Fabaceae"
"LECU","LESE13","Lespedeza serpens Nakai","","Fabaceae"
"LEDE","","Lepidium densiflorum Schrad.","common pepperweed","Brassicaceae"
"LEDE","LEDED","Lepidium densiflorum Schrad. var. densiflorum","","Brassicaceae"
"LEDE","LEDEE","Lepidium densiflorum Schrad. var. elongatum (Rydb.) Thell.","","Brassicaceae"
"LEDE","LEDEM","Lepidium densiflorum Schrad. var. macrocarpum G. Mulligan","","Brassicaceae"
"LEDE","LEDEP","Lepidium densiflorum Schrad. var. pubecarpum (A. Nelson) Thell.","","Brassicaceae"
"LEDE","LEDER","Lepidium densiflorum Schrad. var. ramosum (A. Nelson) Thell.","","Brassicaceae"
"LEDE","LEDET","Lepidium densiflorum Schrad. var. typicum Thell.","","Brassicaceae"
"LEDE","LEEL4","Lepidium elongatum Rydb.","","Brassicaceae"
"LEDE","LENE7","Lepidium neglectum Thell.","","Brassicaceae"
"LEDE","LEPU6","Lepidium pubecarpum A. Nelson","","Brassicaceae"
"LEDE","LERA6","Lepidium ramosum A. Nelson","","Brassicaceae"
"LEDE","LETE7","Lepidium texanum Buckley","","Brassicaceae"
"LEDE22","","Leptochloa decipiens (R. Br.) Stapf ex Maiden","Australian sprangletop","Poaceae"
"LEDEP2","","Leptochloa decipiens (R. Br.) Stapf ex Maiden ssp. peacockii (Maiden & Betche) N. Snow","peacock sprangletop","Poaceae"
"LEDEP2","DIPE10","Diplachne peacockii Maiden & Betche","","Poaceae"
"LEDU","","Leptochloa dubia (Kunth) Nees","green sprangletop","Poaceae"
"LEDU","CHDU2","Chloris dubia Kunth","","Poaceae"
"LEDU","DIDU","Diplachne dubia (Kunth) Scribn.","","Poaceae"
"LEERS","","Leersia Sw.","cutgrass","Poaceae"
"LEFR5","","Lespedeza frutescens (L.) Hornem.","shrubby lespedeza","Fabaceae"
"LEFR5","LEIN30","Lespedeza intermedia (S. Watson) Britton, nom. inq.","","Fabaceae"
"LEFR5","LEVI23","Lespedeza violacea auct. non (L.) Pers.","","Fabaceae"
"LEFU21","","Leptochloa fusca (L.) Kunth","Malabar sprangletop","Poaceae"
"LEFU21","DIFU7","Diplachne fusca (L.) P. Beauv. ex Roem. & Schult.","","Poaceae"
"LEFUF","","Leptochloa fusca (L.) Kunth ssp. fascicularis (Lam.) N. Snow","bearded sprangletop","Poaceae"
"LEFUF","DIAC3","Diplachne acuminata Nash","","Poaceae"
"LEFUF","DIFA4","Diplachne fascicularis (Lam.) P. Beauv.","","Poaceae"
"LEFUF","DIMA10","Diplachne maritima E.P. Bicknell","","Poaceae"
"LEFUF","LEAC2","Leptochloa acuminata (Nash) Mohlenbr.","","Poaceae"
"LEFUF","LEFA","Leptochloa fascicularis (Lam.) A. Gray","","Poaceae"
"LEFUF","LEFAA","Leptochloa fascicularis (Lam.) A. Gray var. acuminata (Nash) Gleason","","Poaceae"
"LEFUF","LEFAM","Leptochloa fascicularis (Lam.) A. Gray var. maritima (E.P. Bicknell) Gleason","","Poaceae"
"LEFUF","LEFUF2","Leptochloa fusca (L.) Kunth var. fascicularis (Lam.) Dorn","","Poaceae"
"LEFUU","","Leptochloa fusca (L.) Kunth ssp. uninervia (J. Presl) N. Snow","Mexican sprangletop","Poaceae"
"LEFUU","DIUN5","Diplachne uninervia (J. Presl) Parodi","","Poaceae"
"LEFUU","LEUN2","Leptochloa uninervia (J. Presl) Hitchc. & Chase","","Poaceae"
"LEFUU","MEUN4","Megastachya uninervia J. Presl","","Poaceae"
"LEGI","","Lemna gibba L.","swollen duckweed","Lemnaceae"
"LEGR2","","Lesquerella gracilis (Hook.) S. Watson","spreading bladderpod","Brassicaceae"
"LEGR2","PHGR6","Physaria gracilis (Hook.) O'Kane & Al-Shehbaz","","Brassicaceae"
"LEGRG","","Lesquerella gracilis (Hook.) S. Watson ssp. gracilis","spreading bladderpod","Brassicaceae"
"LEGRG","VEGR4","Vesicaria gracilis Hook.","","Brassicaceae"
"LEHE","","Leersia hexandra Sw.","southern cutgrass","Poaceae"
"LEHE","HOHE4","Homalocenchrus hexandrus (Sw.) Kuntze","","Poaceae"
"LEHI2","","Lespedeza hirta (L.) Hornem.","hairy lespedeza","Fabaceae"
"LEHIH2","","Lespedeza hirta (L.) Hornem. ssp. hirta","hairy lespedeza","Fabaceae"
"LEHIH2","LECAC3","Lespedeza capitata Michx. var. calycina (Schindl.) Fernald","","Fabaceae"
"LEHIH2","LEHIS","Lespedeza hirta (L.) Hornem. var. sparsiflora Torr. & A. Gray","","Fabaceae"
"LEHIH2","LEPO3","Lespedeza polystachya Michx.","","Fabaceae"
"LELE2","","Leersia lenticularis Michx.","catchfly grass","Poaceae"
"LELE2","HOLE5","Homalocenchrus lenticularis (Michx.) Kuntze","","Poaceae"
"LELO","","Lespedeza ×longifolia DC. (pro sp.) [capitata × hirta]","lespedeza","Fabaceae"
"LELO","LEHID2","Lespedeza hirta (L.) Hornem. var. dissimulans Fernald","","Fabaceae"
"LELO","LEHIL","Lespedeza hirta (L.) Hornem. var. longifolia (DC.) Fernald","","Fabaceae"
"LEMI","","Lechea minor L.","thymeleaf pinweed","Cistaceae"
"LEMI3","","Lemna minor L.","common duckweed","Lemnaceae"
"LEMI3","LECY4","Lemna cyclostasa Elliott ex Schleid.","","Lemnaceae"
"LEMI3","LEMI2","Lemna minima Chevall. ex Schleid.","","Lemnaceae"
"LEMNA","","Lemna L.","duckweed","Lemnaceae"
"LEMU","","Leucospora multifida (Michx.) Nutt.","narrowleaf paleseed","Scrophulariaceae"
"LEMU","COMU4","Conobea multifida (Michx.) Benth.","","Scrophulariaceae"
"LEMU3","","Lechea mucronata Raf.","hairy pinweed","Cistaceae"
"LEMU3","LEMIV","Lechea minor L. var. villosa (Elliott) B. Boivin","","Cistaceae"
"LEMU3","LEVI","Lechea villosa Elliott","","Cistaceae"
"LEMU3","LEVIM3","Lechea villosa Elliott var. macrotheca Hodgdon","","Cistaceae"
"LEMU3","LEVIS2","Lechea villosa Elliott var. schaffneri Hodgdon","","Cistaceae"
"LENE","","Leonotis nepetifolia (L.) R. Br.","Christmas candlestick","Lamiaceae"
"LENU","","Lespedeza ×nuttallii Darl. (pro sp.) [hirta × violacea]","lespedeza","Fabaceae"
"LEOB","","Lepidium oblongum Small","veiny pepperweed","Brassicaceae"
"LEOB2","","Lemna obscura (Austin) Daubs","little duckweed","Lemnaceae"
"LEOB2","LEMIO","Lemna minor L. var. obscura Austin","","Lemnaceae"
"LEOBO","","Lepidium oblongum Small var. oblongum","veiny pepperweed","Brassicaceae"
"LEOBO","LEBI3","Lepidium bipinnatifidum auct. non Desv.","","Brassicaceae"
"LEONO","","Leonotis (Pers.) W.T. Aiton","lion's ear","Lamiaceae"
"LEONU","","Leonurus L.","motherwort","Lamiaceae"
"LEOR","","Leersia oryzoides (L.) Sw.","rice cutgrass","Poaceae"
"LEOR","HOOR3","Homalocenchrus oryzoides (L.) Pollich","","Poaceae"
"LEOR","PHOR5","Phalaris oryzoides L.","","Poaceae"
"LEPA3","","Leptochloa panicoides (J. Presl) Hitchc.","Amazon sprangletop","Poaceae"
"LEPA3","DIPA27","Dinebra panicoides (J. Presl) P.M. Peterson & N. Snow","","Poaceae"
"LEPA3","DIHA4","Diplachne halei Nash","","Poaceae"
"LEPA3","DIPA13","Diplachne panicoides (J. Presl) McNeill","","Poaceae"
"LEPA3","LEFL6","Leptochloa floribunda Döll","","Poaceae"
"LEPA3","MEPA12","Megastachya panicoides J. Presl","","Poaceae"
"LEPA6","","Leptochloa panicea (Retz.) Ohwi","mucronate sprangletop","Poaceae"
"LEPA6","DIPA26","Dinebra panicea (Retz.) P.M. Peterson & N. Snow","","Poaceae"
"LEPAB","","Leptochloa panicea (Retz.) Ohwi ssp. brachiata (Steud.) N. Snow","mucronate sprangeltop","Poaceae"
"LEPAB","FEFI2","Festuca filiformis Lam.","","Poaceae"
"LEPAB","LEBR17","Leptochloa brachiata Steud.","","Poaceae"
"LEPAB","LEFI","Leptochloa filiformis (Lam.) P. Beauv.","","Poaceae"
"LEPAB","LEFIP","Leptochloa filiformis (Lam.) P. Beauv. var. pulchella (Scribn.) Beetle","","Poaceae"
"LEPAM","","Leptochloa panicea (Retz.) Ohwi ssp. mucronata (Michx.) Nowack","mucronate sprangletop","Poaceae"
"LEPAM","LEAT","Leptochloa attenuata (Nutt.) Steud.","","Poaceae"
"LEPAM","LEFIA","Leptochloa filiformis (Lam.) P. Beauv. var. attenuata (Nutt.) Steyerm. & Kucera","","Poaceae"
"LEPAM","LEMU10","Leptochloa mucronata (Michx.) Kunth","","Poaceae"
"LEPE","","Lemna perpusilla Torr.","minute duckweed","Lemnaceae"
"LEPE","LEPET","Lemna perpusilla Torr. var. trinervis Austin","","Lemnaceae"
"LEPE2","","Lepidium perfoliatum L.","clasping pepperweed","Brassicaceae"
"LEPID","","Lepidium L.","pepperweed","Brassicaceae"
"LEPR","","Lespedeza procumbens Michx.","trailing lespedeza","Fabaceae"
"LEPTO","","Leptochloa P. Beauv.","sprangletop","Poaceae"
"LEPU4","","Lechea pulchella Raf.","Leggett's pinweed","Cistaceae"
"LEPUP2","","Lechea pulchella Raf. var. pulchella","Leggett's pinweed","Cistaceae"
"LEPUP2","LELE","Lechea leggettii Britton & Hollick","","Cistaceae"
"LEPUP2","LELER","Lechea leggettii Britton & Hollick var. ramosissima Hodgdon","","Cistaceae"
"LEPUR","","Lepuropetalon Elliott","lepuropetalon","Saxifragaceae"
"LERE2","","Lespedeza repens (L.) W.P.C. Barton","creeping lespedeza","Fabaceae"
"LERE2","HERE7","Hedysarum repens L.","","Fabaceae"
"LESE7","","Lechea sessiliflora Raf.","pineland pinweed","Cistaceae"
"LESE7","LEEX2","Lechea exserta Small","","Cistaceae"
"LESE7","LEPA","Lechea patula Leggett","","Cistaceae"
"LESE7","LEPR4","Lechea prismatica Small","","Cistaceae"
"LESI","","Leonurus sibiricus L.","honeyweed","Lamiaceae"
"LESI","LEAR7","Leonurus artemisia auct. non Lour.","","Lamiaceae"
"LESP","","Lepuropetalon spathulatum Elliott","petiteplant","Saxifragaceae"
"LESP","PYSP2","Pyxidanthera spathulata Muhl., nom. nud.","","Saxifragaceae"
"LESPE","","Lespedeza Michx.","lespedeza","Fabaceae"
"LESQU","","Lesquerella S. Watson","bladderpod","Brassicaceae"
"LEST5","","Lespedeza stuevei Nutt.","tall lespedeza","Fabaceae"
"LETE","","Lechea tenuifolia Michx.","narrowleaf pinweed","Cistaceae"
"LETE","LETEO","Lechea tenuifolia Michx. var. occidentalis Hodgdon","","Cistaceae"
"LETO2","","Lechea torreyi Leggett ex Britton","piedmont pinweed","Cistaceae"
"LETO2","LETOC","Lechea torreyi Leggett ex Britton var. congesta Hodgdon","","Cistaceae"
"LEUCA4","","Leucanthemum Mill.","daisy","Asteraceae"
"LEUCO2","","Leucojum L.","snowflake","Liliaceae"
"LEUCO4","","Leucospora Nutt.","leucospora","Scrophulariaceae"
"LEUCO5","","Leucothoe D. Don","doghobble","Ericaceae"
"LEVA","","Lemna valdiviana Phil.","valdivia duckweed","Lemnaceae"
"LEVA","LECY5","Lemna cyclostasa (Elliott) C.H. Thomp.","","Lemnaceae"
"LEVA","LETO3","Lemna torreyi Austin","","Lemnaceae"
"LEVI2","","Leersia virginica Willd.","whitegrass","Poaceae"
"LEVI2","HOVI4","Homalocenchrus virginicus (Willd.) Britton","","Poaceae"
"LEVI2","LEVIO","Leersia virginica Willd. var. ovata (Poir.) Fernald","","Poaceae"
"LEVI3","","Lepidium virginicum L.","Virginia pepperweed","Brassicaceae"
"LEVI6","","Lespedeza violacea (L.) Pers.","violet lespedeza","Fabaceae"
"LEVI6","HEVI7","Hedysarum violaceum L.","","Fabaceae"
"LEVI6","LEIN2","Lespedeza intermedia sensu Clewell, 1966","","Fabaceae"
"LEVI6","LEPR5","Lespedeza prairea (Mack. & Bush) Britton","","Fabaceae"
"LEVI7","","Lespedeza virginica (L.) Britton","slender lespedeza","Fabaceae"
"LEVIV2","","Lepidium virginicum L. var. virginicum","Virginia pepperweed","Brassicaceae"
"LEVIV2","LEVIT","Lepidium virginicum L. var. typicum C.L. Hitchc.","","Brassicaceae"
"LEVU","","Leucanthemum vulgare Lam.","oxeye daisy","Asteraceae"
"LEVU","CHLE80","Chrysanthemum leucanthemum L.","","Asteraceae"
"LEVU","CHLEB","Chrysanthemum leucanthemum L. var. boecheri B. Boivin","","Asteraceae"
"LEVU","CHLEP","Chrysanthemum leucanthemum L. var. pinnatifidum Lecoq & Lamotte","","Asteraceae"
"LEVU","LELE12","Leucanthemum leucanthemum (L.) Rydb., nom. inval.","","Asteraceae"
"LEVU","LEVUP","Leucanthemum vulgare Lam. var. pinnatifidum (Lecoq & Lamotte) Moldenke","","Asteraceae"
"LIAR","","Limnodea arkansana (Nutt.) L.H. Dewey","Ozark grass","Poaceae"
"LIAR","CIAR10","Cinna arkansana (Nutt.) G. Tucker","","Poaceae"
"LIAS","","Liatris aspera Michx.","tall blazing star","Asteraceae"
"LIASI","","Liatris aspera Michx. var. intermedia (Lunell) Gaiser","tall blazing star","Asteraceae"
"LIASI","LASQI","Lacinaria squarrosa (L.) Hill var. intermedia (Lunell) DC.","","Asteraceae"
"LIATR","","Liatris Gaertn. ex Schreb.","blazing star","Asteraceae"
"LIAU3","","Listera australis Lindl.","southern twayblade","Orchidaceae"
"LIAU3","NEAU2","Neottia australis (Lindl.) Szlach.","","Orchidaceae"
"LIAU3","NEBI3","Neottia bifolia (Raf.) Baumbach","","Orchidaceae"
"LIAU3","OPAU6","Ophrys australis (Lindl.) House","","Orchidaceae"
"LIBE3","","Lindera benzoin (L.) Blume","northern spicebush","Lauraceae"
"LIBEP","","Lindera benzoin (L.) Blume var. pubescens (Palmer & Steyerm.) Rehder","northern spicebush","Lauraceae"
"LIBEP","BEAEP","Benzoin aestivale (L.) Nees var. pubescens Palmer & Steyerm.","","Lauraceae"
"LICA12","","Lithospermum canescens (Michx.) Lehm.","hoary puccoon","Boraginaceae"
"LICA12","BACA7","Batschia canescens Michx.","","Boraginaceae"
"LICA13","","Lithospermum caroliniense (Walter ex J.F. Gmel.) MacMill.","Carolina puccoon","Boraginaceae"
"LICA16","","Ligusticum canadense (L.) Britton","Canadian licorice-root","Apiaceae"
"LICA17","","Limonium carolinianum (Walter) Britton","lavender thrift","Plumbaginaceae"
"LICA17","LIAN9","Limonium angustatum (A. Gray) Small","","Plumbaginaceae"
"LICA17","LICAA2","Limonium carolinianum (Walter) Britton var. angustatum (A. Gray) S.F. Blake","","Plumbaginaceae"
"LICA17","LICAA3","Limonium carolinianum (Walter) Britton var. angustifolium S.F. Blake","","Plumbaginaceae"
"LICA17","LICAC4","Limonium carolinianum (Walter) Britton var. compactum Shinners","","Plumbaginaceae"
"LICA17","LICAN2","Limonium carolinianum (Walter) Britton var. nashii (Small) B. Boivin","","Plumbaginaceae"
"LICA17","LICAO","Limonium carolinianum (Walter) Britton var. obtusilobum (S.F. Blake) H.E. Ahles","","Plumbaginaceae"
"LICA17","LICAT3","Limonium carolinianum (Walter) Britton var. trichogonum (S.F. Blake) B. Boivin","","Plumbaginaceae"
"LICA17","LINA","Limonium nashii Small","","Plumbaginaceae"
"LICA17","LINAA2","Limonium nashii Small var. albiflorum (Raf.) House","","Plumbaginaceae"
"LICA17","LINAA","Limonium nashii Small var. angustatum (A. Gray) H.E. Ahles","","Plumbaginaceae"
"LICA17","LINAT","Limonium nashii Small var. trichogonum (S.F. Blake) S.F. Blake","","Plumbaginaceae"
"LICA17","LIOB3","Limonium obtusilobum S.F. Blake","","Plumbaginaceae"
"LICA17","LITR8","Limonium trichogonum S.F. Blake","","Plumbaginaceae"
"LICA31","","Lilaeopsis carolinensis J.M. Coult. & Rose","Carolina grasswort","Apiaceae"
"LICA31","LIAT","Lilaeopsis attenuata auct. non (Hook. & Arn.) Fernald","","Apiaceae"
"LICA4","","Lilium catesbaei Walter","pine lily","Liliaceae"
"LICAA","","Lilium catesbaei Walter ssp. asperellum Wherry","pine lily","Liliaceae"
"LICAC2","","Lilium catesbaei Walter ssp. catesbaei","pine lily","Liliaceae"
"LICAC2","LICAL","Lilium catesbaei Walter var. longii Fernald","","Liliaceae"
"LICAC8","","Lithospermum caroliniense (Walter ex J.F. Gmel.) MacMill. var. caroliniense","Carolina puccoon","Boraginaceae"
"LICAC8","BACA5","Batschia caroliniensis Walter ex J.F. Gmel.","","Boraginaceae"
"LICAC8","LICA27","Lithospermum carolinianum Lam.","","Boraginaceae"
"LICAC8","LIGM","Lithospermum gmelini (Michx.) Hitchc.","","Boraginaceae"
"LICAN","","Licania Aubl.","licania","Chrysobalanaceae"
"LICH","","Lilaeopsis chinensis (L.) Kuntze","eastern grasswort","Apiaceae"
"LICH","LILI7","Lilaeopsis lineata (Michx.) Greene","","Apiaceae"
"LICR","","Lindernia crustacea (L.) F. Muell.","Malaysian false pimpernel","Scrophulariaceae"
"LICR","CACR21","Capraria crustacea L.","","Scrophulariaceae"
"LICR","LICRS","Lindernia crustacea (L.) F. Muell. var. smithii O. Deg. & Ruhle","","Scrophulariaceae"
"LICR","TOCR","Torenia crustacea (L.) Cham. & Schltdl.","","Scrophulariaceae"
"LIDU","","Lindernia dubia (L.) Pennell","yellowseed false pimpernel","Scrophulariaceae"
"LIDUA","","Lindernia dubia (L.) Pennell var. anagallidea (Michx.) Cooperr.","yellowseed false pimpernel","Scrophulariaceae"
"LIDUA","ILAN3","Ilysanthes anagallidea (Michx.) B.L. Rob.","","Scrophulariaceae"
"LIDUA","ILIN","Ilysanthes inequalis (Walter) Pennell","","Scrophulariaceae"
"LIDUA","LIAN2","Lindernia anagallidea (Michx.) Pennell","","Scrophulariaceae"
"LIDUD","","Lindernia dubia (L.) Pennell var. dubia","yellowseed false pimpernel","Scrophulariaceae"
"LIDUD","GRDU","Gratiola dubia L.","","Scrophulariaceae"
"LIDUD","ILAT3","Ilysanthes attenuata (Spreng.) Small","","Scrophulariaceae"
"LIDUD","ILDU","Ilysanthes dubia (L.) Barnhart","","Scrophulariaceae"
"LIDUD","LIDUI","Lindernia dubia (L.) Pennell var. inundata (Pennell) Pennell","","Scrophulariaceae"
"LIDUD","LIDUM","Lindernia dubia (L.) Pennell var. major (Pursh) Pennell","","Scrophulariaceae"
"LIDUD","LIDUR","Lindernia dubia (L.) Pennell var. riparia (Raf.) Fernald","","Scrophulariaceae"
"LIDUD","LIDUT","Lindernia dubia (L.) Pennell var. typica Pennell","","Scrophulariaceae"
"LIDUD","LIPR2","Lindernia procumbens auct. non (Knock.) Borb.","","Scrophulariaceae"
"LIDUD","LIPY3","Lindernia pyxidaria sensu Pennell, non L.","","Scrophulariaceae"
"LIEL","","Liatris elegans (Walter) Michx.","pinkscale blazing star","Asteraceae"
"LIEL7","","Liatris elegantula (Greene) K. Schum.","shaggy blazing star","Asteraceae"
"LIEL7","LAEL2","Lacinaria elegantula Greene","","Asteraceae"
"LIEL7","LIGRE","Liatris graminifolia Willd. var. elegantula (Greene) Gaiser","","Asteraceae"
"LIEL7","LIPIE","Liatris pilosa (Aiton) Willd. var. elegantula (Greene) ?, ined.","","Asteraceae"
"LIELE","","Liatris elegans (Walter) Michx. var. elegans","pinkscale blazing star","Asteraceae"
"LIELE","LAEL","Lacinaria elegans (Walter) Kuntze","","Asteraceae"
"LIELE","LAFL4","Lacinaria flabellata Small","","Asteraceae"
"LIELE","LIELF","Liatris elegans (Walter) Michx. var. flabellata (Small) Gaiser","","Asteraceae"
"LIFL","","Linum floridanum (Planch.) Trel.","Florida yellow flax","Linaceae"
"LIFLC","","Linum floridanum (Planch.) Trel. var. chrysocarpum C.M. Rogers","Florida yellow flax","Linaceae"
"LIFLF2","","Linum floridanum (Planch.) Trel. var. floridanum","Florida yellow flax","Linaceae"
"LIFLF2","CAFL29","Cathartolinum floridanum (Planch.) Small","","Linaceae"
"LIFLF2","CAMA26","Cathartolinum macrosepalum Small","","Linaceae"
"LIFLF2","LIVIF","Linum virginianum L. var. floridanum Planch.","","Linaceae"
"LIGR9","","Liatris gracilis Pursh","slender blazing star","Asteraceae"
"LIGR9","LAGR8","Lacinaria gracilis (Pursh) Kuntze","","Asteraceae"
"LIGR9","LALA9","Lacinaria laxa Small","","Asteraceae"
"LIGUS","","Ligusticum L.","licorice-root","Apiaceae"
"LIGUS2","","Ligustrum L.","privet","Oleaceae"
"LIJA","","Ligustrum japonicum Thunb.","Japanese privet","Oleaceae"
"LILA2","","Lithospermum latifolium Michx.","American stoneseed","Boraginaceae"
"LILAE2","","Lilaeopsis Greene","grasswort","Apiaceae"
"LILIU","","Lilium L.","lily","Liliaceae"
"LILU2","","Ligustrum lucidum W.T. Aiton","glossy privet","Oleaceae"
"LIMA10","","Linum macrocarpum C.M. Rogers","Spring Hill flax","Linaceae"
"LIMA4","","Lipocarpha maculata (Michx.) Torr.","American halfchaff sedge","Cyperaceae"
"LIME2","","Linum medium (Planch.) Britton","stiff yellow flax","Linaceae"
"LIME7","","Lindera melissifolia (Walter) Blume","southern spicebush","Lauraceae"
"LIME7","BEME","Benzoin melissifolium (Walter) Nees","","Lauraceae"
"LIME7","LAME4","Laurus melissifolia Walter","","Lauraceae"
"LIMET","","Linum medium (Planch.) Britton var. texanum (Planch.) Fernald","stiff yellow flax","Linaceae"
"LIMET","CACU12","Cathartolinum curtissii (Small) Small","","Linaceae"
"LIMET","LISTT","Linum striatum Walter var. texanum (Planch.) B. Boivin","","Linaceae"
"LIMET","LIVIT","Linum virginianum L. var. texanum Planch.","","Linaceae"
"LIMI","","Lilium michauxii Poir.","Carolina lily","Liliaceae"
"LIMI","LICA25","Lilium carolinianum Michx., non Bosc ex Lam.","","Liliaceae"
"LIMI","LIFO3","Lilium fortunofulgidum Roane & Henry","","Liliaceae"
"LIMI","LISUC","Lilium superbum L. var. carolinianum (Michx.) Chapm.","","Liliaceae"
"LIMI12","","Lipocarpha micrantha (Vahl) G. Tucker","smallflower halfchaff sedge","Cyperaceae"
"LIMI12","HEMI5","Hemicarpha micrantha (Vahl) Pax","","Cyperaceae"
"LIMI12","HEMIM3","Hemicarpha micrantha (Vahl) Pax var. minor (Schrad.) Friedland","","Cyperaceae"
"LIMI12","SCMI11","Scirpus micranthus Vahl","","Cyperaceae"
"LIMI12","SCMIM2","Scirpus micranthus Vahl var. minor (Schrad. ex Roem. & Schult.) B. Boivin","","Cyperaceae"
"LIMI5","","Licania michauxii Prance","gopher apple","Chrysobalanaceae"
"LIMI5","CHIN14","Chrysobalanus incanus Raf.","","Chrysobalanaceae"
"LIMI5","CHOB7","Chrysobalanus oblongifolius Michx.","","Chrysobalanaceae"
"LIMI5","CHPA24","Chrysobalanus pallidus (Small) L.B. Sm.","","Chrysobalanaceae"
"LIMI5","CHRE6","Chrysobalanus retusus Raf.","","Chrysobalanaceae"
"LIMI5","GEOB2","Geobalanus oblongifolius (Michx.) Small","","Chrysobalanaceae"
"LIMI5","GEPA6","Geobalanus pallidus Small","","Chrysobalanaceae"
"LIMI9","","Lilium michiganense Farw.","Michigan lily","Liliaceae"
"LIMI9","LICAM","Lilium canadense L. ssp. michiganense (Farw.) B. Boivin & Cody","","Liliaceae"
"LIMI9","LICAU","Lilium canadense L. var. umbelliferum (Farw.) B. Boivin","","Liliaceae"
"LIMI9","LIMIU","Lilium michiganense Farw. var. uniflorum Farw.","","Liliaceae"
"LIMNO","","Limnobium Rich.","spongeplant","Hydrocharitaceae"
"LIMNO2","","Limnodea L.H. Dewey","Ozark grass","Poaceae"
"LIMNO3","","Limnosciadium Mathias & Constance","dogshade","Apiaceae"
"LIMON","","Limonium Mill.","sea lavender","Plumbaginaceae"
"LIMU6","","Liriope muscari (Decne.) L.H. Bailey","big blue lilyturf","Liliaceae"
"LINAR","","Linaria Mill.","toadflax","Scrophulariaceae"
"LINDE","","Lindernia All.","false pimpernel","Scrophulariaceae"
"LINDE2","","Lindera Thunb.","spicebush","Lauraceae"
"LINUM","","Linum L.","flax","Linaceae"
"LIPI2","","Limnosciadium pinnatum (DC.) Mathias & Constance","tansy dogshade","Apiaceae"
"LIPI2","CYPI6","Cynosciadium pinnatum DC.","","Apiaceae"
"LIPOC","","Lipocarpha R. Br.","halfchaff sedge","Cyperaceae"
"LIPY","","Liatris pycnostachya Michx.","prairie blazing star","Asteraceae"
"LIPYP","","Liatris pycnostachya Michx. var. pycnostachya","prairie blazing star","Asteraceae"
"LIPYP","LAPY","Lacinaria pycnostachya (Michx.) Kuntze","","Asteraceae"
"LIPYP","LIBE5","Liatris bebbiana Rydb.","","Asteraceae"
"LIQUI","","Liquidambar L.","sweetgum","Hamamelidaceae"
"LIRIO","","Liriodendron L.","tuliptree","Magnoliaceae"
"LIRIO2","","Liriope Lour.","lilyturf","Liliaceae"
"LISI","","Ligustrum sinense Lour.","Chinese privet","Oleaceae"
"LISI","LIMI13","Ligustrum microcarpum Kaneh. & Sasaki","","Oleaceae"
"LISI","LIVI7","Ligustrum villosum May","","Oleaceae"
"LISP","","Liatris spicata (L.) Willd.","dense blazing star","Asteraceae"
"LISP10","","Liriope spicata (Thunb.) Lour.","creeping liriope","Liliaceae"
"LISP10","LISP8","Liriope spicatum (Thunb.) Lour., orth. var.","","Liliaceae"
"LISP2","","Limnobium spongia (Bosc) Rich. ex Steud.","American spongeplant","Hydrocharitaceae"
"LISP2","HYCO12","Hydrocharis cordifolia Nutt.","","Hydrocharitaceae"
"LISP2","HYSP6","Hydrocharis spongia Bosc","","Hydrocharitaceae"
"LISPR","","Liatris spicata (L.) Willd. var. resinosa (Nutt.) Gaiser","dense blazing star","Asteraceae"
"LISPS","","Liatris spicata (L.) Willd. var. spicata","dense blazing star","Asteraceae"
"LISPS","LASP5","Lacinaria spicata (L.) Kuntze","","Asteraceae"
"LISQ","","Liatris squarrosa (L.) Michx.","scaly blazing star","Asteraceae"
"LISQ2","","Liatris squarrulosa Michx.","Appalachian blazing star","Asteraceae"
"LISQ2","LARU2","Lacinaria ruthii Alexander","","Asteraceae"
"LISQ2","LASH","Lacinaria shortii Alexander","","Asteraceae"
"LISQ2","LATR7","Lacinaria tracyi Alexander","","Asteraceae"
"LISQ2","LIEA","Liatris earlei (Greene) K. Schum.","","Asteraceae"
"LISQ2","LISC","Liatris scabra (Greene) K. Schum.","","Asteraceae"
"LISQ2","LISCS","Liatris scariosa (L.) Willd. var. squarrulosa (Michx.) A. Gray","","Asteraceae"
"LISQA","","Liatris squarrosa (L.) Michx. var. alabamensis (Alexander) Gaiser","Alabama blazing star","Asteraceae"
"LISQA","LIGLA","Liatris glabrata Rydb. var. alabamensis (Alexander) Shinners","","Asteraceae"
"LISQH","","Liatris squarrosa (L.) Michx. var. hirsuta (Rydb.) Gaiser","scaly blazing star","Asteraceae"
"LISQH","LIHI2","Liatris hirsuta Rydb.","","Asteraceae"
"LISQS","","Liatris squarrosa (L.) Michx. var. squarrosa","scaly blazing star","Asteraceae"
"LISQS","LASQ2","Lacinaria squarrosa (L.) Hill","","Asteraceae"
"LISQS","LISQG2","Liatris squarrosa (L.) Michx. var. gracilenta Gaiser","","Asteraceae"
"LIST","","Linum striatum Walter","ridged yellow flax","Linaceae"
"LIST","CAST31","Cathartolinum striatum (Walter) Small","","Linaceae"
"LIST","LISTM2","Linum striatum Walter var. multijugum Fernald","","Linaceae"
"LIST","NEST3","Nezera striata (Walter) Nieuwl.","","Linaceae"
"LIST2","","Liquidambar styraciflua L.","sweetgum","Hamamelidaceae"
"LISTE","","Listera R. Br.","twayblade","Orchidaceae"
"LISU","","Lilium superbum L.","turk's-cap lily","Liliaceae"
"LISU","LICAS2","Lilium canadense L. ssp. superbum (L.) B. Boivin & Cody","","Liliaceae"
"LISU","LICAS3","Lilium canadense L. ssp. superbum (L.) Baker, nom. illeg.","","Liliaceae"
