"ROCAC","ROPA6","Rosa palmeri Rydb.","","Rosaceae"
"ROCAC","ROSE5","Rosa serrulata Raf.","","Rosaceae"
"ROCAC","ROSU5","Rosa subserrulata Rydb.","","Rosaceae"
"ROCAC","ROTE3","Rosa texarkana Rydb.","","Rosaceae"
"ROCH","","Rosa chinensis Jacq.","Chinese rose","Rosaceae"
"ROCO6","","Rottboellia cochinchinensis (Lour.) W.D. Clayton","itchgrass","Poaceae"
"ROCO6","AEEX2","Aegilops exaltata L.","","Poaceae"
"ROCO6","MAEX3","Manisuris exaltata (L.) Kuntze","","Poaceae"
"ROCO6","ROEX2","Rottboellia exaltata (L.) L. f.","","Poaceae"
"ROFO","","Rosa foliolosa Nutt. ex Torr. & A. Gray","white prairie rose","Rosaceae"
"ROFO","ROIG","Rosa ignota Shinners","","Rosaceae"
"ROGA","","Rosa gallica L.","French rose","Rosaceae"
"ROGA","ROGAG","Rosa gallica L. var. gallica","","Rosaceae"
"ROGA","ROGAO","Rosa gallica L. var. officinalis Thory","","Rosaceae"
"ROGA","ROGAV2","Rosa gallica L. var. versicolor L.","","Rosaceae"
"ROHI","","Robinia hispida L.","bristly locust","Fabaceae"
"ROHIH","","Robinia hispida L. var. hispida","bristly locust","Fabaceae"
"ROHIH","ROGR3","Robinia grandiflora auct. non Ashe nec L. nec C.K. Schneid.","","Fabaceae"
"ROHIH","ROPA5","Robinia pallida Ashe","","Fabaceae"
"ROHIH","ROSP5","Robinia speciosa Ashe","","Fabaceae"
"ROIN","","Rorippa indica (L.) Hiern.","variableleaf yellowcress","Brassicaceae"
"ROIN","RODU7","Rorippa dubia (Pers.) Hara","","Brassicaceae"
"ROINA","","Rorippa indica (L.) Hiern. var. apetala Hochr.","variableleaf yellowcress","Brassicaceae"
"ROIS2","","Rorippa islandica (Oeder) Borbás","northern marsh yellowcress","Brassicaceae"
"ROLA","","Rosa laevigata Michx.","Cherokee rose","Rosaceae"
"ROMU","","Rosa multiflora Thunb.","multiflora rose","Rosaceae"
"ROMU","ROCA9","Rosa cathayensis (Rehder & Wilson) L.H. Bailey","","Rosaceae"
"ROMU","ROMUW","Rosa multiflora Thunb. f. watsoniana (Crép.) Matsum.","","Rosaceae"
"ROMU","ROWA4","Rosa watsoniana Crép.","","Rosaceae"
"ROPA","","Rosa palustris Marshall","swamp rose","Rosaceae"
"ROPA","ROFL2","Rosa floridana Rydb.","","Rosaceae"
"ROPA","ROLA3","Rosa lancifolia Small","","Rosaceae"
"ROPA","ROPAD3","Rosa palustris Marshall var. dasistema (Raf.) Palmer & Steyerm.","","Rosaceae"
"ROPA2","","Rorippa palustris (L.) Besser","bog yellowcress","Brassicaceae"
"ROPAF2","","Rorippa palustris (L.) Besser ssp. fernaldiana (Butters & Abbe) Jonsell","Fernald's yellowcress","Brassicaceae"
"ROPAF2","ROHIG","Rorippa hispida (Desv.) Britton var. glabrata Lunell","","Brassicaceae"
"ROPAF2","ROISF3","Rorippa islandica (Oeder) Borbás ssp. fernaldiana (Butters & Abbe) Hultén","","Brassicaceae"
"ROPAF2","ROISF2","Rorippa islandica (Oeder) Borbás var. fernaldiana Butters & Abbe","","Brassicaceae"
"ROPAF2","ROISG","Rorippa islandica (Oeder) Borbás var. glabra (O.E. Schulz) S.L. Welsh & Reveal","","Brassicaceae"
"ROPAF2","ROISG2","Rorippa islandica (Oeder) Borbás var. glabrata (Lunell) Butters & Abbe","","Brassicaceae"
"ROPAF2","ROPAG","Rorippa palustris (L.) Besser ssp. glabra (O.E. Schulz) R. Stuckey","","Brassicaceae"
"ROPAF2","ROPAC3","Rorippa palustris (L.) Besser var. cernua (Nutt.) R. Stuckey","","Brassicaceae"
"ROPAF2","ROPAD2","Rorippa palustris (L.) Besser var. dictyota (Greene) R. Stuckey","","Brassicaceae"
"ROPAF2","ROPAG3","Rorippa palustris (L.) Besser var. glabra (O.E. Schulz) R. Stuckey","","Brassicaceae"
"ROPAF2","ROPAG4","Rorippa palustris (L.) Besser var. glabrata (Lunell) R. Stuckey","","Brassicaceae"
"ROPS","","Robinia pseudoacacia L.","black locust","Fabaceae"
"ROPS","ROPSP","Robinia pseudoacacia L. var. pyramidalis Pepin","","Fabaceae"
"ROPS","ROPSR","Robinia pseudoacacia L. var. rectissima (L.) Raber","","Fabaceae"
"ROPS","ROPSI2","Robinia pseudoacacia L. f. inermis (Mirb.) Rehder","","Fabaceae"
"RORA","","Rotala ramosior (L.) Koehne","lowland rotala","Lythraceae"
"RORA","ROCA5","Rotala catholica (Cham. & Schltdl.) van Leeuwen","","Lythraceae"
"RORA","RODE3","Rotala dentifera (A. Gray) Koehne","","Lythraceae"
"RORA","RORAI","Rotala ramosior (L.) Koehne var. interior Fernald & Grisc.","","Lythraceae"
"RORA","RORAT","Rotala ramosior (L.) Koehne var. typica Fernald & Grisc.","","Lythraceae"
"RORIP","","Rorippa Scop.","yellowcress","Brassicaceae"
"RORU82","","Rosa rubiginosa L.","sweetbriar rose","Rosaceae"
"RORU82","ROEG","Rosa eglanteria L., nom. utique rej.","","Rosaceae"
"ROSA5","","Rosa L.","rose","Rosaceae"
"ROSE","","Rorippa sessiliflora (Nutt.) Hitchc.","stalkless yellowcress","Brassicaceae"
"ROSE","NASE4","Nasturtium sessiliflorum Nutt.","","Brassicaceae"
"ROSE","RASE3","Radicula sessiliflora (Nutt.) Greene","","Brassicaceae"
"ROSE2","","Rosa setigera Michx.","climbing rose","Rosaceae"
"ROSES","","Rosa setigera Michx. var. setigera","climbing rose","Rosaceae"
"ROSES","ROSES2","Rosa setigera Michx. var. serena Palmer & Steyerm.","","Rosaceae"
"ROSY","","Rorippa sylvestris (L.) Besser","creeping yellowcress","Brassicaceae"
"ROSY","RASY","Radicula sylvestris (L.) Druce","","Brassicaceae"
"ROTAL","","Rotala L.","rotala","Lythraceae"
"ROTE2","","Rorippa teres (Michx.) R. Stuckey","southern marsh yellowcress","Brassicaceae"
"ROTE2","CATE16","Cardamine teres Michx.","","Brassicaceae"
"ROTE2","RAOB3","Radicula obtusa (Nutt.) Greene","","Brassicaceae"
"ROTE2","RAWA2","Radicula walteri (Elliott) Greene","","Brassicaceae"
"ROTE2","ROOB3","Rorippa obtusa (Nutt.) Britton","","Brassicaceae"
"ROTE2","ROWA3","Rorippa walteri (Elliott) C. Mohr","","Brassicaceae"
"ROTTB","","Rottboellia L. f.","itchgrass","Poaceae"
"ROWI","","Rosa wichuraiana Crép.","memorial rose","Rosaceae"
"ROWI","ROLU4","Rosa luciae Franch. & Rochebr.","","Rosaceae"
"ROWI","ROWIP2","Rosa wichuraiana Crép. var. poteriifolia Koidz.","","Rosaceae"
"RUAB","","Rubus aboriginum Rydb.","garden dewberry","Rosaceae"
"RUAB","RUAL2","Rubus almus (L.H. Bailey) L.H. Bailey","","Rosaceae"
"RUAB","RUAU3","Rubus austrinus L.H. Bailey","","Rosaceae"
"RUAB","RUBO2","Rubus bollianus L.H. Bailey","","Rosaceae"
"RUAB","RUCL2","Rubus clair-brownii L.H. Bailey","","Rosaceae"
"RUAB","RUDE5","Rubus decor L.H. Bailey","","Rosaceae"
"RUAB","RUFLA2","Rubus flagellaris Willd. var. almus L.H. Bailey","","Rosaceae"
"RUAB","RUFO","Rubus foliaceus L.H. Bailey","","Rosaceae"
"RUAB","RUIG","Rubus ignarus L.H. Bailey","","Rosaceae"
"RUAB","RURI3","Rubus ricei L.H. Bailey","","Rosaceae"
"RUAC3","","Rumex acetosella L.","common sheep sorrel","Polygonaceae"
"RUAC3","ACAC5","Acetosella acetosella (L.) Small, nom. inval.","","Polygonaceae"
"RUAC3","ACTE3","Acetosella tenuifolia (Wallr.) Á. Löve","","Polygonaceae"
"RUAC3","ACVU","Acetosella vulgaris Fourr.","","Polygonaceae"
"RUAC3","RUACA5","Rumex acetosella L. ssp. angiocarpus (Murb.) Murb.","","Polygonaceae"
"RUAC3","RUACP2","Rumex acetosella L. var. pyrenaeus (Pourr.) Timbal-Lagrave","","Polygonaceae"
"RUAC3","RUACT2","Rumex acetosella L. var. tenuifolius Wallr.","","Polygonaceae"
"RUAC3","RUAN","Rumex angiocarpus Murb.","","Polygonaceae"
"RUAC3","RUTE5","Rumex tenuifolius (Wallr.) Á. Löve","","Polygonaceae"
"RUAL4","","Rumex altissimus Alph. Wood","pale dock","Polygonaceae"
"RUAL4","RUBR14","Rumex britannica Meisn., non L.","","Polygonaceae"
"RUAL4","RUBR3","Rumex brittanicus Meisn., orth. var.","","Polygonaceae"
"RUAL4","RUEL6","Rumex ellipticus Greene","","Polygonaceae"
"RUAP","","Rubus apogaeus L.H. Bailey","falling dewberry","Rosaceae"
"RUAP","RUEX7","Rubus exlex L.H. Bailey","","Rosaceae"
"RUAP","RULA11","Rubus lassus L.H. Bailey","","Rosaceae"
"RUAP","RULU2","Rubus lundelliorum L.H. Bailey","","Rosaceae"
"RUAP","RUUN2","Rubus uncus L.H. Bailey","","Rosaceae"
"RUAR2","","Rubus argutus Link","sawtooth blackberry","Rosaceae"
"RUAR2","RUAB3","Rubus abundiflorus L.H. Bailey","","Rosaceae"
"RUAR2","RUBE3","Rubus betulifolius Small","","Rosaceae"
"RUAR2","RUFL5","Rubus floridensis L.H. Bailey","","Rosaceae"
"RUAR2","RUFL7","Rubus floridus Tratt.","","Rosaceae"
"RUAR2","RUIN12","Rubus incisifrons L.H. Bailey","","Rosaceae"
"RUAR2","RULO","Rubus louisianus A. Berger","","Rosaceae"
"RUAR2","RUPE2","Rubus penetrans L.H. Bailey","","Rosaceae"
"RUAR2","RURH","Rubus rhodophyllus Rydb.","","Rosaceae"
"RUAR5","","Rubus arvensis L.H. Bailey","field blackberry","Rosaceae"
"RUAR5","RUSA5","Rubus saepescandens L.H. Bailey","","Rosaceae"
"RUBI","","Rubus bifrons Vest ex Tratt.","Himalayan berry","Rosaceae"
"RUBUS","","Rubus L.","blackberry","Rosaceae"
"RUCA19","","Ruellia caerulea Morong","Britton's wild petunia","Acanthaceae"
"RUCA19","RUBR","Ruellia brittoniana Leonard","","Acanthaceae"
"RUCA19","RUMA18","Ruellia malacosperma sensu Small, non Greenm.","","Acanthaceae"
"RUCA19","RUSI7","Ruellia simplex C. Wright","","Acanthaceae"
"RUCA19","RUTW","Ruellia tweediana auct. non Griseb.","","Acanthaceae"
"RUCA4","","Ruellia caroliniensis (J.F. Gmel.) Steud.","Carolina wild petunia","Acanthaceae"
"RUCAC","","Ruellia caroliniensis (J.F. Gmel.) Steud. ssp. ciliosa (Pursh) R.W. Long","Carolina wild petunia","Acanthaceae"
"RUCAC2","","Ruellia caroliniensis (J.F. Gmel.) Steud. ssp. caroliniensis","Carolina wild petunia","Acanthaceae"
"RUCAC4","","Ruellia caroliniensis (J.F. Gmel.) Steud. ssp. caroliniensis var. caroliniensis","Carolina wild petunia","Acanthaceae"
"RUCAC4","PACA14","Pattersonia caroliniensis J.F. Gmel.","","Acanthaceae"
"RUCAC4","RUCAC6","Ruellia caroliniensis (J.F. Gmel.) Steud. var. cheloniformis Fernald","","Acanthaceae"
"RUCAC4","RUCAD","Ruellia caroliniensis (J.F. Gmel.) Steud. var. dentata (Nees) Fernald","","Acanthaceae"
"RUCAC4","RUCAM","Ruellia caroliniensis (J.F. Gmel.) Steud. var. membranacea Fernald","","Acanthaceae"
"RUCAC4","RUCAN","Ruellia caroliniensis (J.F. Gmel.) Steud. var. nanella Fernald","","Acanthaceae"
"RUCAC4","RUCAP","Ruellia caroliniensis (J.F. Gmel.) Steud. var. parviflora (Nees) S.F. Blake","","Acanthaceae"
"RUCAC4","RUCAS4","Ruellia caroliniensis (J.F. Gmel.) Steud. var. salicina Fernald","","Acanthaceae"
"RUCAC4","RUCAS5","Ruellia caroliniensis (J.F. Gmel.) Steud. var. semicalva Fernald","","Acanthaceae"
"RUCAC4","RUHY3","Ruellia hybrida Pursh","","Acanthaceae"
"RUCAC4","RUPA21","Ruellia parviflora (Nees) Britton","","Acanthaceae"
"RUCAC5","","Ruellia caroliniensis (J.F. Gmel.) Steud. ssp. ciliosa (Pursh) R.W. Long var. cinerascens (Fernald) Kartesz & Gandhi","Carolina wild petunia","Acanthaceae"
"RUCAC5","RUCI4","Ruellia ciliosa Pursh","","Acanthaceae"
"RUCAC5","RUCIC","Ruellia ciliosa Pursh var. cinerascens Fernald","","Acanthaceae"
"RUCAC5","RUHU6","Ruellia humilis sensu Small, non Nutt.","","Acanthaceae"
"RUCH3","","Rumex chrysocarpus Moris","amamastla","Polygonaceae"
"RUCH3","RUBE6","Rumex berlandieri Meisn.","","Polygonaceae"
"RUCO2","","Rumex conglomeratus Murray","clustered dock","Polygonaceae"
"RUCR","","Rumex crispus L.","curly dock","Polygonaceae"
"RUCRC","","Rumex crispus L. ssp. crispus","curly dock","Polygonaceae"
"RUCU","","Rubus cuneifolius Pursh","sand blackberry","Rosaceae"
"RUCU","RUCH5","Rubus chapmanii L.H. Bailey","","Rosaceae"
"RUCU","RUCUA","Rubus cuneifolius Pursh var. angustior L.H. Bailey","","Rosaceae"
"RUCU","RUCUS2","Rubus cuneifolius Pursh var. spiniceps L.H. Bailey","","Rosaceae"
"RUCU","RUCUS","Rubus cuneifolius Pursh var. subellipticus Fernald","","Rosaceae"
"RUCU","RUDI11","Rubus dixiensis Davis, Fuller & Davis","","Rosaceae"
"RUDBE","","Rudbeckia L.","coneflower","Asteraceae"
"RUELL","","Ruellia L.","wild petunia","Acanthaceae"
"RUFL","","Rubus flagellaris Willd.","northern dewberry","Rosaceae"
"RUFL","RUAL14","Rubus alacer L.H. Bailey","","Rosaceae"
"RUFL","RUAR4","Rubus arundelanus Blanch.","","Rosaceae"
"RUFL","RUARJ","Rubus arundelanus Blanch. var. jeckylanus (Blanch.) L.H. Bailey","","Rosaceae"
"RUFL","RUAS","Rubus ascendens Blanch.","","Rosaceae"
"RUFL","RUAS2","Rubus ashei L.H. Bailey","","Rosaceae"
"RUFL","RUBO3","Rubus bonus L.H. Bailey","","Rosaceae"
"RUFL","RUCA10","Rubus camurus L.H. Bailey","","Rosaceae"
"RUFL","RUCL3","Rubus clausenii L.H. Bailey","","Rosaceae"
"RUFL","RUCO16","Rubus connixus L.H. Bailey","","Rosaceae"
"RUFL","RUCO20","Rubus cordialis L.H. Bailey","","Rosaceae"
"RUFL","RUDI7","Rubus dissitiflorus Fernald","","Rosaceae"
"RUFL","RUEN","Rubus enslenii Tratt.","","Rosaceae"
"RUFL","RUEX5","Rubus exemptus L.H. Bailey","","Rosaceae"
"RUFL","RUFR10","Rubus frustratus L.H. Bailey","","Rosaceae"
"RUFL","RUGE2","Rubus geophilus Blanch.","","Rosaceae"
"RUFL","RUJAA","Rubus jaysmithii L.H. Bailey var. angustior L.H. Bailey","","Rosaceae"
"RUFL","RULO6","Rubus longipes Fernald","","Rosaceae"
"RUFL","RUMA14","Rubus maltei L.H. Bailey","","Rosaceae"
"RUFL","RUNE5","Rubus neonefrens L.H. Bailey","","Rosaceae"
"RUFL","RUOC5","Rubus occultus L.H. Bailey","","Rosaceae"
"RUFL","RUPR21","Rubus procumbens Muhl.","","Rosaceae"
"RUFL","RUSA3","Rubus sailori L.H. Bailey","","Rosaceae"
"RUFL","RUSE8","Rubus serenus L.H. Bailey","","Rosaceae"
"RUFL","RUSU8","Rubus subuniflorus Rydb.","","Rosaceae"
"RUFL","RUTE10","Rubus tetricus L.H. Bailey","","Rosaceae"
"RUFL","RUTR8","Rubus tracyi L.H. Bailey","","Rosaceae"
"RUFL","RUUR2","Rubus urbanianus L.H. Bailey","","Rosaceae"
"RUFL","RUVI13","Rubus villosus Aiton","","Rosaceae"
"RUFU2","","Rudbeckia fulgida Aiton","orange coneflower","Asteraceae"
"RUFUU","","Rudbeckia fulgida Aiton var. umbrosa (C.L. Boynt. & Beadle) Cronquist","orange coneflower","Asteraceae"
"RUFUU","RUCH2","Rudbeckia chapmanii C.L. Boynt. & Beadle","","Asteraceae"
"RUFUU","RUUM","Rudbeckia umbrosa C.L. Boynt. & Beadle","","Asteraceae"
"RUGR","","Rudbeckia grandiflora (D. Don) J.F. Gmel. ex DC.","rough coneflower","Asteraceae"
"RUGRA","","Rudbeckia grandiflora (D. Don) J.F. Gmel. ex DC. var. alismifolia (Torr. & A. Gray) Cronquist","rough coneflower","Asteraceae"
"RUGRA","RUAL16","Rudbeckia alismifolia Torr. & A. Gray","","Asteraceae"
"RUHA2","","Rumex hastatulus Baldw.","heartwing sorrel","Polygonaceae"
"RUHE","","Rudbeckia heliopsidis Torr. & A. Gray","sunfacing coneflower","Asteraceae"
"RUHI2","","Rudbeckia hirta L.","blackeyed Susan","Asteraceae"
"RUHIA","","Rudbeckia hirta L. var. angustifolia (T.V. Moore) Perdue","blackeyed Susan","Asteraceae"
"RUHIA","RUDI","Rudbeckia divergens T.V. Moore","","Asteraceae"
"RUHIA","RUFLA","Rudbeckia floridana T.V. Moore var. angustifolia T.V. Moore","","Asteraceae"
"RUHIH","","Rudbeckia hirta L. var. hirta","blackeyed Susan","Asteraceae"
"RUHIH","RUAM8","Rudbeckia amplectens T.V. Moore","","Asteraceae"
"RUHIH","RUBR11","Rudbeckia brittonii Small","","Asteraceae"
"RUHIH","RUHIB","Rudbeckia hirta L. var. brittonii (Small) Fernald","","Asteraceae"
"RUHIH","RUHIM","Rudbeckia hirta L. var. monticola (Small) Fernald","","Asteraceae"
"RUHIH","RUMO7","Rudbeckia monticola Small","","Asteraceae"
"RUHIP","","Rudbeckia hirta L. var. pulcherrima Farw.","blackeyed Susan","Asteraceae"
"RUHIP","RUBI5","Rudbeckia bicolor Nutt.","","Asteraceae"
"RUHIP","RUHIC","Rudbeckia hirta L. var. corymbifera Fernald","","Asteraceae"
"RUHIP","RUHIL","Rudbeckia hirta L. var. lanceolata (Bisch.) Core","","Asteraceae"
"RUHIP","RUHIS","Rudbeckia hirta L. var. sericea (T.V. Moore) Fernald","","Asteraceae"
"RUHIP","RUHIS2","Rudbeckia hirta L. var. serotina (Nutt.) Core","","Asteraceae"
"RUHIP","RULO8","Rudbeckia longipes T.V. Moore","","Asteraceae"
"RUHIP","RUSE16","Rudbeckia sericea T.V. Moore","","Asteraceae"
"RUHIP","RUSE5","Rudbeckia serotina Nutt.","","Asteraceae"
"RUHIP","RUSEC","Rudbeckia serotina Nutt. var. corymbifera (Fernald) Fernald & B.G. Schub.","","Asteraceae"
"RUHIP","RUSEL","Rudbeckia serotina Nutt. var. lanceolata (Bisch.) Fernald & B.G. Schub.","","Asteraceae"
"RUHIP","RUSES","Rudbeckia serotina Nutt. var. sericea (T.V. Moore) Fernald & B.G. Schub.","","Asteraceae"
"RUHU","","Ruellia humilis Nutt.","fringeleaf wild petunia","Acanthaceae"
"RUHU","RUCIL","Ruellia ciliosa Pursh var. longiflora A. Gray","","Acanthaceae"
"RUHU","RUHUC","Ruellia humilis Nutt. var. calvescens Fernald","","Acanthaceae"
"RUHU","RUHUD","Ruellia humilis Nutt. var. depauperata Tharp & F.A. Barkley","","Acanthaceae"
"RUHU","RUHUE","Ruellia humilis Nutt. var. expansa Fernald","","Acanthaceae"
"RUHU","RUHUF","Ruellia humilis Nutt. var. frondosa Fernald","","Acanthaceae"
"RUHU","RUHUL","Ruellia humilis Nutt. var. longiflora (A. Gray) Fernald","","Acanthaceae"
"RUIC","","Rubus ictus L.H. Bailey","savannah dewberry","Rosaceae"
"RUIC","RUAG","Rubus agilis L.H. Bailey","","Rosaceae"
"RULA3","","Rudbeckia laciniata L.","cutleaf coneflower","Asteraceae"
"RULAL","","Rudbeckia laciniata L. var. laciniata","cutleaf coneflower","Asteraceae"
"RULAL","RULAH","Rudbeckia laciniata L. var. hortensis L.H. Bailey","","Asteraceae"
"RULU","","Rubus lucidus Rydb.","manatee dewberry","Rosaceae"
"RULU","RUNE6","Rubus nessianus L.H. Bailey","","Rosaceae"
"RUMA5","","Ruppia maritima L.","widgeongrass","Ruppiaceae"
"RUMA5","RUMAB","Ruppia maritima L. var. brevirostris J. Agardh","","Ruppiaceae"
"RUMA5","RUMAE","Ruppia maritima L. var. exigua Fernald & Wiegand","","Ruppiaceae"
"RUMA5","RUMAI","Ruppia maritima L. var. intermedia (Thed.) Asch. & Graebn.","","Ruppiaceae"
"RUMA5","RUMAL","Ruppia maritima L. var. longipes Hagstr.","","Ruppiaceae"
"RUMA5","RUMAO2","Ruppia maritima L. var. obliqua (Schur) Asch. & Graebn.","","Ruppiaceae"
"RUMA5","RUMAP","Ruppia maritima L. var. pacifica H. St. John & Fosberg","","Ruppiaceae"
"RUMA5","RUMAR","Ruppia maritima L. var. rostrata J. Agardh","","Ruppiaceae"
"RUMA5","RUMAS2","Ruppia maritima L. var. subcapitata Fernald & Wiegand","","Ruppiaceae"
"RUMA5","RUPE14","Ruppia pectinata Rydb.","","Ruppiaceae"
"RUMEX","","Rumex L.","dock","Polygonaceae"
"RUMI3","","Rubus mirus L.H. Bailey","marvel dewberry","Rosaceae"
"RUMI3","RUMA13","Rubus magniflorus L.H. Bailey","","Rosaceae"
"RUNO","","Ruellia noctiflora (Nees) A. Gray","nightflowering wild petunia","Acanthaceae"
"RUNU","","Ruellia nudiflora (Engelm. & A. Gray) Urb.","violet wild petunia","Acanthaceae"
"RUNUN","","Ruellia nudiflora (Engelm. & A. Gray) Urb. var. nudiflora","violet wild petunia","Acanthaceae"
"RUNUN","DINU2","Dipteracanthus nudiflorus Engelm. & A. Gray","","Acanthaceae"
"RUNUN","RUNUG","Ruellia nudiflora (Engelm. & A. Gray) Urb. var. glabrata Leonard","","Acanthaceae"
"RUNUN","RUNUH","Ruellia nudiflora (Engelm. & A. Gray) Urb. var. hispidula Shinners","","Acanthaceae"
"RUNUN","RUTU3","Ruellia tuberosa sensu A. Gray","","Acanthaceae"
"RUOB","","Rumex obtusifolius L.","bitter dock","Polygonaceae"
"RUOB","ACOB3","Acetosa oblongifolia (L.) Á. Löve & D. Löve","","Polygonaceae"
"RUOB","RUOBA","Rumex obtusifolius L. ssp. agrestis (Fr.) Danser","","Polygonaceae"
"RUOB","RUOBS","Rumex obtusifolius L. ssp. sylvestris (Wallr.) Rech. f.","","Polygonaceae"
"RUOB","RUOBS2","Rumex obtusifolius L. var. sylvestris (Wallr.) Koch","","Polygonaceae"
"RUOC","","Rubus occidentalis L.","black raspberry","Rosaceae"
"RUOC","RUOCP2","Rubus occidentalis L. var. pallidus L.H. Bailey","","Rosaceae"
"RUPE4","","Ruellia pedunculata Torr. ex A. Gray","stalked wild petunia","Acanthaceae"
"RUPE8","","Rubus persistens Rydb.","persistent blackberry","Rosaceae"
"RUPE8","RUAN5","Rubus angustus L.H. Bailey","","Rosaceae"
"RUPE8","RUAR10","Rubus arrectus L.H. Bailey","","Rosaceae"
"RUPE8","RUHA8","Rubus harperi L.H. Bailey","","Rosaceae"
"RUPE8","RUZO","Rubus zoae L.H. Bailey","","Rosaceae"
"RUPEP","","Ruellia pedunculata Torr. ex A. Gray ssp. pinetorum (Fernald) R.W. Long","stalked wild petunia","Acanthaceae"
"RUPEP","RUPI2","Ruellia pinetorum Fernald","","Acanthaceae"
"RUPPI","","Ruppia L.","widgeonweed","Ruppiaceae"
"RUPR4","","Rubus probabilis L.H. Bailey","tree blackberry","Rosaceae"
"RUPR4","RUCUA2","Rubus cuneifolius Pursh var. austrifer L.H. Bailey","","Rosaceae"
"RUPR4","RUSE13","Rubus sejunctus L.H. Bailey","","Rosaceae"
"RUPU3","","Rumex pulcher L.","fiddle dock","Polygonaceae"
"RUPU3","RUPUD","Rumex pulcher L. ssp. divaricatus (L.) Murb.","","Polygonaceae"
"RUSO","","Rubus sons L.H. Bailey","New Orleans dewberry","Rosaceae"
"RUST2","","Ruellia strepens L.","limestone wild petunia","Acanthaceae"
"RUST2","DIMI4","Dipteracanthus micranthus Engelm. & A. Gray","","Acanthaceae"
"RUST2","DIST4","Dipteracanthus strepens (L.) Nees","","Acanthaceae"
"RUST2","RUSTC","Ruellia strepens L. var. cleistantha A. Gray","","Acanthaceae"
"RUST2","RUSTM","Ruellia strepens L. var. micrantha (Engelm. & A. Gray) Britton","","Acanthaceae"
"RUSU","","Rudbeckia subtomentosa Pursh","sweet coneflower","Asteraceae"
"RUSU4","","Rubus suus L.H. Bailey","branched blackberry","Rosaceae"
"RUSU4","RUDE11","Rubus demareanus L.H. Bailey","","Rosaceae"
"RUSU4","RUJE","Rubus jennisonii L.H. Bailey","","Rosaceae"
"RUSU4","RUMO8","Rubus monongaliensis L.H. Bailey","","Rosaceae"
"RUSU4","RURA4","Rubus ramifer L.H. Bailey","","Rosaceae"
"RUSU4","RUTE7","Rubus texanus L.H. Bailey","","Rosaceae"
"RUSU4","RUVI9","Rubus vixargutus L.H. Bailey","","Rosaceae"
"RUTR","","Rubus trivialis Michx.","southern dewberry","Rosaceae"
"RUTR","RUCA18","Rubus carpinifolius Rydb.","","Rosaceae"
"RUTR","RUCO14","Rubus continentalis (Focke) L.H. Bailey","","Rosaceae"
"RUTR","RUMI8","Rubus mississippianus L.H. Bailey","","Rosaceae"
"RUTR","RUOK2","Rubus okeechobeus L.H. Bailey","","Rosaceae"
"RUTR","RURU4","Rubus rubrisetus Rydb.","","Rosaceae"
"RUTR","RUTA","Rubus tallahasseanus L.H. Bailey","","Rosaceae"
"RUTR","RUTRS","Rubus trivialis Michx. var. serosus L.H. Bailey","","Rosaceae"
"RUTR2","","Rudbeckia triloba L.","browneyed Susan","Asteraceae"
"RUTRT","","Rudbeckia triloba L. var. triloba","browneyed Susan","Asteraceae"
"RUVE3","","Rumex verticillatus L.","swamp dock","Polygonaceae"
"RUVE3","RUFA","Rumex fascicularis Small","","Polygonaceae"
"RUVE3","RUFL2","Rumex floridanus Meisn.","","Polygonaceae"
"SAAH","","Sarracenia ×ahlesii C.R. Bell & Case [alata × rubra]","pitcherplant","Sarraceniaceae"
"SAAL21","","Saccharum alopecuroides (L.) Nutt.","silver plumegrass","Poaceae"
"SAAL21","ERAL2","Erianthus alopecuroides (L.) Elliott","","Poaceae"
"SAAL21","ERALH","Erianthus alopecuroides (L.) Elliott var. hirsutis Nash","","Poaceae"
"SAAL21","ERDI11","Erianthus divaricatus (L.) Hitchc.","","Poaceae"
"SAAL21","ERTR17","Erianthus tracyi Nash","","Poaceae"
"SAAL21","SAAL8","Saccharum alopecuroideum (L.) Nutt., orth. var.","","Poaceae"
"SAAL21","SAAL9","Saccharum alopecuroidum (L.) Nutt., database artifact","","Poaceae"
"SAAL4","","Sarracenia alata Alph. Wood","yellow trumpets","Sarraceniaceae"
"SAAL4","SASL","Sarracenia sledgei Macfarlane","","Sarraceniaceae"
"SAAL5","","Sassafras albidum (Nutt.) Nees","sassafras","Lauraceae"
"SAAL5","LAAL5","Laurus albidus Nutt.","","Lauraceae"
"SAAL5","LASA6","Laurus sassafras L.","","Lauraceae"
"SAAL5","SAALM2","Sassafras albidum (Nutt.) Nees var. molle (Raf.) Fernald","","Lauraceae"
"SAAL5","SAOF5","Sassafras officinale Nees & Eberm.","","Lauraceae"
"SAAL5","SASA17","Sassafras sassafras (L.) Karst., nom. inval.","","Lauraceae"
"SAAL5","SAVA7","Sassafras variifolium (Salisb.) Kuntze","","Lauraceae"
"SAAN","","Sabatia angularis (L.) Pursh","rosepink","Gentianaceae"
"SAAR24","","Sarracenia ×areolata Macfarlane (pro sp.) [alata × leucophylla]","pitcherplant","Sarraceniaceae"
"SAAU2","","Sagittaria australis (J.G. Sm.) Small","longbeak arrowhead","Alismataceae"
"SAAU2","SAENL2","Sagittaria engelmanniana J.G. Sm. ssp. longirostra auct. non Micheli","","Alismataceae"
"SAAU2","SALO10","Sagittaria longirostra auct. non (Micheli) J.G. Sm.","","Alismataceae"
"SAAU2","SALOA","Sagittaria longirostra (Micheli) J.G. Sm. var. australis J.G. Sm.","","Alismataceae"
"SAAZ","","Salvia azurea Michx. ex Lam.","azure blue sage","Lamiaceae"
"SAAZA","","Salvia azurea Michx. ex Lam. var. azurea","azure blue sage","Lamiaceae"
"SAAZG","","Salvia azurea Michx. ex Lam. var. grandiflora Benth.","pitcher sage","Lamiaceae"
"SAAZG","SAAZI","Salvia azurea Michx. ex Lam. ssp. intermedia Epling","","Lamiaceae"
"SAAZG","SAAZP","Salvia azurea Michx. ex Lam. ssp. pitcheri (Torr. ex Benth.) Epling","","Lamiaceae"
"SAAZG","SAPI3","Salvia pitcheri Torr. ex Benth.","","Lamiaceae"
"SABA10","","Saccharum baldwinii Spreng.","narrow plumegrass","Poaceae"
"SABA10","ERST2","Erianthus strictus Elliott","","Poaceae"
"SABA10","SAST7","Saccharum strictum (Elliott) Elliott ex Nutt.","","Poaceae"
"SABA8","","Sabatia bartramii Wilbur","Bartram's rose gentian","Gentianaceae"
"SABA8","SADE6","Sabatia decandra (Walter) Harper","","Gentianaceae"
"SABA8","SADOC3","Sabatia dodecandra (L.) Britton, Sterns & Poggenb. var. coriacea (Elliott) H.E. Ahles","","Gentianaceae"
"SABAL","","Sabal Adans.","palmetto","Arecaceae"
"SABAT","","Sabatia Adans.","rose gentian","Gentianaceae"
"SABI","","Salicornia bigelovii Torr.","dwarf saltwort","Chenopodiaceae"
"SABI","SAMU3","Salicornia mucronata Bigelow, non Lag.","","Chenopodiaceae"
"SABR18","","Saccharum brevibarbe (Michx.) Pers.","shortbeard plumegrass","Poaceae"
"SABR8","","Sagittaria brevirostra Mack. & Bush","shortbeak arrowhead","Alismataceae"
"SABR8","SAENB2","Sagittaria engelmanniana J.G. Sm. ssp. brevirostra (Mack. & Bush) Bogin","","Alismataceae"
"SABR9","","Sabatia brachiata Elliott","narrowleaf rose gentian","Gentianaceae"
"SABRB5","","Saccharum brevibarbe (Michx.) Pers. var. brevibarbe","shortbeard plumegrass","Poaceae"
"SABRB5","ERBR2","Erianthus brevibarbis Michx.","","Poaceae"
"SABRC3","","Saccharum brevibarbe (Michx.) Pers. var. contortum (Elliott) R. Webster","sortbeard plumegrass","Poaceae"
"SABRC3","ERCO2","Erianthus contortus Elliott","","Poaceae"
"SABRC3","SACO26","Saccharum contortum (Elliott) Nutt.","","Poaceae"
"SACA13","","Sanguinaria canadensis L.","bloodroot","Papaveraceae"
"SACA13","SACAR","Sanguinaria canadensis L. var. rotundifolia (Greene) Fedde","","Papaveraceae"
"SACA15","","Sanicula canadensis L.","Canadian blacksnakeroot","Apiaceae"
"SACA2","","Sabatia calycina (Lam.) A. Heller","coastal rose gentian","Gentianaceae"
"SACA2","SACU4","Sabatia cubensis (Griseb.) Urb.","","Gentianaceae"
"SACA2","SAGRC3","Sabatia gracilis (Michx.) Salisb. var. cubensis Griseb.","","Gentianaceae"
"SACA21","","Sagittaria calycina Engelm.","hooded arrowhead","Alismataceae"
